,Unnamed: 0,Entidad,Nit Entidad,Departamento Entidad,Ciudad Entidad,OrdenEntidad,Entidad Centralizada,ID del Proceso,Referencia del Proceso,PCI,ID del Portafolio,Nombre del Procedimiento,Descripción del Procedimiento,Fase,Fecha de Publicacion del Proceso,Fecha de Ultima Publicación,Fecha de Publicacion (Fase Planeacion Precalificacion),Fecha de Publicacion (Fase Seleccion Precalificacion),Fecha de Publicacion (Manifestacion de Interes),Fecha de Publicacion (Fase Borrador),Fecha de Publicacion (Fase Seleccion),Precio Base,Modalidad de Contratacion,Justificación Modalidad de Contratación,Duracion,Unidad de Duracion,Fecha de Recepcion de Respuestas,Fecha de Apertura de Respuesta,Fecha de Apertura Efectiva,Ciudad de la Unidad de Contratación,Nombre de la Unidad de Contratación,Proveedores Invitados,Proveedores con Invitacion Directa,Visualizaciones del Procedimiento,Proveedores que Manifestaron Interes,Respuestas al Procedimiento,Respuestas Externas,Conteo de Respuestas a Ofertas,Proveedores Unicos con Respuestas,Numero de Lotes,Estado del Procedimiento,ID Estado del Procedimiento,Adjudicado,ID Adjudicacion,CodigoProveedor,Departamento Proveedor,Ciudad Proveedor,Fecha Adjudicacion,Valor Total Adjudicacion,Nombre del Adjudicador,Nombre del Proveedor Adjudicado,NIT del Proveedor Adjudicado,Codigo Principal de Categoria,Estado de Apertura del Proceso,Tipo de Contrato,Subtipo de Contrato,Categorias Adicionales,URLProceso,Codigo Entidad,Estado Resumen,Fecha,exchange_rate,Year,Avg,Valor del Contrato,Valor real,Codigo de Categoria Recortado,keep,Valor Proyectado,range-,range+,in_range,perc_error,Similitud de valor,Tamaño valor extraño,veces la predicción
3866,3866,MUNICIPIO DE BARBOSA,890980445,ANTIOQUIA,BARBOSA,Territorial,Centralizada,CO1.REQ.4746056,CD-CPS-371-2023,700793102,CO1.BDOS.4640830,PRESTACIÓN DE SERVICIOS PARA EL ACOMPAÑAMIENTO A LA OFICINA DEL SISBEN; ADSCRITA A LA SECRETARIA DE PLANEACIÓN MEDIANTE LA  REALIZACIÓN DE ENCUESTAS DE CARACTERIZACIÓN SOCIOECONOMICA EN LA ZONA RURAL,"PRESTACIÓN DE SERVICIOS PARA EL ACOMPAÑAMIENTO A LA OFICINA DEL SISBEN, ADSCRITA A LA SECRETARIA DE PLANEACIÓN MEDIANTE LA  REALIZACIÓN DE ENCUESTAS DE CARACTERIZACIÓN SOCIOECONOMICA EN LA ZONA RURAL Y URBANA DEL MUNICIPIO DE BARBOSA.",Presentación de oferta,06/27/2023,06/27/2023,,,,,06/27/2023,"14,400,000",Contratación directa,Servicios profesionales y apoyo a la gestión,180,día(s),,,,Barbosa,CONTRATACIÓN BARBOSA,0,0,0,0,0,0,0,0,0,Seleccionado,70,No,No Adjudicado,715810107,Antioquia,Barbosa,,0,No Adjudicado,MARIA LORENA TABARES GARCIA,1001249268,V1.80111600,Abierto,Prestación de servicios,No Definido,No definido,https://community.secop.gov.co/Public/Tendering/OpportunityDetail/Index?noticeUID=CO1.NTC.4649821,"700,793,102",Adjudicado,2023,0.00432108451923077,,1,14400000,3.33249672296701,V1.801,True,0.2,0.000432108451923077,0.6,0,15.662483614835,1.25920301487609e-05,0.012671566192307712,16.66248361483505
9054,9054,MUNICIPIO DE BARBOSA,890980445,ANTIOQUIA,BARBOSA,Territorial,Centralizada,CO1.REQ.5086169,SA-OP 015-2023 (Manifestación de interés (Menor Cuantía)) (Presentación de oferta),700793102,CO1.BDOS.4935418,INSTALACIÓN; SUMINISTRO Y TRANSPORTE DE POZOS SÉPTICOS EN FIBRA DE VIDRIO (PRFV) PARA EL MEJORAMIENTO Y OPTIMIZACIÓN DEL SANEAMIENTO BÁSICO AMBIENTAL EN LA ZONA RURAL DEL MUNICIPIO DE BARBOSA; ANTIOQU,"INSTALACIÓN, SUMINISTRO Y TRANSPORTE DE POZOS SÉPTICOS EN FIBRA DE VIDRIO (PRFV) PARA EL MEJORAMIENTO Y OPTIMIZACIÓN DEL SANEAMIENTO BÁSICO AMBIENTAL EN LA ZONA RURAL DEL MUNICIPIO DE BARBOSA, ANTIOQU",Presentación de oferta,09/22/2023,09/22/2023,,,,,09/22/2023,"306,911,180",Selección Abreviada de Menor Cuantía,Presupuesto menor al 10% de la Menor Cuantía,3,Mes(es),09/27/2023,09/27/2023,09/27/2023,Barbosa,CONTRATACIÓN BARBOSA,12,12,15,0,1,0,0,1,4,Cancelado,100,No,No Adjudicado,No Definido,No Definido,No Definido,,0,No Adjudicado,No Definido,No Definido,V1.83101500,Cerrado,Obra,No Definido,No definido,https://community.secop.gov.co/Public/Tendering/OpportunityDetail/Index?noticeUID=CO1.NTC.4985268,"700,793,102",Presentación de oferta,2023,0.00432108451923077,,1,306911180,71.0264237216623,V1.831,True,70.3064498901367,0.15190005611117177,210.91934967041,1,0.0102405089810483,0.318184427304168,-0.3006890444446871,1.0102405089810487
9500,9500,MUNICIPIO DE BARBOSA,890980445,ANTIOQUIA,BARBOSA,Territorial,Centralizada,CO1.REQ.3798383,CD-CPS-008-2023,700793102,CO1.BDOS.3702955,PRESTACION DE SERVICIOS PARA FORTALECER EL COBRO PERSUASIVO Y COACTIVO DE LOS IMPUESTOS DE PREDIAL E INDUSTRIA Y COMERCIO Y LAS LABORES DE ARCHIVO DE LA OFICINA DE IMPUESTOS.,PRESTACION DE SERVICIOS PARA FORTALECER EL COBRO PERSUASIVO Y COACTIVO DE LOS IMPUESTOS DE PREDIAL E INDUSTRIA Y COMERCIO Y LAS LABORES DE ARCHIVO DE LA OFICINA DE IMPUESTOS.,Presentación de oferta,01/04/2023,01/04/2023,,,,,01/04/2023,"8,000,000",Contratación directa,Servicios profesionales y apoyo a la gestión,4,Mes(es),,,,Barbosa,CONTRATACIÓN BARBOSA,0,0,0,0,0,0,0,0,0,Seleccionado,70,No,No Adjudicado,716582531,Antioquia,Barbosa,,0,No Adjudicado,CLAUDIA MARIA PASOS OCAMPO,39210903,V1.80111600,Abierto,Prestación de servicios,No Definido,No definido,https://community.secop.gov.co/Public/Tendering/OpportunityDetail/Index?noticeUID=CO1.NTC.3709638,"700,793,102",Adjudicado,2023,0.00432108451923077,,1,8000000,1.851387068315,V1.801,True,2.8336341381073,0.006122186303669639,8.5009024143219,1,-0.346638635024485,0.70432653764213,-0.016488745214678573,0.6533613649755141
10846,10846,MUNICIPIO DE BARBOSA,890980445,ANTIOQUIA,BARBOSA,Territorial,Centralizada,CO1.REQ.3862514,CD-CPS-079-2023,700793102,CO1.BDOS.3766664,PRESTACIÓN DE SERVICIOS PROFESIONALES COMO INGENIERO CIVIL PARA EL ACOMPAÑAMIENTO A LA SECRETARÍA DE OBRAS PÚBLICAS; MEDIANTE LA ASISTENCIA TÉCNICA PARA LA ELABORACIÓN DE ESTUDIOS TÉCNICOS; DISEÑOS; R,"PRESTACIÓN DE SERVICIOS PROFESIONALES COMO INGENIERO CIVIL PARA EL ACOMPAÑAMIENTO A LA SECRETARÍA DE OBRAS PÚBLICAS, MEDIANTE LA ASISTENCIA TÉCNICA PARA LA ELABORACIÓN DE ESTUDIOS TÉCNICOS, DISEÑOS, REVISIÓN, VISITAS DE DIAGNÓSTICO Y FORMULACIÓN DE NECESIDADES. ELABORACIÓN DE INFORMES DE OBRAS CIVILES Y DE INFRAESTRUCTURA, RELACIONADOS CON EL AGUA POTABLE EN LA ZONA DE COMPENSACIÓN DEL RELLENO SANITARIO DE LA PRADERA.",Presentación de oferta,01/18/2023,01/18/2023,,,,,01/18/2023,"26,250,000",Contratación directa,Servicios profesionales y apoyo a la gestión,104,día(s),,,,Barbosa,CONTRATACIÓN BARBOSA,0,0,0,0,0,0,0,0,0,Seleccionado,70,No,No Adjudicado,716672274,Antioquia,Medellín,,0,No Adjudicado,LEONEL DARIO URREA RIOS,710037491,V1.80111600,Abierto,Prestación de servicios,No Definido,No definido,https://community.secop.gov.co/Public/Tendering/OpportunityDetail/Index?noticeUID=CO1.NTC.3789558,"700,793,102",Adjudicado,2023,0.00432108451923077,,1,26250000,6.0748638179086,V1.801,True,0.2,0.000432108451923077,0.6,0,29.374319089543,1.49062481560718e-06,0.02452156619230767,30.374319089543
16436,16436,MUNICIPIO DE BARBOSA,890980445,ANTIOQUIA,BARBOSA,Territorial,Centralizada,CO1.REQ.3824621,CD-CPS-018-2023,700793102,CO1.BDOS.3728970,FORTALECIMIENTO AL PROCESO DE LAS INTERVENCIONES COLECTIVAS Y VIGILANCIA EPIDEMIOLÓGICA DEL PROGRAMA AMPLIADO DE INMUNIZACIONES -PAI EN LA SECRETARÍA DE SALUD DEL MUNICIPIO DE BARBOSA.,FORTALECIMIENTO AL PROCESO DE LAS INTERVENCIONES COLECTIVAS Y VIGILANCIA EPIDEMIOLÓGICA DEL PROGRAMA AMPLIADO DE INMUNIZACIONES -PAI EN LA SECRETARÍA DE SALUD DEL MUNICIPIO DE BARBOSA.,Presentación de oferta,01/10/2023,01/10/2023,,,,,01/10/2023,"6,999,990",Contratación directa,Servicios profesionales y apoyo a la gestión,105,día(s),,,,Barbosa,CONTRATACIÓN BARBOSA,0,0,0,0,0,0,0,0,0,Seleccionado,70,No,No Adjudicado,715407714,Antioquia,Barbosa,,0,No Adjudicado,Sebastián Arango Agudelo,1035231993,V1.80111600,Abierto,Prestación de servicios,No Definido,No definido,https://community.secop.gov.co/Public/Tendering/OpportunityDetail/Index?noticeUID=CO1.NTC.3733827,"700,793,102",Adjudicado,2023,0.00432108451923077,,1,6999990,1.61996137054179,V1.801,True,0.2,0.000432108451923077,0.6,0,7.09980685270896,0.0001703078181085,0.00527155619230768,8.09980685270895
16999,16999,MUNICIPIO DE BARBOSA,890980445,ANTIOQUIA,BARBOSA,Territorial,Centralizada,CO1.REQ.4231826,SA-MC-001-2023 (Manifestación de interés (Menor Cuantía)) (Presentación de oferta),700793102,CO1.BDOS.4057379,CONTRATAR LOS SEGUROS TODO RIESGO QUE AMPAREN LOS BIENES  MUEBLES E INMUEBLES E INTERESES PATRIMONIALES DEL MUNICIPIO  DE BARBOSA; ANTIOQUIA; ASÍ COMO LOS SEGUROS VIDA GRUPO PARA  ALCALDE; CONCEJALES;,"CONTRATAR LOS SEGUROS TODO RIESGO QUE AMPAREN LOS BIENES 
MUEBLES E INMUEBLES E INTERESES PATRIMONIALES DEL MUNICIPIO 
DE BARBOSA, ANTIOQUIA, ASÍ COMO LOS SEGUROS VIDA GRUPO PARA 
ALCALDE, CONCEJALES, PERSONERO, EDILES; VEHÍCULOS OFICIALES, 
MAQUINARIA AMARILLA DE PROPIEDAD DE LA ENTIDAD Y VEHICULOS 
EN CUSTODIA DE LA ALCALDIA DE BARBOSA EN PATIOS, SEGÚN FICHA 
TÉCNICA QUE HACE PARTE DE LA CONVOCATORIA, ANEXOS Y TIPOS DE 
SEGUROS QUE SE REQUIEREN",Presentación de oferta,03/08/2023,03/08/2023,,,,,03/07/2023,"175,000,000",Selección Abreviada de Menor Cuantía,Presupuesto menor al 10% de la Menor Cuantía,10,Mes(es),03/13/2023,03/13/2023,03/13/2023,Barbosa,CONTRATACIÓN BARBOSA,5,5,6,0,1,0,0,1,4,Seleccionado,70,No,No Adjudicado,700359052,Distrito Capital de Bogotá,No Definido,,0,No Adjudicado,AXA COLPATRIA SEGUROS S.A,860002184,V1.84131501,Cerrado,Suministros,No Definido,"V184131500, V184131600",https://community.secop.gov.co/Public/Tendering/OpportunityDetail/Index?noticeUID=CO1.NTC.4136507,"700,793,102",Adjudicado,2023,0.00432108451923077,,1,175000000,40.4990921193907,V1.841,True,33.0360870361328,0.07137586213389688,99.1082611083984,1,0.225904631958843,0.182032270119746,-0.11050344853558748,1.2259046319588436
19078,19078,MUNICIPIO DE BARBOSA,890980445,ANTIOQUIA,BARBOSA,Territorial,Centralizada,CO1.REQ.3823911,CD-CPS-015-2023,700793102,CO1.BDOS.3728243,PRESTACIÓN DE SERVICIOS TECNICOS PARA EL MANTENIMIENTO DE EQUIPOS DE AIRE ACONDICIONADO DE PROPIEDAD DE LA ALCALDÍA DE BARBOSA INCLUIDOS REPUESTOS MENORES E INSTALACION.,PRESTACIÓN DE SERVICIOS TECNICOS PARA EL MANTENIMIENTO DE EQUIPOS DE AIRE ACONDICIONADO DE PROPIEDAD DE LA ALCALDÍA DE BARBOSA INCLUIDOS REPUESTOS MENORES E INSTALACION.,Presentación de oferta,01/10/2023,01/10/2023,,,,,01/10/2023,"30,000,000",Contratación directa,Servicios profesionales y apoyo a la gestión,350,día(s),,,,Barbosa,CONTRATACIÓN BARBOSA,0,0,0,0,0,0,0,0,0,Seleccionado,70,No,No Adjudicado,716528229,Antioquia,Medellín,,0,No Adjudicado,SOLUAIRES H&L SAS,901233306,V1.80111600,Abierto,Prestación de servicios,No Definido,No definido,https://community.secop.gov.co/Public/Tendering/OpportunityDetail/Index?noticeUID=CO1.NTC.3733110,"700,793,102",Adjudicado,2023,0.00432108451923077,,1,30000000,6.94270150618126,V1.801,True,2.08034682273865,0.00449467722518345,6.24104046821594,0,2.33728079870914,0.0046403074271233,0.012021291099266192,3.337280798709138
25403,25403,MUNICIPIO DE BARBOSA,890980445,ANTIOQUIA,BARBOSA,Territorial,Centralizada,CO1.REQ.4511690,CD-CS-016,700793102,CO1.BDOS.4404482,CONVENIO SOLIDARIO ENTRE EL MUNICIPIO Y LA JUNTA DE ACCIÓN COMUNAL VEREDA VOLANTIN CON EL FIN DE AUNAR ESFUERZOS PARA EL MEJORAMIENTO DE LA VÍA TERCIARIA DE LA VEREDA LA TOLDA DEL MUNICIPIO DE BARBOSA,"CONVENIO SOLIDARIO ENTRE EL MUNICIPIO DE BARBOSA Y EL HOGAR JUVENIL CAMPESINO BARBOSA CON EL FIN DE EDUCAR EN VALORES A LOS ESTUDIANTES DE LOS CENTROS EDUCATIVOS RURALES, A TRAVÉS DE ESPACIOS PEDAGÓGICOS INTEGRADOS A LA AGRICULTURA ECOLÓGICA CON TECNOLOGÍAS APROPIADAS, DENTRO DE LA VIGENCIA 2023",Presentación de oferta,05/12/2023,05/12/2023,,,,,05/12/2023,"5,600,000",Contratación directa,Contratos o convenios Interadministrativos (valor cero),60,día(s),,,,Barbosa,CONTRATACIÓN BARBOSA,0,0,0,0,0,0,0,0,0,Seleccionado,70,No,No Adjudicado,714549425,Antioquia,Barbosa,,0,No Adjudicado,HOGAR JUVENIL CAMPESINO BARBOSA,890983850,V1.80111600,Abierto,Otro,No Definido,V186101500,https://community.secop.gov.co/Public/Tendering/OpportunityDetail/Index?noticeUID=CO1.NTC.4414542,"700,793,102",Adjudicado,2023,0.00432108451923077,,1,5600000,1.2959709478205,V1.801,True,20.3531646728516,0.043973872392606826,61.0594940185547,1,-0.936325826049589,0.543505950096287,-0.1702954895704273,0.06367417395041036
25532,25532,MUNICIPIO DE BARBOSA,890980445,ANTIOQUIA,BARBOSA,Territorial,Centralizada,CO1.REQ.4147374,CD-CPS-121-2023,700793102,CO1.BDOS.4050690,PRESTACIÓN DE SERVICIOS A TODO COSTO; PARA LA REALIZACIÓN DE ACTIVIDADES DE MEDITACIÓN; RELAJACIÓN Y DESCANSO EMOCIONAL Y FÍSICO DE LAS PERSONAS ADULTAS MAYORES DE LA ZONA URBANA Y RURAL DEL MUNCIPIO,"PRESTACIÓN DE SERVICIOS A TODO COSTO, PARA LA REALIZACIÓN DE ACTIVIDADES DE MEDITACIÓN, RELAJACIÓN Y DESCANSO EMOCIONAL Y FÍSICO DE LAS PERSONAS ADULTAS MAYORES DE LA ZONA URBANA Y RURAL DEL MUNCIPIO DE BARBOSA, ORIENTADAS A LA PROMOCIÓN DE ESTILO DE VIDA SALUDABLE.",Presentación de oferta,02/21/2023,02/21/2023,,,,,02/21/2023,"8,250,000",Contratación directa,Servicios profesionales y apoyo a la gestión,68,día(s),,,,Barbosa,CONTRATACIÓN BARBOSA,0,0,0,0,0,0,0,0,0,Seleccionado,70,No,No Adjudicado,720868702,Antioquia,Barbosa,,0,No Adjudicado,Melissa Agudelo Londoño,1007239941,V1.80111600,Abierto,Prestación de servicios,No Definido,No definido,https://community.secop.gov.co/Public/Tendering/OpportunityDetail/Index?noticeUID=CO1.NTC.4052576,"700,793,102",Adjudicado,2023,0.00432108451923077,,1,8250000,1.90924291419985,V1.801,True,0.2,0.000432108451923077,0.6,0,8.54621457099923,9.3595007471912e-05,0.006521566192307705,9.546214570999249
26997,26997,MUNICIPIO DE BARBOSA,890980445,ANTIOQUIA,BARBOSA,Territorial,Centralizada,CO1.REQ.4764698,CD-CI-010-2023,700793102,CO1.BDOS.4659184,CONTRATO INTERADMINISTRATIVO PARA LA OPTIMIZACIÓN DEL SISTEMA DE ACUEDUCTO Y PLANTA DE TRATAMIENTO DE AGUA POTABLE (PTAP) DE LA VEREDA EL PARAÍSO; ZONA RURAL DEL MUNICIPIO DE BARBOSA; ANTIOQUIA; A TOD,"CONTRATO INTERADMINISTRATIVO PARA LA OPTIMIZACIÓN DEL SISTEMA DE ACUEDUCTO Y PLANTA DE TRATAMIENTO DE AGUA POTABLE (PTAP) DE LA VEREDA EL PARAÍSO, ZONA RURAL DEL MUNICIPIO DE BARBOSA, ANTIOQUIA, A TODO COSTO, INCLUYE MATERIALES, TRANSPORTES, MANO DE OBRA CALIFICADA Y NO CALIFICADA E IMPUESTOS LOCALES Y NACIONALES A QUE HAYA LUGAR, POR EL SISTEMA DE PRECIOS UNITARIOS NO REAJUSTABLES.",Presentación de oferta,06/29/2023,06/29/2023,,,,,06/28/2023,"2,238,272,177",Contratación directa,Contratos o convenios Interadministrativos (valor cero),180,día(s),,,,Barbosa,CONTRATACIÓN BARBOSA,0,0,0,0,0,0,0,0,0,Seleccionado,70,No,No Adjudicado,722147394,Antioquia,Barbosa,,0,No Adjudicado,IMPACTO INFRAESTRUCTURA SAS,9016933529,V1.72141119,Abierto,Otro,No Definido,No definido,https://community.secop.gov.co/Public/Tendering/OpportunityDetail/Index?noticeUID=CO1.NTC.4666533,"700,793,102",Adjudicado,2023,0.00432108451923077,,1,2238272177,517.988520483384,V1.721,True,35.0831871032715,0.07579870833861153,105.249561309814,0,13.7645799384937,1.94127364112113e-05,1.9350773436455553,14.764579938493721
29310,29310,MUNICIPIO DE BARBOSA,890980445,ANTIOQUIA,BARBOSA,Territorial,Centralizada,CO1.REQ.5424157,CD-CS-056-2023,700793102,CO1.BDOS.5305471,CONVENIO SOLIDARIO ENTRE EL MUNICIPIO DE BARBOSA Y LA CORPORACIÓN CULTURAL PASCUALA MUÑOZ - CORPASCUALA; CON EL FIN DE AUNAR ESFUERZOS PARA LA ELABORACIÓN Y DISEÑO DE UN MURAL DENOMINADO  BARBOSA SOCI,"CONVENIO SOLIDARIO ENTRE EL MUNICIPIO DE BARBOSA Y LA CORPORACIÓN CULTURAL PASCUALA MUÑOZ - CORPASCUALA, CON EL FIN DE AUNAR ESFUERZOS PARA LA ELABORACIÓN Y DISEÑO DE UN MURAL DENOMINADO  BARBOSA SOCIAL ES LA GENTE , EL CUAL SERÁ UBICADO EN EL SEGUNDO PISO DEL CENTRO ADMINISTRATIVO MUNICPAL, COMO LEGADO ARTÍSTICO E HISTÓRICO DE LA ADMINSITRACIÓN MUNICIPAL  BARBOSA SOCIAL ES LA GENTE 2020 - 2023",Presentación de oferta,12/14/2023,12/14/2023,,,,,12/14/2023,"12,500,000",Contratación directa,Contratos o convenios Interadministrativos (valor cero),15,día(s),,,,Barbosa,CONTRATACIÓN BARBOSA,0,0,0,0,0,0,0,0,0,Seleccionado,70,No,No Adjudicado,716702352,Antioquia,Barbosa,,0,No Adjudicado,CORPORACIÓN CULTURAL PASCUALA MUÑOZ,900077229,V1.80111600,Abierto,Otro,No Definido,No definido,https://community.secop.gov.co/Public/Tendering/OpportunityDetail/Index?noticeUID=CO1.NTC.5319933,"700,793,102",Adjudicado,2023,0.00432108451923077,,1,12500000,2.89279229424219,V1.801,True,0.2,0.000432108451923077,0.6,0,13.463961471211,2.08987892755781e-05,0.010771566192307682,14.46396147121095
30205,30205,MUNICIPIO DE BARBOSA,890980445,ANTIOQUIA,BARBOSA,Territorial,Centralizada,CO1.REQ.4093479,CD-CPS-114-2023,700793102,CO1.BDOS.3997518,PRESTACIÓN DE SERVICIOS PARA ELABORAR LA LÍNEA BASE EN CUANTO AL PROCESO DE VALIDACIÓN SOCIAL Y COMUNITARIA PARA CONSTRUCCIÓN DEL SISTEMA; LA CARACTERIZACIÓN DE ACTORES SOCIALES Y ROLES EN LA GESTIÓN,"PRESTACIÓN DE SERVICIOS PARA ELABORAR LA LÍNEA BASE EN CUANTO AL PROCESO DE VALIDACIÓN SOCIAL Y COMUNITARIA PARA CONSTRUCCIÓN DEL SISTEMA, LA CARACTERIZACIÓN DE ACTORES SOCIALES Y ROLES EN LA GESTIÓN DEL SISTEMA LOCAL DE ÁREAS PROTEGIDAS-SILAP; ASÍ COMO LA IDENTIFICACIÓN DE LOS ACTORES QUE INTERVIENES EN LAS CUATRO ÁREAS ESTRATÉGICAS PRIORIZADA, Y SON CLAVES PARA LA GESTIÓN DEL PROCESO",Presentación de oferta,02/14/2023,02/14/2023,,,,,02/14/2023,"14,385,000",Contratación directa,Servicios profesionales y apoyo a la gestión,75,día(s),,,,Barbosa,CONTRATACIÓN BARBOSA,0,0,0,0,0,0,0,0,0,Seleccionado,70,No,No Adjudicado,719503872,Antioquia,Barbosa,,0,No Adjudicado,EDUARD FABIAN RIOS ESCOBAR,71217859,V1.80111600,Abierto,Prestación de servicios,No Definido,No definido,https://community.secop.gov.co/Public/Tendering/OpportunityDetail/Index?noticeUID=CO1.NTC.3998628,"700,793,102",Adjudicado,2023,0.00432108451923077,,1,14385000,3.32902537221391,V1.801,True,13.4855279922485,0.029136053120479097,40.4565839767456,1,-0.753140894881726,0.753745189548492,-0.10215921248191642,0.24685910511827483
30994,30994,MUNICIPIO DE BARBOSA,890980445,ANTIOQUIA,BARBOSA,Territorial,Centralizada,CO1.REQ.4155442,CD-CPS-123-2023,700793102,CO1.BDOS.4059123,PRESTACIÓN DE SERVICIOS PROFESIONALES PARA ELABORAR EL DOCUMENTO CAPITULO BIODIVERSIDAD DEL MUNICIPIO PRODUCTOS 1; 2; 3 (ANÁLISIS TÉCNICO DE LOS INVENTARIOS DE BIODIVERSIDAD DE LOS SITIOS PRIORIZADOS,"PRESTACIÓN DE SERVICIOS PROFESIONALES PARA ELABORAR EL DOCUMENTO CAPITULO BIODIVERSIDAD DEL MUNICIPIO PRODUCTOS 1, 2, 3 ANÁLISIS TÉCNICO DE LOS INVENTARIOS DE BIODIVERSIDAD DE LOS SITIOS PRIORIZADOS PARA LA CONSERVACIÓN EN EL MUNICIPIO, INCLUYE REVISIÓN E IDENTIFICACIÓN DE ÁREAS ESTRATÉGICAS LA CONSERVACIÓN, CON BASE EN LA IDENTIFICACIÓN DE LOS VALORES OBJETO DE CONSERVACIÓN - VOC DEL SILAP.",Presentación de oferta,02/22/2023,02/22/2023,,,,,02/22/2023,"5,868,000",Contratación directa,Servicios profesionales y apoyo a la gestión,45,día(s),,,,Barbosa,CONTRATACIÓN BARBOSA,0,0,0,0,0,0,0,0,0,Seleccionado,70,No,No Adjudicado,720904457,Antioquia,Itagui,,0,No Adjudicado,EDGAR ANDRES ESTRADA URREA,8324883,V1.80111600,Abierto,Prestación de servicios,No Definido,No definido,https://community.secop.gov.co/Public/Tendering/OpportunityDetail/Index?noticeUID=CO1.NTC.4060636,"700,793,102",Adjudicado,2023,0.00432108451923077,,1,5868000,1.35799241460906,V1.801,True,26.5856876373291,0.05743950164138382,79.7570629119873,1,-0.948920169636602,0.528669732512674,-0.22389000656553526,0.05107983036339808
31060,31060,MUNICIPIO DE BARBOSA,890980445,ANTIOQUIA,BARBOSA,Territorial,Centralizada,CO1.REQ.4281233,CD.CDP-146-2023,700793102,CO1.BDOS.4176150,SERVICIOS PROFESIONALES COMO ABOGADO PARA REALIZAR DIAGNÓSTICO Y BRINDAR ASESORÍA JURÍDICA EN LA CONFORMACIÓN DE LAS JUNTAS DIRECTIVAS DE LOS ACUEDUCTOS RURALES DEL MUNICIPIO DE BARBOSA,SERVICIOS PROFESIONALES COMO ABOGADO PARA REALIZAR DIAGNÓSTICO Y BRINDAR ASESORÍA JURÍDICA EN LA CONFORMACIÓN DE LAS JUNTAS DIRECTIVAS DE LOS ACUEDUCTOS RURALES DEL MUNICIPIO DE BARBOSA.,Presentación de oferta,03/17/2023,03/17/2023,,,,,03/17/2023,"10,500,000",Contratación directa,Servicios profesionales y apoyo a la gestión,90,día(s),,,,Barbosa,CONTRATACIÓN BARBOSA,0,0,0,0,0,0,0,0,0,Seleccionado,70,No,No Adjudicado,715280368,Antioquia,Barbosa,,0,No Adjudicado,Yenny Marin Agudelo,39212937,V1.80111600,Abierto,Prestación de servicios,No Definido,No definido,https://community.secop.gov.co/Public/Tendering/OpportunityDetail/Index?noticeUID=CO1.NTC.4185037,"700,793,102",Adjudicado,2023,0.00432108451923077,,1,10500000,2.42994552716344,V1.801,True,26.2419319152832,0.05669680287691905,78.7257957458496,1,-0.907402186126843,0.578003263567599,-0.21628721150767619,0.09259781387315653
35861,35861,IMPACTO INFRAESTRUCTURA S.A.S.,901693352,ANTIOQUIA,BARBOSA,Territorial,Centralizada,CO1.REQ.5471953,018-2023,721798353,CO1.BDOS.5353547,CONTRATO DE OBRA PARA RETIRO E INSTALACIÓN DE LA CUBIERTA DE LA COMISARIA DE FAMILIA Y OBRAS COMPLEMENTARIAS; DE IGUAL MANERA; RETIRO DE LA CUBIERTA DE LA BIBLIOTECA ISOLDA ECHAVARRIA MISAS.,"CONTRATO DE OBRA POR PRECIOS UNITARIOS PARA EL RETIRO E INSTALACIÓN DE LA CUBIERTA DE LA COMISARIA DE FAMILIA Y OBRAS COMPLEMENTARIAS; DE IGUAL MANERA, RETIRO DE LA CUBIERTA DE LA BIBLIOTECA ISOLDA ECHAVARRIA MISAS, A TODO COSTO, INCLUYE SUMINISTRO, TRANSPORTE, MATERIALES, MANO DE OBRA CALIFICADA E
IMPUESTOS LOCALES Y NACIONALES.",Presentación de oferta,12/30/2023,12/30/2023,,,,,12/30/2023,"180,000,000",Contratación régimen especial,Regla aplicable,2,Mes(es),,,,Barbosa,CONTRATO DE OBRA PARA RETIRO E INSTALACIÓN DE LA CUBIERTA DE LA COMISA,0,0,0,0,0,0,0,0,0,Seleccionado,70,No,No Adjudicado,710378324,Antioquia,Medellín,,0,No Adjudicado,LHM CONSTRUCTORES S.A.S,901115283,V1.72103300,Abierto,Obra,No Definido,No definido,https://community.secop.gov.co/Public/Tendering/OpportunityDetail/Index?noticeUID=CO1.NTC.5369529,"721,798,353",Adjudicado,2023,0.00432108451923077,,1,180000000,41.6562090370876,V1.721,True,117.287391662598,0.2534043662071041,351.862174987793,1,-0.644836427457432,0.834112413184532,-0.8336174648284165,0.3551635725425671
42622,42622,MUNICIPIO DE BARBOSA,890980445,ANTIOQUIA,BARBOSA,Territorial,Centralizada,CO1.REQ.4300550,INVITACION DE MINIMA CUANTIA 006-2023,700793102,CO1.BDOS.4202692,SUMINISTRO DE FORMATOS PREIMPRESOS DE FACTURAS DEL IMPUESTO PREDIAL Y OTROS INGRESOS DEL MUNICIPIO DE BARBOSA,SUMINISTRO DE FORMATOS PREIMPRESOS DE FACTURAS DEL IMPUESTO PREDIAL Y OTROS INGRESOS DEL MUNICIPIO DE BARBOSA,Presentación de oferta,03/22/2023,03/22/2023,,,,,03/22/2023,"31,505,250",Mínima cuantía,Presupuesto inferior al 10% de la menor cuantía,9,Mes(es),03/27/2023,03/27/2023,03/27/2023,Barbosa,CONTRATACIÓN BARBOSA,0,0,18,0,8,0,0,8,4,Seleccionado,70,Si,CO1.AWD.1577848,702704206,Antioquia,No Definido,04/17/2023,"15,351,000",WILSON ANDRES LONDOÑO MONSALVE,DEYSAFIRA GOMEZ DURAN,43151854,V1.82121500,Cerrado,Suministros,No Definido,No definido,https://community.secop.gov.co/Public/Tendering/OpportunityDetail/Index?noticeUID=CO1.NTC.4204753,"700,793,102",Adjudicado,2023,0.00432108451923077,,1,31505250,7.29105155425391,V1.821,True,4.9374098777771,0.010667482693979855,14.8122296333313,1,0.476695622753615,0.098014313536796,-0.011164680775919412,1.476695622753616
45596,45596,MUNICIPIO DE BARBOSA,890980445,ANTIOQUIA,BARBOSA,Territorial,Centralizada,CO1.REQ.4071956,CD-CPS-102-2023,700793102,CO1.BDOS.3976067,SERVICIOS DE APOYO A LA GESTIÓN DE LA SUBSECRETARIA DE ARTE Y CULTURA EN LA IMPLEMENTACIÓN DE LOS PROGRAMAS DE FOMENTO Y PROMOCIÓN CULTURAL DESARROLLANDO ACTIVIDADES COMO PROFESOR DE LA DISCIPLINA DE,"SERVICIOS DE APOYO A LA GESTIÓN DE LA SUBSECRETARIA DE ARTE Y CULTURA EN LA IMPLEMENTACIÓN DE LOS PROGRAMAS DE FOMENTO Y PROMOCIÓN CULTURAL DESARROLLANDO ACTIVIDADES COMO PROFESOR DE LA DISCIPLINA DE INICIACIÓN MUSICAL, INICIACIÓN EN PERCUSIÓN, PERCUSIÓN SINFÓNICA, PERCUSIÓN LATINA Y BATERÍA PARA LA ESCUELA DE MÚSICA Y ARTE MANUEL ANTONIO ÁNGEL TABARES, EN LA ZONA URBANA Y RURAL DEL MUNICIPIO.",Presentación de oferta,02/10/2023,02/10/2023,,,,,02/10/2023,"5,000,000",Contratación directa,Servicios profesionales y apoyo a la gestión,75,día(s),,,,Barbosa,CONTRATACIÓN BARBOSA,0,0,0,0,0,0,0,0,0,Seleccionado,70,No,No Adjudicado,719215048,Antioquia,Barbosa,,0,No Adjudicado,CRISTIAN MATEO VALENCIA CASTRO,1035234135,V1.80111600,Abierto,Prestación de servicios,No Definido,V186131601,https://community.secop.gov.co/Public/Tendering/OpportunityDetail/Index?noticeUID=CO1.NTC.3977283,"700,793,102",Adjudicado,2023,0.00432108451923077,,1,5000000,1.15711691769688,V1.801,True,18.859188079834,0.040746072828516076,56.577564239502,1,-0.938644393767186,0.540764374582336,-0.1579842913140643,0.0613556062328143
