46498,46498,MUNICIPIO DE BARBOSA,890980445,ANTIOQUIA,BARBOSA,Territorial,Centralizada,CO1.REQ.3902671,CD-CPS-054-2023,700793102,CO1.BDOS.3807391,PRESTACIÓN DE SERVICIOS PROFESIONALES PARA LA IMPLEMENTACIÓN DEL PLAN DE GESTIÓN INTEGRAL DE RESIDUOS SÓLIDOS CON VIGENCIA 2017 (PGIRS) DEL MUNICIPIO DE BARBOSA; ANTIOQUIA; A TRAVÉS DE LA SUPERVISIÓN,"PRESTACIÓN DE SERVICIOS PROFESIONALES PARA LA IMPLEMENTACIÓN DEL PLAN DE GESTIÓN INTEGRAL DE RESIDUOS SÓLIDOS CON VIGENCIA 2017 (PGIRS) DEL MUNICIPIO DE BARBOSA, ANTIOQUIA, A TRAVÉS DE LA SUPERVISIÓN BIMESTRAL DEL CONVENIO NO. 0017772 DEL 2000 CELEBRADO ENTRE EMBASEO S.A ESP Y EL MUNICIPIO DE BARBOSA, ASÍ COMO EN EL DIAGNÓSTICO E INTERVENCIÓN COMPORTAMENTAL DE INSTITUCIONES EDUCATIVAS Y SECTORES CON PRESENCIA DE PUNTOS CRÍTICOS.",Presentación de oferta,01/20/2023,01/20/2023,,,,,01/20/2023,"9,900,000",Contratación directa,Servicios profesionales y apoyo a la gestión,90,día(s),,,,Barbosa,CONTRATACIÓN BARBOSA,0,0,0,0,0,0,0,0,0,Seleccionado,70,No,No Adjudicado,716865506,Antioquia,Barbosa,,0,No Adjudicado,Karen Londoño Henao,1035440280,V1.80111600,Abierto,Prestación de servicios,No Definido,No definido,https://community.secop.gov.co/Public/Tendering/OpportunityDetail/Index?noticeUID=CO1.NTC.3808195,"700,793,102",Adjudicado,2023,0.00432108451923077,,1,9900000,2.29109149703982,V1.801,True,25.2152919769287,0.05447870390469522,75.6458759307861,1,-0.909138807548368,0.575920208478468,-0.20801481561878085,0.09086119245163236
46570,46570,MUNICIPIO DE BARBOSA,890980445,ANTIOQUIA,BARBOSA,Territorial,Centralizada,CO1.REQ.4383523,CD-CS-008-2023,700793102,CO1.BDOS.4283797,AUNAR ESFUERZOS PARA LA EJECUCIÓN DEL CONVENIO SOLIDARIO CON LA JUNTA DE ACCIÓN COMUNAL VEREDA LA CHORRERA; PARA LA EJECUCIÓN DE MODELOS PRODUCTIVOS DE AVICULTURA Y PISCICULTURA; COMO ALTERNATIVA ECON,"AUNAR ESFUERZOS PARA LA EJECUCIÓN DEL CONVENIO SOLIDARIO CON LA JUNTA DE ACCIÓN COMUNAL VEREDA LA CHORRERA; PARA LA EJECUCIÓN DE MODELOS PRODUCTIVOS DE AVICULTURA Y PISCICULTURA, COMO ALTERNATIVA ECONÓMICA Y ALIMENTARIA DE LAS FAMILIAS CAMPESINAS EN SUS PROCESOS DE PRODUCCIÓN EN LA REACTIVACIÓN DE LA ECONOMÍA CAMPESINA FAMILIAR Y COMUNITARIA EN EL MUNICIPIO DE BARBOSA- ANTIOQUIA, VIGENCIA 2023",Presentación de oferta,04/12/2023,04/12/2023,,,,,04/12/2023,"7,000,000",Contratación directa,Contratos o convenios Interadministrativos (valor cero),180,día(s),,,,Barbosa,CONTRATACIÓN BARBOSA,0,0,0,0,0,0,0,0,0,Seleccionado,70,No,No Adjudicado,716823547,Antioquia,Barbosa,,0,No Adjudicado,JAC VEREDA LA CHORRERA,900385201,V1.80111600,Abierto,Otro,No Definido,No definido,https://community.secop.gov.co/Public/Tendering/OpportunityDetail/Index?noticeUID=CO1.NTC.4287355,"700,793,102",Adjudicado,2023,0.00432108451923077,,1,7000000,1.61996368477563,V1.801,True,5.21205902099609,0.011260873774471644,15.6361770629883,1,-0.689189305368604,0.808202742894866,-0.038043495097886564,0.31081069463139627
49713,49713,MUNICIPIO DE BARBOSA,890980445,ANTIOQUIA,BARBOSA,Territorial,Centralizada,CO1.REQ.3890996,CD-CPS-046-2023-,700793102,CO1.BDOS.3796115,PRESTACIÓN DE SERVICIOS PARA LLEVAR A CABO ACCIONES Y ACTIVIDADES QUE FORTALEZCAN LA ATENCIÓN EN LA OFICINA DE FAMILIAS EN ACCIÓN DEL MUNICIPIO DE BARBOSA; A TRAVÉS DE LA INSCRIPCIÓN Y ACTUALIZACIÓN D,"PRESTACIÓN DE SERVICIOS PARA LLEVAR A CABO ACCIONES Y ACTIVIDADES QUE FORTALEZCAN LA ATENCIÓN EN LA OFICINA DE FAMILIAS EN ACCIÓN DEL MUNICIPIO DE BARBOSA, A TRAVÉS DE LA INSCRIPCIÓN Y ACTUALIZACIÓN DE BENEFICIARIOS Y POTENCIALES BENEFICIARIOS DE LOS SUBSIDIOS DEL ESTADO.",Presentación de oferta,01/19/2023,01/19/2023,,,,,01/19/2023,"8,400,000",Contratación directa,Servicios profesionales y apoyo a la gestión,102,día(s),,,,Barbosa,CONTRATACIÓN BARBOSA,0,0,0,0,0,0,0,0,0,Seleccionado,70,No,No Adjudicado,716704796,Antioquia,Barbosa,,0,No Adjudicado,FLOR ANGELA JARAMILLO HURTADO,39208057,V1.80111600,Abierto,Prestación de servicios,No Definido,No definido,https://community.secop.gov.co/Public/Tendering/OpportunityDetail/Index?noticeUID=CO1.NTC.3797257,"700,793,102",Adjudicado,2023,0.00432108451923077,,1,8400000,1.94395642173075,V1.801,True,0.2,0.000432108451923077,0.6,0,8.71978210865377,8.76671803900126e-05,0.006671566192307677,9.71978210865375
52283,52283,INSTITUCION EDUCATIVA MANUEL JOSE CAICEDO,8110339047,ANTIOQUIA,BARBOSA,Territorial,Centralizada,CO1.REQ.4390613,CONTRATO DE SUMINISTRO NRO.0000015,718708043,CO1.BDOS.4290834,DOTACIÓN PEDAGOGICA,"ADQUISICIÓN DE DOTACIÓN PEDAGOGICA (IMPLEMENTOS DEPORTIVOS, MATERIALES E IMPLEMENTOS PARA EL LABORATORIO, MATERIAL BIBLIOGRAFICO)",Presentación de oferta,04/14/2023,04/14/2023,,,,,04/13/2023,"16,999,717",Contratación directa,Contratos o convenios Interadministrativos (valor cero),30,día(s),,,,Barbosa,CONTRATACION REGIMEN ESPECIAL,0,0,0,0,0,0,0,0,0,Seleccionado,60,No,No Adjudicado,No Definido,No Definido,No Definido,,0,No Adjudicado,No Definido,No Definido,V1.49221500,Abierto,Suministros,No Definido,No definido,https://community.secop.gov.co/Public/Tendering/OpportunityDetail/Index?noticeUID=CO1.NTC.4294299,"718,708,043",Adjudicado,2023,0.00432108451923077,,1,16999717,3.93413202735184,V1.492,True,9.5014066696167,0.02052819063549835,28.5042200088501,1,-0.585942148973343,0.850171473331649,-0.0651130455419934,0.4140578510266574
55607,55607,MUNICIPIO DE BARBOSA,890980445,ANTIOQUIA,BARBOSA,Territorial,Centralizada,CO1.REQ.4325877,CD-CPS-149-2023,700793102,CO1.BDOS.4227097,PRESTACIÓN DE SERVICIOS COMO AGENTES DE TRÁNSITO DEL MUNICIPIO DE BARBOSA; PARA DAR A CONOCER LAS NORMAS DE MOVILIDAD; SEÑALIZACIÓN; REGULACIÓN Y SEGURIDAD VIAL A LA COMUNIDAD DE CONFORMIDAD CON LA LE,"PRESTACIÓN DE SERVICIOS COMO AGENTES DE TRÁNSITO DEL MUNICIPIO DE BARBOSA, PARA DAR A CONOCER LAS NORMAS DE MOVILIDAD, SEÑALIZACIÓN, REGULACIÓN Y SEGURIDAD VIAL A LA COMUNIDAD DE CONFORMIDAD CON LA LEY 2197 DE 2022",Presentación de oferta,03/28/2023,03/28/2023,,,,,03/28/2023,"4,000,000",Contratación directa,Servicios profesionales y apoyo a la gestión,60,día(s),,,,Barbosa,CONTRATACIÓN BARBOSA,0,0,0,0,0,0,0,0,0,Seleccionado,70,No,No Adjudicado,721252047,Antioquia,Barbosa,,0,No Adjudicado,GERMAN GEOVANNY HERNANDEZ RUIZ,70140923,V1.80111600,Abierto,Prestación de servicios,No Definido,No definido,https://community.secop.gov.co/Public/Tendering/OpportunityDetail/Index?noticeUID=CO1.NTC.4229511,"700,793,102",Adjudicado,2023,0.00432108451923077,,1,4000000,0.925693534157502,V1.801,True,0.2,0.000432108451923077,0.6,0,3.62846767078751,0.0013501818250933,0.0022715661923076937,4.62846767078751
63017,63017,MUNICIPIO DE BARBOSA,890980445,ANTIOQUIA,BARBOSA,Territorial,Centralizada,CO1.REQ.5346695,CD-CPS-395-2023,700793102,CO1.BDOS.5229792,PRESTACIÓN DE SERVICIOS PARA LLEVAR A CABO ACCIONES Y ACTIVIDADES QUE FORTALEZCAN LA ATENCIÓN EN LA OFICINA DE FAMILIAS EN ACCIÓN DEL MUNICIPIO DE BARBOSA; A TRAVÉS DE LA INSCRIPCIÓN Y ACTUALIZACIÓN D,"PRESTACIÓN DE SERVICIOS PARA LLEVAR A CABO ACCIONES Y ACTIVIDADES QUE FORTALEZCAN LA ATENCIÓN EN LA OFICINA DE FAMILIAS EN ACCIÓN DEL MUNICIPIO DE BARBOSA, A TRAVÉS DE LA INSCRIPCIÓN Y ACTUALIZACIÓN DE BENEFICIARIOS Y POTENCIALES BENEFICIARIOS DE LOS SUBSIDIOS DEL ESTADO",Presentación de oferta,11/27/2023,11/27/2023,,,,,11/27/2023,"2,400,000",Contratación directa,Servicios profesionales y apoyo a la gestión,30,día(s),,,,Barbosa,CONTRATACIÓN BARBOSA,0,0,0,0,0,0,0,0,0,Seleccionado,70,No,No Adjudicado,716704796,Antioquia,Barbosa,,0,No Adjudicado,FLOR ANGELA JARAMILLO HURTADO,39208057,V1.80111600,Abierto,Prestación de servicios,No Definido,No definido,https://community.secop.gov.co/Public/Tendering/OpportunityDetail/Index?noticeUID=CO1.NTC.5242596,"700,793,102",Adjudicado,2023,0.00432108451923077,,1,2400000,0.555416120494501,V1.801,True,0.2,0.000432108451923077,0.6,1,1.77708060247251,0.0093397604912811,0.000671566192307692,2.7770806024725045
65584,65584,MUNICIPIO DE BARBOSA,890980445,ANTIOQUIA,BARBOSA,Territorial,Centralizada,CO1.REQ.4088904,CD-CPS-109-2023,700793102,CO1.BDOS.3992293,PRESTACIÓN DE SERVICIOS PROFESIONALES DE APOYO A LA GESTIÓN PARA EL ACOMPAÑAMIENTO EN PROYECTOS EDUCATIVOS ESTRATÉGICOS PARA LA SECRETARÍA DE EDUCACIÓN Y CULTURA MUNICIPAL,PRESTACIÓN DE SERVICIOS PROFESIONALES DE APOYO A LA GESTIÓN PARA EL ACOMPAÑAMIENTO EN PROYECTOS EDUCATIVOS ESTRATÉGICOS PARA LA SECRETARÍA DE EDUCACIÓN Y CULTURA MUNICIPAL,Presentación de oferta,02/13/2023,02/13/2023,,,,,02/13/2023,"8,750,000",Contratación directa,Servicios profesionales y apoyo a la gestión,75,día(s),,,,Barbosa,CONTRATACIÓN BARBOSA,0,0,0,0,0,0,0,0,0,Seleccionado,70,No,No Adjudicado,715277414,Antioquia,Barbosa,,0,No Adjudicado,Juan Carlos Jiménez Valencia,70141993,V1.80111600,Abierto,Prestación de servicios,No Definido,V186141501,https://community.secop.gov.co/Public/Tendering/OpportunityDetail/Index?noticeUID=CO1.NTC.3994226,"700,793,102",Adjudicado,2023,0.00432108451923077,,1,8750000,2.02495460596954,V1.801,True,5.75693273544312,0.012438096460688056,17.2707982063294,1,-0.648258074390429,0.832513760001468,-0.041002385842752204,0.35174192560957135
68618,68618,MUNICIPIO DE BARBOSA,890980445,ANTIOQUIA,BARBOSA,Territorial,Centralizada,CO1.REQ.4539598,CD-CS-027-2023,700793102,CO1.BDOS.4438415,AUNAR ESFUERZOS ENTRE LA JUNTA ACCIÓN COMUNAL VEREDA AGUAS CLARAS ARRIBA Y EL MUNICIPIO DE BARBOSA; ANTIOQUIA PARA EJECUTAR EL PROYECTO DEL MANTENIMIENTO VÍAS TERCIARIAS,"AUNAR ESFUERZOS ENTRE LA JUNTA ACCIÓN COMUNAL VEREDA AGUAS CLARAS ARRIBA Y EL MUNICIPIO DE BARBOSA, ANTIOQUIA PARA EJECUTAR EL PROYECTO DEL MANTENIMIENTO VÍAS TERCIARIAS",Presentación de oferta,05/18/2023,05/18/2023,,,,,05/18/2023,"3,829,909",Contratación directa,Contratos o convenios Interadministrativos (valor cero),1,Mes(es),,,,Barbosa,CONTRATACIÓN BARBOSA,0,0,0,0,0,0,0,0,0,Seleccionado,70,No,No Adjudicado,716285424,Antioquia,Barbosa,,0,No Adjudicado,JUNTA DE ACCION COMUNAL VEREDA AGUAS CLARAS ARRIBA,900328933,V1.80111600,Abierto,Otro,No Definido,No definido,https://community.secop.gov.co/Public/Tendering/OpportunityDetail/Index?noticeUID=CO1.NTC.4441738,"700,793,102",Adjudicado,2023,0.00432108451923077,,1,3829909,0.886330499427906,V1.801,True,0.2,0.000432108451923077,0.6,0,3.43165249713953,0.0015892282465651,0.002101475192307693,4.431652497139529
69195,69195,MUNICIPIO DE BARBOSA,890980445,ANTIOQUIA,BARBOSA,Territorial,Centralizada,CO1.REQ.5268444,CD-CPS-387-2023,700793102,CO1.BDOS.5153334,PRESTACIÓN DE SERVICIOS PROFESIONALES COMO GERONTÓLOGA; PARA LLEVAR A CABO ACTIVIDADES QUE CONLLEVEN A LA ATENCIÓN INTEGRAL DE LOS ADULTOS MAYORES DEL MUNICIPIO DE BARBOSA; EN CUMPLIMIENTO DE LAS META,"PRESTACIÓN DE SERVICIOS PROFESIONALES COMO GERONTÓLOGA, PARA LLEVAR A CABO ACTIVIDADES QUE CONLLEVEN A LA ATENCIÓN INTEGRAL DE LOS ADULTOS MAYORES DEL MUNICIPIO DE BARBOSA, EN CUMPLIMIENTO DE LAS METAS DEL PLAN DE DESARROLLO MUNICIPAL  BARBOSA SOCIAL ES LA GENTE 2020-2023 .",Presentación de oferta,11/10/2023,11/10/2023,,,,,11/10/2023,"4,950,000",Contratación directa,Servicios profesionales y apoyo a la gestión,38,día(s),,,,Barbosa,CONTRATACIÓN BARBOSA,0,0,0,0,0,0,0,0,0,Seleccionado,70,No,No Adjudicado,719659435,Antioquia,Barbosa,,0,No Adjudicado,MARTHA MARGARITA PARRA MUNERA,43496871,V1.80111600,Abierto,Prestación de servicios,No Definido,No definido,https://community.secop.gov.co/Public/Tendering/OpportunityDetail/Index?noticeUID=CO1.NTC.5164829,"700,793,102",Adjudicado,2023,0.00432108451923077,,1,4950000,1.14554574851991,V1.801,True,0.2,0.000432108451923077,0.6,0,4.72772874259954,0.000609968014733,0.0032215661923077,5.72772874259955
70674,70674,MUNICIPIO DE BARBOSA,890980445,ANTIOQUIA,BARBOSA,Territorial,Centralizada,CO1.REQ.4182358,INVITACION DE MINIMA CUANTIA 003-2023,700793102,CO1.BDOS.4085756,SUMINISTRO DE INSUMOS DE PAPELERIA; CAFETERIA Y TONER PARA IMPRESORAS SEGÚN  FICHA TECNICA QUE HACE PARTE DE LA PRESENTE CONVOCATORIA,"SUMINISTRO DE INSUMOS DE PAPELERIA, CAFETERIA Y TONER PARA IMPRESORAS SEGÚN 
FICHA TECNICA QUE HACE PARTE DE LA PRESENTE CONVOCATORIA",Presentación de oferta,02/27/2023,02/27/2023,,,,,02/27/2023,"19,994,560",Mínima cuantía,Presupuesto inferior al 10% de la menor cuantía,8,día(s),03/03/2023,03/03/2023,03/03/2023,Barbosa,CONTRATACIÓN BARBOSA,0,0,36,0,3,0,0,3,4,Seleccionado,70,Si,CO1.AWD.1561357,701821126,Antioquia,Medellín,03/14/2023,"15,275,623",Manuela Suarez Giraldo,EUFRACIO DE JESUS ARISTIZABAL DUQUE,71310564,V1.44103103,Cerrado,Suministros,No Definido,"V124141500, V144103105, V147131700, V182121507",https://community.secop.gov.co/Public/Tendering/OpportunityDetail/Index?noticeUID=CO1.NTC.4086428,"700,793,102",Adjudicado,2023,0.00432108451923077,,1,19994560,4.62720872758105,V1.441,True,27.4735736846924,0.0593578169684351,82.4207210540772,1,-0.831576016258881,0.668479052816461,-0.2174367078737404,0.16842398374111836
77663,77663,MUNICIPIO DE BARBOSA,890980445,ANTIOQUIA,BARBOSA,Territorial,Centralizada,CO1.REQ.4696852,CD-CPS-183,700793102,CO1.BDOS.4592390,FORTALECIMIENTO EN EL PROCESO DE GESTIÓN DE LA SALUD PÚBLICA EN ASEGURAMIENTO AL SISTEMA GENERAL DE SEGURIDAD SOCIAL EN SALUD -SGSSS DEL MUNICIPIO DE BARBOSA,FORTALECIMIENTO EN EL PROCESO DE GESTIÓN DE LA SALUD PÚBLICA EN ASEGURAMIENTO AL SISTEMA GENERAL DE SEGURIDAD SOCIAL EN SALUD -SGSSS DEL MUNICIPIO DE BARBOSA,Presentación de oferta,06/20/2023,06/20/2023,,,,,06/20/2023,"12,000,000",Contratación directa,Servicios profesionales y apoyo a la gestión,150,día(s),,,,Barbosa,CONTRATACIÓN BARBOSA,0,0,0,0,0,0,0,0,0,Seleccionado,70,No,No Adjudicado,714469764,Antioquia,Barbosa,,0,No Adjudicado,Jhony Andres Tapias Puerta,70140298,V1.80111600,Abierto,Prestación de servicios,No Definido,No definido,https://community.secop.gov.co/Public/Tendering/OpportunityDetail/Index?noticeUID=CO1.NTC.4598397,"700,793,102",Adjudicado,2023,0.00432108451923077,,1,12000000,2.7770806024725,V1.801,True,0.2,0.000432108451923077,0.6,0,12.8854030123625,2.41959243827565e-05,0.010271566192307673,13.8854030123625
77678,77678,MUNICIPIO DE BARBOSA,890980445,ANTIOQUIA,BARBOSA,Territorial,Centralizada,CO1.REQ.4021320,CD-CPS-080-2023,700793102,CO1.BDOS.3925278,PRESTACIÓN DE SERVICIOS PARA REALIZAR LABORES DE COBRO DE CARTERA POR CONCEPTOS TRIBUTARIOS Y NO TRIBUTARIOS DEL MUNICIPIO DE BAROSA,PRESTACIÓN DE SERVICIOS PARA REALIZAR LABORES DE COBRO DE CARTERA POR CONCEPTOS TRIBUTARIOS Y NO TRIBUTARIOS DEL MUNICIPIO DE BAROSA,Presentación de oferta,02/03/2023,02/03/2023,,,,,02/03/2023,"11,330,000",Contratación directa,Servicios profesionales y apoyo a la gestión,84,día(s),,,,Barbosa,CONTRATACIÓN BARBOSA,0,0,0,0,0,0,0,0,0,Seleccionado,70,No,No Adjudicado,702714304,Antioquia,Barbosa,,0,No Adjudicado,LIANA PATRICIA HENAO SALAZAR,39212579,V1.80111600,Abierto,Prestación de servicios,No Definido,No definido,https://community.secop.gov.co/Public/Tendering/OpportunityDetail/Index?noticeUID=CO1.NTC.3926691,"700,793,102",Adjudicado,2023,0.00432108451923077,,1,11330000,2.62202693550112,V1.801,True,2.36407828330994,0.005107691036130118,7.09223484992981,1,0.109111721896973,0.246208142986741,-0.009100764144520485,1.1091117218969697
80810,80810,MUNICIPIO DE BARBOSA,890980445,ANTIOQUIA,BARBOSA,Territorial,Centralizada,CO1.REQ.4712147,CD-CPS-200-2023,700793102,CO1.BDOS.4607562,SERVICIOS PROFESIONALES COMO ABOGADO PARA REALIZAR DIAGNÓSTICO Y BRINDAR ASESORÍA JURÍDICA EN LA CONFORMACIÓN DE LAS JUNTAS DIRECTIVAS DE LOS ACUEDUCTOS RURALES DEL MUNICIPIO DE BARBOSA,SERVICIOS PROFESIONALES COMO ABOGADO PARA REALIZAR DIAGNÓSTICO Y BRINDAR ASESORÍA JURÍDICA EN LA CONFORMACIÓN DE LAS JUNTAS DIRECTIVAS DE LOS ACUEDUCTOS RURALES DEL MUNICIPIO DE BARBOSA,Presentación de oferta,06/22/2023,06/22/2023,,,,,06/22/2023,"21,000,000",Contratación directa,Servicios profesionales y apoyo a la gestión,6,Mes(es),,,,Barbosa,CONTRATACIÓN BARBOSA,0,0,0,0,0,0,0,0,0,Seleccionado,70,No,No Adjudicado,715280368,Antioquia,Barbosa,,0,No Adjudicado,Yenny Marin Agudelo,39212937,V1.80111600,Abierto,Prestación de servicios,No Definido,No definido,https://community.secop.gov.co/Public/Tendering/OpportunityDetail/Index?noticeUID=CO1.NTC.4613484,"700,793,102",Adjudicado,2023,0.00432108451923077,,1,21000000,4.85989105432688,V1.801,True,10.5537052154541,0.02280172611351187,31.6611156463623,1,-0.539508546514034,0.846915019090788,-0.07020690445404751,0.46049145348596615
87427,87427,MUNICIPIO DE BARBOSA,890980445,ANTIOQUIA,BARBOSA,Territorial,Centralizada,CO1.REQ.4740540,CD-CPS-366-2023,700793102,CO1.BDOS.4634895,PRESTACION DE SERVICIOS PARA LA ELABORACIÓN DE LOS DIFERENTES ACTOS ADMINISTRATIVOS DE LA OFICINA DE IMPUESTOS (LIQUIDACIÒN OFICIAL; ACUERDOS DE PAGO Y CERTIFICACIONES DE DEUDA); CON BASE EN EL MANUAL,"PRESTACION DE SERVICIOS PARA LA ELABORACIÓN DE LOS DIFERENTES ACTOS ADMINISTRATIVOS DE LA OFICINA DE IMPUESTOS (LIQUIDACIÒN OFICIAL, ACUERDOS DE PAGO Y CERTIFICACIONES DE DEUDA), CON BASE EN EL MANUAL INTERNO DE CARTERA.",Presentación de oferta,06/27/2023,06/27/2023,,,,,06/26/2023,"7,200,000",Contratación directa,Servicios profesionales y apoyo a la gestión,120,día(s),,,,Barbosa,CONTRATACIÓN BARBOSA,0,0,0,0,0,0,0,0,0,Seleccionado,70,No,No Adjudicado,715864815,Antioquia,Barbosa,,0,No Adjudicado,SANDRA MILENA ECHAVARRIA GOMEZ,39214983,V1.80111600,Abierto,Prestación de servicios,No Definido,No definido,https://community.secop.gov.co/Public/Tendering/OpportunityDetail/Index?noticeUID=CO1.NTC.4641838,"700,793,102",Adjudicado,2023,0.00432108451923077,,1,7200000,1.6662483614835,V1.801,True,1.05216729640961,0.0022732519080782294,3.15650188922882,1,0.583634434532772,0.0765723779262531,-0.0018930076323129298,1.583634434532764
87901,87901,MUNICIPIO DE BARBOSA,890980445,ANTIOQUIA,BARBOSA,Territorial,Centralizada,CO1.REQ.4638635,CD-CPS-162-2023,700793102,CO1.BDOS.4535238,PRESTACIÓN DE SERVICIOS PARA EL ACOMPAÑAMIENTO A LA OFICINA DEL SISBEN; ADSCRITA A LA SECRETARIA DE PLANEACIÓN MEDIANTE A REALIZACIÓN DE ENCUESTAS DE CARACTERIZACIÓN SOCIOECONOMICA EN LA ZONA RURAL Y,"PRESTACIÓN DE SERVICIOS PARA EL ACOMPAÑAMIENTO A LA OFICINA DEL SISBEN, ADSCRITA A LA SECRETARIA DE PLANEACIÓN MEDIANTE A REALIZACIÓN DE ENCUESTAS DE CARACTERIZACIÓN SOCIOECONOMICA EN LA ZONA RURAL Y URBANA DEL MUNICIPIO DE BARBOSA.",Presentación de oferta,06/07/2023,06/07/2023,,,,,06/07/2023,"16,800,000",Contratación directa,Servicios profesionales y apoyo a la gestión,202,día(s),,,,Barbosa,CONTRATACIÓN BARBOSA,0,0,0,0,0,0,0,0,0,Seleccionado,70,No,No Adjudicado,714963394,Antioquia,Barbosa,,0,No Adjudicado,John Alexander Tabares Rios,70141649,V1.80111600,Abierto,Prestación de servicios,No Definido,No definido,https://community.secop.gov.co/Public/Tendering/OpportunityDetail/Index?noticeUID=CO1.NTC.4540489,"700,793,102",Adjudicado,2023,0.00432108451923077,,1,16800000,3.88791284346151,V1.801,True,0.2,0.000432108451923077,0.6,0,18.4395642173075,7.26444024978181e-06,0.015071566192307706,19.43956421730755
87980,87980,MUNICIPIO DE BARBOSA,890980445,ANTIOQUIA,BARBOSA,Territorial,Centralizada,CO1.REQ.4521966,CD-CS-021-2023,700793102,CO1.BDOS.4420764,AUNAR ESFUERZOS PARA LA EJECUCIÓN DEL CONVENIO SOLIDARIO CON LA JUNTA DE ACCIÓN COMUNAL; VEREDA CESTILLAL; PARA EL FORTALECIMIENTO DE LOS MODELOS PRODUCTIVOS; DE LAS DIFERENTES VEREDAS DEL MUNICIPIO D,"AUNAR ESFUERZOS PARA LA EJECUCIÓN DEL CONVENIO SOLIDARIO CON LA JUNTA DE ACCIÓN COMUNAL, VEREDA CESTILLAL; PARA EL FORTALECIMIENTO DE LOS MODELOS PRODUCTIVOS, DE LAS DIFERENTES VEREDAS DEL MUNICIPIO DE BARBOSA, ESTABLECIENDO UN PILOTO DE PRODUCCIÓN AGROPECUARIA GRANJA 10, TENIENDO COMO BASE EL DESARROLLO SOSTENIBLE Y EL FORTALECIMIENTO DE LA ECONOMÍA CAMPESINA FAMILIAR Y COMUNITARIA EN EL MUNICIPIO DE BARBOSA - ANTIOQUIA.",Presentación de oferta,05/15/2023,05/15/2023,,,,,05/15/2023,"32,000,000",Contratación directa,Contratos o convenios Interadministrativos (valor cero),210,día(s),,,,Barbosa,CONTRATACIÓN BARBOSA,0,0,0,0,0,0,0,0,0,Seleccionado,70,No,No Adjudicado,715570529,Antioquia,Barbosa,,0,No Adjudicado,JAC VEREDA CESTILLAL,811010686,V1.80111600,Abierto,Otro,No Definido,No definido,https://community.secop.gov.co/Public/Tendering/OpportunityDetail/Index?noticeUID=CO1.NTC.4423369,"700,793,102",Adjudicado,2023,0.00432108451923077,,1,32000000,7.40554827326001,V1.801,True,0.2,0.000432108451923077,0.6,0,36.0277413663001,7.40471729122873e-07,0.030271566192307676,37.02774136630005
89486,89486,MUNICIPIO DE BARBOSA,890980445,ANTIOQUIA,BARBOSA,Territorial,Centralizada,CO1.REQ.4221461,CD-CPS-137-2023,700793102,CO1.BDOS.4125114,PRESTACIÓN DE SERVICIOS PROFESIONALES PARA EL SEGUIMIENTO A LOS INSTRUMENTOS DE PLANIFICACIÓN PLAN INDICATIVO; PLAN DE ACCIÓN; PLAN PLURIANUAL DE INVERSIONES; PLAN OPERATIVO ANUAL DE INVERSIONES Y LA,"PRESTACIÓN DE SERVICIOS PROFESIONALES PARA EL SEGUIMIENTO A LOS INSTRUMENTOS DE PLANIFICACIÓN PLAN INDICATIVO, PLAN DE ACCIÓN, PLAN PLURIANUAL DE INVERSIONES, PLAN OPERATIVO ANUAL DE INVERSIONES Y LA RENDICIÓN DEL SISTEMA DE EJECUCIÓN DE LA EFICACIA SIEE DNP, DEL MUNICIPIO DE BARBOSA.",Presentación de oferta,03/06/2023,03/06/2023,,,,,03/06/2023,"31,250,000",Contratación directa,Servicios profesionales y apoyo a la gestión,150,día(s),,,,Barbosa,CONTRATACIÓN BARBOSA,0,0,0,0,0,0,0,0,0,Seleccionado,70,No,No Adjudicado,715948956,Antioquia,Peñol,,0,No Adjudicado,Luis Fernando Vasquez Quintero,71398191,V1.80111600,Abierto,Prestación de servicios,No Definido,No definido,https://community.secop.gov.co/Public/Tendering/OpportunityDetail/Index?noticeUID=CO1.NTC.4126176,"700,793,102",Adjudicado,2023,0.00432108451923077,,1,31250000,7.23198073560548,V1.801,True,23.9628791809082,0.05177281313240986,71.8886375427246,1,-0.698200676095409,0.801646337929038,-0.17584125252963945,0.3017993239045904
92557,92557,MUNICIPIO DE BARBOSA,890980445,ANTIOQUIA,BARBOSA,Territorial,Centralizada,CO1.REQ.3812186,CONTRATOS INDIVIDUALES DE TRABAJO 2023,700793102,CO1.BDOS.3716354,CONTRATOS  INDIVIDUALES DE TRABAJO A TERMINO FIJO INFERIOR A UN AÑO 2023,"OPERARIOS  DE MANTENIMIENTO, SERVICIOS GENERALES , CONDUCTORES , MANIPULADORAS DE ALIMENTOS , MANTENIMIENTO,APOYO ADMINISTRATIVO , COORDINADOR.",Presentación de oferta,01/06/2023,01/06/2023,,,,,01/06/2023,"173,000,000",Contratación directa,Servicios profesionales y apoyo a la gestión,2,Mes(es),,,,Barbosa,CONTRATACIÓN BARBOSA,0,0,0,0,0,0,0,0,0,Seleccionado,70,No,No Adjudicado,720317379,Antioquia,Barbosa,,0,No Adjudicado,LEIDY JOHANA AGUDELO RESTREPO,1035224428,V1.80111600,Abierto,Prestación de servicios,No Definido,No definido,https://community.secop.gov.co/Public/Tendering/OpportunityDetail/Index?noticeUID=CO1.NTC.3722292,"700,793,102",Adjudicado,2023,0.00432108451923077,,1,173000000,40.0362453523119,V1.801,True,35.9068260192871,0.07757821502332705,107.720478057861,1,0.115003741372372,0.242464736205639,-0.1373128600933084,1.1150037413723706
99894,99894,MUNICIPIO DE BARBOSA,890980445,ANTIOQUIA,BARBOSA,Territorial,Centralizada,CO1.REQ.4761606,CD-CPS-381-2023,700793102,CO1.BDOS.4654517,RESTACIÓN DE SERVICIOS DE FORTALECIMIENTO EN LA SECRETARIA DE PARTICIPACIÓN CIUDADANA E INCLUISIÓN SOCIAL; PARA LA ATENCIÓN   DEL ADULTO MAYOR; EN CUMPLIMIENTO DE LAS METAS DEL PLAN DE DESARROLLO MUNI,"PRESTACIÓN DE SERVICIOS DE FORTALECIMIENTO EN LA SECRETARIA DE PARTICIPACIÓN CIUDADANA E INCLUISIÓN SOCIAL, PARA LA ATENCIÓN   DEL ADULTO MAYOR, EN CUMPLIMIENTO DE LAS METAS DEL PLAN DE DESARROLLO MUNICIPAL  BARBOSA SOCIAL ES LA GENTE 2020-2023",Presentación de oferta,06/28/2023,06/28/2023,,,,,06/28/2023,"13,200,000",Contratación directa,Servicios profesionales y apoyo a la gestión,120,día(s),,,,Barbosa,CONTRATACIÓN BARBOSA,0,0,0,0,0,0,0,0,0,Seleccionado,70,No,No Adjudicado,715277166,Antioquia,Barbosa,,0,No Adjudicado,Andrea  Catalina Lopera Usuga,1036613140,V1.80111600,Abierto,Prestación de servicios,No Definido,No definido,https://community.secop.gov.co/Public/Tendering/OpportunityDetail/Index?noticeUID=CO1.NTC.4662289,"700,793,102",Adjudicado,2023,0.00432108451923077,,1,13200000,3.05478866271975,V1.801,True,0.2,0.000432108451923077,0.6,0,14.2739433135988,1.71911453297934e-05,0.011471566192307669,15.27394331359875
101062,101062,MUNICIPIO DE BARBOSA,890980445,ANTIOQUIA,BARBOSA,Territorial,Centralizada,CO1.REQ.3946323,CD-CPS-064-2023,700793102,CO1.BDOS.3850759,PRESTACIÓN DE SERVICIOS PARA EL ACOMPAÑAMIENTO A LA OFICINA DEL SISBEN MEDIANTE LA REALIZACIÓN DE ENCUESTAS DE CARACTERIZACIÓN SOCIOECONÓMICA EN LA ZONA RURAL Y URBANA DEL MUNICIPIO DE BARBOSA,PRESTACIÓN DE SERVICIOS PARA EL ACOMPAÑAMIENTO A LA OFICINA DEL SISBEN MEDIANTE LA REALIZACIÓN DE ENCUESTAS DE CARACTERIZACIÓN SOCIOECONÓMICA EN LA ZONA RURAL Y URBANA DEL MUNICIPIO DE BARBOSA,Presentación de oferta,01/26/2023,01/26/2023,,,,,01/26/2023,"4,400,000",Contratación directa,Servicios profesionales y apoyo a la gestión,60,día(s),,,,Barbosa,CONTRATACIÓN BARBOSA,0,0,0,0,0,0,0,0,0,Seleccionado,70,No,No Adjudicado,714963394,Antioquia,Barbosa,,0,No Adjudicado,John Alexander Tabares Rios,70141649,V1.80111600,Abierto,Prestación de servicios,No Definido,No definido,https://community.secop.gov.co/Public/Tendering/OpportunityDetail/Index?noticeUID=CO1.NTC.3851655,"700,793,102",Adjudicado,2023,0.00432108451923077,,1,4400000,1.01826288757325,V1.801,True,0.2,0.000432108451923077,0.6,0,4.09131443786626,0.0009454043588992,0.0026715661923076843,5.09131443786625
