101243,101243,MUNICIPIO DE BARBOSA,890980445,ANTIOQUIA,BARBOSA,Territorial,Centralizada,CO1.REQ.3900897,CD-CPS-053-2023,700793102,CO1.BDOS.3806204,PRESTACIÓN DE SERVICIOS PARA LA ADMINISTRACIÓN DEL REGISTRO DE MINERÍA DE SUBSISTENCIA A TRAVÉS DE LA PLATAFORMA GENESIS CREADA POR LA AGENCIA NACIONAL DE MINERÍA DE CONFORMIDAD CON EL ARTÍCULO 327 DE,"PRESTACIÓN DE SERVICIOS PARA LA ADMINISTRACIÓN DEL REGISTRO DE MINERÍA DE SUBSISTENCIA A TRAVÉS DE LA PLATAFORMA GENESIS CREADA POR LA AGENCIA NACIONAL DE MINERÍA DE CONFORMIDAD CON EL ARTÍCULO 327 DE LA LEY 1955 DE 2019, MEDIANTE LAS SOLICITUDES DE INSCRIPCIÓN, ACTUALIZACIÓN O RENOVACIÓN PARA REALIZAR LA ACTIVIDAD DE MINERÍA DE SUBSISTENCIA.",Presentación de oferta,01/20/2023,01/20/2023,,,,,01/20/2023,"7,200,000",Contratación directa,Servicios profesionales y apoyo a la gestión,90,día(s),,,,Barbosa,CONTRATACIÓN BARBOSA,0,0,0,0,0,0,0,0,0,Seleccionado,70,No,No Adjudicado,716848692,Antioquia,Barbosa,,0,No Adjudicado,Elsy del Socorro Morales Perez,21525227,V1.80111600,Abierto,Prestación de servicios,No Definido,No definido,https://community.secop.gov.co/Public/Tendering/OpportunityDetail/Index?noticeUID=CO1.NTC.3807022,"700,793,102",Adjudicado,2023,0.00432108451923077,,1,7200000,1.6662483614835,V1.801,True,0.2,0.000432108451923077,0.6,0,7.33124180741752,0.0001536532077933,0.00547156619230768,8.331241807417499
101300,101300,MUNICIPIO DE BARBOSA,890980445,ANTIOQUIA,BARBOSA,Territorial,Centralizada,CO1.REQ.4715997,CD-CPS-210-2023,700793102,CO1.BDOS.4611295,REALIZAR LA ATENCIÓN EN EL ÁREA DE MEDICINA VETERINARIA DE LA ZONA RURAL Y URBANA DEL MUNICIPIO DE BARBOSA; PARA LA ATENCIÓN DE FAUNA DOMESTICA DE CONFORMIDAD CON LA LEY 1774 DE 2016; 1801 DE 2016 Y 2,"REALIZAR LA ATENCIÓN EN EL ÁREA DE MEDICINA VETERINARIA DE LA ZONA RURAL Y URBANA DEL MUNICIPIO DE BARBOSA, PARA LA ATENCIÓN DE FAUNA DOMESTICA DE CONFORMIDAD CON LA LEY 1774 DE 2016, 1801 DE 2016 Y 2054 DE 2020 DE ACUERDO A LOS LINEAMIENTOS DEL COMPONENTE DE BIENESTAR ANIMAL.",Presentación de oferta,06/22/2023,06/22/2023,,,,,06/22/2023,"19,800,000",Contratación directa,Servicios profesionales y apoyo a la gestión,6,Mes(es),,,,Barbosa,CONTRATACIÓN BARBOSA,0,0,0,0,0,0,0,0,0,Seleccionado,70,No,No Adjudicado,715225462,Antioquia,Barbosa,,0,No Adjudicado,LEIDY JOHANA HENAO HENAO,1035223125,V1.80111600,Abierto,Prestación de servicios,No Definido,V142121500,https://community.secop.gov.co/Public/Tendering/OpportunityDetail/Index?noticeUID=CO1.NTC.4617623,"700,793,102",Adjudicado,2023,0.00432108451923077,,1,19800000,4.58218299407963,V1.801,True,0.2,0.000432108451923077,0.6,0,21.9109149703982,4.04929202306824e-06,0.018071566192307677,22.910914970398146
101821,101821,MUNICIPIO DE BARBOSA,890980445,ANTIOQUIA,BARBOSA,Territorial,Centralizada,CO1.REQ.4075385,CD-CPS-104-2023,700793102,CO1.BDOS.3979664,PRESTACIÓN DE SERVICIOS PROFESIONALES EN LA SUBSECRETARÍA DE ARTE Y CULTURA EN LA IMPLEMENTACIÓN DE LOS PROGRAMAS DE FOMENTO Y PROMOCIÓN CULTURAL DESARROLLANDO ACTIVIDADES COMO PROFESOR DE LA DISCIPLI,"PRESTACIÓN DE SERVICIOS PROFESIONALES EN LA SUBSECRETARÍA DE ARTE Y CULTURA EN LA IMPLEMENTACIÓN DE LOS PROGRAMAS DE FOMENTO Y PROMOCIÓN CULTURAL DESARROLLANDO ACTIVIDADES COMO PROFESOR DE LA DISCIPLINA DE   INSTRUMENTOS DE MADERAS Y LECTURA PARA LA ESCUELA DE MÚSICA Y ARTE MANUEL ANTONIO ÁNGEL TABARES, EN LA ZONA URBANA Y RURAL DEL MUNICIPIO DE BARBOSA",Presentación de oferta,02/10/2023,02/10/2023,,,,,02/10/2023,"5,000,000",Contratación directa,Servicios profesionales y apoyo a la gestión,75,día(s),,,,Barbosa,CONTRATACIÓN BARBOSA,0,0,0,0,0,0,0,0,0,Seleccionado,70,No,No Adjudicado,713695419,Antioquia,Barbosa,,0,No Adjudicado,CARLOS ARTURO OSORIO GALLEGO,1035233676,V1.86131601,Abierto,Prestación de servicios,No Definido,No definido,https://community.secop.gov.co/Public/Tendering/OpportunityDetail/Index?noticeUID=CO1.NTC.3981054,"700,793,102",Adjudicado,2023,0.00432108451923077,,1,5000000,1.15711691769688,V1.861,True,0.2,0.000432108451923077,0.6,0,4.78558458848439,0.0005876469711696,0.003271566192307705,5.7855845884844
106687,106687,MUNICIPIO DE BARBOSA,890980445,ANTIOQUIA,BARBOSA,Territorial,Centralizada,CO1.REQ.4097513,CD-CPS-117-2023,700793102,CO1.BDOS.4001721,APOYO A LA GESTIÓN DE LA ADMINISTRACIÓN PARA LA ELABORACIÓN DEL DOCUMENTO  COMPONENTE PLANIFICACIÓN  (ALCANCES 2 Y 4 ) PARA LA CONSTRUCCIÓN DE LA LÍNEA BASE PARA LA DECLARATORIA DEL SISTEMA LOCAL DE Á,APOYO A LA GESTIÓN DE LA ADMINISTRACIÓN PARA LA ELABORACIÓN DEL DOCUMENTO  COMPONENTE PLANIFICACIÓN  (ALCANCES 2 Y 4 ) PARA LA CONSTRUCCIÓN DE LA LÍNEA BASE PARA LA DECLARATORIA DEL SISTEMA LOCAL DE ÁREAS PROTEGIDAS DE ACUERDO CON EL CONVENIO INTERADMINISTRATIVO 040-COV2208-35 CELEBRADO ENTRE LA CORPORACIÓN AUTÓNOMA REGIONAL DEL CENTRO DE ANTIOQUIA (CORANTIOQUIA) Y EL MUNICIPIO DE BARBOSA,Presentación de oferta,02/14/2023,02/14/2023,,,,,02/14/2023,"1,880,000",Contratación directa,Servicios profesionales y apoyo a la gestión,1,Mes(es),,,,Barbosa,CONTRATACIÓN BARBOSA,0,0,0,0,0,0,0,0,0,Seleccionado,70,No,No Adjudicado,713274348,Antioquia,Barbosa,,0,No Adjudicado,Nora Elena Florez Ospina,39207185,V1.80111600,Abierto,Prestación de servicios,No Definido,No definido,https://community.secop.gov.co/Public/Tendering/OpportunityDetail/Index?noticeUID=CO1.NTC.4002528,"700,793,102",Adjudicado,2023,0.00432108451923077,,1,1880000,0.435075961054026,V1.801,True,4.82006549835205,0.010413955203303694,14.4601964950562,1,-0.909736504368504,0.575203522927088,-0.03977582081321477,0.09026349563149624
108453,108453,MUNICIPIO DE BARBOSA,890980445,ANTIOQUIA,BARBOSA,Territorial,Centralizada,CO1.REQ.4688215,CD-CPS-171-2023,700793102,CO1.BDOS.4583682,PRESTACIÓN DE SERVICIOS PARA ADMINISTRAR LAS PLATAFORMAS DEL SIA OBSERVA; SECOP Y LA DEL SAIMYR; RINDIENDO LOS INFORMES A LOS QUE HAYA LUGAR EN TÉRMINOS DE LEY; IGUALMENTE EN EL MANEJO DE LA INFORMACI,"PRESTACIÓN DE SERVICIOS PARA ADMINISTRAR LAS PLATAFORMAS DEL SIA OBSERVA, SECOP Y LA DEL SAIMYR, RINDIENDO LOS INFORMES A LOS QUE HAYA LUGAR EN TÉRMINOS DE LEY, IGUALMENTE EN EL MANEJO DE LA INFORMACION REMITIDA POR LAS DEPENDENCIAS DE LOS PROCESOS CONTRACTUALES.",Presentación de oferta,06/16/2023,06/16/2023,,,,,06/16/2023,"14,400,000",Contratación directa,Servicios profesionales y apoyo a la gestión,6,Mes(es),,,,Barbosa,CONTRATACIÓN BARBOSA,0,0,0,0,0,0,0,0,0,Seleccionado,70,No,No Adjudicado,714197332,Antioquia,Barbosa,,0,No Adjudicado,YUDI ADELA PEREZ AGUDELO,39214286,V1.80111600,Abierto,Prestación de servicios,No Definido,No definido,https://community.secop.gov.co/Public/Tendering/OpportunityDetail/Index?noticeUID=CO1.NTC.4589916,"700,793,102",Adjudicado,2023,0.00432108451923077,,1,14400000,3.33249672296701,V1.801,True,0.2,0.000432108451923077,0.6,0,15.662483614835,1.25920301487609e-05,0.012671566192307712,16.66248361483505
113568,113568,MUNICIPIO DE BARBOSA,890980445,ANTIOQUIA,BARBOSA,Territorial,Centralizada,CO1.REQ.3845121,CD-CPS-023-2023,700793102,CO1.BDOS.3749810,PRESTACION DE SERVICIOS PROFESIONALES PARA BRINDAR DIRECCIONAMIENTO Y APOYO PROFESIONAL AL MUNICIPIO DE BARBOSA REFERENTE A LA ADMINISTRACIÓN Y GESTIÓN DEL RÉGIMEN PENSIONAL.,PRESTACION DE SERVICIOS PROFESIONALES PARA BRINDAR DIRECCIONAMIENTO Y APOYO PROFESIONAL AL MUNICIPIO DE BARBOSA REFERENTE A LA ADMINISTRACIÓN Y GESTIÓN DEL RÉGIMEN PENSIONAL.,Presentación de oferta,01/13/2023,01/13/2023,,,,,01/13/2023,"10,200,000",Contratación directa,Servicios profesionales y apoyo a la gestión,150,día(s),,,,Barbosa,CONTRATACIÓN BARBOSA,0,0,0,0,0,0,0,0,0,Seleccionado,70,No,No Adjudicado,714290988,Antioquia,Medellín,,0,No Adjudicado,NERY ANDREA NARANJO ALVAREZ,43976362,V1.80111600,Abierto,Prestación de servicios,No Definido,No definido,https://community.secop.gov.co/Public/Tendering/OpportunityDetail/Index?noticeUID=CO1.NTC.3753166,"700,793,102",Adjudicado,2023,0.00432108451923077,,1,10200000,2.36051851210163,V1.801,True,4.30861806869507,0.009308951417958122,12.9258542060852,1,-0.452140228150566,0.804275360427473,-0.02703580567183249,0.5478597718494339
119103,119103,MUNICIPIO DE BARBOSA,890980445,ANTIOQUIA,BARBOSA,Territorial,Centralizada,CO1.REQ.4699560,CD-CPS-177-2023,700793102,CO1.BDOS.4595239,FORTALECIMIENTO DEL PROCESO DE GESTIÓN DEL CONOCIMIENTO Y VIGILANCIA EN SALUD PÚBLICA EN EL TEMA DE CONVIVENCIA SOCIAL Y SALUD MENTAL EN EL MUNICIPIO DE BARBOSA.,FORTALECIMIENTO DEL PROCESO DE GESTIÓN DEL CONOCIMIENTO Y VIGILANCIA EN SALUD PÚBLICA EN EL TEMA DE CONVIVENCIA SOCIAL Y SALUD MENTAL EN EL MUNICIPIO DE BARBOSA.,Presentación de oferta,06/20/2023,06/20/2023,,,,,06/20/2023,"19,800,000",Contratación directa,Servicios profesionales y apoyo a la gestión,180,día(s),,,,Barbosa,CONTRATACIÓN BARBOSA,0,0,0,0,0,0,0,0,0,Seleccionado,70,No,No Adjudicado,714569845,Antioquia,Barbosa,,0,No Adjudicado,JERIS ALBEIRO OSORIO SOSA,1035866623,V1.80111600,Abierto,Prestación de servicios,No Definido,No definido,https://community.secop.gov.co/Public/Tendering/OpportunityDetail/Index?noticeUID=CO1.NTC.4601172,"700,793,102",Adjudicado,2023,0.00432108451923077,,1,19800000,4.58218299407963,V1.801,True,0.2,0.000432108451923077,0.6,0,21.9109149703982,4.04929202306824e-06,0.018071566192307677,22.910914970398146
120281,120281,MUNICIPIO DE BARBOSA,890980445,ANTIOQUIA,BARBOSA,Territorial,Centralizada,CO1.REQ.4537239,CD-CS-025-2023,700793102,CO1.BDOS.4435912,CONVENIO SOLIDARIO ENTRE EL MUNICIPIO DE BARBOSA ANTIOQUIA Y EL HOGAR INFANTIL MIGUELITO; CON EL FIN DE AUNAR ESFUERZOS PARA EL FORTALECIMIENTO DE LA ATENCIÓN INTEGRAL A 90 NIÑOS Y NIÑAS MENORES DE CI,"CONVENIO SOLIDARIO ENTRE EL MUNICIPIO DE BARBOSA ANTIOQUIA Y EL HOGAR INFANTIL MIGUELITO, CON EL FIN DE AUNAR ESFUERZOS PARA EL FORTALECIMIENTO DE LA ATENCIÓN INTEGRAL A 90 NIÑOS Y NIÑAS MENORES DE CINCO AÑOS Y/O HASTA SU INGRESO A LA ETAPA DE TRANSICIÒN, EN LOS SERVICIOS DE EDUCACIÒN INICIAL, ALIMENTACIÓN Y CUIDADO. INICIAL, ALIMENTACIÓN Y CUIDADO",Presentación de oferta,05/18/2023,05/18/2023,,,,,05/17/2023,"8,800,000",Contratación directa,Contratos o convenios Interadministrativos (valor cero),4,Mes(es),,,,Barbosa,CONTRATACIÓN BARBOSA,0,0,0,0,0,0,0,0,0,Seleccionado,70,No,No Adjudicado,708769179,Antioquia,Barbosa,,0,No Adjudicado,ASOCIACION DE PADRES DE FAMILIA DEL HOGAR INFANTIL MIGUELITO,800157046,V1.93141506,Abierto,Otro,No Definido,No definido,https://community.secop.gov.co/Public/Tendering/OpportunityDetail/Index?noticeUID=CO1.NTC.4439645,"700,793,102",Adjudicado,2023,0.00432108451923077,,1,8800000,2.0365257751465,V1.931,True,43.6189956665039,0.09424068345946202,130.856986999512,1,-0.953311034698802,0.523531967228116,-0.3681627338378481,0.04668896530119785
120816,120816,MUNICIPIO DE BARBOSA,890980445,ANTIOQUIA,BARBOSA,Territorial,Centralizada,CO1.REQ.4293547,SA-SI-004-2023 (Presentación de oferta),700793102,CO1.BDOS.4147480,ADQUISICIÓN DE UN (01) VEHÍCULO TIPO GRÚA; PARA EL TRASLADO DE LOS VEHÍCULOS  INMOVILIZADOS POR LA SECRETARÍA DE TRÁNSITO Y TRANSPORTE DEL MUNICIPIO DE  BARBOSA (Presentación de oferta),"ADQUISICIÓN DE UN (01) VEHÍCULO TIPO GRÚA, PARA EL TRASLADO DE LOS VEHÍCULOS 
INMOVILIZADOS POR LA SECRETARÍA DE TRÁNSITO Y TRANSPORTE DEL MUNICIPIO DE 
BARBOSA",Presentación de oferta,03/21/2023,03/21/2023,,,,,03/21/2023,"300,000,000",Selección abreviada subasta inversa,Suministro de bienes y servicios de características técnicas uniformes y común utilización,60,día(s),03/30/2023,04/17/2023,,Barbosa,CONTRATACIÓN BARBOSA,0,0,9,0,0,0,0,0,0,Cancelado,100,No,No Adjudicado,No Definido,No Definido,No Definido,,0,No Adjudicado,No Definido,No Definido,V1.25101503,Cerrado,Suministros,No Definido,No definido,https://community.secop.gov.co/Public/Tendering/OpportunityDetail/Index?noticeUID=CO1.NTC.4197652,"700,793,102",Presentación de oferta,2023,0.00432108451923077,,1,300000000,69.4270150618126,V1.251,True,154.550582885742,0.33391306557283584,463.651748657227,1,-0.550781279724196,0.849005710170893,-1.0356522622913433,0.44921872027580406
121402,121402,MUNICIPIO DE BARBOSA,890980445,ANTIOQUIA,BARBOSA,Territorial,Centralizada,CO1.REQ.4730322,CD-CPS-337-2023,700793102,CO1.BDOS.4625226,OPERACIÓN Y GESTIÓN DEL PROGRAMA DE AGRICULTURA Y DESARROLLO RURAL PARA LA EXPEDICIÓN DE GUÍAS SANITARIAS DE MOVILIZACIÓN ANIMAL Y REGISTRO DE MARCAS Y HERRETES PARA LA IDENTIFICACIÓN DE ANIMALES Y OT,OPERACIÓN Y GESTIÓN DEL PROGRAMA DE AGRICULTURA Y DESARROLLO RURAL PARA LA EXPEDICIÓN DE GUÍAS SANITARIAS DE MOVILIZACIÓN ANIMAL Y REGISTRO DE MARCAS Y HERRETES PARA LA IDENTIFICACIÓN DE ANIMALES Y OTROS.,Presentación de oferta,06/25/2023,06/25/2023,,,,,06/25/2023,"10,800,000",Contratación directa,Servicios profesionales y apoyo a la gestión,135,día(s),,,,Barbosa,CONTRATACIÓN BARBOSA,0,0,0,0,0,0,0,0,0,Seleccionado,70,No,No Adjudicado,715354718,Antioquia,Barbosa,,0,No Adjudicado,Miriam Londoño Tapias,39208594,V1.80111600,Abierto,Prestación de servicios,No Definido,No definido,https://community.secop.gov.co/Public/Tendering/OpportunityDetail/Index?noticeUID=CO1.NTC.4632010,"700,793,102",Adjudicado,2023,0.00432108451923077,,1,10800000,2.49937254222525,V1.801,True,6.94653463363647,0.015008281633853468,20.8396039009094,1,-0.640198649536302,0.836166960489964,-0.04923312653541389,0.3598013504636978
126470,126470,MUNICIPIO DE BARBOSA,890980445,ANTIOQUIA,BARBOSA,Territorial,Centralizada,CO1.REQ.3847290,LP-CMA-001-2022 (LICITACION) (Presentación de oferta),700793102,CO1.BDOS.3677320,LA ELABORACIÓN DE ESTUDIOS Y DISEÑOS DE PREINVERSIÓN PARA LA OPTIMIZACIÓN Y ADECUACIÓN DE DIFERENTES SISTEMAS DE ACUEDUCTOS EXISTENTES ENTRE LOS QUE SE ENCUENTRAN: ACUEDUCTO FILOVERDE; ACUEDUCTO TABLA,"LA ELABORACIÓN DE ESTUDIOS Y DISEÑOS DE PREINVERSIÓN PARA LA OPTIMIZACIÓN Y ADECUACIÓN DE DIFERENTES SISTEMAS DE ACUEDUCTOS EXISTENTES ENTRE LOS QUE SE ENCUENTRAN: ACUEDUCTO FILOVERDE, ACUEDUCTO TABLAZO HATILLO, ACUEDUCTO GRACIANO- BUGA, ACUEDUCTO MULTIVEREDAL AGUAS CRISTALINAS, ACUEDUCTO AGUAS CLARAS ARRIBA Y AGUAS CLARAS ABAJO, ACUEDUCTO LAS VICTORIAS Y ACUEDUCTO MULTIVEREDAL LA GOTA DE AGUA, ZONA RURAL DEL MUNICIPIO DE BARBOSA, ANTIOQUIA",Presentación de oferta,01/13/2023,01/13/2023,,,,,01/13/2023,"545,650,000",CCE-20-Concurso_Meritos_Sin_Lista_Corta_1Sobre,Ley 1150 de 2007,3,Mes(es),02/01/2023,02/01/2023,02/01/2023,Barbosa,CONTRATACION MERITOS,0,0,12,0,3,0,0,3,4,Seleccionado,70,No,No Adjudicado,720668151,No Definido,Popayán,,0,No Adjudicado,UT BARBOSA 2023,No Definido,V1.80111601,Cerrado,Consultoría,No Definido,No definido,https://community.secop.gov.co/Public/Tendering/OpportunityDetail/Index?noticeUID=CO1.NTC.3755811,"700,793,102",Adjudicado,2023,0.00432108451923077,,1,545650000,126.27616922826,V1.801,True,120.562347412109,0.26048004650229306,361.687042236328,1,0.0473930869695136,0.289042704434998,-0.49627018600917294,1.0473930869695152
133124,133124,MUNICIPIO DE BARBOSA,890980445,ANTIOQUIA,BARBOSA,Territorial,Centralizada,CO1.REQ.5356795,CD-CPS-402-2023,700793102,CO1.BDOS.5239771,PRESTACIÓN DE SERVICIOS COMO NOTIFICADOR DE ACTUACIONES REALIZADAS EN EL COBRO ADMINISTRATIVO COACTIVO EN ZONA URBANA DEL MUNICIPIO.,PRESTACIÓN DE SERVICIOS COMO NOTIFICADOR DE ACTUACIONES REALIZADAS EN EL COBRO ADMINISTRATIVO COACTIVO EN ZONA URBANA DEL MUNICIPIO.,Presentación de oferta,11/29/2023,11/29/2023,,,,,11/29/2023,"2,000,000",Contratación directa,Servicios profesionales y apoyo a la gestión,30,día(s),,,,Barbosa,CONTRATACIÓN BARBOSA,0,0,0,0,0,0,0,0,0,Seleccionado,70,No,No Adjudicado,716286547,Antioquia,Barbosa,,0,No Adjudicado,VISTOR RAMIRO MUNERA LONDOÑO,70132726,V1.80111600,Abierto,Prestación de servicios,No Definido,No definido,https://community.secop.gov.co/Public/Tendering/OpportunityDetail/Index?noticeUID=CO1.NTC.5252787,"700,793,102",Adjudicado,2023,0.00432108451923077,,1,2000000,0.462846767078751,V1.801,True,0.041931577026844,9.059494417881409e-05,0.125794731080532,0,10.0381435637978,5.53026734650793e-05,0.0016376202232847444,11.03814356379783
134011,134011,MUNICIPIO DE BARBOSA,890980445,ANTIOQUIA,BARBOSA,Territorial,Centralizada,CO1.REQ.4711417,CD-CPS-198-2023,700793102,CO1.BDOS.4606681,PRESTACIÓN DE SERVICIOS PARA EL ACOMPAÑAMIENTO EN LOS PROCESOS Y PROCEDIMIENTOS DE LA INSPECCION DE POLICIA EN APLICACIÓN DE LA LEY 1801 DE 2016,PRESTACIÓN DE SERVICIOS PARA EL ACOMPAÑAMIENTO EN LOS PROCESOS Y PROCEDIMIENTOS DE LA INSPECCION DE POLICIA EN APLICACIÓN DE LA LEY 1801 DE 2016,Presentación de oferta,06/22/2023,06/22/2023,,,,,06/22/2023,"15,600,000",Contratación directa,Servicios profesionales y apoyo a la gestión,180,día(s),,,,Barbosa,CONTRATACIÓN BARBOSA,0,0,0,0,0,0,0,0,0,Seleccionado,70,No,No Adjudicado,714456662,Antioquia,Girardota,,0,No Adjudicado,CARMEN CECILIA BUSTAMANTE CANO,39357777,V1.80111600,Abierto,Prestación de servicios,No Definido,No definido,https://community.secop.gov.co/Public/Tendering/OpportunityDetail/Index?noticeUID=CO1.NTC.4612908,"700,793,102",Adjudicado,2023,0.00432108451923077,,1,15600000,3.61020478321426,V1.801,True,11.2137975692749,0.024227883539190705,33.6413927078247,1,-0.678056897236491,0.815726567122427,-0.0813115341567628,0.3219431027635093
139992,139992,MUNICIPIO DE BARBOSA,890980445,ANTIOQUIA,BARBOSA,Territorial,Centralizada,CO1.REQ.4046980,CD-CS-002-2023,700793102,CO1.BDOS.3951325,CONVENIO SOLIDARIO ENTRE EL MUNICIPIO DE BARBOSA Y LA FUNDACIÓN HOGAR EL BUEN SAMARITANO; CON EL FIN DE AUNAR ESFUERZOS PARA LA ATENCIÓN INTEGRAL DE DIECINUEVE (19) ADULTOS MAYORES DE LA ZONA RURAL DE,"CONVENIO SOLIDARIO ENTRE EL MUNICIPIO DE BARBOSA Y LA FUNDACIÓN HOGAR EL BUEN SAMARITANO, CON EL FIN DE AUNAR ESFUERZOS PARA LA ATENCIÓN INTEGRAL DE DIECINUEVE (19) ADULTOS MAYORES DE LA ZONA RURAL DEL MUNICIPIO DE BARBOSA, QUE SE ENCUENTRAN EN SITUACIÓN DE ABANDONO Y EN CALLE",Presentación de oferta,02/08/2023,02/08/2023,,,,,02/07/2023,"18,772,416",Contratación directa,Contratos o convenios Interadministrativos (valor cero),82,día(s),,,,Barbosa,CONTRATACIÓN BARBOSA,0,0,0,0,0,0,0,0,0,Seleccionado,70,No,No Adjudicado,702365396,Antioquia,Barbosa,,0,No Adjudicado,FUNDACION HOGAR EL BUEN SAMARITANO,900361841,V1.80111600,Abierto,Otro,No Definido,No definido,https://community.secop.gov.co/Public/Tendering/OpportunityDetail/Index?noticeUID=CO1.NTC.3953013,"700,793,102",Adjudicado,2023,0.00432108451923077,,1,18772416,4.34437602792871,V1.801,True,0.2,0.000432108451923077,0.6,0,20.7218801396435,4.89356591097431e-06,0.0170439821923077,21.721880139643545
140107,140107,MUNICIPIO DE BARBOSA,890980445,ANTIOQUIA,BARBOSA,Territorial,Centralizada,CO1.REQ.3898991,CD-CPS-051-2023,700793102,CO1.BDOS.3804320,PRESTACIÓN SERVICIOS TECNOLÓGICOS EN LOS DIFERENTES PROCESOS EN SISTEMAS DE LA SECRETARIA DE MOVILIDAD DEL MUNICIPIO DE BARBOSA ANTIOQUIA,PRESTACIÓN SERVICIOS TECNOLÓGICOS EN LOS DIFERENTES PROCESOS EN SISTEMAS DE LA SECRETARIA DE MOVILIDAD DEL MUNICIPIO DE BARBOSA   ANTIOQUIA,Presentación de oferta,01/20/2023,01/20/2023,,,,,01/20/2023,"7,800,000",Contratación directa,Servicios profesionales y apoyo a la gestión,90,día(s),,,,Barbosa,CONTRATACIÓN BARBOSA,0,0,0,0,0,0,0,0,0,Seleccionado,70,No,No Adjudicado,714309168,Antioquia,Barbosa,,0,No Adjudicado,ALBERT STEVEN MUNERA ROJAS,1035223114,V1.80111604,Abierto,Prestación de servicios,No Definido,No definido,https://community.secop.gov.co/Public/Tendering/OpportunityDetail/Index?noticeUID=CO1.NTC.3805416,"700,793,102",Adjudicado,2023,0.00432108451923077,,1,7800000,1.80510239160713,V1.801,True,0.2,0.000432108451923077,0.6,0,8.02551195803564,0.0001147690395485,0.006071566192307701,9.025511958035649
143689,143689,MUNICIPIO DE BARBOSA,890980445,ANTIOQUIA,BARBOSA,Territorial,Centralizada,CO1.REQ.3812186,CONTRATOS INDIVIDUALES DE TRABAJO 2023,700793102,CO1.BDOS.3716354,CONTRATOS  INDIVIDUALES DE TRABAJO A TERMINO FIJO INFERIOR A UN AÑO 2023,"OPERARIOS  DE MANTENIMIENTO, SERVICIOS GENERALES , CONDUCTORES , MANIPULADORAS DE ALIMENTOS , MANTENIMIENTO,APOYO ADMINISTRATIVO , COORDINADOR.",Presentación de oferta,01/06/2023,01/06/2023,,,,,01/06/2023,"173,000,000",Contratación directa,Servicios profesionales y apoyo a la gestión,2,Mes(es),,,,Barbosa,CONTRATACIÓN BARBOSA,0,0,0,0,0,0,0,0,0,Seleccionado,70,No,No Adjudicado,720306588,Antioquia,Barbosa,,0,No Adjudicado,JOHN JAIRO GOMEZ BLANDON,70132582,V1.80111600,Abierto,Prestación de servicios,No Definido,No definido,https://community.secop.gov.co/Public/Tendering/OpportunityDetail/Index?noticeUID=CO1.NTC.3722292,"700,793,102",Adjudicado,2023,0.00432108451923077,,1,173000000,40.0362453523119,V1.801,True,35.9068260192871,0.07757821502332705,107.720478057861,1,0.115003741372372,0.242464736205639,-0.1373128600933084,1.1150037413723706
