97375,97375,HOSPITAL GUACHUCAL ESE,837000286,NARIÑO,GUACHUCAL,Territorial,Centralizada,CO1.REQ.5273275,202310039,704470228,CO1.BDOS.5158278,PRESTACION DE SERVICIOS PROFESIONALES DE BACTERIOLOGIA PARA EL APOYO DEL AREA ASISTENCIAL DEL HOSPITAL GUACHUCAL E.S.E.,PRESTACION DE SERVICIOS PROFESIONALES DE BACTERIOLOGIA PARA EL APOYO DEL AREA ASISTENCIAL DEL HOSPITAL GUACHUCAL E.S.E.,Presentación de oferta,11/14/2023,11/14/2023,,,,,11/13/2023,"4,600,000",Contratación régimen especial,Regla aplicable,2,Mes(es),,,,Guachucal,CONTRATACION,0,0,0,0,0,0,0,0,0,Publicado,50,No,No Adjudicado,No Definido,No Definido,No Definido,,0,No Adjudicado,No Definido,No Definido,UNSPECIFIED,Abierto,Prestación de servicios,No Definido,No definido,https://community.secop.gov.co/Public/Tendering/OpportunityDetail/Index?noticeUID=CO1.NTC.5170276,"704,470,228",Presentación de oferta,2023,0.00432108451923077,,1,4600000,1.06454756428113,UNSPEC,True,0.792267084121704,0.0017117265161471986,2.37680125236511,1,0.343672589226989,0.135247397878499,-0.002246906064588781,1.3436725892269932
105576,105576,EMPRESA MUNICIPAL DE SERVICIOS PUBLICOS DE GUACHUCAL NARIÑO EMPAGUA ESP,814002063,NARIÑO,GUACHUCAL,Territorial,Centralizada,CO1.REQ.5368275,2023-057,715699393,CO1.BDOS.5251459,Prestar el servicio técnico en el área de facturación para brindar un buen servicio a todos los usuarios de EMPAGUA E.S.P,Prestar el servicio técnico en el área de facturación para brindar un buen servicio a todos los usuarios de EMPAGUA E.S.P,Presentación de oferta,12/01/2023,12/01/2023,,,,,12/01/2023,"2,200,000",Contratación régimen especial,Decreto 092 de 2017,2,Mes(es),,,,Guachucal,GESTION CONTRACTUAL,0,0,0,0,0,0,0,0,0,Publicado,50,No,No Adjudicado,No Definido,No Definido,No Definido,,0,No Adjudicado,No Definido,No Definido,V1.83101500,Abierto,Decreto 092 de 2017,No Definido,No definido,https://community.secop.gov.co/Public/Tendering/OpportunityDetail/Index?noticeUID=CO1.NTC.5264571,"715,699,393",Presentación de oferta,2023,0.00432108451923077,,1,2200000,0.509131443786626,V1.831,True,0.2,0.000432108451923077,0.6,1,1.54565721893313,0.0130123607790729,0.0004715661923076925,2.5456572189331297
107340,107340,HOSPITAL GUACHUCAL ESE,837000286,NARIÑO,GUACHUCAL,Territorial,Centralizada,CO1.REQ.4399580,202304012,704470228,CO1.BDOS.4299587,PRESTACION DE SERVICIOS PROFESIONALES DE MEDICINA GENERAL PARA EL APOYO A EL AREA ASISTENCIAL DEL HOSPITAL GUACHUCAL E.S.E,PRESTACION DE SERVICIOS PROFESIONALES DE MEDICINA GENERAL PARA EL APOYO A EL AREA ASISTENCIAL DEL HOSPITAL GUACHUCAL E.S.E,Presentación de oferta,04/17/2023,04/17/2023,,,,,04/17/2023,"16,800,000",Contratación régimen especial,Regla aplicable,116,día(s),,,,Guachucal,CONTRATACION,0,0,0,0,0,0,0,0,0,Publicado,50,No,No Adjudicado,No Definido,No Definido,No Definido,,0,No Adjudicado,No Definido,No Definido,V1.80111600,Abierto,Prestación de servicios,No Definido,No definido,https://community.secop.gov.co/Public/Tendering/OpportunityDetail/Index?noticeUID=CO1.NTC.4303530,"704,470,228",Presentación de oferta,2023,0.00432108451923077,,1,16800000,3.88791284346151,V1.801,True,0.2,0.000432108451923077,0.6,0,18.4395642173075,7.26444024978181e-06,0.015071566192307706,19.43956421730755
116935,116935,HOSPITAL GUACHUCAL ESE,837000286,NARIÑO,GUACHUCAL,Territorial,Centralizada,CO1.REQ.4083670,202301052,704470228,CO1.BDOS.3988130,PRESTACION DE SERVICIOS PROFESIONALES DE APOYO AL SEGUIMIENTO DE PLANES Y PROYECTOS Y ASISTENCIA TÉCNICA EN EL SISTEMA OBLIGATORIO DE GARANTIA DE LA CALIDAD EN SALUD PARA EL HOSPITAL GUACHUCAL E.S.E.,PRESTACION DE SERVICIOS PROFESIONALES DE APOYO AL SEGUIMIENTO DE PLANES Y PROYECTOS Y ASISTENCIA TÉCNICA EN EL SISTEMA OBLIGATORIO DE GARANTIA DE LA CALIDAD EN SALUD PARA EL HOSPITAL GUACHUCAL E.S.E.,Presentación de oferta,02/13/2023,02/13/2023,,,,,02/13/2023,"8,800,000",Contratación régimen especial,Regla aplicable,4,Mes(es),,,,Guachucal,CONTRATACION,0,0,0,0,0,0,0,0,0,Publicado,50,No,No Adjudicado,No Definido,No Definido,No Definido,,0,No Adjudicado,No Definido,No Definido,V1.80111600,Abierto,Prestación de servicios,No Definido,No definido,https://community.secop.gov.co/Public/Tendering/OpportunityDetail/Index?noticeUID=CO1.NTC.3989046,"704,470,228",Presentación de oferta,2023,0.00432108451923077,,1,8800000,2.0365257751465,V1.801,True,0.2,0.000432108451923077,0.6,0,9.18262887573252,7.40553065407393e-05,0.007071566192307677,10.1826288757325
117794,117794,HOSPITAL GUACHUCAL ESE,837000286,NARIÑO,GUACHUCAL,Territorial,Centralizada,CO1.REQ.4876911,202307010,704470228,CO1.BDOS.4769759,PRESTACION DE SERVICIOS TECNICOS DE ENFERMERIA PARA EL APOYO A LA GESTION EN EL AREA ASISTENCIAL DE URGENCIAS DEL HOSPITAL GUACHUCAL E.S.E.,PRESTACION DE SERVICIOS TECNICOS DE ENFERMERIA PARA EL APOYO A LA GESTION EN EL AREA ASISTENCIAL DE URGENCIAS DEL HOSPITAL GUACHUCAL E.S.E.,Presentación de oferta,07/26/2023,07/26/2023,,,,,07/26/2023,"3,480,000",Contratación régimen especial,Regla aplicable,3,Mes(es),,,,Guachucal,CONTRATACION,0,0,0,0,0,0,0,0,0,Publicado,50,No,No Adjudicado,No Definido,No Definido,No Definido,,0,No Adjudicado,No Definido,No Definido,V1.80111600,Abierto,Otro,No Definido,No definido,https://community.secop.gov.co/Public/Tendering/OpportunityDetail/Index?noticeUID=CO1.NTC.4778112,"704,470,228",Presentación de oferta,2023,0.00432108451923077,,1,3480000,0.805353374717026,V1.801,True,0.2,0.000432108451923077,0.6,0,3.02676687358513,0.0022791629561051,0.00175156619230769,4.02676687358513
119519,119519,HOSPITAL GUACHUCAL ESE,837000286,NARIÑO,GUACHUCAL,Territorial,Centralizada,CO1.REQ.4487276,202304009,704470228,CO1.BDOS.4279549,PRESTACION DE SERVICIOS DE APOYO A LA GESTION PARA LA CREACION DE CONTENIDO AUDIOVISUAL CON EL FIN DE FOMENTAR LOS SERVICIOS Y PROGRAMAS DEL HOSPITAL GUACHUCAL E.S.E.,PRESTACION DE SERVICIOS DE APOYO A LA GESTION PARA LA CREACION DE CONTENIDO AUDIOVISUAL CON EL FIN DE FOMENTAR LOS SERVICIOS Y PROGRAMAS DEL HOSPITAL GUACHUCAL E.S.E.,Presentación de oferta,05/08/2023,05/08/2023,,,,,05/08/2023,"2,400,000",Contratación régimen especial,Regla aplicable,2,Semana(s),,,,Guachucal,CONTRATACION,0,0,0,0,0,0,0,0,0,Publicado,50,No,No Adjudicado,No Definido,No Definido,No Definido,,0,No Adjudicado,No Definido,No Definido,V1.80111600,Abierto,Prestación de servicios,No Definido,No definido,https://community.secop.gov.co/Public/Tendering/OpportunityDetail/Index?noticeUID=CO1.NTC.4389032,"704,470,228",Presentación de oferta,2023,0.00432108451923077,,1,2400000,0.555416120494501,V1.801,True,13.7836923599243,0.029780249837154164,41.351077079773,1,-0.959704837717551,0.516086172670708,-0.11672099934861666,0.040295162282448914
123870,123870,HOSPITAL GUACHUCAL ESE,837000286,NARIÑO,GUACHUCAL,Territorial,Centralizada,CO1.REQ.4215959,202302013,704470228,CO1.BDOS.4119382,CONTRATO DE PRESTACIóN DE SERVICIOS PROFESIONALES PARA REALIZAR EL PROCESO DE CALIBRACIóN DE EQUIPO BIOMéDICO DE PROPIEDAD DEL HOSPITAL GUACHUCAL ESE,CONTRATO DE PRESTACIóN DE SERVICIOS PROFESIONALES PARA REALIZAR EL PROCESO DE CALIBRACIóN DE EQUIPO BIOMéDICO DE PROPIEDAD DEL HOSPITAL GUACHUCAL ESE,Presentación de oferta,03/05/2023,03/05/2023,,,,,03/05/2023,"14,685,000",Contratación régimen especial,Regla aplicable,1,Mes(es),,,,Guachucal,CONTRATACION,0,0,0,0,0,0,0,0,0,Publicado,50,No,No Adjudicado,No Definido,No Definido,No Definido,,0,No Adjudicado,No Definido,No Definido,V1.80111600,Abierto,Prestación de servicios,No Definido,No definido,https://community.secop.gov.co/Public/Tendering/OpportunityDetail/Index?noticeUID=CO1.NTC.4120607,"704,470,228",Presentación de oferta,2023,0.00432108451923077,,1,14685000,3.39845238727573,V1.801,True,5.31968450546265,0.011493403181873226,15.9590535163879,1,-0.361155274568267,0.720224253367773,-0.031288612727492886,0.6388447254317328
125244,125244,HOSPITAL GUACHUCAL ESE,837000286,NARIÑO,GUACHUCAL,Territorial,Centralizada,CO1.REQ.5271645,202310019,704470228,CO1.BDOS.5156649,PRESTACION DE SERVICIOS TECNICOS DE APOYO A LA GESTION EN EL AREA ASISTENCIAL DE LABORATORIO DEL HOSPITAL GUACHUCAL E.S.E,PRESTACION DE SERVICIOS TECNICOS DE APOYO A LA GESTION EN EL AREA ASISTENCIAL DE LABORATORIO DEL HOSPITAL GUACHUCAL E.S.E,Presentación de oferta,11/12/2023,11/12/2023,,,,,11/12/2023,"2,520,000",Contratación régimen especial,Regla aplicable,2,Mes(es),,,,Guachucal,CONTRATACION,0,0,0,0,0,0,0,0,0,Publicado,50,No,No Adjudicado,No Definido,No Definido,No Definido,,0,No Adjudicado,No Definido,No Definido,UNSPECIFIED,Abierto,Prestación de servicios,No Definido,No definido,https://community.secop.gov.co/Public/Tendering/OpportunityDetail/Index?noticeUID=CO1.NTC.5168134,"704,470,228",Presentación de oferta,2023,0.00432108451923077,,1,2520000,0.583186926519226,UNSPEC,True,28.2902545928955,0.06112229058322897,84.8707637786865,1,-0.979385589316482,0.493463621187118,-0.24196916233291585,0.020614410683517888
127910,127910,HOSPITAL GUACHUCAL ESE,837000286,NARIÑO,GUACHUCAL,Territorial,Centralizada,CO1.REQ.4050577,202301009,704470228,CO1.BDOS.3954259,PRESTACION DE SERVICIOS TECNICOS DE ENFERMERIA PARA APOYAR LAS ACTIVIDADES DE PROMOCION Y MANTENIMIENTO DE LA SALUD EN EL HOSPITAL GUACHUCAL E.S.E.,PRESTACION DE SERVICIOS TECNICOS DE ENFERMERIA PARA APOYAR LAS ACTIVIDADES DE PROMOCION Y MANTENIMIENTO DE LA SALUD EN EL HOSPITAL GUACHUCAL E.S.E.,Presentación de oferta,02/08/2023,02/08/2023,,,,,02/08/2023,"4,640,000",Contratación régimen especial,Regla aplicable,4,Mes(es),,,,Guachucal,CONTRATACION,0,0,0,0,0,0,0,0,0,Publicado,50,No,No Adjudicado,No Definido,No Definido,No Definido,,0,No Adjudicado,No Definido,No Definido,V1.80111600,Abierto,Prestación de servicios,No Definido,No definido,https://community.secop.gov.co/Public/Tendering/OpportunityDetail/Index?noticeUID=CO1.NTC.3956426,"704,470,228",Presentación de oferta,2023,0.00432108451923077,,1,4640000,1.0738044996227,V1.801,True,0.145459115505219,0.0003142705660953011,0.436377346515656,0,6.38217399365513,0.000239203173593,0.0033829177356187877,7.382173993655093
130036,130036,HOSPITAL GUACHUCAL ESE,837000286,NARIÑO,GUACHUCAL,Territorial,Centralizada,CO1.REQ.5271845,202310030,704470228,CO1.BDOS.5156942,PRESTACION DE SERVICIOS TECNOLOGOS DE APOYO A LA GESTION EN EL AREA DE FARMACIA DEL HOSPITAL GUACHUCAL E.S.E.,PRESTACION DE SERVICIOS TECNOLOGOS DE APOYO A LA GESTION EN EL AREA DE FARMACIA DEL HOSPITAL GUACHUCAL E.S.E.,Presentación de oferta,11/13/2023,11/13/2023,,,,,11/12/2023,"2,900,000",Contratación régimen especial,Regla aplicable,2,Mes(es),,,,Guachucal,CONTRATACION,0,0,0,0,0,0,0,0,0,Publicado,50,No,No Adjudicado,No Definido,No Definido,No Definido,,0,No Adjudicado,No Definido,No Definido,UNSPECIFIED,Abierto,Prestación de servicios,No Definido,No definido,https://community.secop.gov.co/Public/Tendering/OpportunityDetail/Index?noticeUID=CO1.NTC.5168744,"704,470,228",Presentación de oferta,2023,0.00432108451923077,,1,2900000,0.671127812264189,UNSPEC,True,2.68713784217835,0.005805674865438022,8.06141352653503,1,-0.750244367173909,0.756570278408957,-0.020322699461752088,0.24975563282609048
132312,132312,INSTITUCION EDUCATIVA GENARO LEON,837000110,NARIÑO,GUACHUCAL,Nacional,Centralizada,CO1.REQ.5447482,R.E N° 2023-002,701780108,CO1.BDOS.5328980,CONTRATO DE COMPRAVENTA DE IMPRESOS; COPIAS Y  ELEMENTOS DE ESCRITORIO NECESARIOS PARA EL  DESARROLLO DE DIFERENTES PROYECTOS TRASVERSALES  EN LA VIGENCIA 2023,"CONTRATO DE COMPRAVENTA DE IMPRESOS, COPIAS Y 
ELEMENTOS DE ESCRITORIO NECESARIOS PARA EL 
DESARROLLO DE DIFERENTES PROYECTOS TRASVERSALES 
EN LA VIGENCIA 2023 DE LA INSTITUCIÓN EDUCATIVA 
GENARO LEÓN, DEL MUNICIPIO DE GUACHUCAL (N)",Presentación de oferta,12/21/2023,12/21/2023,,,,,12/21/2023,"11,538,000",Contratación régimen especial,Regla aplicable,15,día(s),,,,Guachucal,OFICINA DE CONTRATACION I.E GENARO LEON,0,0,0,0,0,0,0,0,0,Publicado,50,No,No Adjudicado,No Definido,No Definido,No Definido,,0,No Adjudicado,No Definido,No Definido,V1.56121500,Abierto,Compraventa,No Definido,No definido,https://community.secop.gov.co/Public/Tendering/OpportunityDetail/Index?noticeUID=CO1.NTC.5343074,"701,780,108",Presentación de oferta,2023,0.00432108451923077,,1,11538000,2.67016299927731,V1.561,True,0.2,0.000432108451923077,0.6,0,12.3508149963866,2.78609037672293e-05,0.009809566192307679,13.35081499638655
136020,136020,HOSPITAL GUACHUCAL ESE,837000286,NARIÑO,GUACHUCAL,Territorial,Centralizada,CO1.REQ.4486686,202303015,704470228,CO1.BDOS.4258230,PRESTACION DE SERVICIO DE MANTENIMINETO PREVENTIVO Y CORRECTIVO DE LOS MUEBLES DE USOASISTENCIAL DEL HOSPITAL GUACHUCAL E.S.E,PRESTACION DE SERVICIO DE MANTENIMINETO PREVENTIVO Y CORRECTIVO DE LOS MUEBLES DE USOASISTENCIAL DEL HOSPITAL GUACHUCAL E.S.E,Presentación de oferta,05/08/2023,05/08/2023,,,,,05/08/2023,"4,024,000",Contratación régimen especial,Regla aplicable,15,día(s),,,,Guachucal,CONTRATACION,0,0,0,0,0,0,0,0,0,Publicado,50,No,No Adjudicado,No Definido,No Definido,No Definido,,0,No Adjudicado,No Definido,No Definido,V1.80111600,Abierto,Prestación de servicios,No Definido,No definido,https://community.secop.gov.co/Public/Tendering/OpportunityDetail/Index?noticeUID=CO1.NTC.4388169,"704,470,228",Presentación de oferta,2023,0.00432108451923077,,1,4024000,0.931247695362447,V1.801,True,0.2,0.000432108451923077,0.6,0,3.65623847681223,0.0013202540612011,0.002295566192307694,4.656238476812235
136061,136061,HOSPITAL GUACHUCAL ESE,837000286,NARIÑO,GUACHUCAL,Territorial,Centralizada,CO1.REQ.4064410,202301032,704470228,CO1.BDOS.3968576,PRESTACION DE SERVICIOS DE APOYO A LA GESTION AL AREA ADMINISTRATIVA DE FACTURACION DEL HOSPITAL GUACHUCAL E.S.E.,PRESTACION DE SERVICIOS DE APOYO A LA GESTION AL AREA ADMINISTRATIVA DE FACTURACION DEL HOSPITAL GUACHUCAL E.S.E.,Presentación de oferta,02/09/2023,02/09/2023,,,,,02/09/2023,"1,160,000",Contratación régimen especial,Regla aplicable,1,Mes(es),,,,Guachucal,CONTRATACION,0,0,0,0,0,0,0,0,0,Publicado,50,No,No Adjudicado,No Definido,No Definido,No Definido,,0,No Adjudicado,No Definido,No Definido,V1.80111600,Abierto,Prestación de servicios,No Definido,No definido,https://community.secop.gov.co/Public/Tendering/OpportunityDetail/Index?noticeUID=CO1.NTC.3969770,"704,470,228",Presentación de oferta,2023,0.00432108451923077,,1,1160000,0.268451124905675,V1.801,True,15.8181037902832,0.034175681705889145,47.4543113708496,1,-0.983028868158611,0.489329514382377,-0.1355427268235566,0.01697113184138924
138050,138050,HOSPITAL GUACHUCAL ESE,837000286,NARIÑO,GUACHUCAL,Territorial,Centralizada,CO1.REQ.4056349,202301016,704470228,CO1.BDOS.3960834,PRESTACION DE SERVICIOS TECNICOS DE ENFERMERIA PARA REALIZAR ATENCIÓN POST CONSULTA Y CARGUE DE INFORMACION REQUERIDA PARA EL HOSPITAL GUACHUCAL,PRESTACION DE SERVICIOS TECNICOS DE ENFERMERIA PARA REALIZAR ATENCIÓN POST CONSULTA Y CARGUE DE INFORMACION REQUERIDA PARA EL HOSPITAL GUACHUCAL,Presentación de oferta,02/08/2023,02/08/2023,,,,,02/08/2023,"4,640,000",Contratación régimen especial,Regla aplicable,4,Mes(es),,,,Guachucal,CONTRATACION,0,0,0,0,0,0,0,0,0,Publicado,50,No,No Adjudicado,No Definido,No Definido,No Definido,,0,No Adjudicado,No Definido,No Definido,V1.80111600,Abierto,Prestación de servicios,No Definido,No definido,https://community.secop.gov.co/Public/Tendering/OpportunityDetail/Index?noticeUID=CO1.NTC.3962543,"704,470,228",Presentación de oferta,2023,0.00432108451923077,,1,4640000,1.0738044996227,V1.801,True,0.2,0.000432108451923077,0.6,0,4.36902249811351,0.0007756643977387,0.002911566192307684,5.3690224981135
138215,138215,HOSPITAL GUACHUCAL ESE,837000286,NARIÑO,GUACHUCAL,Territorial,Centralizada,CO1.REQ.4496413,202302001,704470228,CO1.BDOS.4118984,SUMINISTRO E INSTALACION DE SISTEMA DE VIDEO VIGILANCIA EN NUEVAS INSTALACIONES DEL HOSPITAL GUACHUCAL ESE,SUMINISTRO E INSTALACION DE SISTEMA DE VIDEO VIGILANCIA EN NUEVAS INSTALACIONES DEL HOSPITAL GUACHUCAL ESE,Presentación de oferta,05/09/2023,05/09/2023,,,,,05/09/2023,"13,000,000",Contratación régimen especial,Regla aplicable,20,día(s),,,,Guachucal,CONTRATACION,0,0,0,0,0,0,0,0,0,Publicado,50,No,No Adjudicado,No Definido,No Definido,No Definido,,0,No Adjudicado,No Definido,No Definido,V1.43202215,Abierto,Suministros,No Definido,No definido,https://community.secop.gov.co/Public/Tendering/OpportunityDetail/Index?noticeUID=CO1.NTC.4397078,"704,470,228",Presentación de oferta,2023,0.00432108451923077,,1,13000000,3.00850398601188,V1.432,True,22.0017051696777,0.04753561380268695,66.0051155090332,1,-0.86326041718993,0.631009820031433,-0.17714245521074778,0.1367395828100696
138942,138942,HOSPITAL GUACHUCAL ESE,837000286,NARIÑO,GUACHUCAL,Territorial,Centralizada,CO1.REQ.4486994,202303021,704470228,CO1.BDOS.4258733,SUMINISTRO DE ELEMENTOS DE UTILES DE OFICINA PARA LAS EL HOSPITAL GUACHUCAL E.S.E.,SUMINISTRO DE ELEMENTOS DE UTILES DE OFICINA PARA LAS EL HOSPITAL GUACHUCAL E.S.E.,Presentación de oferta,05/08/2023,05/08/2023,,,,,05/08/2023,"20,199,799",Contratación régimen especial,Regla aplicable,5,día(s),,,,Guachucal,CONTRATACION,0,0,0,0,0,0,0,0,0,Publicado,50,No,No Adjudicado,No Definido,No Definido,No Definido,,0,No Adjudicado,No Definido,No Definido,V1.44111500,Abierto,Suministros,No Definido,No definido,https://community.secop.gov.co/Public/Tendering/OpportunityDetail/Index?noticeUID=CO1.NTC.4388905,"704,470,228",Presentación de oferta,2023,0.00432108451923077,,1,20199799,4.67470583139529,V1.441,True,8.93550300598145,0.019305531855343228,26.8065090179443,1,-0.476839095877867,0.820785542440611,-0.05702232842137292,0.5231609041221327
