,Unnamed: 0,Entidad,Nit Entidad,Departamento Entidad,Ciudad Entidad,OrdenEntidad,Entidad Centralizada,ID del Proceso,Referencia del Proceso,PCI,ID del Portafolio,Nombre del Procedimiento,Descripción del Procedimiento,Fase,Fecha de Publicacion del Proceso,Fecha de Ultima Publicación,Fecha de Publicacion (Fase Planeacion Precalificacion),Fecha de Publicacion (Fase Seleccion Precalificacion),Fecha de Publicacion (Manifestacion de Interes),Fecha de Publicacion (Fase Borrador),Fecha de Publicacion (Fase Seleccion),Precio Base,Modalidad de Contratacion,Justificación Modalidad de Contratación,Duracion,Unidad de Duracion,Fecha de Recepcion de Respuestas,Fecha de Apertura de Respuesta,Fecha de Apertura Efectiva,Ciudad de la Unidad de Contratación,Nombre de la Unidad de Contratación,Proveedores Invitados,Proveedores con Invitacion Directa,Visualizaciones del Procedimiento,Proveedores que Manifestaron Interes,Respuestas al Procedimiento,Respuestas Externas,Conteo de Respuestas a Ofertas,Proveedores Unicos con Respuestas,Numero de Lotes,Estado del Procedimiento,ID Estado del Procedimiento,Adjudicado,ID Adjudicacion,CodigoProveedor,Departamento Proveedor,Ciudad Proveedor,Fecha Adjudicacion,Valor Total Adjudicacion,Nombre del Adjudicador,Nombre del Proveedor Adjudicado,NIT del Proveedor Adjudicado,Codigo Principal de Categoria,Estado de Apertura del Proceso,Tipo de Contrato,Subtipo de Contrato,Categorias Adicionales,URLProceso,Codigo Entidad,Estado Resumen,Fecha,exchange_rate,Year,Avg,Valor del Contrato,Valor real,Codigo de Categoria Recortado,keep,Valor Proyectado,range-,range+,in_range,perc_error,Similitud de valor,Tamaño valor extraño,veces la predicción
3836,3836,HOSPITAL GUACHUCAL ESE,837000286,NARIÑO,GUACHUCAL,Territorial,Centralizada,CO1.REQ.5465181,202311010,704470228,CO1.BDOS.5347116,PRESTACION DE SERVICIOS DE APOYO A LA GESTION AL AREA ADMINISTRATIVA DE FACTURACION DEL HOSPITAL GUACHUCAL E.S.E.,PRESTACION DE SERVICIOS DE APOYO A LA GESTION AL AREA ADMINISTRATIVA DE FACTURACION DEL HOSPITAL GUACHUCAL E.S.E.,Presentación de oferta,12/28/2023,12/28/2023,,,,,12/28/2023,"2,460,000",Contratación régimen especial,Regla aplicable,60,día(s),,,,Guachucal,CONTRATACION,0,0,0,0,0,0,0,0,0,Publicado,50,No,No Adjudicado,No Definido,No Definido,No Definido,,0,No Adjudicado,No Definido,No Definido,V1.80111600,Abierto,Prestación de servicios,No Definido,No definido,https://community.secop.gov.co/Public/Tendering/OpportunityDetail/Index?noticeUID=CO1.NTC.5361145,"704,470,228",Presentación de oferta,2023,0.00432108451923077,,1,2460000,0.569301523506864,V1.801,True,15.8181037902832,0.034175681705889145,47.4543113708496,1,-0.964009496267399,0.511098478812993,-0.1342427268235566,0.03599050373260141
4507,4507,HOSPITAL GUACHUCAL ESE,837000286,NARIÑO,GUACHUCAL,Territorial,Centralizada,CO1.REQ.5271340,202310015,704470228,CO1.BDOS.5156463,PRESTACION DE SERVICIOS TECNICOS DE ENFERMERIA PARA EL APOYO A LA GESTION EN ACTIVIDADES DE PROMOCION Y MANTENIMIENTO DE LA SALUD EN EL HOSPITAL GUACHUCAL E.S.E,PRESTACION DE SERVICIOS TECNICOS DE ENFERMERIA PARA EL APOYO A LA GESTION EN ACTIVIDADES DE PROMOCION Y MANTENIMIENTO DE LA SALUD EN EL HOSPITAL GUACHUCAL E.S.E,Presentación de oferta,11/12/2023,11/12/2023,,,,,11/12/2023,"2,320,000",Contratación régimen especial,Regla aplicable,2,Mes(es),,,,Guachucal,CONTRATACION,0,0,0,0,0,0,0,0,0,Publicado,50,No,No Adjudicado,No Definido,No Definido,No Definido,,0,No Adjudicado,No Definido,No Definido,UNSPECIFIED,Abierto,Prestación de servicios,No Definido,No definido,https://community.secop.gov.co/Public/Tendering/OpportunityDetail/Index?noticeUID=CO1.NTC.5168225,"704,470,228",Presentación de oferta,2023,0.00432108451923077,,1,2320000,0.536902249811351,UNSPEC,True,3.11500144004822,0.006730092249986959,9.34500432014465,1,-0.827639806868584,0.673057511390842,-0.024600368999947837,0.1723601931314163
8886,8886,HOSPITAL GUACHUCAL ESE,837000286,NARIÑO,GUACHUCAL,Territorial,Centralizada,CO1.REQ.5465333,202311009,704470228,CO1.BDOS.5347103,PRESTACION DE SERVICIOS DE APOYO A LA GESTION AL AREA ADMINISTRATIVA DE FACTURACION DEL HOSPITAL GUACHUCAL E.S.E.,PRESTACION DE SERVICIOS DE APOYO A LA GESTION AL AREA ADMINISTRATIVA DE FACTURACION DEL HOSPITAL GUACHUCAL E.S.E.,Presentación de oferta,12/28/2023,12/28/2023,,,,,12/28/2023,"2,320,000",Contratación régimen especial,Regla aplicable,60,día(s),,,,Guachucal,CONTRATACION,0,0,0,0,0,0,0,0,0,Publicado,50,No,No Adjudicado,No Definido,No Definido,No Definido,,0,No Adjudicado,No Definido,No Definido,V1.80111600,Abierto,Prestación de servicios,No Definido,No definido,https://community.secop.gov.co/Public/Tendering/OpportunityDetail/Index?noticeUID=CO1.NTC.5360905,"704,470,228",Presentación de oferta,2023,0.00432108451923077,,1,2320000,0.536902249811351,V1.801,True,15.8181037902832,0.034175681705889145,47.4543113708496,1,-0.966057736317221,0.508732694612125,-0.1343827268235566,0.03394226368277854
8959,8959,HOSPITAL GUACHUCAL ESE,837000286,NARIÑO,GUACHUCAL,Territorial,Centralizada,CO1.REQ.4086438,202301058,704470228,CO1.BDOS.3990500,PRESTACION DE SERVICIOS DE APOYO A LA GESTION EN ACTIVIDADES DE CONSERJERIA PARA LA CONSERVACION; CUSTODIA Y MANTENIMIENTO DE LAS INSTALACIONES DEL HOSPITAL GUACHUCAL E.S.E.,"PRESTACION DE SERVICIOS DE APOYO A LA GESTION EN ACTIVIDADES DE CONSERJERIA PARA LA CONSERVACION, CUSTODIA Y MANTENIMIENTO DE LAS INSTALACIONES DEL HOSPITAL GUACHUCAL E.S.E.",Presentación de oferta,02/13/2023,02/13/2023,,,,,02/13/2023,"4,640,000",Contratación régimen especial,Regla aplicable,4,Mes(es),,,,Guachucal,CONTRATACION,0,0,0,0,0,0,0,0,0,Publicado,50,No,No Adjudicado,No Definido,No Definido,No Definido,,0,No Adjudicado,No Definido,No Definido,V1.80111600,Abierto,Prestación de servicios,No Definido,No definido,https://community.secop.gov.co/Public/Tendering/OpportunityDetail/Index?noticeUID=CO1.NTC.3992431,"704,470,228",Presentación de oferta,2023,0.00432108451923077,,1,4640000,1.0738044996227,V1.801,True,0.2,0.000432108451923077,0.6,0,4.36902249811351,0.0007756643977387,0.002911566192307684,5.3690224981135
19253,19253,HOSPITAL GUACHUCAL ESE,837000286,NARIÑO,GUACHUCAL,Territorial,Centralizada,CO1.REQ.4801882,202306013,704470228,CO1.BDOS.4696463,SUMINISTRO DE ARTICULOS E IMPLEMENTOS DE FERRETERÍA PARA MANTENIMIENTO DE INFRAESTRUCTURA DEL HOSPITAL GUACHUCAL E.S.E,SUMINISTRO DE ARTICULOS E IMPLEMENTOS DE FERRETERÍA PARA MANTENIMIENTO DE INFRAESTRUCTURA DEL HOSPITAL GUACHUCAL E.S.E,Presentación de oferta,07/06/2023,07/06/2023,,,,,07/06/2023,"6,077,000",Contratación régimen especial,Regla aplicable,15,día(s),,,,Guachucal,CONTRATACION,0,0,0,0,0,0,0,0,0,Publicado,50,No,No Adjudicado,No Definido,No Definido,No Definido,,0,No Adjudicado,No Definido,No Definido,V1.12352310,Abierto,Suministros,No Definido,No definido,https://community.secop.gov.co/Public/Tendering/OpportunityDetail/Index?noticeUID=CO1.NTC.4702815,"704,470,228",Presentación de oferta,2023,0.00432108451923077,,1,6077000,1.40635990176878,V1.123,True,4.81974792480469,0.010413269072234088,14.4592437744141,1,-0.70820882674569,0.793898672377687,-0.035576076288936366,0.29179117325430864
24654,24654,HOSPITAL GUACHUCAL ESE,837000286,NARIÑO,GUACHUCAL,Territorial,Centralizada,CO1.REQ.4215842,202301079,704470228,CO1.BDOS.4119363,PRESTACION DE SERVICIOS PARA DESEMPEÑARSE COMO GESTOR COMUNITARIO EN SALUD Y DESARROLLAR LAS ACTIVIDADES CONTEMPLADAS EN EL CONVENIO INTERADMINISTRATIVO No. 2022000745 (IMPLEMENTACION PAPSIVI) CELEBRA,PRESTACION DE SERVICIOS PARA DESEMPEÑARSE COMO GESTOR COMUNITARIO EN SALUD Y DESARROLLAR LAS ACTIVIDADES CONTEMPLADAS EN EL CONVENIO INTERADMINISTRATIVO No. 2022000745 (IMPLEMENTACION PAPSIVI) CELEBRADO ENTRE EL INSTITUTO DEPARTAMENTAL DE SALUD DE NARIÑO Y EL HOSPITAL GUACHUCAL E.S.E.,Presentación de oferta,03/05/2023,03/05/2023,,,,,03/04/2023,"5,600,000",Contratación régimen especial,Regla aplicable,4,Mes(es),,,,Guachucal,CONTRATACION,0,0,0,0,0,0,0,0,0,Publicado,50,No,No Adjudicado,No Definido,No Definido,No Definido,,0,No Adjudicado,No Definido,No Definido,V1.80111600,Abierto,Prestación de servicios,No Definido,No definido,https://community.secop.gov.co/Public/Tendering/OpportunityDetail/Index?noticeUID=CO1.NTC.4120521,"704,470,228",Presentación de oferta,2023,0.00432108451923077,,1,5600000,1.2959709478205,V1.801,True,12.2321786880493,0.026428138982697188,36.6965360641479,1,-0.894052320451577,0.594042023131844,-0.10011255593078877,0.10594767954842328
27285,27285,HOSPITAL GUACHUCAL ESE,837000286,NARIÑO,GUACHUCAL,Territorial,Centralizada,CO1.REQ.4889131,202307053,704470228,CO1.BDOS.4781640,PRESTACION DE SERVICIOS TECNICOS EN SISTEMAS PARA EL APOYO EN ACTIVIDADES DE DISEÑO; CONSTRUCCION; EVALUACION; MANTENIMIENTO Y PUESTA EN MARCHA DE LA TECNOLOGIA DE HARDWARE Y SOFTWARE DE LOS SISTEMAS,"PRESTACION DE SERVICIOS TECNICOS EN SISTEMAS PARA EL APOYO EN ACTIVIDADES DE DISEÑO, CONSTRUCCION, EVALUACION, MANTENIMIENTO Y PUESTA EN MARCHA DE LA TECNOLOGIA DE HARDWARE Y SOFTWARE DE LOS SISTEMAS INFORMATICOS DEL HOSPITAL GUACHUCAL E.S.E.",Presentación de oferta,07/31/2023,07/31/2023,,,,,07/31/2023,"2,900,000",Contratación régimen especial,Regla aplicable,2,Mes(es),,,,Guachucal,CONTRATACION,0,0,0,0,0,0,0,0,0,Publicado,50,No,No Adjudicado,No Definido,No Definido,No Definido,,0,No Adjudicado,No Definido,No Definido,V1.80111600,Abierto,Prestación de servicios,No Definido,No definido,https://community.secop.gov.co/Public/Tendering/OpportunityDetail/Index?noticeUID=CO1.NTC.4789931,"704,470,228",Presentación de oferta,2023,0.00432108451923077,,1,2900000,0.671127812264189,V1.801,True,0.2,0.000432108451923077,0.6,0,2.35563906132094,0.0045446207593048,0.0011715661923076936,3.3556390613209452
32218,32218,INSTITUCION EDUCATIVA GENARO LEON,837000110,NARIÑO,GUACHUCAL,Nacional,Centralizada,CO1.REQ.5450279,R.E N° 2023-009,701780108,CO1.BDOS.5332092,CONTRATO DE MANTENIMIENTO Y ACTUALIZACIÓN DEL  SOFTWARE EDUCATIVO-PLATAFORMA DE NOTAS; CON EL  FIN DE APOYAR LA SISTEMATIZACION DE LA INFORMACION,"CONTRATO DE MANTENIMIENTO Y ACTUALIZACIÓN DEL 
SOFTWARE EDUCATIVO-PLATAFORMA DE NOTAS, CON EL 
FIN DE APOYAR LA SISTEMATIZACION DE LA INFORMACION 
DE LOS CENTROS EDUCATIVOS Y LA INSTITUCIÓN 
EDUCATIVA GENARO LEÓN DEL MUNICIPIO DEL 
GUACHUCAL",Presentación de oferta,12/22/2023,12/22/2023,,,,,12/22/2023,"1,150,000",Contratación régimen especial,Regla aplicable,5,día(s),,,,Guachucal,OFICINA DE CONTRATACION I.E GENARO LEON,0,0,0,0,0,0,0,0,0,Publicado,50,No,No Adjudicado,No Definido,No Definido,No Definido,,0,No Adjudicado,No Definido,No Definido,V1.81112201,Abierto,Prestación de servicios,No Definido,No definido,https://community.secop.gov.co/Public/Tendering/OpportunityDetail/Index?noticeUID=CO1.NTC.5346092,"701,780,108",Presentación de oferta,2023,0.00432108451923077,,1,1150000,0.266136891070282,V1.811,True,0.2,0.000432108451923077,0.6,1,0.330684455351408,0.139681770598008,-0.0005784338076923068,1.33068445535141
40437,40437,HOSPITAL GUACHUCAL ESE,837000286,NARIÑO,GUACHUCAL,Territorial,Centralizada,CO1.REQ.4215370,202301078,704470228,CO1.BDOS.4118974,PRESTACION DE SERVICIOS PARA DESEMPEÑARSE COMO PROFESIONAL PSICOSOCIAL Y DESARROLLAR LAS ACTIVIDADES COMTEMPLADAS EN EL CONVENIO INTERADMINISTRATIVO No. 2022000745 (IMPLEMENTACION PAPSIVI) CELEBRADO E,PRESTACION DE SERVICIOS PARA DESEMPEÑARSE COMO PROFESIONAL PSICOSOCIAL Y DESARROLLAR LAS ACTIVIDADES COMTEMPLADAS EN EL CONVENIO INTERADMINISTRATIVO No. 2022000745 (IMPLEMENTACION PAPSIVI) CELEBRADO ENTRE EL INSTITUTO DEPARTAMENTAL DE SALUD DE NARIÑO Y EL HOSPITAL GUACHUCAL E.S.E.,Presentación de oferta,03/05/2023,03/05/2023,,,,,03/04/2023,"16,800,000",Contratación régimen especial,Regla aplicable,6,Mes(es),,,,Guachucal,CONTRATACION,0,0,0,0,0,0,0,0,0,Publicado,50,No,No Adjudicado,No Definido,No Definido,No Definido,,0,No Adjudicado,No Definido,No Definido,V1.80111600,Abierto,Prestación de servicios,No Definido,No definido,https://community.secop.gov.co/Public/Tendering/OpportunityDetail/Index?noticeUID=CO1.NTC.4120184,"704,470,228",Presentación de oferta,2023,0.00432108451923077,,1,16800000,3.88791284346151,V1.801,True,0.2,0.000432108451923077,0.6,0,18.4395642173075,7.26444024978181e-06,0.015071566192307706,19.43956421730755
43929,43929,HOSPITAL GUACHUCAL ESE,837000286,NARIÑO,GUACHUCAL,Territorial,Centralizada,CO1.REQ.4463977,202305003,704470228,CO1.BDOS.4364251,PRESTACION DE SERVICIOS DE APOYO A LA GESTION EN ACTIVIDADES DE CONSERJERIA PARA LA CONSERVACION; LIMPIEZA Y MANTENIMIENTO DE LAS INSTALACIONES DEL HOSPITAL GUACHUCAL E.S.E.,"PRESTACION DE SERVICIOS DE APOYO A LA GESTION EN ACTIVIDADES DE CONSERJERIA PARA LA CONSERVACION, LIMPIEZA Y MANTENIMIENTO DE LAS INSTALACIONES DEL HOSPITAL GUACHUCAL E.S.E.",Presentación de oferta,05/04/2023,05/04/2023,,,,,05/04/2023,"2,420,000",Contratación régimen especial,Regla aplicable,2,Mes(es),,,,Guachucal,CONTRATACION,0,0,0,0,0,0,0,0,0,Publicado,50,No,No Adjudicado,No Definido,No Definido,No Definido,,0,No Adjudicado,No Definido,No Definido,V1.80111600,Abierto,Prestación de servicios,No Definido,No definido,https://community.secop.gov.co/Public/Tendering/OpportunityDetail/Index?noticeUID=CO1.NTC.4366050,"704,470,228",Presentación de oferta,2023,0.00432108451923077,,1,2420000,0.560044588165288,V1.801,True,0.2,0.000432108451923077,0.6,1,1.80022294082644,0.0090489491576219,0.00069156619230769,2.80022294082644
44081,44081,HOSPITAL GUACHUCAL ESE,837000286,NARIÑO,GUACHUCAL,Territorial,Centralizada,CO1.REQ.4755281,202306003,704470228,CO1.BDOS.4649754,SUMINISTRO DE MEDICAMENTOS PARA EL AREA DE FARMACIA DEL HOSPITAL GUACHUCAL ESE,SUMINISTRO DE MEDICAMENTOS PARA EL AREA DE FARMACIA DEL HOSPITAL GUACHUCAL ESE,Presentación de oferta,06/28/2023,06/28/2023,,,,,06/28/2023,"48,970,444",Contratación régimen especial,Regla aplicable,1,Mes(es),,,,Guachucal,CONTRATACION,0,0,0,0,0,0,0,0,0,Publicado,50,No,No Adjudicado,No Definido,No Definido,No Definido,,0,No Adjudicado,No Definido,No Definido,V1.42271500,Abierto,Suministros,No Definido,No definido,https://community.secop.gov.co/Public/Tendering/OpportunityDetail/Index?noticeUID=CO1.NTC.4656364,"704,470,228",Presentación de oferta,2023,0.00432108451923077,,1,48970444,11.3329058439055,V1.422,True,0.117622017860413,0.00025412734024865785,0.352866053581238,0,95.3502076401612,2.56973810156028e-08,0.04795393463900535,96.35020764016085
44992,44992,HOSPITAL GUACHUCAL ESE,837000286,NARIÑO,GUACHUCAL,Territorial,Centralizada,CO1.REQ.4877198,202307015,704470228,CO1.BDOS.4770032,PRESTACION DE SERVICIOS TECNICOS DE ENFERMERIA PARA EL APOYO A LA GESTION EN ACTIVIDADES DE PROMOCION Y MANTENIMIENTO DE LA SALUD EN EL HOSPITAL GUACHUCAL E.S.E,PRESTACION DE SERVICIOS TECNICOS DE ENFERMERIA PARA EL APOYO A LA GESTION EN ACTIVIDADES DE PROMOCION Y MANTENIMIENTO DE LA SALUD EN EL HOSPITAL GUACHUCAL E.S.E,Presentación de oferta,07/26/2023,07/26/2023,,,,,07/26/2023,"3,480,000",Contratación régimen especial,Regla aplicable,3,Mes(es),,,,Guachucal,CONTRATACION,0,0,0,0,0,0,0,0,0,Publicado,50,No,No Adjudicado,No Definido,No Definido,No Definido,,0,No Adjudicado,No Definido,No Definido,V1.80111600,Abierto,Prestación de servicios,No Definido,No definido,https://community.secop.gov.co/Public/Tendering/OpportunityDetail/Index?noticeUID=CO1.NTC.4778197,"704,470,228",Presentación de oferta,2023,0.00432108451923077,,1,3480000,0.805353374717026,V1.801,True,0.2,0.000432108451923077,0.6,0,3.02676687358513,0.0022791629561051,0.00175156619230769,4.02676687358513
49055,49055,HOSPITAL GUACHUCAL ESE,837000286,NARIÑO,GUACHUCAL,Territorial,Centralizada,CO1.REQ.4785799,202306009,704470228,CO1.BDOS.4680282,PRESTACION DE SERVICIOS PROFESIONALES Y DE APOYO A LA GESTION COMO ABOGADA PARA REALIZAR ASESORIA E INTEGRACION DEL COMITE EVALUADOR EN LA FASE PRE CONTRACTUAL Y CONTRACTUAL DE LA CONTRATACION DE LA O,PRESTACION DE SERVICIOS PROFESIONALES Y DE APOYO A LA GESTION COMO ABOGADA PARA REALIZAR ASESORIA E INTEGRACION DEL COMITE EVALUADOR EN LA FASE PRE CONTRACTUAL Y CONTRACTUAL DE LA CONTRATACION DE LA OBRA E INTERVENTORIA DEL PROYECTO DENOMINADO ESE HOSPITAL DE GUACHUCAL E REPOSICION Y DOTACION DEL HOSPITAL DE PRIMER NIVEL DEL MUNICIPIO DE GUACHUCAL SEGUNDA ETAPA NARIÑO,Presentación de oferta,07/04/2023,07/04/2023,,,,,07/04/2023,"7,500,000",Contratación régimen especial,Regla aplicable,3,Mes(es),,,,Guachucal,CONTRATACION,0,0,0,0,0,0,0,0,0,Publicado,50,No,No Adjudicado,No Definido,No Definido,No Definido,,0,No Adjudicado,No Definido,No Definido,V1.80111600,Abierto,Prestación de servicios,No Definido,No definido,https://community.secop.gov.co/Public/Tendering/OpportunityDetail/Index?noticeUID=CO1.NTC.4687154,"704,470,228",Presentación de oferta,2023,0.00432108451923077,,1,7500000,1.73567537654532,V1.801,True,11.4633874893189,0.024767133109019786,34.3901624679565,1,-0.848589661811349,0.648473993053341,-0.09156853243607914,0.15141033818865052
50876,50876,HOSPITAL GUACHUCAL ESE,837000286,NARIÑO,GUACHUCAL,Territorial,Centralizada,CO1.REQ.4087840,202301061,704470228,CO1.BDOS.3991880,PRESTACION DE SERVICIOS PROFESIONALES CONTABLES PARA APOYAR LOS PROCESOS DE ACTUALIZACION Y GESTIÓN DEL COBRO DE CARTERA A FAVOR DEL HOSPITAL GUACHUCAL E.S.E.,PRESTACION DE SERVICIOS PROFESIONALES CONTABLES PARA APOYAR LOS PROCESOS DE ACTUALIZACION Y GESTIÓN DEL COBRO DE CARTERA A FAVOR DEL HOSPITAL GUACHUCAL E.S.E.,Presentación de oferta,02/13/2023,02/13/2023,,,,,02/13/2023,"4,590,000",Contratación régimen especial,Regla aplicable,81,día(s),,,,Guachucal,CONTRATACION,0,0,0,0,0,0,0,0,0,Publicado,50,No,No Adjudicado,No Definido,No Definido,No Definido,,0,No Adjudicado,No Definido,No Definido,V1.80111600,Abierto,Prestación de servicios,No Definido,No definido,https://community.secop.gov.co/Public/Tendering/OpportunityDetail/Index?noticeUID=CO1.NTC.3992974,"704,470,228",Presentación de oferta,2023,0.00432108451923077,,1,4590000,1.06223333044573,V1.801,True,0.2,0.000432108451923077,0.6,0,4.31116665222867,0.0008075860617391,0.002861566192307679,5.31116665222865
52790,52790,EMPRESA MUNICIPAL DE SERVICIOS PUBLICOS DE GUACHUCAL NARIÑO EMPAGUA ESP,814002063,NARIÑO,GUACHUCAL,Territorial,Centralizada,CO1.REQ.4879543,2023-052,715699393,CO1.BDOS.4772053,Prestar  los  servicios  operativos  en  el  barrido;  recolección  y  transporte de los residuos sólidos que se generan en el  Municipio  de Guachucal,"Prestar los servicios operativos en las actividades que garantizan la prestación del servicios de aseo y alcantarillado,  en los componentes de barrido y limpieza de áreas públicas, corte de césped, poda de árboles y mantenimiento de la red de alcantarillado del casco urbano del municipio de Guachucal.",Presentación de oferta,07/27/2023,07/27/2023,,,,,07/27/2023,"3,920,000",Contratación régimen especial,Decreto 092 de 2017,4,Mes(es),,,,Guachucal,GESTION CONTRACTUAL,0,0,0,0,0,0,0,0,0,Publicado,50,No,No Adjudicado,No Definido,No Definido,No Definido,,0,No Adjudicado,No Definido,No Definido,V1.76121500,Abierto,Decreto 092 de 2017,No Definido,No definido,https://community.secop.gov.co/Public/Tendering/OpportunityDetail/Index?noticeUID=CO1.NTC.4780363,"715,699,393",Presentación de oferta,2023,0.00432108451923077,,1,3920000,0.907179663474352,V1.761,True,0.2,0.000432108451923077,0.6,0,3.53589831737176,0.0014564267693426,0.0021915661923076935,4.5358983173717595
59548,59548,HOSPITAL GUACHUCAL ESE,837000286,NARIÑO,GUACHUCAL,Territorial,Centralizada,CO1.REQ.4788092,202306014,704470228,CO1.BDOS.4682826,PRESTACION DE SERVICIOS PROFESIONALES DE BACTERIOLOGIA PARA EL APOYO DEL AREA ASISTENCIAL DEL HOSPITAL GUACHUCAL E.S.E.,PRESTACION DE SERVICIOS PROFESIONALES DE BACTERIOLOGIA PARA EL APOYO DEL AREA ASISTENCIAL DEL HOSPITAL GUACHUCAL E.S.E.,Presentación de oferta,07/04/2023,07/04/2023,,,,,07/04/2023,"9,600,000",Contratación régimen especial,Regla aplicable,105,día(s),,,,Guachucal,CONTRATACION,0,0,0,0,0,0,0,0,0,Publicado,50,No,No Adjudicado,No Definido,No Definido,No Definido,,0,No Adjudicado,No Definido,No Definido,V1.80111600,Abierto,Prestación de servicios,No Definido,No definido,https://community.secop.gov.co/Public/Tendering/OpportunityDetail/Index?noticeUID=CO1.NTC.4689482,"704,470,228",Presentación de oferta,2023,0.00432108451923077,,1,9600000,2.221664481978,V1.801,True,1.63228046894074,0.0035266109326912865,4.8968414068222,1,0.36108011107904,0.1295522844168,-0.004506443730765163,1.3610801110790338
63035,63035,HOSPITAL GUACHUCAL ESE,837000286,NARIÑO,GUACHUCAL,Territorial,Centralizada,CO1.REQ.4363160,202304004,704470228,CO1.BDOS.4263943,CONTRATO DE PRESTACION DE SERVICIOS PROFESIONALES COMO ABOGADO PARA APOYAR LOS ASUNTOS JURIDICOS INTERNOS PARA EL HOSPITAL GUACHUCAL,CONTRATO DE PRESTACION DE SERVICIOS PROFESIONALES COMO ABOGADO PARA APOYAR LOS ASUNTOS JURIDICOS INTERNOS PARA EL HOSPITAL GUACHUCAL,Presentación de oferta,04/05/2023,04/05/2023,,,,,04/05/2023,"6,000,000",Contratación régimen especial,Regla aplicable,3,Mes(es),,,,Guachucal,CONTRATACION,0,0,0,0,0,0,0,0,0,Publicado,50,No,No Adjudicado,No Definido,No Definido,No Definido,,0,No Adjudicado,No Definido,No Definido,V1.80111600,Abierto,Prestación de servicios,No Definido,No definido,https://community.secop.gov.co/Public/Tendering/OpportunityDetail/Index?noticeUID=CO1.NTC.4266849,"704,470,228",Presentación de oferta,2023,0.00432108451923077,,1,6000000,1.38854030123625,V1.801,True,0.2,0.000432108451923077,0.6,0,5.94270150618126,0.0002996994879055,0.004271566192307682,6.94270150618125
86739,86739,HOSPITAL GUACHUCAL ESE,837000286,NARIÑO,GUACHUCAL,Territorial,Centralizada,CO1.REQ.4910483,202308005,704470228,CO1.BDOS.4802947,PRESTACION DE SERVICIOS PROFESIONALES EN SEGURIDAD Y SALUD EN EL TRABAJO PARA BRINDAR ACOMPAÑAMIENTO Y SEGUIMIENTO EN LA IMPLEMENTACIÓN DEL SG-SST EN EL HOSPITAL GUACHUCAL E.S.E.,PRESTACION DE SERVICIOS PROFESIONALES EN SEGURIDAD Y SALUD EN EL TRABAJO PARA BRINDAR ACOMPAÑAMIENTO Y SEGUIMIENTO EN LA IMPLEMENTACIÓN DEL SG-SST EN EL HOSPITAL GUACHUCAL E.S.E.,Presentación de oferta,08/04/2023,08/04/2023,,,,,08/03/2023,"3,600,000",Contratación régimen especial,Regla aplicable,2,Mes(es),,,,Guachucal,CONTRATACION,0,0,0,0,0,0,0,0,0,Publicado,50,No,No Adjudicado,No Definido,No Definido,No Definido,,0,No Adjudicado,No Definido,No Definido,V1.80111600,Abierto,Prestación de servicios,No Definido,No definido,https://community.secop.gov.co/Public/Tendering/OpportunityDetail/Index?noticeUID=CO1.NTC.4811365,"704,470,228",Presentación de oferta,2023,0.00432108451923077,,1,3600000,0.833124180741751,V1.801,True,37.174446105957,0.08031696178971469,111.523338317871,1,-0.977588793700729,0.495508973538295,-0.31766784715885876,0.02241120629927146
90851,90851,EMPRESA MUNICIPAL DE SERVICIOS PUBLICOS DE GUACHUCAL NARIÑO EMPAGUA ESP,814002063,NARIÑO,GUACHUCAL,Territorial,Centralizada,CO1.REQ.4007846,2023-004,715699393,CO1.BDOS.3912055,AURA ELISA CUATIN,Prestar el servicio técnico en el área de facturación para brindar un buen servicio a todos los usuarios de EMPAGUA E.S.P,Presentación de oferta,02/02/2023,02/02/2023,,,,,02/02/2023,"6,800,000",Contratación régimen especial,Decreto 092 de 2017,5,Mes(es),,,,Guachucal,GESTION CONTRACTUAL,0,0,0,0,0,0,0,0,0,Publicado,50,No,No Adjudicado,No Definido,No Definido,No Definido,,0,No Adjudicado,No Definido,No Definido,V1.83101500,Abierto,Decreto 092 de 2017,No Definido,No definido,https://community.secop.gov.co/Public/Tendering/OpportunityDetail/Index?noticeUID=CO1.NTC.3913243,"715,699,393",Presentación de oferta,2023,0.00432108451923077,,1,6800000,1.57367900806775,V1.831,True,0.2,0.000432108451923077,0.6,0,6.86839504033876,0.0001893523206704,0.00507156619230768,7.86839504033875
92690,92690,HOSPITAL GUACHUCAL ESE,837000286,NARIÑO,GUACHUCAL,Territorial,Centralizada,CO1.REQ.4097093,202301066,704470228,CO1.BDOS.4000155,PRESTACION DE SERVICIOS DE GESTION EXTERNA DE RESIDUOS HOSPITALARIOS Y PELIGROSOS ( RECOLECCION; TRANSPORTE; ALMACENAMIENTO; TRATAMIENTO Y DISPOSICION FINAL A TERCEROS) PARA EL HOSPITAL GUACHUCAL E.S.,"PRESTACION DE SERVICIOS DE GESTION EXTERNA DE RESIDUOS HOSPITALARIOS Y PELIGROSOS ( RECOLECCION, TRANSPORTE, ALMACENAMIENTO, TRATAMIENTO Y DISPOSICION FINAL A TERCEROS) PARA EL HOSPITAL GUACHUCAL E.S.E",Fase de ofertas,02/14/2023,02/14/2023,,,,,02/14/2023,"9,000,000",Contratación régimen especial,Regla aplicable,338,día(s),,,,Guachucal,CONTRATACION,0,0,0,0,0,0,0,0,0,Publicado,50,No,No Adjudicado,No Definido,No Definido,No Definido,,0,No Adjudicado,No Definido,No Definido,V1.76121901,Abierto,Prestación de servicios,No Definido,No definido,https://community.secop.gov.co/Public/Tendering/OpportunityDetail/Index?noticeUID=CO1.NTC.4002252,"704,470,228",Fase de ofertas,2023,0.00432108451923077,,1,9000000,2.08281045185438,V1.761,True,11.9970664978027,0.02592016915991868,35.9911994934082,1,-0.826390021907785,0.674506699720435,-0.0946806766396747,0.17360997809221554
94320,94320,HOSPITAL GUACHUCAL ESE,837000286,NARIÑO,GUACHUCAL,Territorial,Centralizada,CO1.REQ.4434868,202304016,704470228,CO1.BDOS.4334294,PRESTACION DE SERVICIOS PROFESIONALES COMO PSICOLOGA PARA APOYO DISPONIBILIDAD EN EL AREA ASISTENCIAL EN URGENCIAS DEL HOSPITAL GUACHUCAL E.S.E.,PRESTACION DE SERVICIOS PROFESIONALES COMO PSICOLOGA PARA APOYO DISPONIBILIDAD EN EL AREA ASISTENCIAL EN URGENCIAS DEL HOSPITAL GUACHUCAL E.S.E.,Presentación de oferta,04/25/2023,04/25/2023,,,,,04/25/2023,"1,000,000",Contratación régimen especial,Regla aplicable,1,Mes(es),,,,Guachucal,CONTRATACION,0,0,0,0,0,0,0,0,0,Publicado,50,No,No Adjudicado,No Definido,No Definido,No Definido,,0,No Adjudicado,No Definido,No Definido,V1.80111600,Abierto,Prestación de servicios,No Definido,No definido,https://community.secop.gov.co/Public/Tendering/OpportunityDetail/Index?noticeUID=CO1.NTC.4337571,"704,470,228",Presentación de oferta,2023,0.00432108451923077,,1,1000000,0.231423383539375,V1.801,True,16.8040218353271,0.036305799306723875,50.4120655059815,1,-0.986228095523367,0.485714127052769,-0.14422319722689553,0.013771904476632705
