,Unnamed: 0,Entidad,Nit Entidad,Departamento Entidad,Ciudad Entidad,OrdenEntidad,Entidad Centralizada,ID del Proceso,Referencia del Proceso,PCI,ID del Portafolio,Nombre del Procedimiento,Descripción del Procedimiento,Fase,Fecha de Publicacion del Proceso,Fecha de Ultima Publicación,Fecha de Publicacion (Fase Planeacion Precalificacion),Fecha de Publicacion (Fase Seleccion Precalificacion),Fecha de Publicacion (Manifestacion de Interes),Fecha de Publicacion (Fase Borrador),Fecha de Publicacion (Fase Seleccion),Precio Base,Modalidad de Contratacion,Justificación Modalidad de Contratación,Duracion,Unidad de Duracion,Fecha de Recepcion de Respuestas,Fecha de Apertura de Respuesta,Fecha de Apertura Efectiva,Ciudad de la Unidad de Contratación,Nombre de la Unidad de Contratación,Proveedores Invitados,Proveedores con Invitacion Directa,Visualizaciones del Procedimiento,Proveedores que Manifestaron Interes,Respuestas al Procedimiento,Respuestas Externas,Conteo de Respuestas a Ofertas,Proveedores Unicos con Respuestas,Numero de Lotes,Estado del Procedimiento,ID Estado del Procedimiento,Adjudicado,ID Adjudicacion,CodigoProveedor,Departamento Proveedor,Ciudad Proveedor,Fecha Adjudicacion,Valor Total Adjudicacion,Nombre del Adjudicador,Nombre del Proveedor Adjudicado,NIT del Proveedor Adjudicado,Codigo Principal de Categoria,Estado de Apertura del Proceso,Tipo de Contrato,Subtipo de Contrato,Categorias Adicionales,URLProceso,Codigo Entidad,Estado Resumen,Fecha,exchange_rate,Year,Avg,Valor del Contrato,Valor real,Codigo de Categoria Recortado,keep,Valor Proyectado,range-,range+,in_range,perc_error,Similitud de valor,Tamaño valor extraño,veces la predicción
545,545,INSTITUCION EDUCATIVA GUILLERMO VALENCIA,814000114,PUTUMAYO,VILLAGARZÓN,Territorial,Centralizada,CO1.REQ.4052263,001,718119613,CO1.BDOS.3956350,COMPRA PRODUCTOS DE ASEO Y LIMPIEZA,COMPRA PRODUCTOS DE ASEO Y LIMPIEZA,Presentación de oferta,02/08/2023,02/08/2023,,,,,02/08/2023,"1,019,500",Contratación régimen especial,Regla aplicable,3,día(s),,,,Villagarzón,LEANDRO LEON GOME GOMEZ,0,0,0,0,0,0,0,0,0,Publicado,50,No,No Adjudicado,No Definido,No Definido,No Definido,,0,No Adjudicado,No Definido,No Definido,V1.47131700,Abierto,Compraventa,No Definido,No definido,https://community.secop.gov.co/Public/Tendering/OpportunityDetail/Index?noticeUID=CO1.NTC.3960246,"718,119,613",Presentación de oferta,2023,0.00432108451923077,,1,1019500,0.235936139518393,V1.471,True,25.0438766479492,0.05410835384248914,75.1316299438477,1,-0.990579088739534,0.480820012548918,-0.21541391536995655,0.009420911260466274
2332,2332,empresa de servicios públicos Aguas la Cristalina,9003242027,PUTUMAYO,VILLAGARZÓN,Nacional,Centralizada,CO1.REQ.5034910,CN,718898430,CO1.BDOS.4924716,Interventora mejoramiento de la red de distribución mediante suministro e instalación de Válvulas,"Contrato de interventoria, técnica, administrativa, legal,financiera del proyecto: Mejoramiento de la red de distribución mediante el suministro e instalación de válvulas de corte para sectorizar las red urbana, Municipio de Villagarzon, Departamento del Putumayo",Presentación de oferta,09/08/2023,09/08/2023,,,,,09/08/2023,"29,439,252",Contratación régimen especial,Regla aplicable,90,día(s),,,,Villagarzón,"SUBGERENCIA OPERATIVA DE ACUEDUCTO, ALCANTARILLADO Y ASEO",0,0,0,0,0,0,0,0,0,Publicado,50,No,No Adjudicado,No Definido,No Definido,No Definido,,0,No Adjudicado,No Definido,No Definido,V1.83101500,Abierto,Suministros,No Definido,No definido,https://community.secop.gov.co/Public/Tendering/OpportunityDetail/Index?noticeUID=CO1.NTC.4933840,"718,898,430",Presentación de oferta,2023,0.00432108451923077,,1,29439252,6.81293130670832,V1.831,True,3.87778425216675,0.008378116750477305,11.6333527565002,1,0.756913449452876,0.052542090258743,-0.00407321500190924,1.7569134494528746
4072,4072,Institución Educativa Nuestra Señora del Pilar.,8460004668,PUTUMAYO,VILLAGARZÓN,Nacional,Centralizada,CO1.REQ.5226259,CPS-16-2023,718458995,CO1.BDOS.5111726,PRESTAR SUS SERVICIOS PARA LA LOGÍSTICA NECESARIA EN LA EJECUCIÓN DEL PROYECTO ORQUESTA SONIDOS ANCESTRALES FIRMADA MEDIANTE CONVENIO 3465-2023 DE 28 DE ABRIL CON EL MINISTERIO DE CULTURA,"PRESTAR SUS SERVICIOS PARA LA LOGÍSTICA NECESARIA EN LA EJECUCIÓN DEL PROYECTO ORQUESTA SONIDOS ANCESTRALES FIRMADA MEDIANTE CONVENIO 3465-2023 DE 28 DE ABRIL CON EL MINISTERIO DE CULTURA  PARA LA IE NUESTRA SEÑORA DEL PILAR DEL MUNICIPIO DE VILLAGARZON, DEPARTAMENTO DE PUTUMAYO",Presentación de oferta,11/01/2023,11/01/2023,,,,,11/01/2023,"2,800,000",Contratación régimen especial,Regla aplicable,1,día(s),,,,Villagarzón,IE Pilar,0,0,0,0,0,0,0,0,0,Publicado,50,No,No Adjudicado,No Definido,No Definido,No Definido,,0,No Adjudicado,No Definido,No Definido,V1.80111623,Abierto,Prestación de servicios,No Definido,No definido,https://community.secop.gov.co/Public/Tendering/OpportunityDetail/Index?noticeUID=CO1.NTC.5124236,"718,458,995",Presentación de oferta,2023,0.00432108451923077,,1,2800000,0.647985473910251,V1.801,True,0.2,0.000432108451923077,0.6,0,2.23992736955126,0.0051928697862886,0.0010715661923076912,3.2399273695512547
16426,16426,INSTITUCION EDUCATIVA RURAL AGROPECUARIA CIUDAD DE VILLAGARZON,901064198,PUTUMAYO,VILLAGARZÓN,Territorial,Centralizada,CO1.REQ.4423495,02+,718122039,CO1.BDOS.4323600,SERVICIOS DE ACTUALIZACIÓN Y MANTENIMIENTO DEL SOFTWARE DE LA PLATAFORMA MIKOLEGIO Y ADQUISICIÓN DEL DOMINIO INSTERAGRO.COM,SERVICIOS DE ACTUALIZACIÓN Y MANTENIMIENTO DEL SOFTWARE DE LA PLATAFORMA MIKOLEGIO Y ADQUISICIÓN DEL DOMINIO INSTERAGRO.COM,Presentación de oferta,04/21/2023,04/21/2023,,,,,04/21/2023,"1,400,000",Contratación régimen especial,Decreto 092 de 2017,232,día(s),,,,Villagarzón,ADMINISTRATIVA,0,0,0,0,0,0,0,0,0,Publicado,50,No,No Adjudicado,No Definido,No Definido,No Definido,,0,No Adjudicado,No Definido,No Definido,V1.81112205,Abierto,Decreto 092 de 2017,No Definido,No definido,https://community.secop.gov.co/Public/Tendering/OpportunityDetail/Index?noticeUID=CO1.NTC.4326135,"718,122,039",Presentación de oferta,2023,0.00432108451923077,,1,1400000,0.323992736955125,V1.811,True,15.6521692276001,0.033817173070881515,46.9565076828003,1,-0.979300457831505,0.493560433356592,-0.13386869228352605,0.020699542168494803
19178,19178,ALCALDÍA DE VILLAGARZON,800054249,PUTUMAYO,VILLAGARZÓN,Territorial,Centralizada,CO1.REQ.5349021,SGM-CD-242-2023,708723937,CO1.BDOS.5232342,PRESTACION DE SERVICIOS PROFESIONALES,"PRESTACION DE SERVICIOS PROFESIONALES DE UNA TRABAJADORA SOCIAL PARA APOYAR A LA COMISARIA DE FAMILIA DEL MUNICIPIO DE VILLAGARZÓN, DEPARTAMENTO DEL PUTUMAYO.",Presentación de oferta,11/28/2023,11/28/2023,,,,,11/28/2023,"3,565,466",Contratación directa,Servicios profesionales y apoyo a la gestión,34,día(s),,,,Villagarzón,CONTRATACION,0,0,0,0,0,0,0,0,0,Seleccionado,70,No,No Adjudicado,723959250,Putumayo,Villagarzón,,0,No Adjudicado,MILADY LICETH CALDERON PANTOJA,1127075743,V1.80111601,Abierto,Prestación de servicios,No Definido,No definido,https://community.secop.gov.co/Public/Tendering/OpportunityDetail/Index?noticeUID=CO1.NTC.5245994,"708,723,937",Adjudicado,2023,0.00432108451923077,,1,3565466,0.825132205614603,V1.801,True,0.2,0.000432108451923077,0.6,0,3.12566102807301,0.0020799717858067,0.0018370321923076934,4.125661028073015
19693,19693,INSTITUCION EDUCATIVA GUILLERMO VALENCIA,814000114,PUTUMAYO,VILLAGARZÓN,Territorial,Centralizada,CO1.REQ.4336993,008,718119613,CO1.BDOS.4238413,MANTENIMIENTO DE SALONES (LAVADO; RESANE; PINTURA)),"MANTENIMIENTO DE SALONES (LAVADO, RESANE, PINTURA))",Presentación de oferta,03/30/2023,03/30/2023,,,,,03/30/2023,"4,900,000",Contratación régimen especial,Regla aplicable,5,día(s),,,,Villagarzón,LEANDRO LEON GOME GOMEZ,0,0,0,0,0,0,0,0,0,Publicado,50,No,No Adjudicado,No Definido,No Definido,No Definido,,0,No Adjudicado,No Definido,No Definido,V1.72102900,Abierto,Prestación de servicios,No Definido,No definido,https://community.secop.gov.co/Public/Tendering/OpportunityDetail/Index?noticeUID=CO1.NTC.4240507,"718,119,613",Presentación de oferta,2023,0.00432108451923077,,1,4900000,1.13397457934294,V1.721,True,5.08845281600952,0.010993817345047476,15.2653584480286,1,-0.77714747088247,0.729280725202989,-0.0390752693801899,0.2228525291175302
23645,23645,INSTITUCION EDUCATIVA GUILLERMO VALENCIA,814000114,PUTUMAYO,VILLAGARZÓN,Territorial,Centralizada,CO1.REQ.5276408,040-2023,718119613,CO1.BDOS.5160382,AUTOMATIZACION E INSTALACION DE BOMBA EN LOS TANQUES ELEVADOS; INSTALACION DE CANALETA EN LA SALA DE INFORMATICA E INSTALACION DE CONTADORES MONOFASICOS EN LAS TIENDAS A TODO COSTO,"AUTOMATIZACION E INSTALACION DE BOMBA EN LOS TANQUES ELEVADOS, INSTALACION DE CANALETA EN LA SALA DE INFORMATICA E INSTALACION DE CONTADORES MONOFASICOS EN LAS TIENDAS A TODO COSTO",Presentación de oferta,11/14/2023,11/14/2023,,,,,11/14/2023,"11,243,400",Contratación régimen especial,Regla aplicable,3,día(s),,,,Villagarzón,CARLOS ALEXANDER CAMACHO QUINTERO,0,0,0,0,0,0,0,0,0,Publicado,50,No,No Adjudicado,No Definido,No Definido,No Definido,,0,No Adjudicado,No Definido,No Definido,UNSPECIFIED,Abierto,Obra,No Definido,No definido,https://community.secop.gov.co/Public/Tendering/OpportunityDetail/Index?noticeUID=CO1.NTC.5172975,"718,119,613",Presentación de oferta,2023,0.00432108451923077,,1,11243400,2.60198567048661,UNSPEC,True,79.9861755371094,0.17281351243293916,239.958526611328,1,-0.967469557670257,0.507104867662278,-0.6800106497317567,0.03253044232974265
24162,24162,ALCALDÍA DE VILLAGARZON,800054249,PUTUMAYO,VILLAGARZÓN,Territorial,Centralizada,CO1.REQ.5258474,SGM-SASIP-006-2023,708723937,CO1.BDOS.5143599,SGM-SASIP-006-2023,SUMINISTRO DE COLCHONETAS PARA EL ESTABLECIMIENTO PENITENCIARIO DE MEDIANA SEGURIDAD Y CARCELARIO DE PITALITO (H) DE CONFORMIDAD CON EL CONVENIO 002 DEL 1 DE JUNIO DE 2023,Presentación de observaciones,11/10/2023,11/10/2023,,,,11/09/2023,,"60,093,730",Selección abreviada subasta inversa,Suministro de bienes y servicios de características técnicas uniformes y común utilización,1,Mes(es),11/22/2023,11/22/2023,11/22/2023,Villagarzón,CONTRATACION,0,0,11,0,0,0,0,0,0,Evaluación,60,No,No Adjudicado,No Definido,No Definido,No Definido,,0,No Adjudicado,No Definido,No Definido,V1.92101701,Cerrado,Suministros,No Definido,No definido,https://community.secop.gov.co/Public/Tendering/OpportunityDetail/Index?noticeUID=CO1.NTC.5160738,"708,723,937",Presentación de observaciones,2023,0.00432108451923077,,1,60093730,13.9070943261017,V1.921,True,61.4732284545898,0.13281550791113222,184.41968536377,1,-0.773769904790753,0.732828344366544,-0.4711683016445288,0.22623009520924792
31887,31887,ALCALDÍA DE VILLAGARZON,800054249,PUTUMAYO,VILLAGARZÓN,Territorial,Centralizada,CO1.REQ.5428465,SGM-MC-034-2023,708723937,CO1.BDOS.5310076,ADQUISICION,"ADQUISICIÓN DE EQUIPOS DE COMPUTO Y ELEMENTOS DE OFICINA PARA EL FUNCIONAMIENTO DE LA ALCALDIA MUNICIPAL DE VILLAGARZÓN, PUTUMAYO",Presentación de oferta,12/15/2023,12/15/2023,,,,,12/15/2023,"30,000,000",Mínima cuantía,Presupuesto inferior al 10% de la menor cuantía,3,día(s),12/21/2023,12/21/2023,12/21/2023,Villagarzón,CONTRATACION,0,0,12,0,3,0,0,3,10,Seleccionado,70,Si,CO1.AWD.1812806,723416418,Putumayo,Villagarzón,,"22,729,000",ANDREA CAROLINA PAPAMIJA PARRA,A&C INGENIERIA PUTUMAYO SAS,900739085,V1.43211507,Cerrado,Compraventa,No Definido,No definido,https://community.secop.gov.co/Public/Tendering/OpportunityDetail/Index?noticeUID=CO1.NTC.5324249,"708,723,937",Adjudicado,2023,0.00432108451923077,,1,30000000,6.94270150618126,V1.432,True,0.2,0.000432108451923077,0.6,0,33.7135075309063,9.29904664083754e-07,0.02827156619230768,34.7135075309063
33339,33339,PUTUMAYO - INSTITUCION EDUCATIVA LUIS CARLOS GALAN,846000217,PUTUMAYO,VILLAGARZÓN,Territorial,Centralizada,CO1.REQ.5357357,CMA-30-2023,718122161,CO1.BDOS.5240439,MANTENIMIENTO DE UNIDADES SANITARIAS Y ÁRBOLES PARA LA INSTITUCION EDUCATIVA LUIS CARLOS GALAN,"MANTENIMIENTO DE UNIDADES SANITARIAS Y ÁRBOLES PARA LA INSTITUCION EDUCATIVA LUIS CARLOS GALAN, MUNICIPIO DE VILLAGARZON, DEPARATAMENTO DEL PUTUMAYO.",Presentación de oferta,11/29/2023,11/29/2023,,,,,11/29/2023,"4,435,000",Contratación régimen especial,Regla aplicable,4,día(s),,,,Villagarzón,RECTORIA,0,0,0,0,0,0,0,0,0,Publicado,50,No,No Adjudicado,No Definido,No Definido,No Definido,,0,No Adjudicado,No Definido,No Definido,V1.72101510,Abierto,Prestación de servicios,No Definido,No definido,https://community.secop.gov.co/Public/Tendering/OpportunityDetail/Index?noticeUID=CO1.NTC.5253452,"718,122,161",Presentación de oferta,2023,0.00432108451923077,,1,4435000,1.02636270599713,V1.721,True,0.2,0.000432108451923077,0.6,0,4.13181352998565,0.000917873001232,0.002706566192307693,5.13181352998565
33688,33688,INSTITUCIÓN EDUCATIVA RURAL SANTA JULIANA,846001779,PUTUMAYO,VILLAGARZÓN,Territorial,Centralizada,CO1.REQ.4991011,CSAI -09-2023,718121841,CO1.BDOS.4881462,COMPRAVENTA DE FRUTAS Y VERDURAS PARA LA ALIMENTACION ESCOLAR DE LOS ESTUDIANTES INTERNOS DE LA IER SANTA JULIANA,COMPRAVENTA DE FRUTAS Y VERDURAS PARA LA ALIMENTACION ESCOLAR DE LOS ESTUDIANTES INTERNOS DE LA IER SANTA JULIANA,Presentación de oferta,08/29/2023,08/29/2023,,,,,08/29/2023,"6,917,000",Contratación régimen especial,Regla aplicable,20,día(s),,,,Villagarzón,JAIME WUILSON YELA LOZA,0,0,0,0,0,0,0,0,0,Publicado,50,No,No Adjudicado,No Definido,No Definido,No Definido,,0,No Adjudicado,No Definido,No Definido,V1.50301500,Abierto,Compraventa,No Definido,No definido,https://community.secop.gov.co/Public/Tendering/OpportunityDetail/Index?noticeUID=CO1.NTC.4894165,"718,121,841",Presentación de oferta,2023,0.00432108451923077,,1,6917000,1.60075554394186,V1.503,True,16.0412425994873,0.03465778253293486,48.1237277984619,1,-0.900210003432463,0.586639612924925,-0.13171413013173947,0.09978999656753662
38601,38601,INSTITUCION EDUCATIVA RURAL AGROPECUARIA CIUDAD DE VILLAGARZON,901064198,PUTUMAYO,VILLAGARZÓN,Territorial,Centralizada,CO1.REQ.4233264,02-,718122039,CO1.BDOS.4136775,SUMINISTRO DE CARNES PARA LA ALIMENTACIÓN DE LOS ESTUDIANTES INTERNOS,SUMINISTRO DE CARNES PARA LA ALIMENTACIÓN DE LOS ESTUDIANTES INTERNOS,Presentación de oferta,03/08/2023,03/08/2023,,,,,03/08/2023,"14,977,000",Contratación régimen especial,Decreto 092 de 2017,5,Mes(es),,,,Villagarzón,ADMINISTRATIVA,0,0,0,0,0,0,0,0,0,Publicado,50,No,No Adjudicado,No Definido,No Definido,No Definido,,0,No Adjudicado,No Definido,No Definido,V1.50111513,Abierto,Decreto 092 de 2017,No Definido,No definido,https://community.secop.gov.co/Public/Tendering/OpportunityDetail/Index?noticeUID=CO1.NTC.4138201,"718,122,039",Presentación de oferta,2023,0.00432108451923077,,1,14977000,3.46602801526922,V1.501,True,10.7324161529541,0.023187838646236105,32.1972484588623,1,-0.677050538679009,0.816374367002176,-0.07777435458494444,0.32294946132099017
45439,45439,empresa de servicios públicos Aguas la Cristalina,9003242027,PUTUMAYO,VILLAGARZÓN,Nacional,Centralizada,CO1.REQ.4373104,CN-026 DEL 25 DE ENERO DEL 2023,718898430,CO1.BDOS.4274101,SUMINISTRO,"SUMINISTRO DE COMBUSTIBLE GASOLINA CORRIENTE Y ACPM PARA LOS VEHICULOS QUE CONFORMAN EL PARQUE AUTOMOTOR DE LA EMPRESA DE SERVICIOS PUBLICOS AGUAS LA CRISTALINA SA ESP DE VILLAGARZÒN, DEPARTAMENTO DEL PUTUMAYO.",Presentación de oferta,04/11/2023,04/11/2023,,,,,04/11/2023,"100,000,000",Contratación régimen especial,Regla aplicable,180,día(s),,,,Villagarzón,"SUBGERENCIA OPERATIVA DE ACUEDUCTO, ALCANTARILLADO Y ASEO",0,0,0,0,0,0,0,0,0,Publicado,50,No,No Adjudicado,No Definido,No Definido,No Definido,,0,No Adjudicado,No Definido,No Definido,V1.15101506,Abierto,Prestación de servicios,No Definido,V115101505,https://community.secop.gov.co/Public/Tendering/OpportunityDetail/Index?noticeUID=CO1.NTC.4282395,"718,898,430",Presentación de oferta,2023,0.00432108451923077,,1,100000000,23.1423383539375,V1.151,True,99.441535949707,0.2148476407804045,298.324607849121,1,-0.767276941844081,0.739555277813556,-0.7593905631216181,0.23272305815591826
49360,49360,ALCALDÍA DE VILLAGARZON,800054249,PUTUMAYO,VILLAGARZÓN,Territorial,Centralizada,CO1.REQ.5422833,SPIM-CD-150-2023,708723937,CO1.BDOS.5303989,PRESTACION DE SERVICIOS DE APOYO A LA GESTION,"PRESTACION DE SERVICIOS DE UN LIDER PARA APOYAR A LA SECRETARIA  DE PLANEACION E INFRAESTRUCTURA PARA EL PROGRAMA DE GESTION DEL RIESGO DE DESASTRES DEL MUNICIPIO DE VILLAGARZON, DEPARTAMENTO DEL PUTUMAYO.",Presentación de oferta,12/14/2023,12/14/2023,,,,,12/14/2023,"1,000,000",Contratación directa,Servicios profesionales y apoyo a la gestión,15,día(s),,,,Villagarzón,CONTRATACION,0,0,0,0,0,0,0,0,0,Seleccionado,70,No,No Adjudicado,723796397,Putumayo,Villagarzón,,0,No Adjudicado,JOSE MANUEL GAVIRIA LOPEZ,1127072986,V1.80111600,Abierto,Prestación de servicios,No Definido,No definido,https://community.secop.gov.co/Public/Tendering/OpportunityDetail/Index?noticeUID=CO1.NTC.5319207,"708,723,937",Adjudicado,2023,0.00432108451923077,,1,1000000,0.231423383539375,V1.801,True,0.2,0.000432108451923077,0.6,1,0.157116917696877,0.21735043108703,-0.0007284338076923097,1.157116917696875
49950,49950,ALCALDÍA DE VILLAGARZON,800054249,PUTUMAYO,VILLAGARZÓN,Territorial,Centralizada,CO1.REQ.5427875,SPIM-CDCI-005-2023,708723937,CO1.BDOS.5309319,FONDO MIXTO DE ETNOCULTURA Y DESARROLLO SOCIAL FONPACIFICO,AUNAR ESFUERZOS TÉCNICOS ADMINISTRSTIVOS Y FINANCIEROS PARA LA EJECUCIÓN DEL PROYECTO MODERNIZACION Y EXPANSION DEL SISTEMA DE ALUMBRADO PUBLICO CON LÁMPARAS LED SEGUNDA FASE EN ZONA RURAL DEL MUNICIPIO DE VILLAGARZÓN PUTUMAYO,Presentación de oferta,12/15/2023,12/15/2023,,,,,12/15/2023,"956,577,598",Contratación directa,Contratos o convenios Interadministrativos (valor cero),30,día(s),,,,Villagarzón,CONTRATACION,0,0,0,0,0,0,0,0,0,Seleccionado,70,No,No Adjudicado,710427048,Valle del Cauca,Cali,,0,No Adjudicado,FONPACIFICO,901039684,V1.39111800,Abierto,Otro,No Definido,No definido,https://community.secop.gov.co/Public/Tendering/OpportunityDetail/Index?noticeUID=CO1.NTC.5323397,"708,723,937",Adjudicado,2023,0.00432108451923077,,1,956577598,221.374424347128,V1.391,True,25.7469444274902,0.05562736149156142,77.2408332824707,0,7.59808529787189,0.0001369571519366,0.7340681520337523,8.598085297871888
50762,50762,E.S.E. HOSPITAL SAN GABRIEL ARCANGEL //,846001620,PUTUMAYO,VILLAGARZÓN,Nacional,Centralizada,CO1.REQ.3597149,22-0626,704143221,CO1.BDOS.3504929,MATERIAL IMPRESO INSTITUCIONAL,"ADQUISICIÓN DE MATERIAL IMPRESO INSTITUCIONAL, PENDONES Y ACRÍLICOS PARA LA E.S.E. HOSPITAL SAN GABRIEL ARCÁNGEL DE VILLAGARZÓN.",Presentación de oferta,01/23/2023,01/23/2023,,,,,01/23/2023,"19,084,030",Contratación régimen especial,Regla aplicable,10,día(s),,,,Villagarzón,Contratación ESE Hospital,0,0,0,0,0,0,0,0,0,Publicado,50,No,No Adjudicado,No Definido,No Definido,No Definido,,0,No Adjudicado,No Definido,No Definido,V1.55101500,Abierto,Compraventa,No Definido,No definido,https://community.secop.gov.co/Public/Tendering/OpportunityDetail/Index?noticeUID=CO1.NTC.3823221,"704,143,221",Presentación de oferta,2023,0.00432108451923077,,1,19084030,4.41649079416695,V1.551,True,0.2,0.000432108451923077,0.6,0,21.0824539708347,4.61540469085715e-06,0.017355596192307705,22.082453970834745
51041,51041,INSTITUCION EDUCATIVA RURAL AGROPECUARIA CIUDAD DE VILLAGARZON,901064198,PUTUMAYO,VILLAGARZÓN,Territorial,Centralizada,CO1.REQ.4629289,03o,718122039,CO1.BDOS.4526409,CONTRATAR BAJO LA  MODADALIDAD DE CONTRATO DE OBRA PARA REALIZAR ADECUACIONES; MEJORAMIENTO Y MANTENIMIENTO EN LAS INSTALACIONES DE LA SEDE PRINCIPAL Y SEDE CANANGUCHO DE LA INSTITUCIÓN EDUCATIVA RURA,"CONTRATAR BAJO LA  MODADALIDAD DE CONTRATO DE OBRA PARA REALIZAR ADECUACIONES, MEJORAMIENTO Y MANTENIMIENTO EN LAS INSTALACIONES DE LA SEDE PRINCIPAL Y SEDE CANANGUCHO DE LA INSTITUCIÓN EDUCATIVA RURAL AGROPECUARIA CIUDAD DE VILLAGARZÓN",Presentación de oferta,06/06/2023,06/06/2023,,,,,06/06/2023,"2,200,000",Contratación régimen especial,Decreto 092 de 2017,15,día(s),,,,Villagarzón,ADMINISTRATIVA,0,0,0,0,0,0,0,0,0,Publicado,50,No,No Adjudicado,No Definido,No Definido,No Definido,,0,No Adjudicado,No Definido,No Definido,V1.72151401,Abierto,Decreto 092 de 2017,No Definido,No definido,https://community.secop.gov.co/Public/Tendering/OpportunityDetail/Index?noticeUID=CO1.NTC.4532154,"718,122,039",Presentación de oferta,2023,0.00432108451923077,,1,2200000,0.509131443786626,V1.721,True,0.2,0.000432108451923077,0.6,1,1.54565721893313,0.0130123607790729,0.0004715661923076925,2.5456572189331297
52957,52957,ALCALDÍA DE VILLAGARZON,800054249,PUTUMAYO,VILLAGARZÓN,Territorial,Centralizada,CO1.REQ.5428465,SGM-MC-034-2023,708723937,CO1.BDOS.5310076,ADQUISICION,"ADQUISICIÓN DE EQUIPOS DE COMPUTO Y ELEMENTOS DE OFICINA PARA EL FUNCIONAMIENTO DE LA ALCALDIA MUNICIPAL DE VILLAGARZÓN, PUTUMAYO",Presentación de oferta,12/15/2023,12/15/2023,,,,,12/15/2023,"30,000,000",Mínima cuantía,Presupuesto inferior al 10% de la menor cuantía,3,día(s),12/21/2023,12/21/2023,12/21/2023,Villagarzón,CONTRATACION,0,0,12,0,3,0,0,3,10,Seleccionado,70,Si,CO1.AWD.1812649,723416418,Putumayo,Villagarzón,12/26/2023,"30,000,000",ANDREA CAROLINA PAPAMIJA PARRA,A&C INGENIERIA PUTUMAYO SAS,900739085,V1.43211507,Cerrado,Compraventa,No Definido,No definido,https://community.secop.gov.co/Public/Tendering/OpportunityDetail/Index?noticeUID=CO1.NTC.5324249,"708,723,937",Adjudicado,2023,0.00432108451923077,,1,30000000,6.94270150618126,V1.432,True,0.2,0.000432108451923077,0.6,0,33.7135075309063,9.29904664083754e-07,0.02827156619230768,34.7135075309063
54541,54541,ALCALDÍA DE VILLAGARZON,800054249,PUTUMAYO,VILLAGARZÓN,Territorial,Centralizada,CO1.REQ.5332864,SGM-MC-026-2023,708723937,CO1.BDOS.5216595,APOYO LOGISTICO AL CONSEJO MUNICIPAL DE JUVENTUDES CMJ PARA LA CELEBRACIÓN DE LA SEMANA DE LA JUVENTUD VIGENCIA 2023 EN EL MUNICIPIO DE VILLAGARZON; PUTUMAYO,"APOYO LOGISTICO AL CONSEJO MUNICIPAL DE JUVENTUDES CMJ PARA LA CELEBRACIÓN DE LA SEMANA DE LA JUVENTUD VIGENCIA 2023 EN EL MUNICIPIO DE VILLAGARZON, PUTUMAYO",Presentación de oferta,11/23/2023,11/23/2023,,,,,11/23/2023,"15,000,000",Mínima cuantía,Presupuesto inferior al 10% de la menor cuantía,7,día(s),11/29/2023,11/29/2023,11/29/2023,Villagarzón,CONTRATACION,0,0,8,0,1,0,0,1,10,Seleccionado,70,Si,CO1.AWD.1787911,711241513,Putumayo,Mocoa,12/01/2023,"14,900,000",DIANA MARCELA GIRALDO BARRERA,FUNDACION SERVIAMAZONICA,900860060,V1.53102900,Cerrado,Prestación de servicios,No Definido,No definido,https://community.secop.gov.co/Public/Tendering/OpportunityDetail/Index?noticeUID=CO1.NTC.5229132,"708,723,937",Adjudicado,2023,0.00432108451923077,,1,15000000,3.47135075309063,V1.531,True,13.7815341949463,0.02977558703051597,41.3446025848389,1,-0.748115797269974,0.758627515610222,-0.1041023481220639,0.2518842027300253
54982,54982,ALCALDÍA DE VILLAGARZON,800054249,PUTUMAYO,VILLAGARZÓN,Territorial,Centralizada,CO1.REQ.5396149,SGM-MC-030-2023,708723937,CO1.BDOS.5276194,MINIMA CUANTIA,"APOYO MEDIANTE RACIONES ALIMENTICIAS A LA POBLACIÓN PRIVADA DE LA LIBERTAD PPL RECLUIDOS EN LA ESTACIÓN DE POLICÍA DEL MUNICIPIO DE VILLAGARZÓN, PUTUMAYO",Presentación de oferta,12/07/2023,12/07/2023,,,,,12/07/2023,"32,472,500",Mínima cuantía,Presupuesto inferior al 10% de la menor cuantía,17,día(s),12/13/2023,12/13/2023,12/13/2023,Villagarzón,CONTRATACION,0,0,4,0,1,0,0,1,10,Seleccionado,70,Si,CO1.AWD.1803710,724029657,Putumayo,Villagarzón,12/15/2023,"44,500",PAULA ALEJANDRA COY ARREDONDO,Tanya Meliza Isaza Gomez,1127076467,V1.93131608,Cerrado,Suministros,No Definido,No definido,https://community.secop.gov.co/Public/Tendering/OpportunityDetail/Index?noticeUID=CO1.NTC.5292958,"708,723,937",Adjudicado,2023,0.00432108451923077,,1,32472500,7.51489582198237,V1.931,True,4.11788845062256,0.008896872017952162,12.3536653518677,1,0.82493914346957,0.0456731827721728,-0.0031149880718086406,1.82493914346957
54983,54983,ALCALDÍA DE VILLAGARZON,800054249,PUTUMAYO,VILLAGARZÓN,Territorial,Centralizada,CO1.REQ.5396149,SGM-MC-030-2023,708723937,CO1.BDOS.5276194,MINIMA CUANTIA,"APOYO MEDIANTE RACIONES ALIMENTICIAS A LA POBLACIÓN PRIVADA DE LA LIBERTAD PPL RECLUIDOS EN LA ESTACIÓN DE POLICÍA DEL MUNICIPIO DE VILLAGARZÓN, PUTUMAYO",Presentación de oferta,12/07/2023,12/07/2023,,,,,12/07/2023,"32,472,500",Mínima cuantía,Presupuesto inferior al 10% de la menor cuantía,17,día(s),12/13/2023,12/13/2023,12/13/2023,Villagarzón,CONTRATACION,0,0,4,0,1,0,0,1,10,Seleccionado,70,Si,CO1.AWD.1803710,724029657,Putumayo,Villagarzón,12/15/2023,"44,500",PAULA ALEJANDRA COY ARREDONDO,Tanya Meliza Isaza Gomez,1127076467,V1.93131608,Cerrado,Suministros,No Definido,No definido,https://community.secop.gov.co/Public/Tendering/OpportunityDetail/Index?noticeUID=CO1.NTC.5292958,"708,723,937",Adjudicado,2023,0.00432108451923077,,1,32472500,7.51489582198237,V1.931,True,4.11788845062256,0.008896872017952162,12.3536653518677,1,0.82493914346957,0.0456731827721728,-0.0031149880718086406,1.82493914346957
