130459,130459,ALCALDÍA DE VILLAGARZON,800054249,PUTUMAYO,VILLAGARZÓN,Territorial,Centralizada,CO1.REQ.5427663,SGM-CD-248-2023,708723937,CO1.BDOS.5309375,PRESTACION DE SERVICIOS,"APOYO MEDIANTE RACIONES ALIMENTICIAS A LA POBLACIÓN PRIVADA DE LA LIBERTAD PPL RECLUIDOS EN LA ESTACIÓN DE POLICÍA DEL MUNICIPIO DE VILLAGARZÓN, PUTUMAYO",Presentación de oferta,12/15/2023,12/15/2023,,,,,12/15/2023,"32,472,500",Contratación directa,Servicios profesionales y apoyo a la gestión,16,día(s),,,,Villagarzón,CONTRATACION,0,0,0,0,0,0,0,0,0,Seleccionado,70,No,No Adjudicado,724029657,Putumayo,Villagarzón,,0,No Adjudicado,Tanya Meliza Isaza Gomez,1127076467,V1.93131608,Abierto,Prestación de servicios,No Definido,No definido,https://community.secop.gov.co/Public/Tendering/OpportunityDetail/Index?noticeUID=CO1.NTC.5323801,"708,723,937",Adjudicado,2023,0.00432108451923077,,1,32472500,7.51489582198237,V1.931,True,5.3375997543335,0.011532109834150222,16.0127992630005,1,0.407916698115322,0.115540320111049,-0.01365593933660088,1.4079166981153213
131808,131808,Institución Educativa Nuestra Señora del Pilar.,8460004668,PUTUMAYO,VILLAGARZÓN,Nacional,Centralizada,CO1.REQ.5364551,CC-20-2023,718458995,CO1.BDOS.5247265,COMPRAVENTA DE MENAJE PARA RESTAURANTE ESCOLAR Y ESTANTES METALICOS,"COMPRAVENTA DE MENAJE PARA RESTAURANTE ESCOLAR Y ESTANTES METALICOS PARA LA IE NUESTRA SEÑORA DEL PILAR DEL MUNICIPIO DE VILLAGARZÓN, DEPARTAMENTO DE PUTUMAYO",Presentación de oferta,11/30/2023,11/30/2023,,,,,11/30/2023,"15,000,000",Contratación régimen especial,Regla aplicable,5,día(s),,,,Villagarzón,IE Pilar,0,0,0,0,0,0,0,0,0,Publicado,50,No,No Adjudicado,No Definido,No Definido,No Definido,,0,No Adjudicado,No Definido,No Definido,V1.24131601,Abierto,Compraventa,No Definido,No definido,https://community.secop.gov.co/Public/Tendering/OpportunityDetail/Index?noticeUID=CO1.NTC.5260356,"718,458,995",Presentación de oferta,2023,0.00432108451923077,,1,15000000,3.47135075309063,V1.241,True,0.2,0.000432108451923077,0.6,0,16.3567537654532,1.08831605069149e-05,0.013271566192307687,17.35675376545315
132191,132191,ALCALDÍA DE VILLAGARZON,800054249,PUTUMAYO,VILLAGARZÓN,Territorial,Centralizada,CO1.REQ.5224268,SGM-MC-024-2023,708723937,CO1.BDOS.5109562,SGM-MC-024-2023,"APOYO LOGÍSTICO AL CONSEJO MUNICIPAL DE JUVENTUDES CMJ PARA LA CELEBRACIÓN DE LA SEMANA DE LA JUVENTUD VIGENCIA 2023 EN EL MUNICIPIO DE VILLAGARZÓN, PUTUMAYO",Presentación de oferta,10/31/2023,10/31/2023,,,,,10/31/2023,"15,000,000",Mínima cuantía,Presupuesto inferior al 10% de la menor cuantía,7,día(s),11/07/2023,11/07/2023,,Villagarzón,CONTRATACION,0,0,8,0,2,0,0,2,4,Publicado,100,No,No Adjudicado,No Definido,No Definido,No Definido,,0,No Adjudicado,No Definido,No Definido,V1.25171900,Cerrado,Suministros,No Definido,No definido,https://community.secop.gov.co/Public/Tendering/OpportunityDetail/Index?noticeUID=CO1.NTC.5122572,"708,723,937",Presentación de oferta,2023,0.00432108451923077,,1,15000000,3.47135075309063,V1.251,True,22.8276443481445,0.049320090301636484,68.4829330444336,1,-0.847932151905425,0.64925271351335,-0.18228036120654592,0.15206784809457538
133491,133491,ALCALDÍA DE VILLAGARZON,800054249,PUTUMAYO,VILLAGARZÓN,Territorial,Centralizada,CO1.REQ.5411964,SGM-MC-033-2023,708723937,CO1.BDOS.5293786,MINIMA CUANTIA,"APOYO A LA POBLACIÓN CON DISCAPACIDAD DEL MUNICIPIO DE VILLAGARZÓN, DEPARTAMENTO DEL PUTUMAYO",Presentación de oferta,12/14/2023,12/14/2023,,,,,12/14/2023,"30,000,000",Mínima cuantía,Presupuesto inferior al 10% de la menor cuantía,3,día(s),12/18/2023,12/18/2023,12/18/2023,Villagarzón,CONTRATACION,0,0,3,0,1,0,0,1,10,Seleccionado,70,Si,CO1.AWD.1807687,707187068,Putumayo,Villagarzón,12/20/2023,"30,000,000",CRISTIAN JOHAN CORTES,omar cañetes amaya,93416058,V1.50151513,Cerrado,Suministros,No Definido,No definido,https://community.secop.gov.co/Public/Tendering/OpportunityDetail/Index?noticeUID=CO1.NTC.5316657,"708,723,937",Adjudicado,2023,0.00432108451923077,,1,30000000,6.94270150618126,V1.501,True,19.5975399017334,0.04234131314219374,58.7926197052002,1,-0.645736069884609,0.833698867933335,-0.139365252568775,0.35426393011539065
134255,134255,INSTITUCION EDUCATIVA RURAL ALBANIA,846004027,PUTUMAYO,VILLAGARZÓN,Territorial,Centralizada,CO1.REQ.5068091,CSI-09-202,720051580,CO1.BDOS.4957390,SERVICIO DE INTERNET COMERCIAL 25 MBPS POR 89 DÍAS,"SERVICIO DE INTERNET COMERCIAL 25 MBPS POR 89 DÍAS PARA LA IE RURAL ALBANIA DEL MUNICIPIO DE VILLAGARZON, DEPARTAMENTO DE PUTUMAYO",Presentación de oferta,09/18/2023,09/18/2023,,,,,09/18/2023,"1,015,428",Contratación régimen especial,Regla aplicable,89,día(s),,,,Mocoa,IER ALBANIA,0,0,0,0,0,0,0,0,0,Publicado,50,No,No Adjudicado,No Definido,No Definido,No Definido,,0,No Adjudicado,No Definido,No Definido,V1.81112101,Abierto,Prestación de servicios,No Definido,No definido,https://community.secop.gov.co/Public/Tendering/OpportunityDetail/Index?noticeUID=CO1.NTC.4967385,"720,051,580",Presentación de oferta,2023,0.00432108451923077,,1,1015428,0.234993783500621,V1.811,True,0.2,0.000432108451923077,0.6,1,0.174968917503104,0.207535097429912,-0.0007130058076923075,1.1749689175031048
136845,136845,INSTITUCIÓN EDUCATIVA RURAL SANTA JULIANA,846001779,PUTUMAYO,VILLAGARZÓN,Territorial,Centralizada,CO1.REQ.4214356,CSAI-05-2023,718121841,CO1.BDOS.4118045,SUMINISTRO DE VÍVERES Y ABARROTES PARA LA ALIMENTACION ESCOLAR DE LOS INTERNOS,"SUMINISTRO DE VÍVERES Y ABARROTES PARA LA ALIMENTACION ESCOLAR DE LOS INTERNOS PARA LA IER SANTA JULIANA DEL MUNICIPIO DE VILLAGARZON, DEPATAMENTO DE PUTUMAYO",Presentación de oferta,03/04/2023,03/04/2023,,,,,03/04/2023,"22,999,995",Contratación régimen especial,Regla aplicable,262,día(s),,,,Villagarzón,JAIME WUILSON YELA LOZA,0,0,0,0,0,0,0,0,0,Publicado,50,No,No Adjudicado,No Definido,No Definido,No Definido,,0,No Adjudicado,No Definido,No Definido,V1.50221001,Abierto,Suministros,No Definido,No definido,https://community.secop.gov.co/Public/Tendering/OpportunityDetail/Index?noticeUID=CO1.NTC.4119355,"718,121,841",Presentación de oferta,2023,0.00432108451923077,,1,22999995,5.32273666428872,V1.502,True,54.1817970275879,0.11706206218000689,162.545391082764,1,-0.901761533276969,0.58477545150861,-0.4452482537200276,0.09823846672303112
147759,147759,INSTITUCION  ETNOEDUCATIVO RURAL BILINGUE INGA ATUN ÑAMBI,846004054,PUTUMAYO,VILLAGARZÓN,Territorial,Centralizada,CO1.REQ.4407522,CM-06-2023,719836090,CO1.BDOS.4307266,MANTENIMIENTO Y REPARACIONES LOCATIVAS DE LA INFRAESTRUCTURA FISICA,MANTENIMIENTO Y REPARACIONES LOCATIVAS DE LA INFRAESTRUCTURA FISICA PARA LA INSTITUCION ETNOEDUCATIVO RURAL BILINGÜE INGA ATUN ÑAMBI,Presentación de oferta,04/18/2023,04/18/2023,,,,,04/18/2023,"5,068,000",Contratación régimen especial,Regla aplicable,9,día(s),,,,Villagarzón,IE ATUNÑAMBI,0,0,0,0,0,0,0,0,0,Publicado,50,No,No Adjudicado,No Definido,No Definido,No Definido,,0,No Adjudicado,No Definido,No Definido,V1.39121308,Abierto,Prestación de servicios,No Definido,No definido,https://community.secop.gov.co/Public/Tendering/OpportunityDetail/Index?noticeUID=CO1.NTC.4310282,"719,836,090",Presentación de oferta,2023,0.00432108451923077,,1,5068000,1.17285370777755,V1.391,True,14.1802225112915,0.030636969986394685,42.5406675338745,1,-0.917289470821517,0.566159452486714,-0.11747987994557876,0.0827105291784825
