121,110430,8434,13981,MUNICIPIO DE DAGUA,800100514,VALLE DEL CAUCA,DAGUA,Territorial,Centralizada,CO1.REQ.6210418,CD-088-2024,704923762,CO1.BDOS.6089764,PRESTACIÓN DE SERVICIOS DE APOYO OPERATIVO A LA GESTIÓN DE LA SECRETARIA DE ECONOMÍA; DEPORTE; RECREACIÓN; CULTURA Y TURISMO; EN EL DESARROLLO DE ACTIVIDADES DE FORMACION EN LA DISCIPLINA DEPORTIVA FU,"PRESTACIÓN DE SERVICIOS DE APOYO
OPERATIVO A LA GESTIÓN DE LA
SECRETARIA DE ECONOMÍA, DEPORTE,
RECREACIÓN, CULTURA Y TURISMO, EN EL
DESARROLLO DE ACTIVIDADES DE
FORMACION EN LA DISCIPLINA DEPORTIVA
FUTBOL, DIRIGIDA A NNJA Y ADULTOS DE
LOS CORREGIMIENTOS EL QUEREMAL, Y
SAN JOSE DEL SALADO Y ZONAS ALEDAÑAS.",Presentación de oferta,05/08/2024,05/08/2024,,,,,05/08/2024,16200000,Contratación directa,Servicios profesionales y apoyo a la gestión,otro,día(s),,,,Dagua,CONTRATACIÓN DAGUA,0,0,0,0,0,0,0,0,0,Seleccionado,70,No,No Adjudicado,715268561,Valle del Cauca,Cali,,0,No Adjudicado,ANDRES ESTEBAN SAA TRULLO,1143854054,V1.80161500,Abierto,Prestación de servicios,No Definido,No definido,https://community.secop.gov.co/Public/Tendering/OpportunityDetail/Index?noticeUID=CO1.NTC.6097078,704923762,Adjudicado,2024,3.9155429850746266,,1,16200000,16.2,V1.801,True,0.7831085970149254,1.533147686796712,0.6000000000000001,0,19.68678604953591,1.45266213642867e-09,3.937357209907183,19.60905838012695,1.259188244425176,20.68678604953591
122,589388,236,377,MUNICIPIO DE DAGUA,800100514,VALLE DEL CAUCA,DAGUA,Territorial,Centralizada,CO1.REQ.6791191,CD-214-2024,704923762,CO1.BDOS.6664543,PRESTACIÓN DE SERVICIOS DE APOYO A LA GESTION DE LA SECRETARIA DE PLANEACIÓN Y PROYECTOS DE INVERSION; EN LA OPERATIVIDAD DEL COMPONENTE DE PLANEACIÓN ESTRATÉGICA Y GESTIÓN DE RESULTADOS CON ORIENTACI,"PRESTACIÓN DE SERVICIOS DE APOYO A LA GESTION DE LA
SECRETARIA DE PLANEACIÓN Y PROYECTOS DE INVERSION, EN LA OPERATIVIDAD DEL
COMPONENTE DE PLANEACIÓN ESTRATÉGICA Y GESTIÓN DE RESULTADOS CON
ORIENTACIÓN A FORTALECER LAS SECRETARIA DE ECONOMÍA, DEPORTE,
RECREACIÓN, CULTURA Y TURISMO, DEL MUNICIPIO DE DAGUA, VALLE DEL CAUCA",Presentación de oferta,09/05/2024,09/05/2024,,,,,09/05/2024,11200000,Contratación directa,Servicios profesionales y apoyo a la gestión,otro,día(s),,,,Dagua,CONTRATACIÓN DAGUA,0,0,0,0,0,0,0,0,0,Seleccionado,70,No,No Adjudicado,713364578,Valle del Cauca,Dagua,,0,No Adjudicado,Maria Paula Caicedo Rivera,1006252877,V1.80161500,Abierto,Prestación de servicios,No Definido,No definido,https://community.secop.gov.co/Public/Tendering/OpportunityDetail/Index?noticeUID=CO1.NTC.6673140,704923762,Adjudicado,2024,3.9155429850746266,,1,11200000,11.199999999999998,V1.801,True,0.7831085970149254,1.533147686796712,0.6000000000000001,0,13.30197554041989,3.926176653766329e-08,2.660395108083978,13.22605514526367,0.8503084257496708,14.301975540419887
123,787608,10640,17471,MUNICIPIO DE DAGUA,800100514,VALLE DEL CAUCA,DAGUA,Territorial,Centralizada,CO1.REQ.6657685,MC-016-2024,704923762,CO1.BDOS.6531574,ADQUISICIÓN DE PÓLIZA TODO RIESGO PARA VEHÍCULOS AUTOMOTORES DE PROPIEDAD DEL MUNICIPIO DE DAGUA - VALLE DEL PARA LA VIGENCIA 2024,ADQUISICIÓN DE PÓLIZA TODO RIESGO PARA VEHÍCULOS AUTOMOTORES DE PROPIEDAD DEL MUNICIPIO DE DAGUA - VALLE DEL PARA LA VIGENCIA 2024,Presentación de oferta,08/13/2024,08/13/2024,,,,,08/13/2024,14282227,Mínima cuantía,Presupuesto inferior al 10% de la menor cuantía,otro,día(s),08/16/2024,08/16/2024,08/16/2024,Dagua,CONTRATACIÓN DAGUA,0,0,2,0,1,0,0,1,0,Seleccionado,70,Si,CO1.AWD.2011522,700306053,Distrito Capital de Bogotá,No Definido,08/23/2024,14162904,ana Cecilia bravo loaiza,LA PREVISORA S.A. COMPAÑÍA DE SEGUROS,860002400,V1.84131503,Cerrado,Seguros,No Definido,No definido,https://community.secop.gov.co/Public/Tendering/OpportunityDetail/Index?noticeUID=CO1.NTC.6543119,704923762,Adjudicado,2024,3.9155429850746266,,1,14282227,14.282226999999995,V1.841,True,0.7831085970149254,1.533147686796712,0.6000000000000001,0,17.23786260863612,8.494837790424476e-10,3.447572521727224,17.18170356750488,0.8020761735387291,18.23786260863612
124,622340,7507,12409,MUNICIPIO DE DAGUA,800100514,VALLE DEL CAUCA,DAGUA,Territorial,Centralizada,CO1.REQ.6326851,CD-136-2024,704923762,CO1.BDOS.6203742,PRESTACION DE SERVICIOS DE APOYO A LA GESTION DE LA SECRETARIA DE BIENESTAR SOCIAL Y DESARROLLO COMUNITARIO; EN APOYO AL DESARROLLO EN LA IMPLEMENTACION DE ACTIVIDADES QUE APUNTEN AL MEJORAMIENTO DE L,"PRESTACION DE SERVICIOS DE APOYO A LA GESTION DE LA
SECRETARIA DE BIENESTAR SOCIAL Y DESARROLLO COMUNITARIO, EN APOYO
AL DESARROLLO EN LA IMPLEMENTACION DE ACTIVIDADES QUE APUNTEN AL
MEJORAMIENTO DE LOS PROCESOS DE CAPACITACION DE LOS GRUPOS
ORGANIZADOS A TRAVES DE LA OFERTA INSTITUCIONAL DE LA CASA DE LA
MUJER EMPODERADA EN TEMAS COMO: CAPACITACION PARA EL TRABAJO,
SEGURIDAD ALIMENTARIA (IMPLEMENTACION DE HUERTA), GASTRONOMIA,
MANUALIDADES, MANEJO DE TICs, ENTRE OTROS, COMO FORTELECIMIENTO A
LO",Presentación de oferta,05/31/2024,05/31/2024,,,,,05/31/2024,8800000,Contratación directa,Servicios profesionales y apoyo a la gestión,otro,Mes(es),,,,Dagua,CONTRATACIÓN DAGUA,0,0,0,0,0,0,0,0,0,Seleccionado,70,No,No Adjudicado,713455368,Valle del Cauca,Dagua,,0,No Adjudicado,Angela Patricia Aguirre Vargas,66911925,V1.80161500,Abierto,Prestación de servicios,No Definido,No definido,https://community.secop.gov.co/Public/Tendering/OpportunityDetail/Index?noticeUID=CO1.NTC.6212612,704923762,Adjudicado,2024,3.9155429850746266,,1,8800000,8.799999999999999,V1.801,True,44.224863386260665,86.58217679897832,33.8840847015381,1,-0.801016909353893,0.4310370919694766,-9.04724160130386,-0.8843302726745605,0.7331575972218741,0.1989830906461068
125,568567,5297,8903,MUNICIPIO DE DAGUA,800100514,VALLE DEL CAUCA,DAGUA,Territorial,Centralizada,CO1.REQ.6926110,CD-279-2024,704923762,CO1.BDOS.6796709,PRESTACIÓN DE SERVICIOS DE APOYO A LA GESTIÓN A LA SECRETARIA DE PLANEACIÓN Y PROYECTOS; PARA LA PREVENCIÓN; ATENCIÓN; CONTROL Y/O MITIGACIÓN A LOS RIESGOS DE DESASTRES; EN LA ZONA RURAL Y URBANA DEL,"PRESTACIÓN DE SERVICIOS DE APOYO A
LA GESTIÓN A LA SECRETARIA DE
PLANEACIÓN Y PROYECTOS, PARA LA
PREVENCIÓN, ATENCIÓN, CONTROL Y/O
MITIGACIÓN A LOS RIESGOS DE
DESASTRES, EN LA ZONA RURAL Y
URBANA DEL MUNICIPIO.",Presentación de oferta,10/01/2024,10/01/2024,,,,,10/01/2024,5700000,Contratación directa,Servicios profesionales y apoyo a la gestión,otro,día(s),,,,Dagua,CONTRATACIÓN DAGUA,0,0,0,0,0,0,0,0,0,Seleccionado,60,No,No Adjudicado,721321081,Valle del Cauca,Dagua,,0,No Adjudicado,GIOVANNY ZUÑIGA CALAMBAS,1114734898,V1.80161500,Abierto,Prestación de servicios,No Definido,No definido,https://community.secop.gov.co/Public/Tendering/OpportunityDetail/Index?noticeUID=CO1.NTC.6811935,704923762,Adjudicado,2024,3.9155429850746266,,1,5700000,5.699999999999999,V1.801,True,0.7831085970149254,1.533147686796712,0.6000000000000001,0,6.278683980392265,3.960229738480426e-06,1.255736796078453,6.17563009262085,0.5874071602970686,7.278683980392265
126,55220,4118,6812,MUNICIPIO DE DAGUA,800100514,VALLE DEL CAUCA,DAGUA,Territorial,Centralizada,CO1.REQ.6357157,CD-159-2024,704923762,CO1.BDOS.6234045,PRESTACIÓN DE SERVICIOS DE APOYO A LA GESTIÓN DE LA SECRETARIA DE ECONOMÍA; DEPORTE; RECREACIÓN; CULTURA Y TURISMO; EN EL DESARROLLO DE ACTIVIDADES DE APOYO A LA GESTION DE LA BIBLIOTECA DE LA CASA DE,"PRESTACIÓN DE SERVICIOS DE APOYO A LA
GESTIÓN DE LA SECRETARIA DE ECONOMÍA,
DEPORTE, RECREACIÓN, CULTURA Y
TURISMO, EN EL DESARROLLO DE
ACTIVIDADES DE APOYO A LA GESTION DE LA
BIBLIOTECA DE LA CASA DE LA CULTURA DEL
CORREGIMIENTO QUEREMAL",Presentación de oferta,06/07/2024,06/07/2024,,,,,06/07/2024,9500000,Contratación directa,Servicios profesionales y apoyo a la gestión,otro,día(s),,,,Dagua,CONTRATACIÓN DAGUA,0,0,0,0,0,0,0,0,0,Seleccionado,70,No,No Adjudicado,727050676,Valle del Cauca,Dagua,,0,No Adjudicado,KATERINE ANDREA LOPEZ HERRERA,1107050381,V1.80161500,Abierto,Prestación de servicios,No Definido,No definido,https://community.secop.gov.co/Public/Tendering/OpportunityDetail/Index?noticeUID=CO1.NTC.6243656,704923762,Adjudicado,2024,3.9155429850746266,,1,9500000,9.500000000000002,V1.801,True,70.25187838720123,137.5371248036608,53.82539176940919,1,-0.8647722990744864,0.400744569828042,-15.51556926300564,-0.9145838618278505,0.4732098461569587,0.1352277009255136
127,456560,8843,14817,MUNICIPIO DE DAGUA,800100514,VALLE DEL CAUCA,DAGUA,Territorial,Centralizada,CO1.REQ.6855606,CD-250-2024,704923762,CO1.BDOS.6727422,PRESTACION DE SERVICIOS DE APOYO A LA GESTION DE LA SECRETARIA DE BIENESTAR SOCIAL Y DESARROLLO COMUNITARIO; EN EL DESARROLLO DE ACCIONES PARA LA MASIFICACION DE LOS AMBIENTES DE APRENDIZAJE EN EL USO,"PRESTACION DE SERVICIOS DE APOYO A LA GESTION DE LA SECRETARIA DE
BIENESTAR SOCIAL Y DESARROLLO COMUNITARIO, EN EL DESARROLLO DE
ACCIONES PARA LA MASIFICACION DE LOS AMBIENTES DE APRENDIZAJE EN
EL USO DE LAS TICS A TRAVES DE LA OPERATIVIDAD DEL VIVE DIGITAL
UBICADO EN LA INSTITUCIÓN EDUCATIVA GIMNASIO DEL DAGUA DEL
MUNICIPIO DE DAGUA VALLE DEL CAUCA.",Presentación de oferta,09/17/2024,09/17/2024,,,,,09/17/2024,8800000,Contratación directa,Servicios profesionales y apoyo a la gestión,otro,día(s),,,,Dagua,CONTRATACIÓN DAGUA,0,0,0,0,0,0,0,0,0,Seleccionado,70,No,No Adjudicado,713394153,Valle del Cauca,Dagua,,0,No Adjudicado,CRISTIAN FERNANDO GUEVARA DELGADO,1114727119,V1.80111600,Abierto,Prestación de servicios,No Definido,No definido,https://community.secop.gov.co/Public/Tendering/OpportunityDetail/Index?noticeUID=CO1.NTC.6737261,704923762,Adjudicado,2024,3.9155429850746266,,1,8800000,8.799999999999999,V1.801,True,20.228460129053627,39.60270257858885,15.49858617782593,1,-0.5649693578325924,0.6623623606823577,-2.918742093399803,-0.6123578548431396,0.4170187736928158,0.4350306421674075
128,81738,5541,9107,MUNICIPIO DE DAGUA,800100514,VALLE DEL CAUCA,DAGUA,Territorial,Centralizada,CO1.REQ.6365086,CD-168-2024,704923762,CO1.BDOS.6241825,PRESTACION DE SERVICIOS DE APOYO A LA GESTION DE LA SECRETARIA DE HACIENDA PARA LA ENTREGA DE LA FACTURACION EN LA ZONA URBANA Y RURAL; QUE SE GENEREN EN LA GESTIÓN DE LOS PROCESOS DE COBRO COACTIVO Y,"PRESTACION DE SERVICIOS DE APOYO A LA
GESTION DE LA SECRETARIA DE HACIENDA
PARA LA ENTREGA DE LA FACTURACION EN
LA ZONA URBANA Y RURAL, QUE SE
GENEREN EN LA GESTIÓN DE LOS PROCESOS
DE COBRO COACTIVO Y PERSUASIVO DEL
IMPUESTO PREDIAL PARA LA EFICIENCIA DEL
RECAUDO EN EL MUNICIPIO DE DAGUA.",Presentación de oferta,06/11/2024,06/11/2024,,,,,06/11/2024,10000000,Contratación directa,Servicios profesionales y apoyo a la gestión,otro,día(s),,,,Dagua,CONTRATACIÓN DAGUA,0,0,0,0,0,0,0,0,0,Seleccionado,70,No,No Adjudicado,727054256,Valle del Cauca,Dagua,,0,No Adjudicado,GLADYS MEDINA VACA,29400856,V1.80161500,Abierto,Prestación de servicios,No Definido,No definido,https://community.secop.gov.co/Public/Tendering/OpportunityDetail/Index?noticeUID=CO1.NTC.6251628,704923762,Adjudicado,2024,3.9155429850746266,,1,10000000,9.999999999999998,V1.801,True,0.7831085970149254,1.533147686796712,0.6000000000000001,0,11.76962101823204,4.4961435749782e-08,2.353924203646409,11.72880458831787,0.4081642991417133,12.769621018232042
129,555213,4788,7852,MUNICIPIO DE DAGUA,800100514,VALLE DEL CAUCA,DAGUA,Territorial,Centralizada,CO1.REQ.6244507,MC-008-2024,704923762,CO1.BDOS.6122689,ADQUIRIR POLIZA DE VIDA GRUPO;DESTINADA A PROTEGER LA VIDA  E INTEGRIDAD DE LOS EMPLEADOS DE LA ALCALDIA MUNICIPAL DE DAGUA VALLE PARA LA VIGENCIA 2024-2025,"ADQUIRIR POLIZA DE VIDA GRUPO,DESTINADA A PROTEGER LA VIDA  E INTEGRIDAD DE LOS EMPLEADOS DE LA ALCALDIA MUNICIPAL DE DAGUA VALLE PARA LA VIGENCIA 2024-2025",Presentación de oferta,05/16/2024,05/16/2024,,,,,05/16/2024,9560400,Mínima cuantía,Presupuesto inferior al 10% de la menor cuantía,otro,día(s),05/22/2024,05/22/2024,05/22/2024,Dagua,CONTRATACIÓN DAGUA,0,0,4,0,1,0,0,1,0,Cancelado,100,Si,CO1.AWD.1938209,723294559,Distrito Capital de Bogotá,Bogotá,,9560400,Rosa Elizabeth Grisales Franco,Palig,860038299,V1.84131601,Cerrado,Seguros,No Definido,No definido,https://community.secop.gov.co/Public/Tendering/OpportunityDetail/Index?noticeUID=CO1.NTC.6134544,704923762,Adjudicado,2024,3.9155429850746266,,1,9560400,9.5604,V1.841,True,160.31903849961694,313.86804328554206,122.8328018188477,1,-0.940366408821602,0.3144747212001009,-38.50261357729511,-0.982422947883606,0.4020773360483821,0.0596335911783979
130,770960,7006,11405,MUNICIPIO DE DAGUA,800100514,VALLE DEL CAUCA,DAGUA,Territorial,Centralizada,CO1.REQ.6271187,CD-114-2024,704923762,CO1.BDOS.6149448,PRESTACIÓN DE SERVICIO PROFESIONAL A LA GESTIÓN DE LA SECRETARIA DE ECONOMÍA; DEPORTE; RECREACIÓN; CULTURA Y TURISMO; EN EL DESARROLLO DE ACTIVIDADES DE FORMACION EN LA DISCIPLINA DEPORTIVA FUTBOL; DI,"PRESTACIÓN DE
SERVICIO PROFESIONAL A LA GESTIÓN DE LA SECRETARIA DE ECONOMÍA, DEPORTE,
RECREACIÓN, CULTURA Y TURISMO, EN EL DESARROLLO DE ACTIVIDADES DE
FORMACION EN LA DISCIPLINA DEPORTIVA FUTBOL, DIRIGIDA A NNJA Y ADULTOS DEL
CORREGIMIENTO BORRERO AYERBE, KM 26 Y ZONAS ALEDAÑAS.",Presentación de oferta,05/21/2024,05/21/2024,,,,,05/21/2024,16800000,Contratación directa,Servicios profesionales y apoyo a la gestión,otro,día(s),,,,Dagua,CONTRATACIÓN DAGUA,0,0,0,0,0,0,0,0,0,Seleccionado,70,No,No Adjudicado,713795656,Valle del Cauca,Dagua,,0,No Adjudicado,Carlos Andres Toro Sarria,1148448455,V1.80161500,Abierto,Prestación de servicios,No Definido,No definido,https://community.secop.gov.co/Public/Tendering/OpportunityDetail/Index?noticeUID=CO1.NTC.6157871,704923762,Adjudicado,2024,3.9155429850746266,,1,16800000,16.8,V1.801,True,0.7831085970149254,1.533147686796712,0.6000000000000001,0,20.45296331062984,2.554751070564824e-09,4.090592662125967,20.43235969543457,0.3461407352805395,21.45296331062984
131,527039,2375,3995,MUNICIPIO DE DAGUA,800100514,VALLE DEL CAUCA,DAGUA,Territorial,Centralizada,CO1.REQ.6597449,CD-191-2024,704923762,CO1.BDOS.6471751,PRESTACIÓN DE SERVICIOS DE APOYO A LA GESTIÓN A LA SECRETARÍA DE BIENESTAR SOCIAL Y DESARROLLO COMUNITARIO; EN LA ATENCIÓN DE SOLICITUDES; RECOLECCIÓN Y GESTIÓN DE INFORMACIÓN; QUE PERMITA ACTUALIZAR,"PRESTACIÓN DE SERVICIOS DE APOYO A LA
GESTIÓN A LA SECRETARÍA DE BIENESTAR
SOCIAL Y DESARROLLO COMUNITARIO, EN LA
ATENCIÓN DE SOLICITUDES, RECOLECCIÓN Y
GESTIÓN DE INFORMACIÓN, QUE PERMITA
ACTUALIZAR EL SISTEMA DE POTENCIALES
DE PROGRAMAS SOCIALES, SISBÉN, EN EL
MUNICIPIO DE DAGUA VALLE DEL CAUCA",Presentación de oferta,08/01/2024,08/01/2024,,,,,08/01/2024,7200000,Contratación directa,Servicios profesionales y apoyo a la gestión,otro,día(s),,,,Dagua,CONTRATACIÓN DAGUA,0,0,0,0,0,0,0,0,0,Seleccionado,70,No,No Adjudicado,719212110,Valle del Cauca,Dagua,,0,No Adjudicado,Diana Julieth Zuñiga Badillo,1114733448,V1.80161500,Abierto,Prestación de servicios,No Definido,No definido,https://community.secop.gov.co/Public/Tendering/OpportunityDetail/Index?noticeUID=CO1.NTC.6481154,704923762,Adjudicado,2024,3.9155429850746266,,1,7200000,7.200000000000001,V1.801,True,62.608385050243264,122.57291144516556,47.96912097930909,1,-0.8849994294818179,0.3694851183466175,-14.15088156647762,-0.9108051657676696,0.1858013012581322,0.1150005705181821
132,527572,2908,4859,MUNICIPIO DE DAGUA,800100514,VALLE DEL CAUCA,DAGUA,Territorial,Centralizada,CO1.REQ.6599442,CD-195-2024,704923762,CO1.BDOS.6473772,PRESTACIÓN DE SERVICIOS DE APOYO A LA  GESTIÓN A LA SECRETARÍA DE BIENESTAR  SOCIAL Y DESARROLLO COMUNITARIO; EN LA  ATENCIÓN DE SOLICITUDES; RECOLECCIÓN Y  GESTIÓN DE INFORMACIÓN; QUE PERMITA  ACTUAL,"PRESTACIÓN DE SERVICIOS DE APOYO A LA 
GESTIÓN A LA SECRETARÍA DE BIENESTAR 
SOCIAL Y DESARROLLO COMUNITARIO, EN LA 
ATENCIÓN DE SOLICITUDES, RECOLECCIÓN Y 
GESTIÓN DE INFORMACIÓN, QUE PERMITA 
ACTUALIZAR EL SISTEMA DE POTENCIALES 
DE PROGRAMAS SOCIALES, SISBÉN, EN EL 
MUNICIPIO DE DAGUA VALLE DEL CAUCA",Presentación de oferta,08/01/2024,08/01/2024,,,,,08/01/2024,7200000,Contratación directa,Servicios profesionales y apoyo a la gestión,otro,día(s),,,,Dagua,CONTRATACIÓN DAGUA,0,0,0,0,0,0,0,0,0,Seleccionado,70,No,No Adjudicado,713623270,Valle del Cauca,Dagua,,0,No Adjudicado,alcaldia dagua,66911053,V1.80161500,Abierto,Prestación de servicios,No Definido,No definido,https://community.secop.gov.co/Public/Tendering/OpportunityDetail/Index?noticeUID=CO1.NTC.6483136,704923762,Adjudicado,2024,3.9155429850746266,,1,7200000,7.200000000000001,V1.801,True,62.608385050243264,122.57291144516556,47.96912097930909,1,-0.8849994294818179,0.3694851183466175,-14.15088156647762,-0.9108051657676696,0.1858013012581322,0.1150005705181821
133,183488,5109,8443,MUNICIPIO DE DAGUA,800100514,VALLE DEL CAUCA,DAGUA,Territorial,Centralizada,CO1.REQ.6128644,CD-063-2024,704923762,CO1.BDOS.6005862,PRESTAR LOS SERVICIOS DE APOYO OPERATIVO A LA SECRETARIA DE DESARROLLO INSTITUCIONAL EN LA ADECUACIÓN DE LOS ESPACIOS FÍSICOS DE LA PLANTA DE BENEFICIO ANIMAL DEL MUNICIPIO DE DAGUA  VALLE DEL CAUCA.,"PRESTAR LOS SERVICIOS DE APOYO OPERATIVO A LA
SECRETARIA DE DESARROLLO INSTITUCIONAL EN LA ADECUACIÓN DE LOS ESPACIOS
FÍSICOS DE LA PLANTA DE BENEFICIO ANIMAL DEL MUNICIPIO DE DAGUA - VALLE DEL
CAUCA.",Presentación de oferta,04/22/2024,04/22/2024,,,,,04/22/2024,7600000,Contratación directa,Servicios profesionales y apoyo a la gestión,otro,día(s),,,,Dagua,CONTRATACIÓN DAGUA,0,0,0,0,0,0,0,0,0,Seleccionado,70,No,No Adjudicado,714144326,Valle del Cauca,Dagua,,0,No Adjudicado,ANDRES FERNANDO QUINTERO,94421604,V1.80161500,Abierto,Prestación de servicios,No Definido,No definido,https://community.secop.gov.co/Public/Tendering/OpportunityDetail/Index?noticeUID=CO1.NTC.6016959,704923762,Adjudicado,2024,3.9155429850746266,,1,7600000,7.6,V1.801,True,0.7831085970149254,1.533147686796712,0.6000000000000001,0,8.704911973856355,7.279503032380626e-07,1.740982394771271,8.683853149414062,0.1600470657614209,9.704911973856351
134,23262,10461,17457,MUNICIPIO DE DAGUA,800100514,VALLE DEL CAUCA,DAGUA,Territorial,Centralizada,CO1.REQ.6365526,C169-2024,704923762,CO1.BDOS.6242417,PRESTACION DE SERVICIOS DE APOYO A LA GESTION DE LA SECRETARIA DE HACIENDA PARA LA ENTREGA DE LA FACTURACION EN LA ZONA URBANA Y RURAL; QUE SE GENEREN EN LA GESTIÓN DE LOS PROCESOS DE COBRO COACTIVO Y,"PRESTACION DE SERVICIOS DE APOYO A LA GESTION DE LA
SECRETARIA DE HACIENDA PARA LA ENTREGA DE LA FACTURACION EN LA
ZONA URBANA Y RURAL, QUE SE GENEREN EN LA GESTIÓN DE LOS
PROCESOS DE COBRO COACTIVO Y PERSUASIVO DEL IMPUESTO PREDIAL
PARA LA EFICIENCIA DEL RECAUDO EN EL MUNICIPIO DE DAGUA.",Presentación de oferta,06/11/2024,06/11/2024,,,,,06/11/2024,13200000,Contratación directa,Servicios profesionales y apoyo a la gestión,otro,día(s),,,,Dagua,CONTRATACIÓN DAGUA,0,0,0,0,0,0,0,0,0,Seleccionado,70,No,No Adjudicado,713406445,Valle del Cauca,Dagua,,0,No Adjudicado,ORFANNY MARIA VELEZ,66913131,V1.80161500,Abierto,Prestación de servicios,No Definido,No definido,https://community.secop.gov.co/Public/Tendering/OpportunityDetail/Index?noticeUID=CO1.NTC.6251933,704923762,Adjudicado,2024,3.9155429850746266,,1,13200000,13.2,V1.801,True,0.7831085970149254,1.533147686796712,0.6000000000000001,0,15.8558997440663,7.420277156730905e-09,3.17117994881326,15.85993385314941,-0.0532502398970692,16.8558997440663
135,205094,1248,2068,MUNICIPIO DE DAGUA,800100514,VALLE DEL CAUCA,DAGUA,Territorial,Centralizada,CO1.REQ.6241509,MC-009-2024,704923762,CO1.BDOS.6120102,PRESTACIÓN DE SERVICIOS LOGÍSTICOS DE ALIMENTACIÓN A PRECIO UNITARIO; AUXILIO DE ALOJAMIENTO TRANSITORIO Y AUXILIO DE TRANSPORTE DE EMERGENCIA; ASÍ COMO EL SUMINISTRO A PRECIO UNITARIO DE KIT ALIMENTA,"PRESTACIÓN DE SERVICIOS LOGÍSTICOS DE ALIMENTACIÓN A PRECIO UNITARIO, AUXILIO DE ALOJAMIENTO TRANSITORIO Y AUXILIO DE TRANSPORTE DE EMERGENCIA, ASÍ COMO EL SUMINISTRO A PRECIO UNITARIO DE KIT ALIMENTARIO, KIT DE ASEO Y KIT DE HÁBITAT PARA LA IMPLEMENTACIÓN DE LA ESTRATEGIA DE AYUDA HUMANITARIA INMEDIATA A LA POBLACIÓN VÍCTIMA DEL CONFLICTO QUE AÚN NO SE ENCUENTRA INCLUIDA EN EL REGISTRO ÚNICO DE VICTIMAS EN EL MUNICIPIO DE DAGUA (VALLE).",Presentación de oferta,05/15/2024,05/15/2024,,,,,05/15/2024,15000000,Mínima cuantía,Presupuesto inferior al 10% de la menor cuantía,otro,día(s),05/21/2024,05/21/2024,05/21/2024,Dagua,CONTRATACIÓN DAGUA,0,0,7,0,1,0,0,1,0,Seleccionado,70,Si,CO1.AWD.1938232,715725347,Valle del Cauca,Dagua,05/30/2024,15000000,Rosa Elizabeth Grisales Franco,SUPERMERCADO EL CAMPESINO DE DAGUA,66910555,V1.80111623,Cerrado,Prestación de servicios,No Definido,No definido,https://community.secop.gov.co/Public/Tendering/OpportunityDetail/Index?noticeUID=CO1.NTC.6129364,704923762,Adjudicado,2024,3.9155429850746266,,1,15000000,15.0,V1.801,True,48.29923855981772,94.55887236367008,37.00577831268312,1,-0.6894360978088138,0.5558086409042765,-8.504373132091427,-0.6816781163215637,-0.1163697223087506,0.3105639021911862
136,603980,2104,3496,MUNICIPIO DE DAGUA,800100514,VALLE DEL CAUCA,DAGUA,Territorial,Centralizada,CO1.REQ.6795106,CD-223-2024,704923762,CO1.BDOS.6667864,PRESTACIÓN DE SERVICIOS PROFESIONALES PARA APOYAR EL FORTALECIMIENTO DE LAS POLÍTICAS DE GESTIÓN Y DESEMPEÑO DEL MODELO INTEGRADO DE PLANEACIÓN Y GESTIÓN - MIPG; PARA EL FORTALECIMIENTO EN LAS HERRAMI,"PRESTACIÓN DE SERVICIOS PROFESIONALES PARA  APOYAR EL FORTALECIMIENTO DE LAS POLÍTICAS DE GESTIÓN Y DESEMPEÑO DEL MODELO INTEGRADO DE PLANEACIÓN Y GESTIÓN - MIPG, PARA EL FORTALECIMIENTO EN LAS HERRAMIENTAS DE GESTIÓN, CONOCIMIENTO Y DE APOYO A LA DIRECCIÓN Y DE LA ADMINISTRACIÓN TERRITORIAL",Presentación de oferta,09/06/2024,09/06/2024,,,,,09/06/2024,12000000,Contratación directa,Servicios profesionales y apoyo a la gestión,otro,día(s),,,,Dagua,CONTRATACIÓN DAGUA,0,0,0,0,0,0,0,0,0,Seleccionado,70,No,No Adjudicado,713364925,Valle del Cauca,Dagua,,0,No Adjudicado,VIVIANA VALVERDE ORTIZ,66911608,V1.80161500,Abierto,Prestación de servicios,No Definido,No definido,https://community.secop.gov.co/Public/Tendering/OpportunityDetail/Index?noticeUID=CO1.NTC.6676482,704923762,Adjudicado,2024,3.9155429850746266,,1,12000000,11.999999999999998,V1.801,True,14.252250138060225,27.902649024805296,10.91974997520447,1,-0.1580276879961331,0.7480625734504839,-0.575207614025798,-0.1447880864143372,-0.1588752189815505,0.8419723120038669
137,482745,9692,15979,MUNICIPIO DE DAGUA,800100514,VALLE DEL CAUCA,DAGUA,Territorial,Centralizada,CO1.REQ.6933811,CD-262-2024,704923762,CO1.BDOS.6804089,PRESTACION DE SERVICIOS DE APOYO A LA FORMULACIÓN Y ACTUALIZACIÓN DEL PLAN DE GESTIÓN DE RIESGO DE DESASTRES DEL MUNICIPIO DE DAGUA; MEDIANTE LA REALIZACIÓN DE ACTIVIDADES ORIENTADAS A LA SENSIBILIZAC,"PRESTACION DE SERVICIOS DE APOYO A LA FORMULACIÓN Y ACTUALIZACIÓN
DEL PLAN DE GESTIÓN DE RIESGO DE DESASTRES DEL MUNICIPIO DE DAGUA, MEDIANTE LA REALIZACIÓN DE ACTIVIDADES ORIENTADAS A LA
SENSIBILIZACIÓN, MONITOREO Y ATENCIÓN DE RIESGOS Y EMERGENCIAS EN
LAS ZONAS RURALES Y URBANAS DEL MUNICIPIO.",Presentación de oferta,10/01/2024,10/01/2024,,,,,10/01/2024,7500000,Contratación directa,Servicios profesionales y apoyo a la gestión,otro,día(s),,,,Dagua,CONTRATACIÓN DAGUA,0,0,0,0,0,0,0,0,0,Seleccionado,70,No,No Adjudicado,726231723,Valle del Cauca,Dagua,,0,No Adjudicado,JHON SEBASTIAN VILLA MARIN,1193075943,V1.80161500,Abierto,Prestación de servicios,No Definido,No definido,https://community.secop.gov.co/Public/Tendering/OpportunityDetail/Index?noticeUID=CO1.NTC.6814032,704923762,Adjudicado,2024,3.9155429850746266,,1,7500000,7.5,V1.801,True,112.81950236493635,220.8748055323184,86.43973731994629,1,-0.9335221318762796,0.3212745955276474,-26.89780262058062,-0.9114660024642944,-0.165420970589889,0.0664778681237203
138,154598,1813,3032,MUNICIPIO DE DAGUA,800100514,VALLE DEL CAUCA,DAGUA,Territorial,Centralizada,CO1.REQ.6117873,CD-058-2024,704923762,CO1.BDOS.5998455,PRESTACIÓN DE SERVICIOS DE APOYO A LA GESTIÓN A LA  SECRETARÍA DE PLANEACION Y PROYECTOS; PARA LA PREVENCION; ATENCION;  CONTROL Y/O MITIGACION A LOS RIESGOS DE DESASTRES; EN LA ZONA RURAL Y  URBANA D,"PRESTACIÓN DE SERVICIOS DE APOYO A LA GESTIÓN A LA 
SECRETARÍA DE PLANEACION Y PROYECTOS, PARA LA PREVENCION, ATENCION, 
CONTROL Y/O MITIGACION A LOS RIESGOS DE DESASTRES, EN LA ZONA RURAL Y 
URBANA DEL MUNICIPIO.",Presentación de oferta,04/19/2024,04/19/2024,,,,,04/19/2024,7600000,Contratación directa,Servicios profesionales y apoyo a la gestión,otro,Mes(es),,,,Dagua,CONTRATACIÓN DAGUA,0,0,0,0,0,0,0,0,0,Seleccionado,70,No,No Adjudicado,726108772,Valle del Cauca,Dagua,,0,No Adjudicado,MARIA FERNANDA CHAVARRO REALPE,1114732437,V1.80161500,Abierto,Prestación de servicios,No Definido,No definido,https://community.secop.gov.co/Public/Tendering/OpportunityDetail/Index?noticeUID=CO1.NTC.6006239,704923762,Adjudicado,2024,3.9155429850746266,,1,7600000,7.6,V1.801,True,1.163372381193202,2.2776172831053034,0.8913494646549225,0,5.532732015010646,1.364782035752244e-05,1.643865906552963,5.577181339263916,-0.3378148643248501,6.532732015010646
