143,569709,6439,10767,MUNICIPIO DE DAGUA,800100514,VALLE DEL CAUCA,DAGUA,Territorial,Centralizada,CO1.REQ.6210021,CD-092-2024,704923762,CO1.BDOS.6089429,PRESTACION DE SERVICIOS DE APOYO A LA GESTION DE LA SECRETARIA DE BIENESTAR SOCIAL Y DESARROLLO COMUNITARIO PARA EJECUTAR ACTIVIDADES DE:  SEGUIMIENTO Y PROMOCIÓN DEL CUMPLIMIENTO DE LOS COMPROMISOS P,"PRESTACION DE SERVICIOS DE APOYO A LA GESTION DE LA SECRETARIA DE BIENESTAR SOCIAL Y DESARROLLO COMUNITARIO PARA EJECUTAR ACTIVIDADES DE:  SEGUIMIENTO Y PROMOCIÓN DEL CUMPLIMIENTO DE LOS COMPROMISOS PACTADOS EN LA ATENCION COMUNITARIA; SEGUIMIENTO DE LOS COMPROMISOS DEL POA;  APOYO EN LA RENDICION DE INFORMES; FOCALIZACION, VERIFICACION Y REGISTRO DE NOVEDADES DE LOS BENEFICIARIOS DEL PROGRAMA  RENTA CIUDADANA, EN EL MUNICIPIO DE DAGUA VALLE DEL CAUCA.",Presentación de oferta,05/08/2024,05/08/2024,,,,,05/08/2024,9600000,Contratación directa,Servicios profesionales y apoyo a la gestión,otro,día(s),,,,Dagua,CONTRATACIÓN DAGUA,0,0,0,0,0,0,0,0,0,Seleccionado,70,No,No Adjudicado,713392496,Valle del Cauca,Dagua,,0,No Adjudicado,ADRIANA MARMOLEJO CORRALES,29401499,V1.80111600,Abierto,Prestación de servicios,No Definido,No definido,https://community.secop.gov.co/Public/Tendering/OpportunityDetail/Index?noticeUID=CO1.NTC.6096861,704923762,Adjudicado,2024,3.9155429850746266,,1,9600000,9.6,V1.801,True,28.38022393746091,55.56199337658604,21.74428224563599,1,-0.6617362843522763,0.5549469332851229,-4.796326846378109,-0.5929545164108276,-0.660304972237907,0.3382637156477238
144,386870,3310,5419,MUNICIPIO DE DAGUA,800100514,VALLE DEL CAUCA,DAGUA,Territorial,Centralizada,CO1.REQ.6814201,CD-241-2024,704923762,CO1.BDOS.6686938,PRESTACION DE SERVICIOS DE APOYO A LA GESTIÓN DE LA SECRETARIA DE AGRICULTURA Y DESARROLLO RURAL EN LA GESTIÓN OPERATIVA ORIENTADA A FORTALECER LOS PROCESOS DE CONSERVACION Y EDUCACION AMBIENTAL DEL M,"PRESTACION DE SERVICIOS DE APOYO A LA
GESTIÓN DE LA SECRETARIA DE
AGRICULTURA Y DESARROLLO RURAL EN LA
GESTIÓN OPERATIVA ORIENTADA A
FORTALECER LOS PROCESOS DE
CONSERVACION Y EDUCACION AMBIENTAL
DEL MUNICIPIO DE DAGUA.",Presentación de oferta,09/10/2024,09/10/2024,,,,,09/10/2024,8000000,Contratación directa,Servicios profesionales y apoyo a la gestión,otro,día(s),,,,Dagua,CONTRATACIÓN DAGUA,0,0,0,0,0,0,0,0,0,Seleccionado,70,No,No Adjudicado,713392991,Valle del Cauca,Dagua,,0,No Adjudicado,DANIELA BERLISA ORTIZ PANTOJA,1114732568,V1.80161500,Abierto,Prestación de servicios,No Definido,No definido,https://community.secop.gov.co/Public/Tendering/OpportunityDetail/Index?noticeUID=CO1.NTC.6695794,704923762,Adjudicado,2024,3.9155429850746266,,1,8000000,7.999999999999998,V1.801,True,35.02952710298282,68.57980955928294,26.83882713317871,1,-0.7716212389484759,0.4745958416249462,-6.903136348142443,-0.6627305746078491,-0.871125314725014,0.228378761051524
145,761728,6577,10727,MUNICIPIO DE DAGUA,800100514,VALLE DEL CAUCA,DAGUA,Territorial,Centralizada,CO1.REQ.6357973,CD-163-2024,704923762,CO1.BDOS.6234975,PRESTACION DE SERVICIOS DE APOYO A LA GESTIÓN DE LA SECRETARIA DE AGRICULTURA Y DESARROLLO RURAL PARA EL SEGUIMIENTO DE UNIDADES PRODUCTIVAS AGRICOLAS FAMILIARES Y ASOCIATIVAS; CON ORIENTACION A PROMO,"PRESTACION DE SERVICIOS DE APOYO A LA
GESTIÓN DE LA SECRETARIA DE
AGRICULTURA Y DESARROLLO RURAL PARA
EL SEGUIMIENTO DE UNIDADES
PRODUCTIVAS AGRICOLAS FAMILIARES Y
ASOCIATIVAS, CON ORIENTACION A
PROMOVER LA SOSTENIBILIDAD AMBIENTAL
Y AUTOSUFICIENCIA ALIMENTARIA EN EL
MUNICIPIO DE DAGUA.",Presentación de oferta,06/08/2024,06/08/2024,,,,,06/08/2024,8400000,Contratación directa,Servicios profesionales y apoyo a la gestión,otro,día(s),,,,Dagua,CONTRATACIÓN DAGUA,0,0,0,0,0,0,0,0,0,Seleccionado,70,No,No Adjudicado,713643682,Valle del Cauca,Dagua,,0,No Adjudicado,Norman Castro Cerezo,2549983,V1.80161500,Abierto,Prestación de servicios,No Definido,No definido,https://community.secop.gov.co/Public/Tendering/OpportunityDetail/Index?noticeUID=CO1.NTC.6244594,704923762,Adjudicado,2024,3.9155429850746266,,1,8400000,8.4,V1.801,True,0.7831085970149254,1.533147686796712,0.6000000000000001,0,9.726481655314918,3.313108910213213e-07,1.945296331062984,9.850055694580078,-1.038021929827341,10.726481655314918
146,356021,11252,18435,MUNICIPIO DE DAGUA,800100514,VALLE DEL CAUCA,DAGUA,Territorial,Centralizada,CO1.REQ.6357898,CD-162-2024,704923762,CO1.BDOS.6234893,PRESTACION DE SERVICIOS DE APOYO A LA GESTION DE LA SECRETARIA DE AGRICULTURA Y DESARROLLO RURAL PARA EL SEGUIMIENTO y FORTALECIMIENTO DE UNIDADES PRODUCTIVAS AGROPECUARIAS FAMILIARES Y ASOCIATIVAS; C,"PRESTACION DE SERVICIOS DE APOYO A LA
GESTION DE LA SECRETARIA DE
AGRICULTURA Y DESARROLLO RURAL PARA
EL SEGUIMIENTO y FORTALECIMIENTO DE
UNIDADES PRODUCTIVAS AGROPECUARIAS
FAMILIARES Y ASOCIATIVAS, CON
ORIENTACION A PROMOVER LA
SOSTENIBILIDAD AMBIENTAL Y
AUTOSUFICIENCIA ALIMENTARIA EN EL
MUNICIPIO DE DAGUA",Presentación de oferta,06/08/2024,06/08/2024,,,,,06/08/2024,7600000,Contratación directa,Servicios profesionales y apoyo a la gestión,otro,día(s),,,,Dagua,CONTRATACIÓN DAGUA,0,0,0,0,0,0,0,0,0,Seleccionado,70,No,No Adjudicado,713394484,Valle del Cauca,Dagua,,0,No Adjudicado,ERIKA CRUZ TREJOS,1114733701,V1.80161500,Abierto,Prestación de servicios,No Definido,No definido,https://community.secop.gov.co/Public/Tendering/OpportunityDetail/Index?noticeUID=CO1.NTC.6244812,704923762,Adjudicado,2024,3.9155429850746266,,1,7600000,7.6,V1.801,True,64.97439279541585,127.20501395978695,49.78190231323242,1,-0.8830308422591953,0.3799539293906883,-14.65298504297287,-0.7448964715003967,-1.0498212177668689,0.1169691577408046
147,186887,8508,13973,MUNICIPIO DE DAGUA,800100514,VALLE DEL CAUCA,DAGUA,Territorial,Centralizada,CO1.REQ.6242876,CD-105-2024,704923762,CO1.BDOS.6121627,PRESTACIÓN DE SERVICIOS DE APOYO OPERATIVO A LA GESTIÓN DE LA SECRETARIA DE ECONOMÍA; DEPORTE; RECREACIÓN; CULTURA Y TURISMO; EN EL DESARROLLO DE ACTIVIDADES DE FOMENTO Y PROMOCION EN LA DISCIPLINA DE,"PRESTACIÓN DE SERVICIOS DE APOYO OPERATIVO A LA
GESTIÓN DE LA SECRETARIA DE ECONOMÍA, DEPORTE, RECREACIÓN, CULTURA Y
TURISMO, EN EL DESARROLLO DE ACTIVIDADES DE FOMENTO Y PROMOCION EN LA
DISCIPLINA DEPORTIVA FUTBOL Y FUTBOL SALA DE LOS CORREGIMIENTOS BORRERO
AYERBE, EL CARMEN Y VEREDA LA CLORINDA.",Presentación de oferta,05/15/2024,05/15/2024,,,,,05/15/2024,13200000,Contratación directa,Servicios profesionales y apoyo a la gestión,otro,día(s),,,,Dagua,CONTRATACIÓN DAGUA,0,0,0,0,0,0,0,0,0,Seleccionado,70,No,No Adjudicado,713455921,Valle del Cauca,Dagua,,0,No Adjudicado,LUIS ALBERTO VALLEJO,94420431,V1.80161500,Abierto,Prestación de servicios,No Definido,No definido,https://community.secop.gov.co/Public/Tendering/OpportunityDetail/Index?noticeUID=CO1.NTC.6129282,704923762,Adjudicado,2024,3.9155429850746266,,1,13200000,13.2,V1.801,True,122.9662410300246,240.7398012330543,94.2139377593994,1,-0.8926534641586957,0.374981306907446,-28.03346597098654,-0.8103972673416138,-1.0857817979854818,0.1073465358413043
148,571817,8547,14213,MUNICIPIO DE DAGUA,800100514,VALLE DEL CAUCA,DAGUA,Territorial,Centralizada,CO1.REQ.6940776,CD-289-2024,704923762,CO1.BDOS.6810988,PRESTACION DE SERVICIOS DE APOYO A LA GESTION DE LA SECRETARIA DE BIENESTAR SOCIAL Y DESARROLLO COMUNITARIO PARA EJECUTAR ACTIVIDADES DE: SEGUIMIENTO Y PROMOCIÓN DEL CUMPLIMIENTO DE LOS COMPROMISOS PA,"PRESTACION DE SERVICIOS DE APOYO A LA
GESTION DE LA SECRETARIA DE BIENESTAR
SOCIAL Y DESARROLLO COMUNITARIO PARA
EJECUTAR ACTIVIDADES DE: SEGUIMIENTO
Y PROMOCIÓN DEL CUMPLIMIENTO DE LOS
COMPROMISOS PACTADOS EN LA ATENCION
COMUNITARIA; SEGUIMIENTO DE LOS
COMPROMISOS DEL POA; APOYO EN LA
RENDICION DE INFORMES; FOCALIZACION,
VERIFICACION Y REGISTRO DE NOVEDADES
DE LOS BENEFICIARIOS DEL PROGRAMA
RENTA CIUDADANA, EN EL MUNICIPIO DE
DAGUA VALLE DEL CAUCA.",Presentación de oferta,10/02/2024,10/02/2024,,,,,10/02/2024,7200000,Contratación directa,Servicios profesionales y apoyo a la gestión,otro,día(s),,,,Dagua,CONTRATACIÓN DAGUA,0,0,0,0,0,0,0,0,0,Seleccionado,70,No,No Adjudicado,713392496,Valle del Cauca,Dagua,,0,No Adjudicado,ADRIANA MARMOLEJO CORRALES,29401499,V1.80111600,Abierto,Prestación de servicios,No Definido,No definido,https://community.secop.gov.co/Public/Tendering/OpportunityDetail/Index?noticeUID=CO1.NTC.6820569,704923762,Adjudicado,2024,3.9155429850746266,,1,7200000,7.200000000000001,V1.801,True,28.38022393746091,55.56199337658604,21.74428224563599,1,-0.7463022132642072,0.4802295655172029,-5.409268655253247,-0.5929545164108276,-1.1041034173443331,0.2536977867357928
149,488782,2880,4736,MUNICIPIO DE DAGUA,800100514,VALLE DEL CAUCA,DAGUA,Territorial,Centralizada,CO1.REQ.6916967,CD-274-2024,704923762,CO1.BDOS.6787025,PRESTACION DE SERVICIOS DE APOYO A LA GESTION DE LA SECRETARIA DE BIENESTAR SOCIAL Y DESARROLLO COMUNITARIO; REALIZANDO ACTIVIDADES DIRIGIDAS A DESARROLLAR UNA ESTRATEGIA QUE CONLLEVE A GARANTIZAR LA,"PRESTACION DE SERVICIOS DE APOYO A LA GESTION DE LA SECRETARIA DE BIENESTAR SOCIAL Y DESARROLLO COMUNITARIO, REALIZANDO ACTIVIDADES DIRIGIDAS A DESARROLLAR UNA ESTRATEGIA QUE CONLLEVE A GARANTIZAR LA AMPLIACIÓN DE PROTOCOLOS DE ATENCIÓN DIFERENCIADA Y RECONOZCA LAS CONDICIONES, PARTICULARES EN MATERIA DE ORIENTACIÓN SEXUAL E IDENTIDAD DE GÉNERO EN EL MUNICIPIO DE DAGUA, DE ACUERDO A PROYECTO MUNICIPAL DENOMINADO FORTALECIMIENTO A PROCESOS DE INCLUSION SOCIAL, GOBERNABILIDAD Y PARTICIPACIÓN COMUN",Presentación de oferta,09/27/2024,09/27/2024,,,,,09/27/2024,6600000,Contratación directa,Servicios profesionales y apoyo a la gestión,otro,día(s),,,,Dagua,CONTRATACIÓN DAGUA,0,0,0,0,0,0,0,0,0,Seleccionado,70,No,No Adjudicado,728561325,Valle del Cauca,Dagua,,0,No Adjudicado,KAREN VIVIANA CAJIGAS GONZALEZ,1114729281,V1.80111600,Abierto,Prestación de servicios,No Definido,No definido,https://community.secop.gov.co/Public/Tendering/OpportunityDetail/Index?noticeUID=CO1.NTC.6797403,704923762,Adjudicado,2024,3.9155429850746266,,1,6600000,6.6,V1.801,True,0.7831085970149254,1.533147686796712,0.6000000000000001,0,7.42794987203315,8.633991674706666e-07,1.48558997440663,7.616312980651855,-1.243196516883453,8.42794987203315
150,561756,11331,18681,MUNICIPIO DE DAGUA,800100514,VALLE DEL CAUCA,DAGUA,Territorial,Centralizada,CO1.REQ.6358509,CD-167-2024,704923762,CO1.BDOS.6235606,PRESTACION DE SERVICIOS DE APOYO OPERATIVO A LA GESTION DE LA SECRETARIA DE HACIENDA PARA LA ORIENTACION Y ENTREGA DE LA FACTURACION QUE SE GENEREN EN LA GESTIÓN DE LOS PROCESOS DE COBRO COACTIVO Y PE,"PRESTACION DE SERVICIOS DE APOYO OPERATIVO A LA GESTION DE
LA SECRETARIA DE HACIENDA PARA LA ORIENTACION Y ENTREGA DE LA
FACTURACION QUE SE GENEREN EN LA GESTIÓN DE LOS PROCESOS DE COBRO
COACTIVO Y PERSUASIVO DE INDUSTRIA Y COMERCIO DE LA ZONA URBANA Y
RURAL PARA LA EFICIENCIA DEL RECAUDO EN EL MUNICIPIO DE DAGUA.",Presentación de oferta,06/08/2024,06/08/2024,,,,,06/08/2024,10000000,Contratación directa,Servicios profesionales y apoyo a la gestión,otro,día(s),,,,Dagua,CONTRATACIÓN DAGUA,0,0,0,0,0,0,0,0,0,Seleccionado,70,No,No Adjudicado,722469921,Valle del Cauca,Dagua,,0,No Adjudicado,Alcaldia,1006252829,V1.80161500,Abierto,Prestación de servicios,No Definido,No definido,https://community.secop.gov.co/Public/Tendering/OpportunityDetail/Index?noticeUID=CO1.NTC.6245025,704923762,Adjudicado,2024,3.9155429850746266,,1,10000000,9.999999999999998,V1.801,True,13.949659602328625,27.31024590003837,10.68791198730469,1,-0.2831366294894613,0.786088491568171,-1.008713125455153,-0.1563744693994522,-1.2676216009000905,0.7168633705105386
151,230754,1329,2160,MUNICIPIO DE DAGUA,800100514,VALLE DEL CAUCA,DAGUA,Territorial,Centralizada,CO1.REQ.6326158,CD-134-2024,704923762,CO1.BDOS.6202994,PRESTACION DE SERVICIOS PROFESIONALES A LA SECRETARIA DE PLANEACION Y PROYECTOS PARA EL DESARROLLO INTEGRAL DE ESTUDIOS GEOTECNICOS PARA LA GESTION DE MOVIMIENTOS EN MASA EN EL MUNICIPIO DE DAGUA QUE,"PRESTACION DE SERVICIOS
PROFESIONALES A LA SECRETARIA DE
PLANEACION Y PROYECTOS PARA EL
DESARROLLO INTEGRAL DE ESTUDIOS
GEOTECNICOS PARA LA GESTION DE
MOVIMIENTOS EN MASA EN EL MUNICIPIO DE
DAGUA QUE PERMITA CULMINAR EL
PROCESO",Presentación de oferta,05/31/2024,05/31/2024,,,,,05/31/2024,12900000,Contratación directa,Servicios profesionales y apoyo a la gestión,otro,Mes(es),,,,Dagua,CONTRATACIÓN DAGUA,0,0,0,0,0,0,0,0,0,Seleccionado,70,No,No Adjudicado,719896417,Caldas,Manizales,,0,No Adjudicado,LUZ ELENA FRANCO GARCIA,30392106,V1.80161500,Abierto,Prestación de servicios,No Definido,No definido,https://community.secop.gov.co/Public/Tendering/OpportunityDetail/Index?noticeUID=CO1.NTC.6211839,704923762,Adjudicado,2024,3.9155429850746266,,1,12900000,12.9,V1.801,True,207.93968814555265,407.09839361846207,159.318660736084,1,-0.9379627808666794,0.3331676621519022,-49.81165802265746,-0.8395335674285889,-1.2697368533513675,0.0620372191333206
152,626495,11662,19420,MUNICIPIO DE DAGUA,800100514,VALLE DEL CAUCA,DAGUA,Territorial,Centralizada,CO1.REQ.6795474,CD-218-2024,704923762,CO1.BDOS.6668801,PRESTACIÓN DE SERVICIOS DE APOYO A LA  GESTIÓN DE LA SECRETARÍA DE ECONOMÍA;  DEPORTE; RECREACIÓN; CULTURA Y  TURISMO PARA EL DESARROLLO DE  ACTIVIDADES DE PROMOCIÓN TURISTICA  QUE FORTALEZCA LA OFERT,"PRESTACIÓN DE SERVICIOS DE APOYO A LA 
GESTIÓN DE LA SECRETARÍA DE ECONOMÍA, 
DEPORTE, RECREACIÓN, CULTURA Y 
TURISMO PARA EL DESARROLLO DE 
ACTIVIDADES DE PROMOCIÓN TURISTICA 
QUE FORTALEZCA LA OFERTA DE LA CADENA 
DE VALOR Y LOS ATRACTIVOS TURISTICOS 
DEL MUNICIPIO DE DAGUA.",Presentación de oferta,09/06/2024,09/06/2024,,,,,09/06/2024,6600000,Contratación directa,Servicios profesionales y apoyo a la gestión,otro,día(s),,,,Dagua,CONTRATACIÓN DAGUA,0,0,0,0,0,0,0,0,0,Seleccionado,70,No,No Adjudicado,728278235,Valle del Cauca,Cali,,0,No Adjudicado,julian andres mera gomez,1114734227,V1.80161500,Abierto,Prestación de servicios,No Definido,No definido,https://community.secop.gov.co/Public/Tendering/OpportunityDetail/Index?noticeUID=CO1.NTC.6677211,704923762,Adjudicado,2024,3.9155429850746266,,1,6600000,6.6,V1.801,True,63.89765730970923,125.0970119208672,48.95693206787109,1,-0.8967098282178002,0.3471446739377184,-14.6333873815504,-0.6930955052375793,-1.3438545316694577,0.1032901717821997
153,534735,10071,16618,MUNICIPIO DE DAGUA,800100514,VALLE DEL CAUCA,DAGUA,Territorial,Centralizada,CO1.REQ.6358519,CD-177-2024,704923762,CO1.BDOS.6235426,PRESTACION DE SERVICIOS DE APOYO A LA GESTION DE LA SECRETARIA DE HACIENDA PARA LA ENTREGA DE LA FACTURACION EN LA ZONA URBANA Y RURAL; QUE SE GENEREN EN LA GESTIÓN DE LOS PROCESOS DE COBRO COACTIVO Y,"PRESTACION DE SERVICIOS DE APOYO A LA GESTION DE LA
SECRETARIA DE HACIENDA PARA LA ENTREGA DE LA FACTURACION EN LA ZONA
URBANA Y RURAL, QUE SE GENEREN EN LA GESTIÓN DE LOS PROCESOS DE
COBRO COACTIVO Y PERSUASIVO DEL IMPUESTO PREDIAL PARA LA EFICIENCIA
DEL RECAUDO EN EL MUNICIPIO DE DAGUA.",Presentación de oferta,06/08/2024,06/08/2024,,,,,06/08/2024,13200000,Contratación directa,Servicios profesionales y apoyo a la gestión,otro,día(s),,,,Dagua,CONTRATACIÓN DAGUA,0,0,0,0,0,0,0,0,0,Seleccionado,70,No,No Adjudicado,719039653,Valle del Cauca,Dagua,,0,No Adjudicado,HENRY INSUASTY RAMOS,6248808,V1.80161500,Abierto,Prestación de servicios,No Definido,No definido,https://community.secop.gov.co/Public/Tendering/OpportunityDetail/Index?noticeUID=CO1.NTC.6244955,704923762,Adjudicado,2024,3.9155429850746266,,1,13200000,13.2,V1.801,True,0.7831085970149254,1.533147686796712,0.6000000000000001,0,15.8558997440663,9.424330626250825e-09,3.17117994881326,15.96884059906006,-1.4908192859176472,16.8558997440663
154,432125,10059,16633,MUNICIPIO DE DAGUA,800100514,VALLE DEL CAUCA,DAGUA,Territorial,Centralizada,CO1.REQ.6195199,CD-087-2024,704923762,CO1.BDOS.6075265,PRESTACIÓN DE SERVICIOS DE APOYO OPERATIVO A LA GESTIÓN DE LA SECRETARIA DE ECONOMÍA; DEPORTE; RECREACIÓN; CULTURA Y TURISMO; DEL MUNICIPIO DE DAGUA; EN EL DESARROLLO DE ACTIVIDADES DE FORTALECIMIENTO,"PRESTACIÓN DE SERVICIOS DE APOYO OPERATIVO A LA GESTIÓN DE LA SECRETARIA
DE ECONOMÍA, DEPORTE, RECREACIÓN, CULTURA Y TURISMO, DEL MUNICIPIO DE DAGUA,
EN EL DESARROLLO DE ACTIVIDADES DE FORTALECIMIENTO, ARTICULACIÓN, Y FOMENTO
AL TRABAJO MANCOMUNADO ENTRE ENTRENADORES, ATLETAS Y ORGANIZACIONES
DEPORTIVAS DE LAS MODALIDADES ASOCIADAS AL FUTBOL; EN ORIENTACIÓN A LA
PARTICIPACIÓN DE LOS JUEGOS DEPARTAMENTALES.",Presentación de oferta,05/06/2024,05/06/2024,,,,,05/06/2024,14000000,Contratación directa,Servicios profesionales y apoyo a la gestión,otro,día(s),,,,Dagua,CONTRATACIÓN DAGUA,0,0,0,0,0,0,0,0,0,Seleccionado,70,No,No Adjudicado,713391688,Valle del Cauca,Dagua,,0,No Adjudicado,MANUEL EFREN MARTINEZ ARCOS,13015543,V1.80161500,Abierto,Prestación de servicios,No Definido,No definido,https://community.secop.gov.co/Public/Tendering/OpportunityDetail/Index?noticeUID=CO1.NTC.6082780,704923762,Adjudicado,2024,3.9155429850746266,,1,14000000,14.0,V1.801,True,185.2473313232843,362.6719443333405,141.9322929382324,1,-0.924425362028196,0.3360354552968318,-43.73527042763916,-0.8126033544540405,-1.565508106038177,0.0755746379718037
155,271502,3172,5250,MUNICIPIO DE DAGUA,800100514,VALLE DEL CAUCA,DAGUA,Territorial,Centralizada,CO1.REQ.6598868,CD-193-2024,704923762,CO1.BDOS.6473448,PRESTACIÓN DE SERVICIOS DE APOYO A LA GESTIÓN A LA SECRETARÍA DE BIENESTAR SOCIAL Y DESARROLLO COMUNITARIO; EN LA ATENCIÓN DE SOLICITUDES; RECOLECCIÓN Y GESTIÓN DE INFORMACIÓN; QUE PERMITA ACTUALIZAR,"PRESTACIÓN DE SERVICIOS DE APOYO A LA GESTIÓN A LA SECRETARÍA DE BIENESTAR SOCIAL Y DESARROLLO COMUNITARIO, EN LA ATENCIÓN DE SOLICITUDES, RECOLECCIÓN Y GESTIÓN DE INFORMACIÓN, QUE PERMITA ACTUALIZAR EL SISTEMA DE POTENCIALES DE PROGRAMAS SOCIALES, SISBÉN, EN EL MUNICIPIO DE DAGUA VALLE DEL CAUCA.",Presentación de oferta,08/01/2024,08/01/2024,,,,,08/01/2024,7200000,Contratación directa,Servicios profesionales y apoyo a la gestión,otro,día(s),,,,Dagua,CONTRATACIÓN DAGUA,0,0,0,0,0,0,0,0,0,Seleccionado,70,No,No Adjudicado,721916120,Valle del Cauca,Dagua,,0,No Adjudicado,SAHIAN MARIANA  PEREIRA ARROYAVE,1193106424,V1.80161500,Abierto,Prestación de servicios,No Definido,No definido,https://community.secop.gov.co/Public/Tendering/OpportunityDetail/Index?noticeUID=CO1.NTC.6482581,704923762,Adjudicado,2024,3.9155429850746266,,1,7200000,7.200000000000001,V1.801,True,62.608385050243264,122.57291144516556,47.96912097930909,1,-0.8849994294818179,0.3824570205733847,-14.15088156647762,-0.6375550627708435,-1.7815994403190156,0.1150005705181821
156,737522,7912,13061,MUNICIPIO DE DAGUA,800100514,VALLE DEL CAUCA,DAGUA,Territorial,Centralizada,CO1.REQ.6841616,CD-247-2024,704923762,CO1.BDOS.6713469,PRESTACIÓN DE SERVICIOS PROFESIONALES DE APOYO A LA GESTIÓN DE LA SECRETARIA DE AGRICULTURA Y DESARROLLO RURAL EN LA CREACIÓN Y GESTIÓN DE ESTRATEGIAS A PROCESOS DE CONSERVACIÓN Y RESTAURACIÓN ECOSIST,"PRESTACIÓN DE SERVICIOS
PROFESIONALES DE APOYO A LA GESTIÓN
DE LA SECRETARIA DE AGRICULTURA Y
DESARROLLO RURAL EN LA CREACIÓN Y
GESTIÓN DE ESTRATEGIAS A PROCESOS DE
CONSERVACIÓN Y RESTAURACIÓN
ECOSISTÉMICA DEL MUNICIPIO DE DAGUA.",Presentación de oferta,09/16/2024,09/16/2024,,,,,09/16/2024,11600000,Contratación directa,Servicios profesionales y apoyo a la gestión,otro,día(s),,,,Dagua,CONTRATACIÓN DAGUA,0,0,0,0,0,0,0,0,0,Seleccionado,70,No,No Adjudicado,728362344,Valle del Cauca,Dagua,,0,No Adjudicado,LUIS ALEJANDRO AGUILAR PRADO,1114737044,V1.80161500,Abierto,Prestación de servicios,No Definido,No definido,https://community.secop.gov.co/Public/Tendering/OpportunityDetail/Index?noticeUID=CO1.NTC.6727298,704923762,Adjudicado,2024,3.9155429850746266,,1,11600000,11.6,V1.801,True,70.54362774387532,138.1083033771234,54.04892349243165,1,-0.835562752143731,0.4428923710934229,-15.05375575458072,-0.6557425856590271,-2.0859139312225654,0.164437247856269
157,460503,145,273,MUNICIPIO DE DAGUA,800100514,VALLE DEL CAUCA,DAGUA,Territorial,Centralizada,CO1.REQ.6841229,CD-246-2024,704923762,CO1.BDOS.6713333,PRESTACION DE SERVICIOS DE APOYO A LA GESTIÓN DE LA SECRETARIA DE AGRICULTURA Y DESARROLLO RURAL PARA EL SEGUIMIENTO DE UNIDADES PRODUCTIVAS AGROPECUARIAS FAMILIARES Y ASOCIATIVAS; CON ORIENTACION A P,"PRESTACION DE SERVICIOS DE APOYO A LA GESTIÓN DE LA SECRETARIA DE
AGRICULTURA Y DESARROLLO RURAL PARA EL SEGUIMIENTO DE UNIDADES
PRODUCTIVAS AGROPECUARIAS FAMILIARES Y ASOCIATIVAS, CON ORIENTACION A
PROMOVER LA SOSTENIBILIDAD AMBIENTAL Y AUTOSUFICIENCIA ALIMENTARIA EN EL
MUNICIPIO DE DAGUA.",Presentación de oferta,09/13/2024,09/13/2024,,,,,09/13/2024,8400000,Contratación directa,Servicios profesionales y apoyo a la gestión,otro,día(s),,,,Dagua,CONTRATACIÓN DAGUA,0,0,0,0,0,0,0,0,0,Seleccionado,70,No,No Adjudicado,713650562,Valle del Cauca,Dagua,,0,No Adjudicado,LUIS GABRIEL HENAO BETANCOUR,16.376.832,V1.80161500,Abierto,Prestación de servicios,No Definido,No definido,https://community.secop.gov.co/Public/Tendering/OpportunityDetail/Index?noticeUID=CO1.NTC.6722588,704923762,Adjudicado,2024,3.9155429850746266,,1,8400000,8.4,V1.801,True,0.7831085970149254,1.533147686796712,0.6000000000000001,0,9.726481655314918,8.852089947993942e-08,1.945296331062984,9.980995178222656,-2.137913592424997,10.726481655314918
158,707671,3495,5688,MUNICIPIO DE DAGUA,800100514,VALLE DEL CAUCA,DAGUA,Territorial,Centralizada,CO1.REQ.6356951,CD-154-2024,704923762,CO1.BDOS.6233582,PRESTACION DE SERVICIOS DE APOYO OPERATIVO A LA GESTION DE LA SECRETARIA DE HACIENDA PARA LA ORIENTACION Y ENTREGA DE LA FACTURACION QUE SE GENEREN EN LA GESTIÓN DE LOS PROCESOS DE COBRO COACTIVO Y PE,"PRESTACION DE SERVICIOS DE APOYO
OPERATIVO A LA GESTION DE LA
SECRETARIA DE HACIENDA PARA LA
ORIENTACION Y ENTREGA DE LA
FACTURACION QUE SE GENEREN EN LA
GESTIÓN DE LOS PROCESOS DE COBRO
COACTIVO Y PERSUASIVO DE INDUSTRIA Y
COMERCIO DE LA ZONA URBANA Y RURAL
PARA LA EFICIENCIA DEL RECAUDO EN EL
MUNICIPIO DE DAGUA",Presentación de oferta,06/07/2024,06/07/2024,,,,,06/07/2024,13200000,Contratación directa,Servicios profesionales y apoyo a la gestión,otro,día(s),,,,Dagua,CONTRATACIÓN DAGUA,0,0,0,0,0,0,0,0,0,Seleccionado,70,No,No Adjudicado,713409241,Valle del Cauca,Dagua,,0,No Adjudicado,miguel angel peña,1114729029,V1.80161500,Abierto,Prestación de servicios,No Definido,No definido,https://community.secop.gov.co/Public/Tendering/OpportunityDetail/Index?noticeUID=CO1.NTC.6243226,704923762,Adjudicado,2024,3.9155429850746266,,1,13200000,13.2,V1.801,True,13.949659602328625,27.31024590003837,10.68791198730469,1,-0.0537403509260888,2.381137309281151,-0.1914573802883019,0.1103924438357353,-2.166552890856078,0.9462596490739112
159,507216,8295,13727,MUNICIPIO DE DAGUA,800100514,VALLE DEL CAUCA,DAGUA,Territorial,Centralizada,CO1.REQ.6925293,CD-278-2024,704923762,CO1.BDOS.6796307,PRESTACIÓN DE SERVICIOS DE APOYO A LA GESTIÓN A LA SECRETARIA DE PLANEACIÓN Y PROYECTOS; RELACIONADA CON EL FORTALECIMIENTO ORGANIZACIONAL EN LA DEPENDENCIA DE GESTIÓN DEL RIESGO DE DESASTRES Y ASISTE,"PRESTACIÓN DE SERVICIOS DE APOYO A
LA GESTIÓN A LA SECRETARIA DE
PLANEACIÓN Y PROYECTOS,
RELACIONADA CON EL
FORTALECIMIENTO ORGANIZACIONAL EN
LA DEPENDENCIA DE GESTIÓN DEL
RIESGO DE DESASTRES Y ASISTENCIA
DOCUMENTAL DEL ARCHIVO.",Presentación de oferta,09/30/2024,09/30/2024,,,,,09/30/2024,6600000,No Definido,Servicios profesionales y apoyo a la gestión,otro,día(s),,,,Dagua,CONTRATACIÓN DAGUA,0,0,0,0,0,0,0,0,0,Seleccionado,70,No,No Adjudicado,721142560,Valle del Cauca,Dagua,,0,No Adjudicado,YESCENIA MONDRAGON CABEZAS,66911739,V1.80161500,Abierto,Prestación de servicios,No Definido,No definido,https://community.secop.gov.co/Public/Tendering/OpportunityDetail/Index?noticeUID=CO1.NTC.6806298,704923762,Adjudicado,2024,3.9155429850746266,,1,6600000,6.6,V1.801,True,244.71676140788404,479.09949923041074,187.4964179992676,1,-0.9730300451753716,0.2874425440557257,-60.81321602534923,-0.6442359089851379,-2.170041298855542,0.0269699548246284
160,417792,8569,14207,MUNICIPIO DE DAGUA,800100514,VALLE DEL CAUCA,DAGUA,Territorial,Centralizada,CO1.REQ.6856092,CD-249-2024,704923762,CO1.BDOS.6727799,PRESTACIÓN DE SERVICIOS DE APOYO A LA GESTIÓN A LA SECRETARÍA DE BIENESTAR SOCIAL Y DESARROLLO COMUNITARIO; EN LA ATENCIÓN DE SOLICITUDES; RECOLECCIÓN Y GESTIÓN DE INFORMACIÓN; QUE PERMITA ACTUALIZAR,"PRESTACIÓN DE SERVICIOS DE APOYO A LA
GESTIÓN A LA SECRETARÍA DE BIENESTAR
SOCIAL Y DESARROLLO COMUNITARIO, EN LA
ATENCIÓN DE SOLICITUDES, RECOLECCIÓN Y
GESTIÓN DE INFORMACIÓN, QUE PERMITA
ACTUALIZAR EL SISTEMA DE POTENCIALES
DE PROGRAMAS SOCIALES, SISBÉN, EN EL
MUNICIPIO DE DAGUA VALLE DEL CAUCA.",Presentación de oferta,09/17/2024,09/17/2024,,,,,09/17/2024,8400000,Contratación directa,Servicios profesionales y apoyo a la gestión,otro,día(s),,,,Dagua,CONTRATACIÓN DAGUA,0,0,0,0,0,0,0,0,0,Seleccionado,60,No,No Adjudicado,726338023,Valle del Cauca,Dagua,,0,No Adjudicado,JAMIE MARCELA MOLINA MEZA,1114726948,V1.80111600,Abierto,Prestación de servicios,No Definido,No definido,https://community.secop.gov.co/Public/Tendering/OpportunityDetail/Index?noticeUID=CO1.NTC.6738202,704923762,Adjudicado,2024,3.9155429850746266,,1,8400000,8.4,V1.801,True,62.608385050243264,122.57291144516556,47.96912097930909,1,-0.8658326677287875,0.386718389050597,-13.84441066204005,-0.5881323218345642,-2.332682905511476,0.1341673322712125
