,Nombre Entidad,Descripcion del Proceso,Tipo de Contrato,Género Representante Legal,Valor real,Valor Proyectado,Duración del contrato,Tamaño valor extraño,veces la predicción,URLProceso,similarity
72999,SECRETARÍA GENERAL DE LA ALCALDÍA MAYOR DE BOGOTÁ,"Prestar servicios profesionales a la gestión de la Oficina Consejería Distrital
de Comunicaciones; para la actualización de contenidos y acciones de
comunicación pública para medios y redes sociales; con el fin de
optimizar los canales de comunicación de la Alcaldía Mayor de Bogotá",Prestación de servicios,No Definido,30.35448,33.42013843128693,6 Mes(es),-0.10099525444965392,0.9082691282805414,https://community.secop.gov.co/Public/Tendering/OpportunityDetail/Index?noticeUID=CO1.NTC.7439246&isFromPublicArea=True&isModal=true&asPopupView=true,0.3300565481185913
633423,ALCALDÍA DE POPAYÁN,"PRESTAR SERVICIOS PROFESIONALES ESPECIALIZADOS PARA APOYAR LA DIVULGACIÓN DE PROGRAMAS SOCIALES CONFORME A LA ESTRATEGIA DE PRENSA Y COMUNICACIONES; EN EL
MARCO DEL PROYECTO DENOMINADO: FORTALECIMIENTO INTEGRAL DE LA ESTRATEGIA DE COMUNICACIÓNES Y DIVULGACIÓN EN LA ALCALDÍA DE POPAYÁN.",Prestación de servicios,Mujer,22.5,24.76283563046467,139 Dia(s),-0.10057047246509651,0.9086196886239959,https://community.secop.gov.co/Public/Tendering/OpportunityDetail/Index?noticeUID=CO1.NTC.7595448&isFromPublicArea=True&isModal=true&asPopupView=true,0.30666008591651917
324096,GOBERNACIÓN DE CUNDINAMARCA - SECRETARÍA DE PRENSA Y COMUNICACIONES,PRESTAR SERVICIOS PROFESIONALES A LA SECRETARÍA DE PRENSA Y COMUNICACIONES COMO PRODUCTORA AUDIOVISUAL DE LOS DISTINTOS PROGRAMAS RADIALES DE LA EMISORA EL DORADO RADIO; CONTRIBUYENDO A SU ESTRATEGIA DE RECONOCIMIENTO Y POSICIONAMIENTO; EN BUSCA DE AUMENTAR LA AUDIENCIA EN LOS MUNICIPIOS,Prestación de servicios,Mujer,28.333333000000003,31.12951907407152,170 Dia(s),-0.0986889214223938,0.910175738101893,https://community.secop.gov.co/Public/Tendering/OpportunityDetail/Index?noticeUID=CO1.NTC.6380271&isFromPublicArea=True&isModal=true&asPopupView=true,0.3617967367172241
889160,ALCALDIA MUNICIPIO DE RICAURTE,DCI1- PRESTACIÓN DE SERVICIOS PROFESIONALES PARA LA ELABORACIÓN DE PIEZAS AUDIOVISUALES; ORGANIZACIÓN Y EDICIÓN DE VIDEOS Y CONTENIDO AUDIOVISUAL DE LAS DIFERENTES ACTIVIDADES PROGRAMADAS POR LA ALCALDÍA MUNICIPAL DE RICAURTE,Prestación de servicios,Mujer,21.0,23.04545265488495,166 Dia(s),-0.09740250737547385,0.9112426783055018,https://community.secop.gov.co/Public/Tendering/OpportunityDetail/Index?noticeUID=CO1.NTC.7362325&isFromPublicArea=True&isModal=true&asPopupView=true,0.37793904542922974
85875,AGENCIA DE EDUCACIÓN POSTSECUNDARIA DE MEDELLÍN -SAPIENCIA-,Prestación de servicios de forma temporal como profesional I en diseño gráfico; en el área de comunicaciones; para apoyar la conceptualización; diseño y ejecución de campañas publicitarias para medios convencionales y digitales que acompañen la promoción y divulgación de los diferentes programas y p,Prestación de servicios,Hombre,24.510057,26.88670871614394,146 Dia(s),-0.09696638878252872,0.9116049591180755,https://community.secop.gov.co/Public/Tendering/OpportunityDetail/Index?noticeUID=CO1.NTC.6502269&isFromPublicArea=True&isModal=true&asPopupView=true,0.33023637533187866
1045477,ALCALDIA DEL MUNICIPIO DE ACACIAS,PRESTACIÓN DE SERVICIOS PROFESIONALES PARA EL APOYAR LA CREACIÓN DE BOLETINES DE PRENSA; PRODUCCIÓN Y EDICIÓN DE NOTICIAS PARA PLATAFORMAS DIGITALES; GENERACIÓN DE CONTENIDO; REDACCIÓN DE COPYS Y CONTENIDO CREATIVO PARA REDES SOCIALES; Y ASISTENCIA EN EVENTOS Y ACTIVIDADES DE SOCIALIZACIÓN Y DIVULGA,Prestación de servicios,Mujer,17.400000000000002,19.069071059503564,116 Dia(s),-0.0959236241094001,0.9124723457007762,https://community.secop.gov.co/Public/Tendering/OpportunityDetail/Index?noticeUID=CO1.NTC.6621393&isFromPublicArea=True&isModal=true&asPopupView=true,0.32855039834976196
1184161,MINCULTURA,Prestar los servicios profesionales al Grupo de Divulgación y Prensa para apoyar la producción fotográfica y audiovisual de piezas para la divulgación de las estrategias de comunicación interna; externa y digitales del Ministerio de Cultura; en especial los relacionados con el programa de Sonidos pa,Prestación de servicios,Mujer,36.5,39.99799368463208,215 Dia(s),-0.09583544341457749,0.9125457713651255,https://community.secop.gov.co/Public/Tendering/OpportunityDetail/Index?noticeUID=CO1.NTC.6206523&isFromPublicArea=True&isModal=true&asPopupView=true,0.31521961092948914
865949,ALCALDÍA MUNICIPAL DE EL ESPINAL,PRESTACION DE SERVICIOS PROFESIONALES PARA LA ELABORACION Y DIFUSION DE PIEZAS INFORMATIVAS DIGITALES CON CONTENIDO PROPIO A LAS ACTIVIDADES DESARROLLADAS POR LA ALCALDIA MUNICIPAL DE EL ESPINAL Y SUS RESPECTIVAS DEPENDENCIAS.,Prestación de servicios,No Definido,25.000000000000004,27.362321103070283,150 Dia(s),-0.09449284412281116,0.9136651786896395,https://community.secop.gov.co/Public/Tendering/OpportunityDetail/Index?noticeUID=CO1.NTC.7985964&isFromPublicArea=True&isModal=true&asPopupView=true,0.3155556619167328
449937,INSTITUTO NACIONAL DE VIGILANCIA DE MEDICAMENTOS Y ALIMENTOS //,PRESTAR LOS SERVICIOS PROFESIONALES COMO COMUNICADOR SOCIAL Y PERIODISTA PARA APOYAR LAS RELACIONES CON LOS MEDIOS DE COMUNICACIÓN; CUBRIMIENTO Y DIVULGACIÓN DE CONTENIDOS NOTICIOSOS PARA EL PUBLICO EXTERNO Y LA OPINION PUBLICA; ASI COMO LOS PROGRAMAS Y POLÍTICAS DEL INSTITUTO NACIONAL DE VIGILANCIA,Prestación de servicios,No Definido,54.028200000000005,59.03954737439084,318 Dia(s),-0.09275429080352181,0.9151188043056615,https://community.secop.gov.co/Public/Tendering/OpportunityDetail/Index?noticeUID=CO1.NTC.7622833&isFromPublicArea=True&isModal=true&asPopupView=true,0.38797104358673096
1234562,RADIO TELEVISION NACIONAL DE COLOMBIA.,EL CONTRATISTA se obliga a prestar sus servicios desarrollando actividades de registro audiovisual y/o reportería con equipo para los contenidos audiovisuales y/o transmisiones de RTVC,Prestación de servicios,Hombre,22.800000000000004,24.86392044925692,3 Mes(es),-0.09052282672179453,0.9169913508423166,https://community.secop.gov.co/Public/Tendering/OpportunityDetail/Index?noticeUID=CO1.NTC.7395327&isFromPublicArea=True&isModal=true&asPopupView=true,0.34616005420684814
365033,ALCALDÍA MUNICIPIO DE PALMIRA,"ERVICIO DE APOYO A LA GESTION PARA EL CUBRIMIENTO Y DIFUSION EN MEDIOS DIGITALES  Y  REDES  SOCIALES  DE  LAS  ACTIVIDADES  Y  PROGRAMAS  QUE  ADELANTA  LA
SECRETARIA DE SEGURIDAD Y CONVIVENCIA.",Prestación de servicios,Mujer,12.150000000000002,13.214900482098699,137 Dia(s),-0.08764613021388448,0.9194166854649233,https://community.secop.gov.co/Public/Tendering/OpportunityDetail/Index?noticeUID=CO1.NTC.6471521&isFromPublicArea=True&isModal=true&asPopupView=true,0.31680306792259216
1185735,CORPORACION CULTURA MUNICIPAL DE VILLAVICENCIO CORCUMVI*,PRESTACION DE SERVICIOS PROFESIONALES COMO COMUNICADOR SOCIAL Y PERIODISTA PARA BRINDAR APOYO EN LA DIVULGACION Y PROMOCION EN MEDIOS DE COMUNICACION DE LOS DIFERENTES EVENTOS; ACTIVIDADES Y PROGRAMACION CULTURAL EN LA CORPORACION CULTURAL MUNICIPAL DE VILLAVICENCIO.,Prestación de servicios,Mujer,16.400000000000002,17.82040691531663,4 Mes(es),-0.0866101777632091,0.920293238977849,https://community.secop.gov.co/Public/Tendering/OpportunityDetail/Index?noticeUID=CO1.NTC.5841968&isFromPublicArea=True&isModal=true&asPopupView=true,0.3813045620918274
670446,MUNICIPIO DE YOPAL..,BRINDAR SERVICIOS PROFESIONALES COMO COMUNICADOR SOCIAL PARA REALIZAR EL REPORTAJE MEDIÁTICO; LA GESTIÓN INTEGRAL DE LA COMUNICACIÓN Y DIVULGACIÓN INSTITUCIONAL; DE LAS ACCIONES Y ACTIVIDADES DESARROLLADAS POR LA SECRETARIA DE INFRAESTRUCTURA DEL MUNIPIO DE YOPAL.,Prestación de servicios,No Definido,22.000000000000004,23.902029825633395,4 Mes(es),-0.08645590116515416,0.9204239204992714,https://community.secop.gov.co/Public/Tendering/OpportunityDetail/Index?noticeUID=CO1.NTC.6516391&isFromPublicArea=True&isModal=true&asPopupView=true,0.3008405268192291
1121690,ALCALDIA MUNICIPIO DE ZIPAQUIRA,PRESTACIÓN DE SERVICIOS DE APOYO A LA GESTIÓN PARA REALIZAR ACTIVIDADES DE COMUNICACIÓN GRÁFICA; ESTRATEGIA VISUAL; CONTENIDO MULTIMEDIA; DISEÑO Y PRODUCCIÓN AUDIOVISUAL PARA LOS PROGRAMAS SOCIALES DE LA SECRETARIA DE FAMILIA Y DESARROLLO SOCIAL,Prestación de servicios,Hombre,13.200000000000003,14.318803026680715,6 Mes(es),-0.08475780505156912,0.9218647658888799,https://community.secop.gov.co/Public/Tendering/OpportunityDetail/Index?noticeUID=CO1.NTC.7896423&isFromPublicArea=True&isModal=true&asPopupView=true,0.31283363699913025
1222027,ALCALDIA DEL MUNICIPIO DE AGUAZUL,PRESTACION DE SERVICIOS DE PUBLICIDAD DE ESTRATEGIAS DE COMUNICACIÓN E INFORMACIÓN DIGITAL A TRAVÉS DE PIEZAS COMUNICATIVAS ORIENTADAS A PROMOCIONAR LOS RESULTADOS DE GESTIÓN DE LA ADMINISTRACIÓN MUNICIPAL DE AGUAZUL DURANTE EL SEGUNDO SEMESTRE 2024.,Prestación de servicios,Hombre,22.428,24.32064165615321,2 Mes(es),-0.08438744676980602,0.9221796166848104,https://community.secop.gov.co/Public/Tendering/OpportunityDetail/Index?noticeUID=CO1.NTC.6853637&isFromPublicArea=True&isModal=true&asPopupView=true,0.30791789293289185
752585,INSTITUTO NACIONAL PARA CIEGOS,Prestar servicios profesionales para la producción y difusión de contenidos radiales y audiovisuales.,Prestación de servicios,No Definido,44.06550699999998,47.74462456178208,326 Dia(s),-0.08349200570373787,0.9229417427500916,https://community.secop.gov.co/Public/Tendering/OpportunityDetail/Index?noticeUID=CO1.NTC.7502831&isFromPublicArea=True&isModal=true&asPopupView=true,0.3332046568393707
986673,RADIO TELEVISION NACIONAL DE COLOMBIA.,"EL CONTRATISTA SE OBLIGA CON -RTVC-A LA PRESTACIÓN DE SERVICIOS PARA REALIZAR ACTIVIDADES DE PERIODISMO PARA LAS PLATAFORMAS DIGITALES DE RTVC 
SISTEMA DE MEDIOS PÚBLICOS Y SUS MARCAS.",Prestación de servicios,No Definido,14.481800000000002,15.656356656813044,111 Dia(s),-0.08110570901497341,0.9249789282040966,https://community.secop.gov.co/Public/Tendering/OpportunityDetail/Index?noticeUID=CO1.NTC.6872642&isFromPublicArea=True&isModal=true&asPopupView=true,0.30755481123924255
1116439,SERVICIO NACIONAL DE APRENDIZAJE - SENA MAGDALENA,Prestar servicios personales de carácter temporal para impartir formación profesional de nivel técnico programada por el Centro de Logística y Promoción Ecoturística Regional Magdalena para el programa de Articulación con la Educación Media en el area de ELABORACION DE AUDIOVISUALES,Prestación de servicios,Mujer,30.8424,33.328120086498146,800 Hora(s),-0.08059424968543771,0.9254167327756012,https://community.secop.gov.co/Public/Tendering/OpportunityDetail/Index?noticeUID=CO1.NTC.5520472&isFromPublicArea=True&isModal=true&asPopupView=true,0.3045242428779602
117372,EMPRESA IBAGUEREÑA DE ACUEDUCTO Y ALCANTARILLADO SA ESP OFICIAL IBAL SA ESP OFICIAL,CONTRATAR EL SERVICIO DE PUBLICIDAD EN UN MEDIO DE COMUNICACIÓN DIGITAL CON COBERTURA EN IBAGUÉ PARA LA DIFUSIÓN DE CAMPAÑAS; MENSAJES Y DEMÁS INFORMACIÓN INSTITUCIONAL DEL IBAL S.A. E.S.P. OFICIAL; DE CONFORMIDAD CON EL PLAN DE MEDIOS APROBADO POR LA GERENCIA.,Prestación de servicios,Hombre,39.99999999999999,43.196900447490926,10 Mes(es),-0.07992251118727332,0.9259923648601361,https://community.secop.gov.co/Public/Tendering/OpportunityDetail/Index?noticeUID=CO1.NTC.5765113&isFromPublicArea=True&isModal=true&asPopupView=true,0.37733614444732666
28057,ALCALDÍA MUNICIPAL DE MAGANGUE,"PRESTACIÓN DE SERVICIOS DE UN COMUNICADOR 
O COMUNICADORA SOCIAL COMO APOYO A LA 
PROMOCIÓN EN SALUD Y GESTIÓN DEL RIESGO A 
TRAVÉS DE MEDIOS DE COMUNICACIÓN O A TRAVÉS 
DE LAS REDES SOCIALES DISPONIBLES EN EL 
MUNICIPIO DE MAGANGUÉ",Prestación de servicios,Mujer,14.400000000000002,15.55076369004659,6 Mes(es),-0.07991414514212418,0.925999538480342,https://community.secop.gov.co/Public/Tendering/OpportunityDetail/Index?noticeUID=CO1.NTC.5990165&isFromPublicArea=True&isModal=true&asPopupView=true,0.30889010429382324
591287,ALCALDIA MUNICIPIO DE APARTADO,PUBLICACIÓN PROMOCIÓN Y DIFUSIÓN DE NOTICIAS Y ACTIVIDADES PROPIAS DE LA ADMINISTRACIÓN MUNICIPAL DE APARTADO A TRAVÉS DE UN MEDIO MASIVO; REGIONAL DIGITAL.,Prestación de servicios,Hombre,50.000000000000014,53.953050398145436,5 Mes(es),-0.07906100796290841,0.9267316607870367,https://community.secop.gov.co/Public/Tendering/OpportunityDetail/Index?noticeUID=CO1.NTC.6277403&isFromPublicArea=True&isModal=true&asPopupView=true,0.3169911503791809
1176551,EMPRESA DE SERVICIOS PUBLICOS DE LA VIRGINIA E.S.P,ELABORAR LA POLITICA DE COMUNICACIÓN DE LA E.S.P DE LA VIRGINIA Y PRESTAR APOYO EN EL FORTALECIMIENTO DE LA COMUNICACIÓN INTERNA Y EXTERNA DE LA ENTIDAD; DESARROLLADON ESTRATEGIAS AUDIOVISUALES Y PROMOCIONANDOLAS EN LOS DIFERENTES MEDIOS.,Prestación de servicios,Mujer,17.0,18.335442645734457,5 Mes(es),-0.07855544974908568,0.9271660536624605,https://community.secop.gov.co/Public/Tendering/OpportunityDetail/Index?noticeUID=CO1.NTC.5761643&isFromPublicArea=True&isModal=true&asPopupView=true,0.3089934289455414
569329,ALCALDIA LOCAL DE ANTONIO NARIÑO,"Apoyar a la junta administradora local de la Alcaldía
Local en la realización y publicación de contenidos de redes sociales y canales de divulgación digital; así como cubrimiento de las actividades; y generación de contenidos periodísticos.",Prestación de servicios,Mujer,30.000000000000007,32.354564241034325,6 Mes(es),-0.0784854747011439,0.9272262106980228,https://community.secop.gov.co/Public/Tendering/OpportunityDetail/Index?noticeUID=CO1.NTC.5703530&isFromPublicArea=True&isModal=true&asPopupView=true,0.34427422285079956
269154,PERSONERIA DE CAJICA,SERVICIOS PROFESIONALES PARA APOYAR EL FORTALECIMIENTO DE LA VISIBILIDAD Y RECONOCIMIENTO DE LA PERSONERÍA MUNICIPAL A TRAVÉS DE DIVERSOS MEDIOS DE COMUNICACIÓN; PRENSA Y ENTIDADES PÚBLICAS Y PRIVADAS,Prestación de servicios,Hombre,36.00000000000001,38.80891736495293,6 Mes(es),-0.07802548235980347,0.9276218571484922,https://community.secop.gov.co/Public/Tendering/OpportunityDetail/Index?noticeUID=CO1.NTC.5509814&isFromPublicArea=True&isModal=true&asPopupView=true,0.377982497215271
721916,ALCALDIA MUNICIPIO DE VILLAVICENCIO,PRESTACIÓN DE SESRVICIOS PARA LA DIVULGACIÓN Y PROMOCIÓN RADIAL EN FRECUENCIA MODULADA (FM) DE LOS PROGRAMAS; PROYECTOS Y DEMÁS TEMAS DE INTERÉS PÚBLICO DE LA ALCALDÍA DE VILLAVICENCIO.,Prestación de servicios,Hombre,11.970000000000002,12.901158023670218,75 Dia(s),-0.07779097942107066,0.9278236866828709,https://community.secop.gov.co/Public/Tendering/OpportunityDetail/Index?noticeUID=CO1.NTC.6848229&isFromPublicArea=True&isModal=true&asPopupView=true,0.35192006826400757
547100,CORPORACIÓN AUTÓNOMA REGIONAL PARA LA DEFENSA DE LA MESETA DE BUCARAMANGA,CONTRATAR LOS SERVICIOS DE UN (01) COMUNICADOR SOCIAL PERIODISTA ESPECIALIZADO; PARA FORTALECER LAS COMUNICACIONES ESTRATÉGICAS EN LA COMUNICACIÓN EXTERNA DE LA ENTIDAD. (PRENSA25_PERIODISTAESP_02),Prestación de servicios,Mujer,25.2,27.08648679033567,7 Mes(es),-0.07486058691808216,0.9303532124731377,https://community.secop.gov.co/Public/Tendering/OpportunityDetail/Index?noticeUID=CO1.NTC.7678220&isFromPublicArea=True&isModal=true&asPopupView=true,0.3061083257198334
632528,METROSABANAS S.A.S,PRESTACION DE SERVICIOS PROFESIONALES PARA BRINDAR APOYO Y ACOMPAÑAMIENTO EN LAS ACTIVIDADES SOCIALES ADELANTADAS POR LA DIVISIÓN TÉCNICA DE LA SOCIEDAD PUBLICA METRO SABANAS S.A.S,Prestación de servicios,Mujer,16.0,17.195163193667057,4 Mes(es),-0.07469769960419104,0.930494222113156,https://community.secop.gov.co/Public/Tendering/OpportunityDetail/Index?noticeUID=CO1.NTC.5808855&isFromPublicArea=True&isModal=true&asPopupView=true,0.3036266565322876
216467,MUNICIPIO DE ENVIGADO,PRESTACIÓN DE SERVICIOS PROFESIONALES EN COMUNICACIÓN PARA EL POSICIONAMIENTO Y LA REDACCIÓN EN MEDIOS PUBLICITARIOS DE LOS EVENTOS; PROGRAMAS Y CAMPAÑAS DE LA SECRETARÍA DE SEGURIDAD,Prestación de servicios,Hombre,30.153658,32.21810848680008,206 Dia(s),-0.06846434640865386,0.9359226663587066,https://community.secop.gov.co/Public/Tendering/OpportunityDetail/Index?noticeUID=CO1.NTC.6168309&isFromPublicArea=True&isModal=true&asPopupView=true,0.31286051869392395
982674,RADIO TELEVISION NACIONAL DE COLOMBIA.,"EL CONTRATISTA SE OBLIGA A PRESTAR SUS SERVICIOS DESARROLLANDO ACTIVIDADES DE 
REGISTRO AUDIOVISUAL Y/O REPORTERÍA PARA RTVC",Prestación de servicios,No Definido,22.5,23.987602408920992,135 Dia(s),-0.06611566261871075,0.9379845311940074,https://community.secop.gov.co/Public/Tendering/OpportunityDetail/Index?noticeUID=CO1.NTC.7488755&isFromPublicArea=True&isModal=true&asPopupView=true,0.3170338273048401
642826,RADIO TELEVISION NACIONAL DE COLOMBIA.,El CONTRATISTA se obliga a prestar sus servicios desarrollando actividades de registro audiovisual y/o reportería para los contenidos audiovisuales y/o transmisiones de RTVC,Prestación de servicios,No Definido,23.237763,24.728589233488826,145 Dia(s),-0.0641553248257513,0.9397124429779493,https://community.secop.gov.co/Public/Tendering/OpportunityDetail/Index?noticeUID=CO1.NTC.6756981&isFromPublicArea=True&isModal=true&asPopupView=true,0.3458944261074066
1051658,MINISTERIO DEL INTERIOR,Prestación de servicios profesionales a la Oficina de Información Pública; para la implementación de estrategias de comunicación y elaboración de contenidos gráficos; audiovisuales y periodísticos para la divulgación de la gestión y acciones del Ministerio del Interior.,Prestación de servicios,Hombre,70.266667,74.74198877583767,344 Dia(s),-0.06369053730466069,0.9401230573451849,https://community.secop.gov.co/Public/Tendering/OpportunityDetail/Index?noticeUID=CO1.NTC.7383368&isFromPublicArea=True&isModal=true&asPopupView=true,0.30359259247779846
111022,MUNICIPIO DE SIBATE,PRESTACIÓN DE SERVICIOS DE APOYO A LA GESTIÓN EN LA PRODUCCIÓN AUDIOVISUAL Y FOTOGRÁFICA QUE FORTALEZCAN LA DIVULGACIÓN INTERNA Y EXTERNA DE LA ESTRATEGIA DE COMUNICACIÓN IMPLEMENTADA EN LA OFICINA TICS; TECNOLOGÍAS DE LA INFORMACIÓN Y DE LA COMUNICACIÓN - PRENSA; DE LA ALCALDÍA MUNICIPAL DE SIBATÉ;,Prestación de servicios,Mujer,14.759999999999998,15.66855417155345,9 Mes(es),-0.06155516067435318,0.94201416661641,https://community.secop.gov.co/Public/Tendering/OpportunityDetail/Index?noticeUID=CO1.NTC.5873799&isFromPublicArea=True&isModal=true&asPopupView=true,0.3021082282066345
1139617,MUNICIPIO DE MONTERIA,PRESTACIÓN DE SERVICIOS DE APOYO A LA GESTIÓN PARA BRINDAR APOYO A LA OFICINA ASESORA DE PRENSA Y PROTOCOLO DEL MUNICIPIO DE MONTERÍA EN EL CUBRIMIENTO PERIODÍSTICO DE LAS ACTIVIDADES DE LAS SECRETARÍAS Y PROGRAMAS DE LA ADMINISTRACIÓN; REALIZACIÓN DE CONTENIDO AUDIVISUAL PARA REDES SOCIALES.,Prestación de servicios,Hombre,16.282476000000003,17.27298542792735,6 Mes(es),-0.06083285047847429,0.942655574390408,https://community.secop.gov.co/Public/Tendering/OpportunityDetail/Index?noticeUID=CO1.NTC.7506023&isFromPublicArea=True&isModal=true&asPopupView=true,0.31327909231185913
36534,ALCALDIA MUNICIPIO DE ZIPAQUIRA,PRESTACIÓN DE SERVICIOS PARA EL CUBRIMIENTO PERIODÍSTICO Y DIVULGACIÓN DE LA INFORMACIÓN; ACTIVIDADES Y GESTIÓN DE LA ADMINISTRACIÓN MUNICIPAL; A TRAVES DE UN MEDIO DE COMUNICACIÓN DIGITAL.,Prestación de servicios,Hombre,10.499999999999998,11.131845797391408,55 Dia(s),-0.060175790227753344,0.9432397996799889,https://community.secop.gov.co/Public/Tendering/OpportunityDetail/Index?noticeUID=CO1.NTC.6964596&isFromPublicArea=True&isModal=true&asPopupView=true,0.3443774878978729
1095625,SECRETARIA GENERAL Y DE CERCANIA AL CIUDADANO,PRESTAR SERVICIOS PROFESIONALES COMO GESTOR DIGITAL PARA LA GENERACIÓN DE CONTENIDOS AUDIOVISUALES; INFORMATIVOS Y PERIODÍSTICOS QUE CONTRIBUYAN A LA PROMOCIÓN; FORTALECIMIENTO Y CONSOLIDACIÓN DE LA MARCA CUNDINAMARCA; EL DORADO LA LEYENDA VIVE,Prestación de servicios,Hombre,26.000000000000004,27.563535261333538,4 Mes(es),-0.06013597158975131,0.9432752277053923,https://community.secop.gov.co/Public/Tendering/OpportunityDetail/Index?noticeUID=CO1.NTC.5997369&isFromPublicArea=True&isModal=true&asPopupView=true,0.3020261526107788
522339,RADIO TELEVISION NACIONAL DE COLOMBIA.,EL CONTRATISTA SE OBLIGA A PRESTAR SUS SERVICIOS DESARROLLANDO ACTIVIDADES DE REGISTRO AUDIOVISUAL Y/O REPORTERÍA PARA LOS CONTENIDOS AUDIOVISUALES Y/O TRANSMISIONES DE RTVC.,Prestación de servicios,Hombre,24.0,25.388741177915758,3 Mes(es),-0.05786421574648992,0.9453009045157487,https://community.secop.gov.co/Public/Tendering/OpportunityDetail/Index?noticeUID=CO1.NTC.7899643&isFromPublicArea=True&isModal=true&asPopupView=true,0.35141921043395996
655333,RADIO TELEVISION NACIONAL DE COLOMBIA.,EL CONTRATISTA SE OBLIGA A PRESTAR SUS SERVICIOS DESARROLLANDO ACTIVIDADES DE REGISTRO AUDIOVISUAL Y/O REPORTERÍA PARA LOS CONTENIDOS AUDIOVISUALES Y/O TRANSMISIONES DE RTVC.,Prestación de servicios,Mujer,24.0,25.388741177915758,90 Dia(s),-0.05786421574648992,0.9453009045157487,https://community.secop.gov.co/Public/Tendering/OpportunityDetail/Index?noticeUID=CO1.NTC.7656441&isFromPublicArea=True&isModal=true&asPopupView=true,0.35141921043395996
652355,MUNICIPIO DE FREDONIA,PRESTAR LOS SERVICIOS PROFESIONALES COMO COMUNICADOR SOCIAL Y PERIODISTA PARA LA GESTIÓN DE LOS PROCESOS COMUNICACIONALES EXTERNOS DE LA ADMINISTRACIÓN MUNICIPAL DE FREDONIA.,Prestación de servicios,Hombre,23.4,24.752138563493197,173 Dia(s),-0.05778369929458115,0.9453728589945977,https://community.secop.gov.co/Public/Tendering/OpportunityDetail/Index?noticeUID=CO1.NTC.7822635&isFromPublicArea=True&isModal=true&asPopupView=true,0.3014035224914551
566847,INSTITUTO DISTRITAL DE SANTA MARTA PARA LA RECREACIÓN Y EL DEPORTE,PRESTACIÓN DE SERVICIOS DE APOYO A LA GESTIÓN PARA LA DIFUSIÓN Y CREACIÓN DE CONTENIDOS PARA LA PROMOCIÓN INSTITUCIONAL A TRAVÉS DE LAS REDES SOCIALES; ELABORACION DE BOLETINES Y CUBRIMIENTO DE EVENTOS DEPORTIVOS Y RECREATIVOS EN MEDIOS DE COMUNICACION,Prestación de servicios,Hombre,20.0,21.15056795126252,111 Dia(s),-0.057528397563126,0.9456010848543743,https://community.secop.gov.co/Public/Tendering/OpportunityDetail/Index?noticeUID=CO1.NTC.5812932&isFromPublicArea=True&isModal=true&asPopupView=true,0.3431221842765808
758360,ASAMBLEA DEPARTAMENTAL DEL TOLIMA,CONTRATAR LA PRESTACIÓN DE SERVICIOS PROFESIONALES DE UNA COMUNICADORA SOCIAL PARA ASESORAR TEMA DE MEDIOS DE COMUNICACIÒN (PRENSA; RADIO; TELEVISIÒN Y NUEVAS TECNOLOGÌAS) EN LA ASAMBLEA DEPARTAMENTAL DEL TOLIMA.,Prestación de servicios,Mujer,20.000000000000007,21.14040778658011,200 Dia(s),-0.057020389329005085,0.9460555445243573,https://community.secop.gov.co/Public/Tendering/OpportunityDetail/Index?noticeUID=CO1.NTC.7834927&isFromPublicArea=True&isModal=true&asPopupView=true,0.3715083599090576
789947,ALCALDIA MUNICIPAL DE YOTOCO,PRESTACIÓN DE SERVICIOS DE APOYO A LA GESTIÓN EN COMUNICACIONES Y PRENSA A TRAVES DE PUBLICACIONES Y DIVULGACIÓN AUDIOVISUAL DE LAS DIFERENTES ACTIVIDADES DEL MUNICIPIO DE YOTOCO VALLE DEL CAUCA,Prestación de servicios,Mujer,12.0,12.663206903041017,94 Dia(s),-0.05526724192008473,0.9476272552348687,https://community.secop.gov.co/Public/Tendering/OpportunityDetail/Index?noticeUID=CO1.NTC.8000713&isFromPublicArea=True&isModal=true&asPopupView=true,0.3485557436943054
533392,GOBERNACION DEL CHOCÓ.,PRESTAR LOS SERVICIOS DE APOYO A LA GESTIÓN DE LA SECRETARÍA DE HACIENDA PARA EL DISEÑO Y PRODUCCIÓN DE PIEZAS PUBLICITARIAS; PAUTAS RADIALES; VIRTUALES; COMERCIALES TV; PRENSA Y EN GENERAL PUBLICIDAD INSTITUCIONAL ALUSIVA A LA ESTRATEGIA DEL PROGRAMA DE ANTICONTRABANDO EN EL MARCO DEL CONVENIO INTE,Prestación de servicios,No Definido,20.112193,21.20657257466414,20 Dia(s),-0.054413736715043376,0.9483943211091257,https://community.secop.gov.co/Public/Tendering/OpportunityDetail/Index?noticeUID=CO1.NTC.7145823&isFromPublicArea=True&isModal=true&asPopupView=true,0.3156564235687256
360881,RADIO TELEVISION NACIONAL DE COLOMBIA.,EL CONTRATISTA SE OBLIGA A PRESTAR SUS SERVICIOS DESARROLLANDO ACTIVIDADES DE REGISTRO AUDIOVISUAL Y/O REPORTERÍA PARA LOS CONTENIDOS AUDIOVISUALES Y/O TRANSMISIONES DE RTVC,Prestación de servicios,Hombre,24.12,25.411352011214696,3 Mes(es),-0.05353864059762416,0.9491820816678787,https://community.secop.gov.co/Public/Tendering/OpportunityDetail/Index?noticeUID=CO1.NTC.7377131&isFromPublicArea=True&isModal=true&asPopupView=true,0.3458944261074066
760287,MUNICIPIO DE NEIVA,PRESTAR LOS SERVICIOS PROFESIONALES A LA OFICINA DE COMUNICACIONES PARA APOYAR CON LA PRODUCCION Y EDICION DE MATERIAL AUDIOVISUAL REQUERIDO EN LA PROMOCION CON LOS MEDIOS TRADICIONALES Y DIGITALES DE LAS EJECUTORIAS DE LA ALCALDIA DE NEIVA,Prestación de servicios,No Definido,24.0,25.265395303506505,5 Mes(es),-0.052724804312771045,0.9499158715584836,https://community.secop.gov.co/Public/Tendering/OpportunityDetail/Index?noticeUID=CO1.NTC.5805940&isFromPublicArea=True&isModal=true&asPopupView=true,0.32397377490997314
482335,UNIDAD ADMINISTRATIVA ESPECIAL CUERPO OFICIAL DE BOMBEROS DE BOGOTA,Prestación de servicios profesionales en asuntos de comunicaciones y prensa para apoyar la creación y divulgación audiovisual relacionada con la misionalidad de la UAECOB.,Prestación de servicios,Mujer,25.0,26.315903836907964,5 Mes(es),-0.05263615347631855,0.9499958715055641,https://community.secop.gov.co/Public/Tendering/OpportunityDetail/Index?noticeUID=CO1.NTC.6746581&isFromPublicArea=True&isModal=true&asPopupView=true,0.3596392869949341
