,Nombre Entidad,Descripcion del Proceso,Tipo de Contrato,Género Representante Legal,Valor real,Valor Proyectado,Duración del contrato,Tamaño valor extraño,veces la predicción,URLProceso,similarity
553013,MUNICIPIO DE ARMENIA QUINDIO,CONTRATAR SERVICIOS PROFESIONALES PARA REALIZAR ACOMPAÑAMIENTO A LA PRODUCCIÓN DE CONTENIDOS AUDIOVISUALES DE MEDIOS INSTITUCIONALES; CREACIÓN DE CAMPAÑAS PUBLICITARIAS EN ESPACIOS FISICOS; EN MEDIOS Y REDES SOCIALES INSTITUCIONALES DEL MUNICIPIO DE ARMENIA.,Prestación de servicios,Mujer,11.200000000000001,16.926373515629905,105 Dia(s),-0.5112833496098128,0.6616892856380524,https://community.secop.gov.co/Public/Tendering/OpportunityDetail/Index?noticeUID=CO1.NTC.6657716&isFromPublicArea=True&isModal=true&asPopupView=true,0.36628109216690063
1064676,GOBERNACIÓN DE RISARALDA,PRESTACIÓN DE SERVICIOS PROFESIONALES COMO COMUNICADOR SOCIAL-PERIODISTA PARA IMPLEMENTAR ESTRATEGIAS DE COMUNICACIÓN PÚBLICA DEL PLAN DE DESARROLLO RISARALDA EQUITATIVA E INCLUYENTE,Prestación de servicios,No Definido,15.722542000000002,23.756156678784095,117 Dia(s),-0.5109615658068581,0.6618302031170442,https://community.secop.gov.co/Public/Tendering/OpportunityDetail/Index?noticeUID=CO1.NTC.6665792&isFromPublicArea=True&isModal=true&asPopupView=true,0.31781917810440063
600663,SECRETARÍA GENERAL DE LA ALCALDÍA MAYOR DE BOGOTÁ,Prestar servicios profesionales en la generación de contenidos videográficos y fotográficos para su divulgación en diferentes medios de comunicación relevantes para la ciudadanía.,Prestación de servicios,No Definido,22.054212000000003,33.24653558673949,3 Mes(es),-0.5074914300605927,0.6633536881598097,https://community.secop.gov.co/Public/Tendering/OpportunityDetail/Index?noticeUID=CO1.NTC.5948077&isFromPublicArea=True&isModal=true&asPopupView=true,0.3432215452194214
102709,CENTRO CULTURAL BACATA,PRESTACIÓN DE SERVICIOS DE APOYO A LA GESTIÓN EN LA PRODUCCIÓN; REGISTRO AUDIOVISUAL; TRASMISIONES Y DIVULGACIÓN DE LOS EVENTOS DEL CENTRO CULTURAL BACATÁ; E INSTRUCTOR EN LA ESCUELA DE COMUNICACIONES Y MEDIOS AUDIOVISUALES.,Prestación de servicios,Hombre,13.120000000000003,19.74546393663749,124 Dia(s),-0.5049896293168814,0.6644564058915825,https://community.secop.gov.co/Public/Tendering/OpportunityDetail/Index?noticeUID=CO1.NTC.5750765&isFromPublicArea=True&isModal=true&asPopupView=true,0.325522243976593
81395,"EMPRESA PÚBLICA DEL MUNICIPIO DE SOACHA, EPUXUA AVANZA E.I.C.E.",PRESTACION DEL SERVICIO PARA LA DIFUSION EN MEDIOS MASIVOS DE COMUNICACION Y SEGUIMIENTO DEL PLAN DE DIFUSION TALES COMO STREAMING Y MEDIOS DIGITALES DE LOS PROGRAMAS Y ACTIVIDADES QUE REQUIERA LA ALCALDIA MUNICIPAL DE SOACHA. EN EL MARCO DE LA GERENCIA INTEGRAL DEL CONTRATO INTERADMINISTRATIVO N°,Prestación de servicios,Hombre,24.733800000000002,37.200471031460836,5 Mes(es),-0.5040337930872261,0.6648786779899202,https://community.secop.gov.co/Public/Tendering/OpportunityDetail/Index?noticeUID=CO1.NTC.6607907&isFromPublicArea=True&isModal=true&asPopupView=true,0.3026437759399414
912408,MUNICIPIO DE SABANETA,"PRESTACIÓN DE SERVICIOS PROFESIONALES PARA LA REALIZACIÓN DE PIEZAS
PUBLICITARIAS; MEDIOS GRÁFICOS Y MANEJO EN REDES SOCIALES DE LA
SECRETARÍA DEL MEDIO AMBIENTE EN EL MUNICIPIO DE SABANETA",Prestación de servicios,Mujer,15.038100000000002,22.612491194837368,3 Mes(es),-0.5036800656224766,0.6650350848310483,https://community.secop.gov.co/Public/Tendering/OpportunityDetail/Index?noticeUID=CO1.NTC.5940432&isFromPublicArea=True&isModal=true&asPopupView=true,0.3176858425140381
471679,ALCALDIA MUNICIPAL DE CHIA,PRESTACION DE SERVICIOS PROFESIONALES EN LA OFICINA ASESORA DE COMUNICACIÓN; PRENSA Y PROTOCOLO PARA APOYAR LA PRODUCCIÓN DE CONTENIDOS INFORMATIVOS; TEXTUALES; AUDIOVISUALES Y RADIALES SOBRE LAS ACTIVIDADES DESARROLLADAS POR LA ALCALDÍA DE CHÍA EN TEMAS DE PLANEACIÓN; SALUD Y GOBIERNO,Prestación de servicios,Mujer,18.333333,27.565702969711047,110 Dia(s),-0.5035838256857631,0.6650776517524152,https://community.secop.gov.co/Public/Tendering/OpportunityDetail/Index?noticeUID=CO1.NTC.6628824&isFromPublicArea=True&isModal=true&asPopupView=true,0.3491665720939636
1002493,RADIO TELEVISION NACIONAL DE COLOMBIA.,EL CONTRATISTA SE OBLIGA CON RTVC A PRESTAR LOS SERVICIOS PARA REALIZAR ACTIVIDADES DE PERIODISMO SEO; CONSTRUCCIÓN; EDICIÓN Y POSICIONAMIENTO DE CONTENIDOS PARA LAS PLATAFORMAS DIGITALES DE RTVC SISTEMA DE MEDIOS PÚBLICOS Y SUS MARCAS,Prestación de servicios,Mujer,14.812500000000002,22.266203813034192,75 Dia(s),-0.5032036329474558,0.6652458642873402,https://community.secop.gov.co/Public/Tendering/OpportunityDetail/Index?noticeUID=CO1.NTC.6880958&isFromPublicArea=True&isModal=true&asPopupView=true,0.3004140257835388
790262,PROSPERIDAD SOCIAL,Prestar servicios profesionales para apoyar a la Oficina Asesora de Comunicaciones en la creación; acompañamiento y realización de contenidos audiovisuales y periodísticos para los canales digitales de la entidad.,Prestación de servicios,Hombre,39.666666000000006,59.55320429893272,159 Dia(s),-0.5013413100796702,0.6660710614476691,https://community.secop.gov.co/Public/Tendering/OpportunityDetail/Index?noticeUID=CO1.NTC.6438711&isFromPublicArea=True&isModal=true&asPopupView=true,0.30802157521247864
487494,MUNICIPIO DE PAIPA,PRESTAR SERVICIOS PROFESIONALES EN LA OFICINA TIC EN ACTIVIDADES COMO DISEÑAR PIEZAS GRÁFICAS PARA EL DESARROLLO DE CAMPAÑAS PUBLICITARIAS; DISEÑO DE PIEZAS DIGITALES PARA CONTENIDOS EN REDES SOCIALES EN LA ALCALDÍA DE PAIPA.,Prestación de servicios,Mujer,16.82856,25.219978420910223,6 Mes(es),-0.49864150116885964,0.6672709912411033,https://community.secop.gov.co/Public/Tendering/OpportunityDetail/Index?noticeUID=CO1.NTC.5642907&isFromPublicArea=True&isModal=true&asPopupView=true,0.3046444058418274
446388,LOTERIA DE BOYCA,"COMPRA DE ESPACIO PUBLICITARIO EN EL MEDIO DIGITAL EL KANAL AMV TELEVISIÓN DE CHIQUINQUIRÁ; 
PARA PROMOCIONAR LOS PRODUCTOS Y/O CAMPAÑAS PUBLICITARIAS DE LA LOTERÍA DE BOYACÁ DEL AÑO 
2024.",Prestación de servicios,Hombre,12.500000000000002,18.727256200528902,5 Mes(es),-0.49818049604231196,0.6674763172005396,https://community.secop.gov.co/Public/Tendering/OpportunityDetail/Index?noticeUID=CO1.NTC.6322301&isFromPublicArea=True&isModal=true&asPopupView=true,0.3921302258968353
391603,MUNICIPIO DE ABEJORRAL,"PRESTACIÓN DE SERVICIOS PROFESIONALES DE APOYO A LA
GESTIÓN EN ACTIVIDADES DE DIFUSIÓN; PUBLICIDAD
AUDIOVISUAL Y COMUNICACIÓN DIGITAL (REDES SOCIALES;
PROGRAMAS RADIALES; EVENTOS OFICIALES) DE LA OFERTA DE
SERVICIOS INSTITUCIONALES DE LAS DIFERENTES DEPENDENCIAS
DE LA ADMINISTRACIÓN MUNICIPAL DE ABE",Prestación de servicios,Hombre,14.224,21.28554150730069,4 Mes(es),-0.4964525806594972,0.6682470349707259,https://community.secop.gov.co/Public/Tendering/OpportunityDetail/Index?noticeUID=CO1.NTC.6163023&isFromPublicArea=True&isModal=true&asPopupView=true,0.33026421070098877
240874,MUNICIPIO DE SANTA ROSA DE CABAL,PRESTACION DE SERVICIOS PROFESIONALES PARA APOYAR LA REALIZACIÓN DEL DISEÑO Y ELABORACION DE PIEZAS DE INFORMACIÓN Y PUBLICIDAD GRAFICA PARA IMPRESOS Y MEDIOS DE COMUNICACIÓN DIGITALES Y TRADICIONALES DE LA ADMINISTRACION MUNICIPAL DE SANTA ROSA DE CABAL,Prestación de servicios,Mujer,18.000000000000004,26.893897552943415,6 Mes(es),-0.49410541960796717,0.669296815925068,https://community.secop.gov.co/Public/Tendering/OpportunityDetail/Index?noticeUID=CO1.NTC.5609933&isFromPublicArea=True&isModal=true&asPopupView=true,0.316941499710083
42901,ESE HOSPITAL SALAZAR DE VILLETA,PRESTACIÓN DE SERVICIOS DE PUBLICIDAD Y PROPAGANDA A TRAVÉS DE REDES SOCIALES E INTERNET DE LA INFORMACIÓN INSTITUCIONAL DEL HOSPITAL SALAZAR DE VILLETA E.S.E.,Prestación de servicios,Hombre,14.174999999999999,21.15275676219445,259 Dia(s),-0.4922579726415839,0.6701254195545074,https://community.secop.gov.co/Public/Tendering/OpportunityDetail/Index?noticeUID=CO1.NTC.8007762&isFromPublicArea=True&isModal=true&asPopupView=true,0.3646509051322937
796241,"SECRETARIA DISTRITAL DE SEGURIDAD, CONVIVENCIA Y JUSTICIA",PRESTAR LOS SERVICIOS PROFESIONALES PARA REALIZAR LAS FOTOGRAFIAS; VIDEOS Y EDICIÓN DE PRODUCTOS AUDIOVISUALES Y MULTIMEDIA QUE REQUIERA LA ENTIDAD PARA DAR A CONOCER LA GESTIÓN EN MEDIOS DE COMUNICACIÓN Y MEDIOS DIGITALES,Prestación de servicios,No Definido,36.00000000000001,53.694490195141206,5 Mes(es),-0.4915136165316999,0.6704598529414407,https://community.secop.gov.co/Public/Tendering/OpportunityDetail/Index?noticeUID=CO1.NTC.6534288&isFromPublicArea=True&isModal=true&asPopupView=true,0.363738089799881
1253681,MUNICIPIO DE LA UNION ANTIOQUIA,PRESTACIÓN DE SERVICIOS DE PRODUCCIÓN AUDIOVISUAL Y CAMPAÑAS PUBLICITARIAS DE LAS DIFERENTES ACTIVIDADES QUE DESARROLLE LA ADMINISTRACIÓN MUNICIPAL.,Prestación de servicios,Hombre,7.199999999999998,10.732667627711438,4 Mes(es),-0.4906482816265889,0.6708490609929825,https://community.secop.gov.co/Public/Tendering/OpportunityDetail/Index?noticeUID=CO1.NTC.6565992&isFromPublicArea=True&isModal=true&asPopupView=true,0.3112279176712036
130473,ALCALDIA LOCAL DE ENGATIVÁ,PRESTAR LOS SERVICIOS PROFESIONALES EN PRENSA; PARA LA REALIZACIÓN DE PIEZAS DIGITALES; IMPRESAS Y PUBLICITARIAS DE GRAN FORMATO Y DE ANIMACIÓN GRÁFICA.,Prestación de servicios,Hombre,15.166666,22.567254064264667,65 Dia(s),-0.4879508828284784,0.6720651948531245,https://community.secop.gov.co/Public/Tendering/OpportunityDetail/Index?noticeUID=CO1.NTC.7033045&isFromPublicArea=True&isModal=true&asPopupView=true,0.3086196184158325
1247581,GOBERNACIÓN DE CUNDINAMARCA - SECRETARÍA DE PRENSA Y COMUNICACIONES,PRESTAR LOS SERVICIOS PROFESIONALES COMO COMMUNITY MANAGER PARA EL MANEJO DE LAS REDES SOCIALES DE LA EMISORA DE INTERES PUBLICO; PARA LA IMPLEMENTACION DE ESTRATEGIAS SOCIAL MEDIA PARA EL POSICIONAMIENTO DE LA EMISORA EL DORADO RADIO EN BUSCA DE AUMENTAR LA AUDIENCIA DE LOS MUNICIPIOS.,Prestación de servicios,Mujer,20.5,30.438332851972458,123 Dia(s),-0.4847967244864614,0.6734928650558982,https://community.secop.gov.co/Public/Tendering/OpportunityDetail/Index?noticeUID=CO1.NTC.6427831&isFromPublicArea=True&isModal=true&asPopupView=true,0.30657321214675903
519788,INSTITUTO DE DEPORTES Y RECREACIÓN DEL MUNICIPIO DE FACATATIVA,PRESTAR SERVICIOS PROFESIONALES DE APOYO PARA LOS PROGRAMAS EDITORIAL; SONORO; AUDIOVISUAL; COMUNICACIÓN INTERNA Y MONITOREO DE REDES SOCIALES EN LOS MEDIOS DE COMUNICACIÓN PERMANENTE; CON EL FIN DE MANTENER A LA COMUNIDAD MUNICIPAL Y REGIONAL INFORMADA SOBRE LAS DIFERENTES ACTIVIDADES ORGANIZADAS P,Prestación de servicios,Hombre,12.800000000000002,19.004378294743482,4 Mes(es),-0.48471705427683426,0.6735290048157176,https://community.secop.gov.co/Public/Tendering/OpportunityDetail/Index?noticeUID=CO1.NTC.7615739&isFromPublicArea=True&isModal=true&asPopupView=true,0.3697373569011688
395870,EMPUMELGAR ESP**,CONTRATO DE PRESTACIÓN DE SERVICIOS DE APOYO A LA GESTIÓN PARA LA PUBLICACIÓN Y DIFUSIÓN DE CONTENIDO AUDIOVISUAL DE LA EMPRESA DE SERVICIOS PÚBLICOS DOMICILIARIOS DE MELGAR EMPUMELGAR E.S.P.,Prestación de servicios,Mujer,10.000000000000004,14.838104467597901,5 Mes(es),-0.4838104467597896,0.6739405307353841,https://community.secop.gov.co/Public/Tendering/OpportunityDetail/Index?noticeUID=CO1.NTC.7833112&isFromPublicArea=True&isModal=true&asPopupView=true,0.32085055112838745
178178,CONCEJO MUNICIPAL DE BUCARAMANGA,PRESTAR SERVICIOS PROFESIONALES EN MEDIOS AUDIOVISUALES Y APOYAR EN LAS COMUNICACIONES ESTRATÉGICAS DEL CONCEJO MUNICIPAL DE BUCARAMANGA,Prestación de servicios,Mujer,13.200000000000001,19.564366842233476,4 Mes(es),-0.4821490031995056,0.6746959973938561,https://community.secop.gov.co/Public/Tendering/OpportunityDetail/Index?noticeUID=CO1.NTC.6540789&isFromPublicArea=True&isModal=true&asPopupView=true,0.3163992762565613
1107424,Concejo Anserma,Prestar los servicios de apoyo logístico para el crecimiento; difusión y publicación de información oficial de interés general que se genere en el actuar del CONCEJO MUNICIPAL DE ANSERMA CALDAS; a través de medios de comunicación; prensa; radio y plataformas digitales.,Prestación de servicios,Mujer,12.0,17.773227754403507,273 Dia(s),-0.4811023128669589,0.6751728029269681,https://community.secop.gov.co/Public/Tendering/OpportunityDetail/Index?noticeUID=CO1.NTC.7940249&isFromPublicArea=True&isModal=true&asPopupView=true,0.3572915196418762
709761,PERSONERIA MUNICIPAL DE CARTAGO,PRESTACION DE SERVICIOS A LA PERSONERIA MUNICIPAL EN LA REALIZACION DE PIEZAS AUDIOVISUALES Y CREACION DE CONTENIDOS PARA LA PROMOCION DE LAS ACTIVIDADES DE LA ENTIDAD EN REDES SOCIALES,Prestación de servicios,Hombre,12.0,17.75511830945968,3 Mes(es),-0.4795931924549732,0.6758614496872469,https://community.secop.gov.co/Public/Tendering/OpportunityDetail/Index?noticeUID=CO1.NTC.7528120&isFromPublicArea=True&isModal=true&asPopupView=true,0.31968188285827637
145713,AREA METROPOLITANA DE VALLEDUPAR.,PRESTAR LOS SERVICIOS PROFESIONALES Y DE APOYO A LA GESTIÓN COMO COMUNICADORA SOCIAL - PERIODISTA  QUE BRINDE ACOMPAÑAMIENTO EN EL CUBRIMIENTO; REDACCIÓN  DE COMUNICADOS DE PRENSA; MANEJO DE CONTENIDOS Y DIFUSIÓN DE LA INFORMACIÓN QUE GENERA EL ÁREA METROPOLITANA DE VALLEDUPAR.,Prestación de servicios,Mujer,13.866667,20.501875936629265,3 Mes(es),-0.47850063296603756,0.6763608873091168,https://community.secop.gov.co/Public/Tendering/OpportunityDetail/Index?noticeUID=CO1.NTC.6746733&isFromPublicArea=True&isModal=true&asPopupView=true,0.31488338112831116
310069,MUNICIPIO DE ARMENIA QUINDIO,CONTRATAR SERVICIOS PROFESIONALES PARA REALIZAR ACOMPAÑAMIENTO A LA PRODUCCION DE CONTENIDOS AUDIOVISUALES DE MEDIOS INSTITUCIONALES; CREACION DE CAMPAÑAS PUBLICITARIAS EN ESPACIOS FISICOS EN MEDIOS Y REDES SOCIALES INSTITUCIONALES DEL MUNICIPIO DE ARMENIA,Prestación de servicios,Hombre,11.250000000000004,16.617649771176225,125 Dia(s),-0.4771244241045529,0.6769910399431718,https://community.secop.gov.co/Public/Tendering/OpportunityDetail/Index?noticeUID=CO1.NTC.5606811&isFromPublicArea=True&isModal=true&asPopupView=true,0.37145063281059265
1258242,MUNICIPIO DE ARMENIA QUINDIO,PRESTACIÓN DE SERVICIOS PROFESIONALES  APOYANDO LA PRODUCCIÓN; EDICIÓN  Y REDACCIÓN DE CONTENIDOS AUDIVISUALES EN MEDIOS INSTITUCIONALES; CREACIÓN DE CAMPAÑAS PUBLICITARIAS; EN ESPACIOS FISICOS; EN MEDIOS Y EN REDES SOCIALES INSTITUCIONALES  DEL MUNICIPIO DE ARMENIA.,Prestación de servicios,No Definido,12.72,18.754310364911277,90 Dia(s),-0.4743954689395657,0.6782440810939505,https://community.secop.gov.co/Public/Tendering/OpportunityDetail/Index?noticeUID=CO1.NTC.7589007&isFromPublicArea=True&isModal=true&asPopupView=true,0.36360207200050354
433533,CONCEJO MUNICIPAL DE BUCARAMANGA,PRESTAR SERVICIOS PROFESIONALES COMO COMUNICADOR SOCIAL Y PERIODISTA APOYANDO LOS MEDIOS AUDIOVISUALES Y EN COMUNICACIONES ESTRATÉGICAS DEL CONCEJO MUNICIPAL DE BUCARAMANGA,Prestación de servicios,No Definido,14.0,20.631632606142638,4 Mes(es),-0.4736880432959027,0.6785696637420634,https://community.secop.gov.co/Public/Tendering/OpportunityDetail/Index?noticeUID=CO1.NTC.6541429&isFromPublicArea=True&isModal=true&asPopupView=true,0.3956119418144226
824270,"SECRETARIA DISTRITAL DE SEGURIDAD, CONVIVENCIA Y JUSTICIA","11190-PRESTAR SERVICIOS PROFESIONALES PARA LA REALIZACIÓN DE BOLETIINES DE PRENSA Y GESTIÓN CON LOS MEDIOS DE COMUNICACIÓN DE LAS DIFERENTES NOTICIAS Y CONTENIDOS QUE 
GENERA LA ENTIDAD; ASI COMO EL CUBRIMIENTO Y ENTREGA DE PRODUCTOS PERIODISTICOS QUE SE REQUIERAN.",Prestación de servicios,Hombre,26.8,39.48395285743498,4 Mes(es),-0.47328182303861854,0.678756762190629,https://community.secop.gov.co/Public/Tendering/OpportunityDetail/Index?noticeUID=CO1.NTC.7781351&isFromPublicArea=True&isModal=true&asPopupView=true,0.30982446670532227
1181007,ALCALDIA DE TURBACO BOLIVAR,"PRESTACION DE SERVICIOS PROFESIONALES EN EL DESARROLLO DE LAS ACTIVIDADES DE
PUBLICIDAD Y COMUNICACION VISUAL DE LA ALCALDIA MUNICIPAL DE TURBACO",Prestación de servicios,Hombre,12.6,18.532905158674165,4 Mes(es),-0.4708654887836639,0.6798718221521076,https://community.secop.gov.co/Public/Tendering/OpportunityDetail/Index?noticeUID=CO1.NTC.7550239&isFromPublicArea=True&isModal=true&asPopupView=true,0.34490299224853516
692880,GOBERNACIÓN DE RISARALDA,"PRESTACIÓN DE SERVICIOS DE APOYO PARA LA DIVULGACION Y PROMOCION DEL CARTEL DE LOS MAS BUSCADOS Y LAS DIFERENTES
ESTRATEGIAS DEL PISCC (2024 2027) SEGURIDAD EQUITATIVA E INCLUSIVA¿; A TRAVES DE
PUBLICACIONES EN MEDIOS MASIVOS DE COMUNICACION RADIALES; TELEVISIVOS DE
PRENSA Y DIGITALES CON AMPLIA COB",Prestación de servicios,Hombre,9.999999999999998,14.703149958842454,60 Dia(s),-0.4703149958842457,0.6801263693829098,https://community.secop.gov.co/Public/Tendering/OpportunityDetail/Index?noticeUID=CO1.NTC.6963963&isFromPublicArea=True&isModal=true&asPopupView=true,0.3400641679763794
1087044,GOBIERNO DEPARTAMENTAL,PRESTAR POR SUS PROPIOS MEDIOS Y CON PLENA AUTONOMIA PRESTACION DE SERVICIOS PROFESIONALES DE UN COMUNICADOR SOCIAL - PERIODISTA PARA BRINDAR APOYO A LA DIRECCION DE PRENSA Y COMUNICACIONES DE LA GOBERNACIÓN DE TOLIMA.,Prestación de servicios,Mujer,18.55,27.110621478794425,104 Dia(s),-0.4614890285064379,0.6842336688780657,https://community.secop.gov.co/Public/Tendering/OpportunityDetail/Index?noticeUID=CO1.NTC.6705652&isFromPublicArea=True&isModal=true&asPopupView=true,0.3066093921661377
1018782,DIRECCION DE TRANSITO DE BUCARAMANGA,"PRESTAR SERVICIOS DE APOYO A LA GESTIÓN DEL GRUPO COMUNICACIÓN Y PRENSA
PARA LA PRODUCCIÓN DE PIEZAS PUBLICITARIAS; TOMA DE FOTOGRAFÍAS Y EDICIÓN
DE FORMATOS AUDIOVISUALES DE LA DIRECCIÓN DE TRÁNSITO DE BUCARAMANGA",Prestación de servicios,Hombre,12.0,17.534938800352567,4 Mes(es),-0.46124490002938057,0.6843479829971646,https://community.secop.gov.co/Public/Tendering/OpportunityDetail/Index?noticeUID=CO1.NTC.7546847&isFromPublicArea=True&isModal=true&asPopupView=true,0.33647826313972473
148724,CAMARA DE REPRESENTANTES,PRESTACION DE SERVICIOS PROFESIONALES PARA BRINDAR ACOMPAÑAMIENTO A LA COMISIÓN ESPECIAL DE VIGILANCIA DE LOS ORGANISMOS DE CONTROL PÚBLICO EN LOS ASUNTOS RELACIONADOS CON LOS PROCESOS DE COMUNICACIÓN Y PUBLICACION EN MEDIOS FISICOS Y DIGITALES,Prestación de servicios,Mujer,18.000000000000004,26.27848574379391,3 Mes(es),-0.45991587465521705,0.6849709749448175,https://community.secop.gov.co/Public/Tendering/OpportunityDetail/Index?noticeUID=CO1.NTC.6092463&isFromPublicArea=True&isModal=true&asPopupView=true,0.3301159143447876
20504,EMPRESA IBAGUEREÑA DE ACUEDUCTO Y ALCANTARILLADO SA ESP OFICIAL IBAL SA ESP OFICIAL,CONTRATAR EL SERVICIO DE PUBLICIDAD EN UN MEDIO DE COMUNICACIÓN DIGITAL PARA LA DIFUSIÓN DE MENSAJES; CAMPAÑAS E INFORMACIÓN INSTITUCIONAL DEL IBAL S.A. E.S.P. OFICIAL; CON GRAN ALCANCE A NIVEL LOCAL EN SUS REDES SOCIALES DE CONFORMIDAD CON EL PLAN DE MEDIOS APROBADO POR LA GERENCIA,Prestación de servicios,Hombre,18.000000000000004,26.24351529974804,7 Mes(es),-0.45797307220822414,0.6858837238231121,https://community.secop.gov.co/Public/Tendering/OpportunityDetail/Index?noticeUID=CO1.NTC.6071521&isFromPublicArea=True&isModal=true&asPopupView=true,0.3738587498664856
25186,PERSONERIA MUNICIPAL DE JAMUNDI VALLE DEL CAUCA,PRESTACION DE SERVICIOS PROFESIONALES COMO COMUNICADORA SOCIAL DESARROLLANDO ACTIVIDADES DE COMUNICACIÓN; DIVULGACIÓN Y PUBLICIDAD DE LA PERSONERIA DE JAMUNDI; ESPECIALMENTE LA REDACCION; DIFUSION DE COMUNICADOS; BOLETINES DE PRENSA Y APOYO EXTERNO DE CONTENIDO PARA LOS CANALES DE COMUNICACION DE LA,Prestación de servicios,Mujer,11.000000000000004,16.030182316589737,2 Mes(es),-0.4572893015081575,0.6862055454363756,https://community.secop.gov.co/Public/Tendering/OpportunityDetail/Index?noticeUID=CO1.NTC.5442006&isFromPublicArea=True&isModal=true&asPopupView=true,0.40693792700767517
383423,CONCEJO MUNICIPAL DE POPAYAN,PRESTACIÓN DE SERVICIOS PROFESIONALES COMO COMUNICADOR SOCIAL Y/O PERIODISTA  DENTRO DEL PROCESO DE COMUNICACIÓN Y DIVULGACIÓN PUBLICACIÓN DEL CONCEJO MUNICIPAL DE POPAYÁN,Prestación de servicios,Mujer,13.500000000000002,19.660377214970964,128 Dia(s),-0.45632423814599715,0.6866602737265913,https://community.secop.gov.co/Public/Tendering/OpportunityDetail/Index?noticeUID=CO1.NTC.6587563&isFromPublicArea=True&isModal=true&asPopupView=true,0.3464794158935547
