,Nombre Entidad,Descripcion del Proceso,Tipo de Contrato,Género Representante Legal,Valor real,Valor Proyectado,Duración del contrato,Tamaño valor extraño,veces la predicción,URLProceso,similarity
100962,ALCALDIA LOCAL DE CIUDAD BOLIVAR //,PRESTAR SUS SERVICIOS PROFESIONALES PARA APOYAR AL EQUIPO DE PRENSA Y COMUNICACIONES DE LA ALCALDÍA LOCAL EN LA REALIZACIÓN Y PUBLICACIÓN DE CONTENIDOS DE REDES SOCIALES Y CANALES DE DIVULGACIÓN DIGITAL (SITIO WEB) DE LA ALCALDÍA LOCAL.,Prestación de servicios,No Definido,17.64,13.940220501831433,3 Mes(es),0.2097380667896013,1.265403226418298,https://community.secop.gov.co/Public/Tendering/OpportunityDetail/Index?noticeUID=CO1.NTC.6953529&isFromPublicArea=True&isModal=true&asPopupView=true,0.33496296405792236
143364,MUNICIPIO DE ANSERMA CALDAS,Prestar los servicios de apoyo a la gestión en la Alcaldía de Anserma; para servir de enlace con los medios de comunicación; así como la recopilación y difusión de información audiovisual de la ejecución de programas y actividades adelantados por la administración municipal,Prestación de servicios,Hombre,13.0,10.173493554506708,142 Dia(s),0.21742357273025326,1.2778304650560468,https://community.secop.gov.co/Public/Tendering/OpportunityDetail/Index?noticeUID=CO1.NTC.5630578&isFromPublicArea=True&isModal=true&asPopupView=true,0.30807802081108093
270408,ALCALDIA SAN PABLO DE BORBUR,PRESTACIÓN DE SERVICIOS PROFESIONALES Y DE APOYO A LA GESTIÓN COMO COMUNICADOR SOCIAL PARA LA GESTION; SOSTENIMIENTO Y CRECIMIENTO DE LOS CONTENIDOS PUBLICADOS EN REDES SOCIALES Y EL DESARROLLO DE PIEZAS PUBLICITARIAS Y CONTENIDOS AUDIOVISUALES DEL MUNICIPIO DE SAN PABLO DE BORBUR 2024,Prestación de servicios,No Definido,40.739999999999995,31.776192850579843,315 Dia(s),0.22002472138979265,1.2820919167872113,https://community.secop.gov.co/Public/Tendering/OpportunityDetail/Index?noticeUID=CO1.NTC.5617846&isFromPublicArea=True&isModal=true&asPopupView=true,0.341308057308197
664922,GOBERNACIÓN DE CUNDINAMARCA - SECRETARÍA DE PRENSA Y COMUNICACIONES,PRESTAR SERVICIOS PROFESIONALES A LA SECRETARÍA DE PRENSA Y COMUNICACIONES COMO PRODUCTORA AUDIOVISUAL DE LOS DISTINTOS PROGRAMAS RADIALES DE LA EMISORA EL DORADO RADIO; CONTRIBUYENDO A SU ESTRATEGIA DE RECONOCIMIENTO Y POSICIONAMIENTO; EN BUSCA DE AUMENTAR LA AUDIENCIA EN LOS MUNICIPIOS,Prestación de servicios,Mujer,28.333332999999996,21.868146525339355,170 Dia(s),0.2281830547313527,1.2956440074685438,https://community.secop.gov.co/Public/Tendering/OpportunityDetail/Index?noticeUID=CO1.NTC.6380271&isFromPublicArea=True&isModal=true&asPopupView=true,0.3617967367172241
204351,CORPORACIÓN AUTÓNOMA REGIONAL DEL CANAL DEL DIQUE,PRESTACION DE SERVICIOS PROFESIONALES DE APOYO A LA GESTIÓN EN LA ELABORACIÓN Y DIVULGACIÓN DE PIEZAS PUBLICITARIAS Y AUDIOVISUALES; PARA LA PROMOCIÓN DE LAS ACTIVIDADES MISIONALES EN LA JURISDICCION DE LA CORPORACION AUTONOMA REGIONAL DEL CANAL DEL DIQUE - CARDIQUE,Prestación de servicios,No Definido,37.485,28.620228001032018,7 Mes(es),0.23648851537863097,1.3097379936542897,https://community.secop.gov.co/Public/Tendering/OpportunityDetail/Index?noticeUID=CO1.NTC.6062454&isFromPublicArea=True&isModal=true&asPopupView=true,0.30747297406196594
262897,EMPRESA DE FOMENTO Y DESARROLLO SOSTENIBLE DE OCCIDENTE,CONTRATAR LA PRESTACION DE SERVICIO PARA LAS CAMPAÑAS DE COMUNICACIÓN Y LA IMPRESIÓN DE MATERIAL PUBLICITARIO; QUE PERMITAN HACER PROMOCIÓN Y DIVULGACIÓN DE LAS ACTIVIDADES DE LA ADMINISTRACIÓN MUNICIPAL EN MEDIOS MASIVOS Y ALTERNATIVOS DE COMUNICACIÓN,Prestación de servicios,Mujer,175.0,133.17599201778313,150 Dia(s),0.23899433132695355,1.314050658444745,https://community.secop.gov.co/Public/Tendering/OpportunityDetail/Index?noticeUID=CO1.NTC.6317700&isFromPublicArea=True&isModal=true&asPopupView=true,0.36511823534965515
720698,PROSPERIDAD SOCIAL,Prestar servicios profesionales para apoyar el cumplimiento de actividades estratégicas en el cubrimiento periodístico; digital y relacionamiento con medios de comunicación.,Prestación de servicios,Mujer,31.439999999999994,23.872043355967893,134 Dia(s),0.2407110891867717,1.3170217367312274,https://community.secop.gov.co/Public/Tendering/OpportunityDetail/Index?noticeUID=CO1.NTC.6572909&isFromPublicArea=True&isModal=true&asPopupView=true,0.3216506242752075
766763,Contraloría Municipal de Pereira,Prestación de servicios profesionales como comunicador social periodista; brindando acompañamiento en virtud de visibilizar a través de medios de comunicación y redes sociales la labor desempeñada por la Contraloría Municipal de Pereira,Prestación de servicios,Hombre,5.3999999999999995,4.092520282487415,2 Mes(es),0.24212587361344157,1.3194803268556812,https://community.secop.gov.co/Public/Tendering/OpportunityDetail/Index?noticeUID=CO1.NTC.5640376&isFromPublicArea=True&isModal=true&asPopupView=true,0.3751341700553894
346202,CORPORACIÓN AUTÓNOMA REGIONAL PARA LA DEFENSA DE LA MESETA DE BUCARAMANGA,CONTRATAR LOS SERVICIOS DE UN (1) COMUNICADOR SOCIAL PERIODISTA; PARA APOYAR LAS ESTRATEGIAS DE COMUNICACIÓN INSTITUCIONAL; ORGANIZACIONAL Y REDES SOCIALES DE LA ENTIDAD.(PRENSA_PERIODISTA_01),Prestación de servicios,Mujer,18.0,13.437771969231093,6 Mes(es),0.2534571128204948,1.339507772658681,https://community.secop.gov.co/Public/Tendering/OpportunityDetail/Index?noticeUID=CO1.NTC.6226636&isFromPublicArea=True&isModal=true&asPopupView=true,0.31949496269226074
422310,ALCALDIA MUNICIPAL DE BUGA,PRESTACIÓN DE SERVICIOS PROFESIONALES PARA APOYAR LA GESTIÓN COMUNICACIONAL EN LA AUDIENCIA PÚBLICA DE RENDICIÓN DE CUENTAS; ENCUENTROS COMUNITARIOS Y DEMÁS ACTIVIDADES EN LA SECRETARIA DE BIENESTAR SOCIAL Y DESARROLLO COMUNITARIO REQUERIDAS POR LA OFICINA DE PRENSA DE LA ALCALDIA MUNICIPAL DE GUADA,Prestación de servicios,No Definido,11.999999999999998,8.946910171732377,6 Mes(es),0.25442415235563515,1.341245163935345,https://community.secop.gov.co/Public/Tendering/OpportunityDetail/Index?noticeUID=CO1.NTC.5881484&isFromPublicArea=True&isModal=true&asPopupView=true,0.33404630422592163
77039,AGENCIA DE EDUCACIÓN POSTSECUNDARIA DE MEDELLÍN -SAPIENCIA-,Prestación de servicios de forma temporal como profesional I en diseño gráfico; en el área de comunicaciones; para apoyar la conceptualización; diseño y ejecución de campañas publicitarias para medios convencionales y digitales que acompañen la promoción y divulgación de los diferentes programas y p,Prestación de servicios,Hombre,24.510057,18.268899669769223,146 Dia(s),0.2546365897978441,1.341627434768742,https://community.secop.gov.co/Public/Tendering/OpportunityDetail/Index?noticeUID=CO1.NTC.6502269&isFromPublicArea=True&isModal=true&asPopupView=true,0.33023637533187866
192002,MUNICIPIO DE ANSERMA CALDAS,Prestación de servicios de apoyo a la gestión en la Alcaldía de Anserma; para servir de enlace con los medios de comunicación; así como la recopilación; difusión y respuesta a través de medios audiovisuales de la ejecución de programas y actividades adelantados por la administración municipal,Prestación de servicios,Hombre,9.999999999999998,7.330922671879351,114 Dia(s),0.2669077328120647,1.3640847745344453,https://community.secop.gov.co/Public/Tendering/OpportunityDetail/Index?noticeUID=CO1.NTC.6655850&isFromPublicArea=True&isModal=true&asPopupView=true,0.3255193829536438
326942,SECRETARIA DISTRITAL DE DESARROLLO ECONOMICO - ALCALDIA BOGOTÁ,"PRESTAR LOS SERVICIOS PROFESIONALES PARA APOYAR LA CREACIÓN; REALIZACIÓN E IMPLEMENTACIÓN DE ESTRATEGIAS DE
COMUNICACIÓN Y MARKETING; A TRAVÉS DE CONTENIDOS MULTIMEDIA Y AUDIOVISUALES; REQUERIDOS PARA LA DIFUSIÓN Y DIVULGACIÓN
DE LAS ACCIONES COMUNICATIVAS LIDERADAS POR LA OFICINA ASESORA DE COMUNIC",Prestación de servicios,Hombre,29.999999999999996,21.971220044406063,120 Dia(s),0.2676259985197978,1.3654225818760612,https://community.secop.gov.co/Public/Tendering/OpportunityDetail/Index?noticeUID=CO1.NTC.6576732&isFromPublicArea=True&isModal=true&asPopupView=true,0.34865275025367737
208894,GOBERNACIÓN DE CUNDINAMARCA - SECRETARÍA DE PRENSA Y COMUNICACIONES,PRESTAR LOS SERVICIOS PROFESIONALES COMO COMMUNITY MANAGER PARA EL MANEJO DE LAS REDES SOCIALES DE LA EMISORA DE INTERES PUBLICO; PARA LA IMPLEMENTACION DE ESTRATEGIAS SOCIAL MEDIA PARA EL POSICIONAMIENTO DE LA EMISORA EL DORADO RADIO EN BUSCA DE AUMENTAR LA AUDIENCIA DE LOS MUNICIPIOS.,Prestación de servicios,Mujer,20.5,14.96994215572624,123 Dia(s),0.2697589192328663,1.3694107690428465,https://community.secop.gov.co/Public/Tendering/OpportunityDetail/Index?noticeUID=CO1.NTC.6427831&isFromPublicArea=True&isModal=true&asPopupView=true,0.30657321214675903
424678,MINTRABAJO NIVEL CENTRAL*/,Prestar servicios profesionales acompañando la creación; redacción; realización; preproducción; producción y posproducción de contenidos audiovisuales estratégicos que fortalezcan en medios televisivos; radiales y digitales la comunicación de la política pública de IVC; a las audiencias interna y ex,Prestación de servicios,No Definido,104.5465,76.05377009032716,307 Dia(s),0.2725364302934372,1.3746392831786345,https://community.secop.gov.co/Public/Tendering/OpportunityDetail/Index?noticeUID=CO1.NTC.5738010&isFromPublicArea=True&isModal=true&asPopupView=true,0.3895474076271057
325942,ALCALDIA DISTRITAL BARRANCABERMEJA,PRESTACION DE SERVICIOS PROFESIONALES COMO COMUNICADOR SOCIAL ESPECIALISTA PARA APOYAR EN LA REVISIÓN Y APROBACIÓN DE LOS PRODUCTOS COMUNICATIVOS DE LA OFICINA ASESORA DE PRENSA; COMUNICACIONES Y PROTOCOLO DE LA ALCALDIA DISTRITAL DE BARRANCABERMEJA,Prestación de servicios,Mujer,23.999999999999996,17.18333536979373,4 Mes(es),0.2840276929252611,1.3967020653155122,https://community.secop.gov.co/Public/Tendering/OpportunityDetail/Index?noticeUID=CO1.NTC.5583402&isFromPublicArea=True&isModal=true&asPopupView=true,0.3078116774559021
689025,MUNICIPIO DE COGUA,PRESTACION DE SERVICIOS PROFESIONALES PARA LA COORDINACION  DEL EQUIPO DE PRENSA Y MEDIOS DE COMUNICACIONES Y PROTOCOLO DE LA ADMINISTRACION MUNICIPAL,Prestación de servicios,Hombre,39.466660000000005,27.641751481406583,320 Dia(s),0.2996176651024794,1.4277915792183982,https://community.secop.gov.co/Public/Tendering/OpportunityDetail/Index?noticeUID=CO1.NTC.5524403&isFromPublicArea=True&isModal=true&asPopupView=true,0.32138800621032715
461676,CONTRALORIA DISTRITAL DE SANTA MARTA,PRESTAR LOS SERVICIOS PROFESIONALES COMO COMUNICADOR SOCIAL Y PERIODISTA PARA APOYAR A LA SECRETARIA GENERAL DE LA CONTRALORIA DISTRITAL DE SANTA MARTA; EN EL INTERCAMBIO DE    INFORMACIÓN ENTRE LA ADMINISTRACIÓN Y LOS CIUDADANOS A TRAVÉS DE LAS REDES SOCIALES; MEDIOS DE COMUNICACIÓN PERIDISTICOS; A,Prestación de servicios,Mujer,21.599999999999998,15.039709919721483,6 Mes(es),0.3037171333462276,1.4361979130778344,https://community.secop.gov.co/Public/Tendering/OpportunityDetail/Index?noticeUID=CO1.NTC.5818511&isFromPublicArea=True&isModal=true&asPopupView=true,0.33281612396240234
811972,MUNICIPIO DE HONDA,CONTRATAR LA PRESTACION DE SERVICIOS PROFESIONALES PARA LA DIRECCION Y CORDINACION DE LAS ACTIVIDADES DE PRENSA; MANEJO DE LOS MEDIOS DE COMUNICACION; ADMINISTRACION Y ACTUALIZACION DE LAS REDES SOCIALES DE LA ALCALDIA MUNICIPAL,Prestación de servicios,Mujer,30.974999999999998,21.544761750487844,300 Dia(s),0.30444675543219224,1.4377044572933662,https://community.secop.gov.co/Public/Tendering/OpportunityDetail/Index?noticeUID=CO1.NTC.5757562&isFromPublicArea=True&isModal=true&asPopupView=true,0.3342672884464264
678513,ESTABLECIMIENTO PUBLICO AMBIENTAL DE CARTAGENA,"Prestación de servicios profesionales como Comunicador Social para el desarrollo 
de las actividades asociadas a comunicaciones y prensa del Establecimiento 
Público Ambiental EPA CARTAGENA.",Prestación de servicios,No Definido,16.0,11.069040213189247,4 Mes(es),0.30818498667567207,1.4454731116556336,https://community.secop.gov.co/Public/Tendering/OpportunityDetail/Index?noticeUID=CO1.NTC.5599313&isFromPublicArea=True&isModal=true&asPopupView=true,0.3356879949569702
417924,INSTITUTO DEPARTAMENTAL DE DEPORTES DE CÓRDOBA INDEPORTES CÓRDOBA,PRESTACIÓN DE SERVICIOS DE UN LICENCIADO EN MEDIOS AUDIOVISUALES PARA BRINDAR APOYO EN EL ÁREA PRENSA Y COMUNICACIONES DEL INSTITUTO DEPARTAMENTAL DE DEPORTES DE CÓRDOBA - INDEPORTES CÓRDOBA,Prestación de servicios,Mujer,21.593333,14.804200081952335,158 Dia(s),0.3144087537596751,1.458595052786691,https://community.secop.gov.co/Public/Tendering/OpportunityDetail/Index?noticeUID=CO1.NTC.6438375&isFromPublicArea=True&isModal=true&asPopupView=true,0.30719542503356934
335001,INSTITUTO DEPARTAMENTAL DE DEPORTES DE CÓRDOBA INDEPORTES CÓRDOBA,PRESTACIÓN DE SERVICIOS DE UN LICENCIADO EN MEDIOS AUDIOVISUALES PARA BRINDAR APOYO EN EL ÁREA PRENSA Y COMUNICACIONES DEL INSTITUTO DEPARTAMENTAL DE DEPORTES DE CÓRDOBA-INDEPORTES CÓRDOBA,Prestación de servicios,Hombre,21.593333,14.804200081952335,158 Dia(s),0.3144087537596751,1.458595052786691,https://community.secop.gov.co/Public/Tendering/OpportunityDetail/Index?noticeUID=CO1.NTC.6438380&isFromPublicArea=True&isModal=true&asPopupView=true,0.30719542503356934
41113,ALCALDIA DEL MUNICIPIO DE AGUAZUL,PRESTACION DE SERVICIOS DE PUBLICIDAD DE ESTRATEGIAS DE COMUNICACIÓN E INFORMACIÓN DIGITAL A TRAVÉS DE PIEZAS COMUNICATIVAS ORIENTADAS A PROMOCIONAR LOS RESULTADOS DE GESTIÓN DE LA ADMINISTRACIÓN MUNICIPAL DE AGUAZUL DURANTE EL SEGUNDO SEMESTRE 2024.,Prestación de servicios,Hombre,22.427999999999997,15.350454208737649,2 Mes(es),0.31556740642332576,1.461064258752274,https://community.secop.gov.co/Public/Tendering/OpportunityDetail/Index?noticeUID=CO1.NTC.6853637&isFromPublicArea=True&isModal=true&asPopupView=true,0.30791789293289185
270622,DEPARTAMENTO DE CUNDINAMARCA-SECRETARIA GENERAL,PRESTAR LOS SERVICIOS PROFESIONALES PARA ADELANTAR LABORES PERIODÍSTICAS EN EL SISTEMA INFORMATIVO DE LA EMISORA EL DORADO RADIO; LIDERADA POR LA SECRETARÍA DE PRENSA Y COMUNICACIONES DE CUNDINAMARCA.,Prestación de servicios,Hombre,20.0,13.561814145687212,4 Mes(es),0.3219092927156394,1.4747289547807432,https://community.secop.gov.co/Public/Tendering/OpportunityDetail/Index?noticeUID=CO1.NTC.5994236&isFromPublicArea=True&isModal=true&asPopupView=true,0.3074057698249817
642793,SUPERSOCIEDADES,PRESTAR LOS SERVICIOS DE PREPRODUCCIÓN; PRODUCCIÓN; REALIZACIÓN DE MATERIAL AUDIOVISUAL; CONTENIDOS DIGITALES; CONVERGENTES; MULTIPLATAFORMA Y MULTIMEDIA PARA DIFUNDIR LAS ACCIONES MISIONALES REALIZADAS POR LA ENTIDAD A NIVEL NACIONAL Y LA TRANSMISIÓN EN DIRECTO CON LA INTERPRETACIÓN EN LENGUAJE DE,Prestación de servicios,No Definido,99.53615900000001,66.96729500444737,60 Dia(s),0.3272063571948024,1.4863398468370228,https://community.secop.gov.co/Public/Tendering/OpportunityDetail/Index?noticeUID=CO1.NTC.6896077&isFromPublicArea=True&isModal=true&asPopupView=true,0.30971065163612366
148728,EMPUMELGAR ESP**,CONTRATO DE PRESTACIÓN DE SERVICIOS PARA EL APOYO A LA GESTION EN EL PROCESO DE COMUNICACIONES EN DIFUSION DE MENSAJES AUDIOVISUALES DE LA  EMPRESA DE SERVICIOS PÚBLICOS DE MELGAR EMPUMELGAR ESP A TRAVES DEL CANAL 6 DE MULTIVISION MELGAR (TOLIMA TELEVISION) Y EN REDES SOCIALES.,Prestación de servicios,Hombre,25.2,16.93710504323451,6 Mes(es),0.32789265701450354,1.487857572806758,https://community.secop.gov.co/Public/Tendering/OpportunityDetail/Index?noticeUID=CO1.NTC.5519589&isFromPublicArea=True&isModal=true&asPopupView=true,0.33656543493270874
477965,CORPORACION PARA EL DESARROLLO SOSTENIBLE DEL AREA DE MANEJO ESPECIAL LA MACARENA - CORMACARENA,PRESTAR LOS SERVICIOS DE APOYO A LA GESTIÓN PARA EL APOYO EN LA DIVULGACIÓN DE INFORMACIÓN RELACIONADA CON MENSAJES DE EDUCACIÓN AMBIENTAL Y PARTICIPACIÓN CIUDADANA; A TRAVÉS DE UN MEDIO DE COMUNICACIÓN DIGITAL Y RADIAL CON COBERTURA EN EL DEPARTAMENTO DEL META.,Prestación de servicios,Hombre,6.000000000000002,3.9904207038685025,3 Mes(es),0.33492988268858315,1.5036008594741197,https://community.secop.gov.co/Public/Tendering/OpportunityDetail/Index?noticeUID=CO1.NTC.6738790&isFromPublicArea=True&isModal=true&asPopupView=true,0.3014093339443207
471474,MUNICIPIO DE SALENTO,CONTRATO DE PRESTACIÓN DE SERVICIOS PROFESIONALES COMO COMUNICADOR SOCIAL Y PERIODISTA PARA ACOMPAÑAR A LA SECRETARIA DE GOBIERNO; ADMINISTRATIVA Y TICS EN LA CREACIÓN; DIFUSION Y PUBLICACIÓN DE CONTENIDO PARA LAS REDES SOCIALES; PÁGINA WEB Y DIFERENTES MEDIOS DE COMUNICACIÓN EXTERNOS; EN ARAS DE AP,Prestación de servicios,Hombre,15.499999999999998,10.2700752700389,5 Mes(es),0.33741449870716766,1.5092391820358382,https://community.secop.gov.co/Public/Tendering/OpportunityDetail/Index?noticeUID=CO1.NTC.5659411&isFromPublicArea=True&isModal=true&asPopupView=true,0.32111597061157227
605518,EMPRESA DE ENERGÍA DE CASANARE S.A. E.S.P.,EMITIR INFORMACIÓN DE INTERÉS GENERAL DE LA EMPRESA DE ENERGÍA DE CASANARE ENERCA S.A.  E.S.P.; A TRAVÉS DE MEDIOS DE COMUNICACIÓN AUDITIVO; ESCRITO Y VIRTUAL; PRODUCCIÓN AUDIOVISUAL.,Prestación de servicios,Hombre,80.91999999999999,53.543814943118456,2 Mes(es),0.3383117283351648,1.5112856655052362,https://community.secop.gov.co/Public/Tendering/OpportunityDetail/Index?noticeUID=CO1.NTC.5600047&isFromPublicArea=True&isModal=true&asPopupView=true,0.3069421052932739
66068,UNIDADES TECNOLOGICAS DE SANTANDER,PRESTAR SERVICIOS PROFESIONALES COMO COMUNICADOR SOCIAL DE APOYO EN LOS PROCESOS DEL GRUPO DE PRENSA Y MEDIOS DE REPRESENTACIÓN INSTITUCIONAL ADSCRITO A LA SECRETARIA GENERAL DE LAS UNIDADES TECNOLÓGICAS DE SANTANDER.,Prestación de servicios,Hombre,17.276666000000002,11.377127614047717,133 Dia(s),0.34147435540817217,1.5185437472519803,https://community.secop.gov.co/Public/Tendering/OpportunityDetail/Index?noticeUID=CO1.NTC.6410218&isFromPublicArea=True&isModal=true&asPopupView=true,0.313880980014801
773668,GOBERNACIÓN DE CUNDINAMARCA - SECRETARÍA DE PRENSA Y COMUNICACIONES,PRESTAR LOS SERVICIOS PROFESIONALES A LA SECRETARÍA DE PRENSA Y COMUNICACIONES PARA REALIZAR LAS LABORES PERIODÍSTICAS Y DE REDACCIÓN QUE APORTEN A  LA ESTRATEGIA DE RECONOCIMIENTO Y POSICIONAMIENTO DE LA EMISORA EL DORADO RADIO EN BUSCA DE AUMENTAR LA AUDIENCIA EN LOS MUNICIPIOS,Prestación de servicios,No Definido,39.599999999999994,25.796852457129447,198 Dia(s),0.34856433189067043,1.5350709961926299,https://community.secop.gov.co/Public/Tendering/OpportunityDetail/Index?noticeUID=CO1.NTC.6253680&isFromPublicArea=True&isModal=true&asPopupView=true,0.30028921365737915
260415,SECRETARÍA DISTRITAL DE MOVILIDAD,PRESTAR SERVICIOS PROFESIONALES ESPECIALIZADOS A LA OFICINA ASESORA DE COMUNICACIONES Y CULTURA PARA LA MOVILIDAD DE LA SECRETARIA DISTRITAL DE MOVILIDAD PARA LA ELABORACION DE PRODUCTOS DE COMUNICACION MASIVA REDACCION DE BOLETINES DE PRENSA PRODUCCION DE PIEZAS INFORMATIVAS Y DIVULGATIVAS PARA DIF,Prestación de servicios,Hombre,49.66749999999998,32.31426775531512,5 Mes(es),0.3493880755964135,1.5370145588965285,https://community.secop.gov.co/Public/Tendering/OpportunityDetail/Index?noticeUID=CO1.NTC.6749438&isFromPublicArea=True&isModal=true&asPopupView=true,0.3129875063896179
542086,EMPRESA SOCIAL DEL ESTADO HOSPITAL SAN ANTONIO DE ARBELAEZ,PRESTAR SERVICIO DE PAUTAS PUBLICITARIAS EN EL PROGRAMA  RADIAL (NOTICIERO)  QUE EMITE LA EMISORA ORTIZ APOLINAR COMUNICACIONES K.C RADIO ON LINE A FIN DE PROMOCIONAR LOS DIFERENTES PROGRAMAS DE PROMOCION Y PREVENCION DE SALUD PUBLICA DE LA E.S.E. HOSPITAL SAN ANTONIO DE ARBELAEZ,Prestación de servicios,No Definido,6.000000000000002,3.9036707462615885,103 Dia(s),0.3493882089564021,1.5370148739480645,https://community.secop.gov.co/Public/Tendering/OpportunityDetail/Index?noticeUID=CO1.NTC.5864523&isFromPublicArea=True&isModal=true&asPopupView=true,0.3634569048881531
399759,MUNICIPIO DE ARMENIA QUINDIO,PRESTACIÓN DE SERVICIOS PROFESIONALES  APOYANDO LA PRODUCCIÓN; EDICIÓN  Y REDACCIÓN DE LOS CONTENIDOS  AUDIVISUALES EN MEDIOS INSTITUCIONALES; CREACIÓN DE CAMPAÑAS PUBLICITARIAS; EN ESPACIOS FISICOS; EN MEDIOS Y EN REDES SOCIALES INSTITUCIONALES  DEL MUNICIPIO DE ARMENIA.,Prestación de servicios,No Definido,7.999999999999998,5.198470424837437,60 Dia(s),0.35019119689532024,1.5389142086443954,https://community.secop.gov.co/Public/Tendering/OpportunityDetail/Index?noticeUID=CO1.NTC.6921930&isFromPublicArea=True&isModal=true&asPopupView=true,0.3618367910385132
748589,LOTERIA DE BOYCA,"PRESTACIÓN DEL SERVICIO DE RADIODIFUSIÓN CONSISTENTE EN ESPACIO PUBLICITARIO A TRAVÉS
DEL MEDIO RADIAL RADIO LA PAZ 710 AM PARA PROMOCIONAR LOS PRODUCTOS Y/O CAMPAÑAS
PUBLICITARIAS DE LA LOTERIA DE BOYACÁ Y SUS DIFERENTES SORTEOS AÑO 2024",Prestación de servicios,Hombre,7.5,4.86987445212902,5 Mes(es),0.3506834063827974,1.5400807708135344,https://community.secop.gov.co/Public/Tendering/OpportunityDetail/Index?noticeUID=CO1.NTC.6087504&isFromPublicArea=True&isModal=true&asPopupView=true,0.4391478896141052
125602,RADIO TELEVISION NACIONAL DE COLOMBIA.,EL CONTRATISTA se obliga a prestar sus servicios de corresponsalía en la ciudad de Medellín; Antioquia; desarrollando actividades de registro audiovisual o reportería de forma transversal para RTVC.,Prestación de servicios,Hombre,10.452,6.753473402784104,39 Dia(s),0.3538582660941347,1.5476480585073729,https://community.secop.gov.co/Public/Tendering/OpportunityDetail/Index?noticeUID=CO1.NTC.7085785&isFromPublicArea=True&isModal=true&asPopupView=true,0.3042394518852234
434445,CENTRO CULTURAL BACATA,"PRESTACIÓN DE SERVICIOS DE APOYO A LA GESTIÓN EN LA PRODUCCIÓN;
REGISTRO AUDIOVISUAL; TRASMISIONES Y DIVULGACIÓN DE EVENTOS; ASÍ
COMO INSTRUCTOR EN LA ESCUELA DE COMUNICACIONES Y MEDIOS
AUDIOVISUALES DEL CENTROCULTURAL BACATÁ DEL MUNICIPIO DE FUNZA.",Prestación de servicios,Hombre,17.920000000000005,11.55229771526038,168 Dia(s),0.35534052928234505,1.5512065600878693,https://community.secop.gov.co/Public/Tendering/OpportunityDetail/Index?noticeUID=CO1.NTC.6343038&isFromPublicArea=True&isModal=true&asPopupView=true,0.30724698305130005
