,Nombre Entidad,Descripcion del Proceso,Tipo de Contrato,Género Representante Legal,Valor real,Valor Proyectado,Duración del contrato,Tamaño valor extraño,veces la predicción,URLProceso,similarity
181455,UNIATLANTICO,Prestar servicios profesionales de apoyo a la gestión en la generación; edición; análisis de métricas; creación de piezas publicitarias; creación de contenido para redes sociales y estrategias de marketing digital; que permitan la divulgación; visualización y promoción cultural de las estrategias e,Prestación de servicios,Hombre,39.0,33.046289649501304,170 Dia(s),0.15265923975637682,1.1801627478801857,https://community.secop.gov.co/Public/Tendering/OpportunityDetail/Index?noticeUID=CO1.NTC.6328195&isFromPublicArea=True&isModal=true&asPopupView=true,0.3026256263256073
1255412,UNIATLANTICO,Prestar servicios profesionales de apoyo a la gestión en la generación; edición; análisis de métricas; creación de piezas publicitarias; creación de contenido para redes sociales y estrategias de marketing digital; que permitan la divulgación; visualización y promoción cultural de las estrategias e,Prestación de servicios,Mujer,39.0,33.046289649501304,161 Dia(s),0.15265923975637682,1.1801627478801857,https://community.secop.gov.co/Public/Tendering/OpportunityDetail/Index?noticeUID=CO1.NTC.6366811&isFromPublicArea=True&isModal=true&asPopupView=true,0.3026256263256073
27128,ALCALDIA LOCAL DE TUNJUELITO,"PRESTAR LOS SERVICIOS PROFESIONALES EN TEMAS DE PRENSA Y
COMUNICACIONES DE LA ALCALDÍA LOCAL DE TUJNJUELITO EN LA REALIZACIÓN Y
PUBLICACIÓN DE CONTENIDOS DE REDES SOCIALES EN SUS CANALES DE DIVULGACIÓN
DIGITAL; PARA EL DESARROLLO DE ACCIONES DE GOBIERNO ABIERTO",Prestación de servicios,Mujer,31.800000000000004,26.887677099731807,6 Mes(es),0.15447556290151562,1.1826979282013617,https://community.secop.gov.co/Public/Tendering/OpportunityDetail/Index?noticeUID=CO1.NTC.5794092&isFromPublicArea=True&isModal=true&asPopupView=true,0.32734593749046326
1066450,FONDO DE DESARROLLO LOCAL DE SANTA FE - FDLSF,PRESTAR SERVICIOS TECNICOS RELACIONADOS CON LA REALIZACIÓN Y PUBLICACIÓN DE CONTENIDOS DE REDES SOCIALES Y CANALES DE DIVULGACIÓN DIGITAL (SITIO WEB) DE LA OFICINA DE PRENSA Y COMUNICACIONES DE LA ALCALDÍA LOCAL DE SANTA FE.,Prestación de servicios,Mujer,35.28,29.821699609289116,8 Mes(es),0.15471372989543325,1.1830311639585656,https://community.secop.gov.co/Public/Tendering/OpportunityDetail/Index?noticeUID=CO1.NTC.7515143&isFromPublicArea=True&isModal=true&asPopupView=true,0.31962811946868896
817829,CENTRO CULTURAL BACATA,PRESTACIÓN DE SERVICIOS DE APOYO A LA GESTIÓN COMO INSTRUCTORA DE PRODUCCIÓN AUDIOVISUAL DE LA ESCUELA DE COMUNICACIONES Y MEDIOS AUDIOVISUALES DEL CENTRO CULTURAL BACATÁ DEL MUNICIPIO DE FUNZA.,Prestación de servicios,Mujer,9.161778,7.723817181961608,115 Dia(s),0.1569521568890222,1.1861723010995964,https://community.secop.gov.co/Public/Tendering/OpportunityDetail/Index?noticeUID=CO1.NTC.6526676&isFromPublicArea=True&isModal=true&asPopupView=true,0.3026462495326996
895878,MINCULTURA,PRESTAR LOS SERVICIOS PROFESIONALES EN EL GRUPO DE DIVULGACIÓN Y PRENSA PARA APOYAR LA PREPRODUCCIÓN; PRODUCCIÓN Y POSTPRODUCCIÓN DE VIDEOS Y CONTENIDOS INSTITUCIONALES PARA LA DIVULGACIÓN EN MEDIOS DIGITALES DE LA ENTIDAD Y EN DIFERENTES PLATAFORMAS DE DIVULGACIÓN.,Prestación de servicios,No Definido,59.602484999999994,50.18842205404006,9 Mes(es),0.15794749071217307,1.1875743958601328,https://community.secop.gov.co/Public/Tendering/OpportunityDetail/Index?noticeUID=CO1.NTC.5658321&isFromPublicArea=True&isModal=true&asPopupView=true,0.37141919136047363
1201505,RADIO TELEVISION NACIONAL DE COLOMBIA.,EL CONTRATISTA se obliga a prestar sus servicios desarrollando actividades de registro audiovisual y/o reportería para los contenidos audiovisuales y/o transmisiones de RTVC.,Prestación de servicios,No Definido,28.165284000000003,23.590019898980707,180 Dia(s),0.16244338601447428,1.1939491412305672,https://community.secop.gov.co/Public/Tendering/OpportunityDetail/Index?noticeUID=CO1.NTC.6282261&isFromPublicArea=True&isModal=true&asPopupView=true,0.35141921043395996
381662,SECRETARÍA GENERAL DE LA ALCALDÍA MAYOR DE BOGOTÁ,"Prestar servicios de apoyo a la gestión; para la actualización de medios y 
contenidos de las redes sociales que requiere la Oficina Consejería de 
Comunicaciones en el desarrollo de acciones de comunicación pública.",Prestación de servicios,No Definido,24.504678,20.496295509575642,4 Mes(es),0.16357621554645022,1.1955661933421913,https://community.secop.gov.co/Public/Tendering/OpportunityDetail/Index?noticeUID=CO1.NTC.5520326&isFromPublicArea=True&isModal=true&asPopupView=true,0.3150705099105835
1265944,MUNICIPIO DE SANTA ROSA DE CABAL,PRESTACIÓN DE SERVICIOS PROFESIONALES PARA REALIZAR EL MATERIAL AUDIOVISUAL DE LA GESTIÓN ADMINISTRATIVA CON EL FIN DE SER PUBLICADO Y DIFUNDIDO EN MEDIOS DE COMUNICACIÓN INTERNO Y EXTERNO,Prestación de servicios,Hombre,18.000000000000004,15.006433271598631,6 Mes(es),0.1663092626889651,1.1994855589080609,https://community.secop.gov.co/Public/Tendering/OpportunityDetail/Index?noticeUID=CO1.NTC.5626865&isFromPublicArea=True&isModal=true&asPopupView=true,0.3344670832157135
339147,MUNICIPIO DE NEIVA,PRESTAR LOS SERVICIOS PROFESIONALES APOYANDO LA COORDINACIÓN AUDIOVISUAL PARA LA DIVULGACIÓN DE LA INFORMACIÓN A LOS MEDIOS TRADICIONALES Y DIGITALES DE LAS ACTIVIDADES DESARROLLADAS POR LA ALCALDIA DE NEIVA,Prestación de servicios,No Definido,25.0,20.638705972916828,5 Mes(es),0.17445176108332688,1.2113162536840385,https://community.secop.gov.co/Public/Tendering/OpportunityDetail/Index?noticeUID=CO1.NTC.5805559&isFromPublicArea=True&isModal=true&asPopupView=true,0.40277689695358276
1096758,SECRETARIA GENERAL Y DE CERCANIA AL CIUDADANO,PRESTAR LOS SERVICIOS  DE APOYO A LA GESTIÓN EN LA REALIZACIÓN Y EDICION DE MATERIAL AUDIOVISUAL PARA LAS DIFERENTES CAMPAÑAS Y ESTRATEGIAS DISEÑADAS PARA PROMOVER; FORTALECER Y CONSOLIDAR LA IMAGEN DEL DEPARTAMENTO EN MEDIOS DIGITALES; REDES SOCIALES Y BUSCADORES WEB.,Prestación de servicios,Hombre,20.332,16.768052975209415,4 Mes(es),0.17528757745379628,1.212543879128941,https://community.secop.gov.co/Public/Tendering/OpportunityDetail/Index?noticeUID=CO1.NTC.6111791&isFromPublicArea=True&isModal=true&asPopupView=true,0.32404959201812744
1027056,UNIDAD ADMINISTRATIVA ESPECIAL CUERPO OFICIAL DE BOMBEROS DE BOGOTA,Prestación de servicios profesionales en asuntos de comunicaciones y prensa para apoyar la conducción; presentación y divulgación de contenidos audiovisuales e informativos relacionados con la misionalidad de la UAECOB,Prestación de servicios,No Definido,42.0,34.621599269994476,6 Mes(es),0.17567620785727436,1.2131155372825357,https://community.secop.gov.co/Public/Tendering/OpportunityDetail/Index?noticeUID=CO1.NTC.7955335&isFromPublicArea=True&isModal=true&asPopupView=true,0.3611113429069519
847922,ALCALDIA MUNICIPIO DE APARTADO,PRESTACIÓN DE SERVICIOS PARA LA GENERACIÓN DE CONTENIDO AUDIOVISUAL E INFORMATIVO EN LA OFICINA DE COMUNICACIONES DE LA ALCALDÍA DE APARTADÓ,Prestación de servicios,Hombre,27.000000000000004,22.22285787419654,9 Mes(es),0.17693118984457276,1.214965246722399,https://community.secop.gov.co/Public/Tendering/OpportunityDetail/Index?noticeUID=CO1.NTC.5798932&isFromPublicArea=True&isModal=true&asPopupView=true,0.3010888993740082
256352,ALCALDIA MUNICIPAL DE CHIA,PRESTACIÓN DE SERVICIOS PROFESIONALES COMO COMUNICADOR SOCIAL EN LA OFICINA ASESORA DE COMUNICACIÓN; PRENSA Y PROTOCOLO COMO PERIODISTA PARA APOYAR LA PRODUCCIÓN DE CONTENIDOS INFORMATIVOS; TEXTUALES; AUDIOVISUALES Y RADIALES SOBRE LAS ACTIVIDADES DESARROLLADAS POR LA ALCALDÍA DE CHÍA,Prestación de servicios,Hombre,43.083333,35.45814574696805,235 Dia(s),0.1769869395441609,1.2150475466891544,https://community.secop.gov.co/Public/Tendering/OpportunityDetail/Index?noticeUID=CO1.NTC.6075364&isFromPublicArea=True&isModal=true&asPopupView=true,0.41598090529441833
1032198,GOBIERNO DEPARTAMENTAL,PRESTAR POR SUS PROPIOS MEDIOS Y CON PLENA AUTONOMÍA LOS SERVICIOS DE UN MEDIO DE COMUNICACIÓN RADIAL Y DIGITAL PARA EL INTERCAMBIO INFORMATIVO DE LOS TEMAS INHERENTES AL FORTALECIMIENTO DE ESTRATEGIA DE DIVULGACIÓN DE LAS CAMPAÑAS VIENTES DE LA GOBERNACIÓN DEL TOLIMA,Prestación de servicios,Mujer,67.99999999999999,55.83364432232175,60 Dia(s),0.17891699525997404,1.217903664096206,https://community.secop.gov.co/Public/Tendering/OpportunityDetail/Index?noticeUID=CO1.NTC.6945186&isFromPublicArea=True&isModal=true&asPopupView=true,0.30782583355903625
497598,ALCALDIA LOCAL DE SAN CRISTOBAL,PRESTAR SUS SERVICIOS TÉCNICOS PARA APOYAR AL ALCALDE LOCAL EN TEMAS DE PRENSA Y COMUNICACIONES EN LA REALIZACIÓN Y PUBLICACIÓN DE CONTENIDOS DE REDES SOCIALES Y CANALES DE DIVULGACIÓN DIGITAL (SITIO WEB) DE LA ALCALDÍA LOCAL.,Prestación de servicios,Mujer,28.8,23.630086960970722,6 Mes(es),0.17951086941073885,1.218785188880951,https://community.secop.gov.co/Public/Tendering/OpportunityDetail/Index?noticeUID=CO1.NTC.7473077&isFromPublicArea=True&isModal=true&asPopupView=true,0.30678191781044006
767665,MUNICIPIO DE LA UNION ANTIOQUIA,PRESTACIÓN DE SERVICIOS DE PRODUCCIÓN AUDIOVISUAL Y CAMPAÑAS PUBLICITARIAS DE LAS DIFERENTES ACTIVIDADES QUE DESARROLLE LA ADMINISTRACIÓN MUNICIPAL,Prestación de servicios,Hombre,27.599999999999998,22.596574192914282,11 Mes(es),0.1812835437349897,1.221424086871304,https://community.secop.gov.co/Public/Tendering/OpportunityDetail/Index?noticeUID=CO1.NTC.7351101&isFromPublicArea=True&isModal=true&asPopupView=true,0.3044798672199249
861494,GOBERNACIÓN DE CUNDINAMARCA - SECRETARÍA DE PRENSA Y COMUNICACIONES,PRESTAR SERVICIOS PROFESIONALES PARA LA GENERACIÓN Y GESTIÓN DE LOS DIFERENTES CONTENIDOS EDITORIALES; AUDIOVISUALES Y RADIALES DE LA GOBERNACIÓN DE CUNDINAMARCA; CONTRIBUYENDO A LA ESTRATEGIA DE RECONOCIMIETO Y POSICIONAMIENTO DE LA EMISORA EL DORADO RADIO EN BUSCA DE AUMENTAR LA AUDIENCIA EN LOS,Prestación de servicios,Hombre,36.833333,30.13758516807904,170 Dia(s),0.18178501065654212,1.222172672248901,https://community.secop.gov.co/Public/Tendering/OpportunityDetail/Index?noticeUID=CO1.NTC.6380283&isFromPublicArea=True&isModal=true&asPopupView=true,0.30913615226745605
50901,ALCALDÍA MUNICIPAL DE SOPO,"PRESTACIÓN DE SERVICIOS PROFESIONALES PARA BRINDAR ACOMPAÑAMIENTO EN EL
PROCESO DE GENERACIÓN DE CONTENIDO AUDIOVISUAL; EDICIÓN Y PUBLICACIÓN EN
LOS DIFERENTES MEDIOS DE COMUNICACIÓN DE LA ADMINISTTACIÓN MUNICIPAL DE
SOPÓ.",Prestación de servicios,Hombre,29.900000000000002,24.4093061246031,10 Mes(es),0.18363524666879275,1.2249426447178937,https://community.secop.gov.co/Public/Tendering/OpportunityDetail/Index?noticeUID=CO1.NTC.5731581&isFromPublicArea=True&isModal=true&asPopupView=true,0.38806381821632385
320620,ALCALDIA MUNICIPAL DE ARMERO GUAYABAL,PRESTAR LOS SERVICIOS PROFESIONALES COMO COMUNICADOR SOCIAL PARA LA RECOPILACION; REDACCION Y SU POSTERIOR DIVULGACION EN LOS DIFERENTES MEDIOS DE COMUNICACION SOBRE LOS PROGRAMAS; PROYECTOS Y ACTIVIDADES QUE LA ADMINISTRACION MUNICIPAL REALICE EN EL MUNICIPIO DE ARMERO GUAYABAL,Prestación de servicios,Hombre,16.8,13.696817334882748,120 Dia(s),0.1847132538760269,1.2265623165765769,https://community.secop.gov.co/Public/Tendering/OpportunityDetail/Index?noticeUID=CO1.NTC.6619372&isFromPublicArea=True&isModal=true&asPopupView=true,0.3202528655529022
465771,MINCIENCIAS,El Contratista se obliga a prestar a la Entidad; con plena autonomía técnica y administrativa; los servicios profesionales especializados de realización y edición de video para los contenidos audiovisuales; digitales y multiformato de la Estrategia de Divulgación y Comunicación Pública de la CTeI; u,Prestación de servicios,Hombre,57.68,46.890271085031706,8 Mes(es),0.18706187439265418,1.2301059188888457,https://community.secop.gov.co/Public/Tendering/OpportunityDetail/Index?noticeUID=CO1.NTC.7394278&isFromPublicArea=True&isModal=true&asPopupView=true,0.3208460509777069
1292156,ALCALDIA LOCAL DE SAN CRISTOBAL,PRESTAR SUS SERVICIOS TÉCNICOS PARA APOYAR AL ALCALDE LOCAL EN TEMAS DE PRENSA Y COMUNICACIONES EN LA REALIZACIÓN Y PUBLICACIÓN DE CONTENIDOS DE REDES SOCIALES Y CANALES DE DIVULGACIÓN DIGITAL (SITIO WEB) DE LA ALCALDÍA LOCAL,Prestación de servicios,Hombre,28.560000000000006,23.184835581534852,6 Mes(es),0.18820603706110478,1.2318396608663513,https://community.secop.gov.co/Public/Tendering/OpportunityDetail/Index?noticeUID=CO1.NTC.5858707&isFromPublicArea=True&isModal=true&asPopupView=true,0.30223631858825684
777229,FONDO DE DESARROLLO LOCAL DE SANTA FE - FDLSF,Apoyar al equipo de prensa y comunicaciones de la Alcaldía Local en la realización y publicación de contenidos de redes sociales y canales de divulgación digital (sitio web) de la Alcaldía local.,Prestación de servicios,Mujer,33.0,26.756168633188114,6 Mes(es),0.1892070111155117,1.2333604430593659,https://community.secop.gov.co/Public/Tendering/OpportunityDetail/Index?noticeUID=CO1.NTC.5793785&isFromPublicArea=True&isModal=true&asPopupView=true,0.33494308590888977
707553,ALCALDIA MUNICIPAL DE PUERTO SALGAR,PRESTACIÓN DE SERVICIOS DE APOYO A LA GESTIÓN PARA LA INVESTIGACIÓN; CONCEPTUALIZACIÓN; DISEÑO Y DESARROLLO DE CONTENIDO EN PRENSA ESCRITA; TELEVISIÓN; RADIO; Y MEDIOS DIGITALES PARA EL MUNICIPIO DE PUERTO SALGAR - CUNDINAMARCA.,Prestación de servicios,Mujer,28.0,22.67959086854322,10 Mes(es),0.19001461183774218,1.2345901723842925,https://community.secop.gov.co/Public/Tendering/OpportunityDetail/Index?noticeUID=CO1.NTC.5724603&isFromPublicArea=True&isModal=true&asPopupView=true,0.3030940592288971
277020,RADIO TELEVISION NACIONAL DE COLOMBIA.,EL CONTRATISTA se obliga a prestar sus servicios de corresponsalía en la ciudad de Cali Valle del Cauca desarrollando actividades de registro audiovisual o reportería de forma transversal para el servicio informativo de RTVC.,Prestación de servicios,Hombre,25.828017000000003,20.883505873971608,3 Mes(es),0.1914398277664288,1.2367663339607666,https://community.secop.gov.co/Public/Tendering/OpportunityDetail/Index?noticeUID=CO1.NTC.7876535&isFromPublicArea=True&isModal=true&asPopupView=true,0.32682862877845764
663647,EMPRESA IBAGUEREÑA DE ACUEDUCTO Y ALCANTARILLADO SA ESP OFICIAL IBAL SA ESP OFICIAL,CONTRATAR EL SERVICIO DE PUBLICIDAD EN UN ESPACIO DIGITAL E IMPRESO PARA LA TRANSMISIÓN DE CONTENIDO; Y PUBLICACIÓN DE ARTICULOS INFORMATIVOS INSTITUCIONALES DE CAMPAÑAS Y MENSAJES DEL IBAL S.A. E.S.P. OFICIAL DE CONFORMIDAD CON EL PLAN DE MEDIOS APROBADO POR LA GERENCIA,Prestación de servicios,Mujer,30.000000000000007,24.24655280146829,6 Mes(es),0.19178157328439052,1.2372892858478137,https://community.secop.gov.co/Public/Tendering/OpportunityDetail/Index?noticeUID=CO1.NTC.5993993&isFromPublicArea=True&isModal=true&asPopupView=true,0.35653769969940186
373511,MINISTERIO DE SALUD Y PROTECCIÓN SOCIAL,"Prestar servicios profesionales para apoyar al Grupo de Comunicaciones en la edición; producción y realización de
contenidos audiovisuales; con el propósito de documentar y divulgar las acciones adelantadas por el Ministerio de
Salud y Protección Social; fortaleciendo la comunicación estratégica y c",Prestación de servicios,Mujer,50.99999999999999,41.21347879330767,6 Mes(es),0.1918925726802416,1.2374592364739052,https://community.secop.gov.co/Public/Tendering/OpportunityDetail/Index?noticeUID=CO1.NTC.7503614&isFromPublicArea=True&isModal=true&asPopupView=true,0.30200836062431335
762613,ALCALDÍA MUNICIPAL DE MADRID CUNDINAMARCA,PRESTACIÓN DE SERVICIOS PROFESIONALES DE LA OFICINA DE PRENSA E IMAGEN CORPORATIVA PARA EL CUBRIMIENTO Y EDICION AUDIOVISUAL  DE LOS DIFERENTES PROGRAMAS; EVENTOS Y CAMPAÑAS  QUE ADELANTA  ADMINISTRACION MUNICIPAL,Prestación de servicios,Hombre,11.600000000000001,9.370647425813988,4 Mes(es),0.1921855667401735,1.2379080625789693,https://community.secop.gov.co/Public/Tendering/OpportunityDetail/Index?noticeUID=CO1.NTC.6528786&isFromPublicArea=True&isModal=true&asPopupView=true,0.3156154751777649
218904,ALCALDÍA MUNICIPAL DE MADRID CUNDINAMARCA,PRESTACIÓN DE SERVICIOS PROFESIONALES DE LA OFICINA DE PRENSA E IMAGEN CORPORATIVA PARA EL CUBRIMIENTO Y EDICION AUDIOVISUAL  DE LOS DIFERENTES PROGRAMAS; EVENTOS Y CAMPAÑAS  QUE ADELANTA  ADMINISTRACION MUNICIPAL,Prestación de servicios,Hombre,11.600000000000001,9.370647425813988,4 Mes(es),0.1921855667401735,1.2379080625789693,https://community.secop.gov.co/Public/Tendering/OpportunityDetail/Index?noticeUID=CO1.NTC.6528373&isFromPublicArea=True&isModal=true&asPopupView=true,0.3156154751777649
1258093,UNIDADES TECNOLOGICAS DE SANTANDER,PRESTAR SERVICIOS PROFESIONALES DE COMUNICACIÓN SOCIAL DE APOYO EN LOS PROCESOS DEL GRUPO DE PRENSA Y MEDIOS DE REPRESENTACIÓN INSTITUCIONAL ADSCRITO A LA SECRETARIA GENERAL DE LAS UNIDADES TECNOLÓGICAS DE SANTANDER.,Prestación de servicios,Mujer,21.0,16.951265450862238,6 Mes(es),0.1927968832922744,1.2388455635288174,https://community.secop.gov.co/Public/Tendering/OpportunityDetail/Index?noticeUID=CO1.NTC.7669163&isFromPublicArea=True&isModal=true&asPopupView=true,0.31566309928894043
601038,ALCALDIA LOCAL DE SAN CRISTOBAL,PRESTAR SUS SERVICIOS TÉCNICOS PARA APOYAR AL ALCALDE LOCAL EN TEMAS DE PRENSA Y COMUNICACIONES EN LA REALIZACIÓN Y PUBLICACIÓN DE CONTENIDOS DE REDES SOCIALES Y CANALES DE DIVULGACIÓN DIGITAL (SITIO WEB) DE LA ALCALDÍA LOCAL.,Prestación de servicios,Mujer,28.578000000000003,22.99518395367477,4 Mes(es),0.1953536302864173,1.242781969371159,https://community.secop.gov.co/Public/Tendering/OpportunityDetail/Index?noticeUID=CO1.NTC.6414145&isFromPublicArea=True&isModal=true&asPopupView=true,0.30678191781044006
555679,ALCALDIA MUNICIPAL DE RESTREPO META,PRESTACION DE SERVICIOS PROFESIONALES COMO COMUNICADOR SOCIAL Y PERIODISTA PARA APOYAR AL DESPACHO MUNICIPAL EN ACTIVIDADES ESTRATEGICAS E INFORMATIVAS PARA CONTENIDOS DE REDES SOCIALES Y PAGINA WEB DE LA ALCALDIA DE RESTREPO - META,Prestación de servicios,Mujer,13.933333,11.144675208188117,110 Dia(s),0.20014290850666402,1.2502233344371512,https://community.secop.gov.co/Public/Tendering/OpportunityDetail/Index?noticeUID=CO1.NTC.6614801&isFromPublicArea=True&isModal=true&asPopupView=true,0.3287732005119324
1255632,ALCALDIA MUNICIPAL DE CHIA,PRESTACIÓN DE SERVICIOS PROFESIONALES COMO COMUNICADOR SOCIAL EN LA OFICINA ASESORA DE COMUNICACIÓN; PRENSA Y PROTOCOLO COMO PERIODISTA PARA APOYAR LA PRODUCCIÓN DE CONTENIDOS INFORMATIVOS; TEXTUALES; AUDIOVISUALES Y RADIALES SOBRE LAS ACTIVIDADES DESARROLLADAS POR LA ALCALDÍA DE CHÍA EN TEMAS CULTU,Prestación de servicios,Mujer,39.750000000000014,31.738213434682415,225 Dia(s),0.20155437900170056,1.2524334453105226,https://community.secop.gov.co/Public/Tendering/OpportunityDetail/Index?noticeUID=CO1.NTC.6145928&isFromPublicArea=True&isModal=true&asPopupView=true,0.41613292694091797
184636,CONCEJO MUNICIPAL DE BUCARAMANGA,PRESTAR SERVICIOS PROFESIONALES EN MEDIOS AUDIOVISUALES Y APOYAR EN LAS COMUNICACIONES ESTRATÉGICAS DEL CONCEJO MUNICIPAL DE BUCARAMANGA,Prestación de servicios,Mujer,13.200000000000001,10.440244920684579,4 Mes(es),0.20907235449359254,1.264338154926586,https://community.secop.gov.co/Public/Tendering/OpportunityDetail/Index?noticeUID=CO1.NTC.6540789&isFromPublicArea=True&isModal=true&asPopupView=true,0.3163992762565613
963050,ALCALDIA DISTRITO DE RIOHACHA,PRODUCCIÓN DE MATERIAL PUBLICITARIO AUDIOVISUAL PARA LA PROMOCIÓN TURÍSTICA Y CULTURAL DEL DISTRITO DE RIOHACHA.,Prestación de servicios,Hombre,31.400000000000002,24.774514831629197,2 Mes(es),0.21100271236849696,1.2674314800268929,https://community.secop.gov.co/Public/Tendering/OpportunityDetail/Index?noticeUID=CO1.NTC.6652954&isFromPublicArea=True&isModal=true&asPopupView=true,0.33495455980300903
411794,ALCALDIA LOCAL DE USME,APOYAR AL EQUIPO DE PRENSA Y COMUNICACIONES DE LA ALCALDÍA LOCAL EN LA REALIZACIÓN Y PUBLICACIÓN DE CONTENIDOS DE REDES SOCIALES Y CANALES DE DIVULGACIÓN DIGITAL (SITIO WEB) DE LA ALCALDÍA LOCAL,Prestación de servicios,Mujer,35.75,28.18639474066579,4 Mes(es),0.2115693778834744,1.2683424158685273,https://community.secop.gov.co/Public/Tendering/OpportunityDetail/Index?noticeUID=CO1.NTC.6785103&isFromPublicArea=True&isModal=true&asPopupView=true,0.33045846223831177
554179,CONCEJO MUNICIPAL DE PIEDECUESTA,"PRESTAR SERVICIOS DE APOYO A LA GESTIÓN PARA REALIZAR LA TRANSMISIÓN EN VIVO DE
MATERIAL AUDIOVISUAL DE LAS SESIONES Y PUBLICACIÓN DE ACTOS ADMINISTRATIVOS E
INFORMATIVOS EN LAS REDES SOCIALES DEL CONCEJO MUNICIPAL DE PIEDECUESTA",Prestación de servicios,Mujer,12.000000000000002,9.434152162226253,6 Mes(es),0.21382065314781237,1.2719743961780945,https://community.secop.gov.co/Public/Tendering/OpportunityDetail/Index?noticeUID=CO1.NTC.5427330&isFromPublicArea=True&isModal=true&asPopupView=true,0.3196146488189697
1299600,MUNICIPIO DE PEREIRA- OFICIAL,PRESTACION DE SERVICIOS PROFESIONALES PARA REALIZAR ACTIVIDADES DE MONITOREO EN RADIO; PRENSA Y REDES SOCIALES DE LAS PUBLICACIONES DE LA ADMINISTRACION DEL SECTOR CENTRAL Y DESCENTRALIZADO DEL MUNICIPIO DE PEREIRA.,Prestación de servicios,Mujer,30.400000000000002,23.88272749205901,8 Mes(es),0.21438396407700627,1.272886441052764,https://community.secop.gov.co/Public/Tendering/OpportunityDetail/Index?noticeUID=CO1.NTC.7900557&isFromPublicArea=True&isModal=true&asPopupView=true,0.31885167956352234
385067,SECRETARIA GENERAL Y DE CERCANIA AL CIUDADANO,PRESTAR SERVICIOS PROFESIONALES COMO COMUNICADORA SOCIAL Y PERIODISTA PARA EJECUTAR LABORES PERIODÍSTICAS Y DE LOCUCIÓN EN LA EMISORA EL DORADO RADIO DE LA SECRETARÍA DE PRENSA Y COMUNICACIONES DE LA GOBERNACIÓN DE CUNDINAMARCA.,Prestación de servicios,Mujer,27.500000000000004,21.552818941287093,165 Dia(s),0.21626112940774217,1.2759351839271638,https://community.secop.gov.co/Public/Tendering/OpportunityDetail/Index?noticeUID=CO1.NTC.6292688&isFromPublicArea=True&isModal=true&asPopupView=true,0.3118542432785034
859037,GOBIERNO DEPARTAMENTAL,PRESTAR POR SUS PROPIOS MEDIOS Y CON PLENA AUTONOMIA SERVICIOS PROFESIONALES DE UN COMUNICADOR SOCIAL - PERIODISTA PARA BRINDAR APOYO A LA DIRECCION DE PRENSA Y COMUNICACIONES; RESPECTO DEL CUBRIMIENTO PERIODISTICO DE ESTA DIRECCIÓN; ASI COMO EN LAS DIFERENTES DEPENDENCIAS QUE LO REQUIERAN.,Prestación de servicios,Mujer,31.8,24.828678137964882,180 Dia(s),0.21922395792563265,1.2807770040474065,https://community.secop.gov.co/Public/Tendering/OpportunityDetail/Index?noticeUID=CO1.NTC.7783348&isFromPublicArea=True&isModal=true&asPopupView=true,0.30123597383499146
